key,speech_date,speech_time,company_id,company_name,subject,matched_keywords,enterDate,marketKind,serialNumber,detail_json,fetched_at_tw
1150414|otc|4123|4,115/04/14,14:55:35,4123,晟德,公告本公司董事會決議辦理私募現金增資發行普通股,現金增資,1150414,otc,4,"{""code"": 200, ""message"": ""查詢成功"", ""result"": {""marketName"": ""上櫃公司"", ""companyId"": ""4123"", ""data"": [[4, ""115/04/14"", ""14:55:35"", ""林秀月"", ""董事長室協理"", ""2655-8680分機301"", ""公告本公司董事會決議辦理私募現金增資發行普通股"", ""11"", ""115/04/14"", ""1.董事會決議日期:115/04/14\n2.私募有價證券種類:本公司普通股\n3.私募對象及其與公司間關係:\n依證券交易法第43條之6及相關函令之規定擇定特定人，以策略性投資人為限，洽定\n應募人之相關事宜，擬提請股東會授權董事會全權處理之。為配合公司未來發展、改善\n財務結構、提升公司獲利能力，引進對本公司有助益之策略聯盟夥伴實有其必要性。\n預計透過其經驗、技術及知識之協助，可提升營業績效，有助公司未來穩定成長。\n4.私募股數或張數:不超過30,000,000股。\n5.得私募額度:\n不超過30,000,000股額度內，於股東會決議日起一年內分2次辦理。\n第1次不超過15,000,000股，第2次不超過15,000,000股。\n6.私募價格訂定之依據及合理性:\n私募參考價格之計算係以下列二基準計算價格較高者訂定之：\nA.定價日前1、3或5個營業日擇一計算普通股收盤價簡單算數平均數扣除無償配股除權\n及配息，並加回減資反除權後之股價。\n\nB.定價日前30個營業日普通股收盤價簡單算數平均數扣除無償配股除權及配息，並加回\n減資反除權後之股價。\n本次私募普通股價格，不得低於參考價格之八成，其訂定方式係依現行法令規定訂定，\n應屬合理。實際定價日及實際私募價格於不低於股東會決議成數之範圍內，提請股東會\n授權董事會，依法令規定視日後洽定特定人情形及資本市場狀況決定之。\n7.本次私募資金用途:\n本次辦理私募資金用途皆為充實營運資金、償還借款及轉投資生技產業。\n8.不採用公開募集之理由:\n考量籌資之時效性、便利性及發行成本等因素，私募具有迅速簡便之特性，及三年內\n不得自由轉讓之限制，更可確保公司與策略性投資人之穩定長期關係，故擬採私募方式\n募集資金。\n9.獨立董事反對或保留意見:無\n10.實際定價日:不適用\n11.參考價格:不適用\n12.實際私募價格、轉換或認購價格:不適用\n13.本次私募新股之權利義務:\n本次私募普通股之權利義務原則上與本公司已發行之普通股相同；惟依證券交易法規定\n，本公司私募之普通股於交付日起三年內，除依證券交易法第43條之8規定之轉讓對象\n外，餘不得再行賣出。本次私募之普通股將自交付日起滿三年後，授權董事會視當時\n狀況，依相關規定向主管機關申請補辦公開發行及上櫃交易。\n14.附有轉換、交換或認股者，其換股基準日:不適用\n15.附有轉換、交換或認股者，對股權可能稀釋情形:不適用\n16.附有轉換或認股者，於私募公司債交付且假設全數轉換或認購普通股後對上櫃普通股\n股權比率之可能影響（上櫃普通股數A、A/已發行普通股）:不適用\n17.前項預計上櫃普通股未達500萬股且未達25%者，請說明股權流通性偏低之因應措施:\n不適用\n18.其他應敘明事項:\n本次私募計畫之主要內容，除私募訂價成數外，包括實際發行價格、發行股數、發行條\n件、定價日、增資基準日、計劃項目、募集金額、預計進度、預計可能產生效益等相關\n事項，暨其他一切有關發行計畫之事項，擬提請股東會授權董事會視市場狀況調整、訂\n定與辦理，未來如遇法令變更、經主管機關指示修正、基於營運評估或因應市場客觀環\n境而須訂定或修正時，亦授權董事會全權處理之。""]], ""footer"": [""以上資料均由各公司依發言當時所屬市場別之規定申報後，由本系統對外公佈，資料如有虛偽不實，均由該公司負責。""], ""header"": {""note"": [], ""subTitle"": [], ""mainTitle"": [""公司當日重大訊息之詳細內容""]}, ""titles"": [{""sub"": [], ""main"": ""序號""}, {""sub"": [], ""main"": ""發言日期""}, {""sub"": [], ""main"": ""發言時間""}, {""sub"": [], ""main"": ""發言人""}, {""sub"": [], ""main"": ""發言人職稱""}, {""sub"": [], ""main"": ""發言人電話""}, {""sub"": [], ""main"": ""主旨""}, {""sub"": [], ""main"": ""符合條款""}, {""sub"": [], ""main"": ""事實發生日""}, {""sub"": [], ""main"": ""說明""}], ""companyAbbreviation"": ""晟德""}, ""datetime"": ""115/04/14 18:45:14""}",2026-04-14 18:44:51
1150414|otc|4123|6,115/04/14,15:46:00,4123,晟德,公告本公司國內第八次無擔保轉換公司債暨第九次無擔保轉換公司債代收價款行庫及存儲專戶行庫,公司債,1150414,otc,6,"{""code"": 200, ""message"": ""查詢成功"", ""result"": {""marketName"": ""上櫃公司"", ""companyId"": ""4123"", ""data"": [[6, ""115/04/14"", ""15:46:00"", ""林秀月"", ""董事長室協理"", ""2655-8680分機301"", ""公告本公司國內第八次無擔保轉換公司債暨\r\n第九次無擔保轉換公司債代收價款行庫及存儲專戶行庫"", ""53"", ""115/04/14"", ""1.事實發生日:115/04/14\n2.公司名稱:晟德大藥廠股份有限公司\n3.與公司關係(請輸入本公司或子公司):本公司\n4.相互持股比例:不適用。\n5.發生緣由:依據「發行人募集與發行有價證券處理準則」第9條第1項第2款規定辦理。\n6.因應措施:無。\n7.其他應敘明事項(若事件發生或決議之主體係屬公開發行以上公司，\n本則重大訊息同時符合證券交易法施行細則第7條第9款所定\n對股東權益或證券價格有重大影響之事項):\n(1)訂約日期：民國115年04月14日。\n(2)代收價款行庫：台新國際商業銀行建北分行\n(3)存儲專戶行庫：永豐商業銀行股份有限公司忠孝分行""]], ""footer"": [""以上資料均由各公司依發言當時所屬市場別之規定申報後，由本系統對外公佈，資料如有虛偽不實，均由該公司負責。""], ""header"": {""note"": [], ""subTitle"": [], ""mainTitle"": [""公司當日重大訊息之詳細內容""]}, ""titles"": [{""sub"": [], ""main"": ""序號""}, {""sub"": [], ""main"": ""發言日期""}, {""sub"": [], ""main"": ""發言時間""}, {""sub"": [], ""main"": ""發言人""}, {""sub"": [], ""main"": ""發言人職稱""}, {""sub"": [], ""main"": ""發言人電話""}, {""sub"": [], ""main"": ""主旨""}, {""sub"": [], ""main"": ""符合條款""}, {""sub"": [], ""main"": ""事實發生日""}, {""sub"": [], ""main"": ""說明""}], ""companyAbbreviation"": ""晟德""}, ""datetime"": ""115/04/14 18:45:15""}",2026-04-14 18:44:51
1150414|otc|5278|1,115/04/14,15:49:45,5278,尚凡*,(補充公告)公告本公司董事會決議辦理私募普通股事宜(分三次辦理及各次私募資金用途),私募普通股,1150414,otc,1,"{""code"": 200, ""message"": ""查詢成功"", ""result"": {""marketName"": ""上櫃公司"", ""companyId"": ""5278"", ""data"": [[1, ""115/04/14"", ""15:49:45"", ""張立"", ""財務長暨資深副總裁"", ""02-23650103"", ""(補充公告)公告本公司董事會決議辦理私募普通股事宜\r\n(分三次辦理及各次私募資金用途)"", ""11"", ""115/04/14"", ""1.董事會決議日期:115/04/14\n2.私募有價證券種類:普通股\n3.私募對象及其與公司間關係:\n本次私募普通股對象為策略性投資人，依據證券交易法第43條之6及金融監督管理\n委員會112年9月12日金管證發字第1120383220號令及112年12月29日金融監督管理\n委員會金管證發字第11203860674號修正之「公開發行公司辦理私募有價證券應\n注意事項」等規定，擇定對公司長遠發展有所助益者，並以能提升公司營運效能\n、強化競爭力及對既有股東權益產生效益者，惟目前並無已洽定之應募人。\n4.私募股數或張數:發行總股數以不超過45,000,000股為限。\n5.得私募額度:(新增)發行總股數以不超過45,000,000股為限，於股東會決議之\n日起一年內分次(分三次)辦理。\n6.私募價格訂定之依據及合理性:\n本次私募價格，以不低於定價日前1、3或5個營業日擇一計算普通股收盤價簡單\n算數平均數扣除無償配股除權及配息，並加回減資反除權後之股價，或定價日前\n30個營業日普通股收盤價簡單算數平均數扣除無償配股除權及配息，並加回減資\n反除權後之股價，二基準計算價格較高者之八成訂定之，實際定價日及實際私募\n價格於不低於股東會決議成數之範圍內，授權董事會依法令規定視當時市場狀況\n訂定。\n7.本次私募資金用途:\n(補充說明)各分次辦理私募之資金用途及預計達成效益皆為充實公司營運資金\n及其他因應本公司未來發展之資金需求，預期可改善公司財務結構，有助公\n司營運穩定成長，對股東權益有其正面助益。\n8.不採用公開募集之理由:\n考量募集資本之時效性、便利性及發行成本等因素，且限制三年內不得轉讓\n有助於公司經營權穩定及拓展營運，故擬以私募方式進行籌資。\n9.獨立董事反對或保留意見:無。\n10.實際定價日:未定。\n11.參考價格:未定。\n12.實際私募價格、轉換或認購價格:未定。\n13.本次私募新股之權利義務:\n依據證交法規定，本次私募之普通股於交付日後除依證交法43條之8規定外，\n原則上三年內不得自由轉讓。本公司於交付滿三年後，擬依證交法相關規定\n向主管機關申請補辦公開發行程序及上櫃交易。除以上規定外，本次私募之\n普通股權利義務，與本公司已發行普通股相同。\n14.附有轉換、交換或認股者，其換股基準日:不適用\n15.附有轉換、交換或認股者，對股權可能稀釋情形:不適用\n16.附有轉換或認股者，於私募公司債交付且假設全數轉換或認購普通股後對上櫃普通股\n股權比率之可能影響（上櫃普通股數A、A/已發行普通股）:不適用\n17.前項預計上櫃普通股未達500萬股且未達25%者，請說明股權流通性偏低之因應措施:\n不適用\n18.其他應敘明事項:\n本次私募計畫之主要內容，除私募定價成數外，包括發行價格、發行股數、\n發行金額、計畫項目、資金運用進度、預計可能產生效益及其他相關未盡事宜等，\n未來如經主管機關修正或客觀環境變更而有所修正時，擬提請股東會授權董事會\n依相關規定辦理。""]], ""footer"": [""以上資料均由各公司依發言當時所屬市場別之規定申報後，由本系統對外公佈，資料如有虛偽不實，均由該公司負責。""], ""header"": {""note"": [], ""subTitle"": [], ""mainTitle"": [""公司當日重大訊息之詳細內容""]}, ""titles"": [{""sub"": [], ""main"": ""序號""}, {""sub"": [], ""main"": ""發言日期""}, {""sub"": [], ""main"": ""發言時間""}, {""sub"": [], ""main"": ""發言人""}, {""sub"": [], ""main"": ""發言人職稱""}, {""sub"": [], ""main"": ""發言人電話""}, {""sub"": [], ""main"": ""主旨""}, {""sub"": [], ""main"": ""符合條款""}, {""sub"": [], ""main"": ""事實發生日""}, {""sub"": [], ""main"": ""說明""}], ""companyAbbreviation"": ""尚凡*""}, ""datetime"": ""115/04/14 18:45:16""}",2026-04-14 18:44:51
1150414|otc|4114|1,115/04/14,16:23:25,4114,健喬,公告本公司董事會決議庫藏股轉讓員工並訂定認股基準日,庫藏股,1150414,otc,1,"{""code"": 200, ""message"": ""查詢成功"", ""result"": {""marketName"": ""上櫃公司"", ""companyId"": ""4114"", ""data"": [[1, ""115/04/14"", ""16:23:25"", ""黃立宇"", ""財務長"", ""(02)8797-7100"", ""公告本公司董事會決議庫藏股轉讓員工並訂定認股基準日"", ""53"", ""115/04/14"", ""1.事實發生日:115/04/14\n2.公司名稱:健喬信元醫藥生技股份有限公司\n3.與公司關係(請輸入本公司或子公司):本公司\n4.相互持股比例:不適用\n5.發生緣由:本公司董事會決議庫藏股轉讓員工並訂定認股基準日。\n6.因應措施:\n(1)本公司第十三次買回庫藏股計4,000,000股，董事會決議依公司「買回股份轉讓員工\n辦法」辦理轉讓1,779,000股予員工。\n(2)員工認股基準日訂為115年4月14日。\n7.其他應敘明事項(若事件發生或決議之主體係屬公開發行以上公司，\n本則重大訊息同時符合證券交易法施行細則第7條第9款所定\n對股東權益或證券價格有重大影響之事項):無""]], ""footer"": [""以上資料均由各公司依發言當時所屬市場別之規定申報後，由本系統對外公佈，資料如有虛偽不實，均由該公司負責。""], ""header"": {""note"": [], ""subTitle"": [], ""mainTitle"": [""公司當日重大訊息之詳細內容""]}, ""titles"": [{""sub"": [], ""main"": ""序號""}, {""sub"": [], ""main"": ""發言日期""}, {""sub"": [], ""main"": ""發言時間""}, {""sub"": [], ""main"": ""發言人""}, {""sub"": [], ""main"": ""發言人職稱""}, {""sub"": [], ""main"": ""發言人電話""}, {""sub"": [], ""main"": ""主旨""}, {""sub"": [], ""main"": ""符合條款""}, {""sub"": [], ""main"": ""事實發生日""}, {""sub"": [], ""main"": ""說明""}], ""companyAbbreviation"": ""健喬""}, ""datetime"": ""115/04/14 18:45:17""}",2026-04-14 18:44:51
1150413|otc|8111|2,115/04/14,16:33:08,8111,立碁,公告本公司發行國內第四次無擔保轉換公司債代收價款及存儲專戶行庫,公司債,1150413,otc,2,"{""code"": 200, ""message"": ""查詢成功"", ""result"": {""marketName"": ""上櫃公司"", ""companyId"": ""8111"", ""data"": [[2, ""115/04/14"", ""16:33:08"", ""黃冠甄"", ""稽核主管"", ""02-77036166"", ""公告本公司發行國內第四次無擔保轉換公司債\r\n代收價款及存儲專戶行庫"", ""53"", ""115/04/14"", ""1.事實發生日:115/04/14\n2.公司名稱:立碁電子工業股份有限公司\n3.與公司關係(請輸入本公司或子公司):本公司\n4.相互持股比例:不適用\n5.發生緣由:依據「發行人募集與發行有價證券處理準則」第9條第1項第2款規定辦理。\n6.因應措施:無\n7.其他應敘明事項(若事件發生或決議之主體係屬公開發行以上公司，\n本則重大訊息同時符合證券交易法施行細則第7條第9款所定\n對股東權益或證券價格有重大影響之事項):\n(1)訂約日期：115/04/14。\n(2)委託代收價款行庫：第一銀行/新湖分行。\n(3)委託存儲專戶機構：玉山商業銀行/土城分行。""]], ""footer"": [""以上資料均由各公司依發言當時所屬市場別之規定申報後，由本系統對外公佈，資料如有虛偽不實，均由該公司負責。""], ""header"": {""note"": [], ""subTitle"": [], ""mainTitle"": [""公司當日重大訊息之詳細內容""]}, ""titles"": [{""sub"": [], ""main"": ""序號""}, {""sub"": [], ""main"": ""發言日期""}, {""sub"": [], ""main"": ""發言時間""}, {""sub"": [], ""main"": ""發言人""}, {""sub"": [], ""main"": ""發言人職稱""}, {""sub"": [], ""main"": ""發言人電話""}, {""sub"": [], ""main"": ""主旨""}, {""sub"": [], ""main"": ""符合條款""}, {""sub"": [], ""main"": ""事實發生日""}, {""sub"": [], ""main"": ""說明""}], ""companyAbbreviation"": ""立碁""}, ""datetime"": ""115/04/14 18:45:18""}",2026-04-14 18:44:51
1150414|otc|3587|3,115/04/14,16:39:16,3587,閎康,奉櫃買中心通知本公司可轉換公司債閎康一(代號:35871)價格變動達應公布注意交易資訊標準，故公告相關訊息，以利投資人區別暸解,公司債,1150414,otc,3,"{""code"": 200, ""message"": ""查詢成功"", ""result"": {""marketName"": ""上櫃公司"", ""companyId"": ""3587"", ""data"": [[3, ""115/04/14"", ""16:39:16"", ""楊儒霖"", ""處長"", ""03-6116678"", ""奉櫃買中心通知本公司可轉換公司債閎康一(代號:35871)\r\n價格變動達應公布注意交易資訊標準，故公告相關訊息，以利\r\n投資人區別暸解"", ""53"", ""115/04/14"", ""1.事實發生日:115/04/14\n2.發生緣由:本公司於今日14:19接獲櫃買中心通知，本公司可轉換公司債\n閎康一(代號:35871)已達應公布注意交易資訊標準，爰奉櫃買中心指示公\n布下列訊息，以供投資人參酌。。\n3.財務業務資訊:\n閎康一(35871)轉換公司債相關資訊：\n到期日期：115/06/20\n實際發行總額：新台幣600,000,000元整\n本月發行餘額：新台幣84,500,000元整 (截至115/04/13)\n最新轉換價格：190.7元\n轉換標的收盤價格(代號：3587)：317.5元 (115/04/13)\n轉換公司債收盤價格(代號:35871)：164元 (115/04/13)\n4.有無「財團法人中華民國證券櫃檯買賣中心對有價證券上櫃公司\n重大訊息之查證暨公開處理程序 」第4條所列重大訊息之情事（如\n「有」，請說明）:無\n5.有無「財團法人中華民國證券櫃檯買賣中心對有價證券上櫃公司\n重大訊息之查證暨公開處理程序」第11條所列重大訊息說明記者會\n之情事:無\n6.其他應敘明事項:無""]], ""footer"": [""以上資料均由各公司依發言當時所屬市場別之規定申報後，由本系統對外公佈，資料如有虛偽不實，均由該公司負責。""], ""header"": {""note"": [], ""subTitle"": [], ""mainTitle"": [""公司當日重大訊息之詳細內容""]}, ""titles"": [{""sub"": [], ""main"": ""序號""}, {""sub"": [], ""main"": ""發言日期""}, {""sub"": [], ""main"": ""發言時間""}, {""sub"": [], ""main"": ""發言人""}, {""sub"": [], ""main"": ""發言人職稱""}, {""sub"": [], ""main"": ""發言人電話""}, {""sub"": [], ""main"": ""主旨""}, {""sub"": [], ""main"": ""符合條款""}, {""sub"": [], ""main"": ""事實發生日""}, {""sub"": [], ""main"": ""說明""}], ""companyAbbreviation"": ""閎康""}, ""datetime"": ""115/04/14 18:45:19""}",2026-04-14 18:44:51
1150414|otc|6870|1,115/04/14,16:56:41,6870,騰雲,本公司修訂「國內第一次無擔保轉換公司債發行及轉換辦法」致債權人異議期間屆滿公告,公司債,1150414,otc,1,"{""code"": 200, ""message"": ""查詢成功"", ""result"": {""marketName"": ""上櫃公司"", ""companyId"": ""6870"", ""data"": [[1, ""115/04/14"", ""16:56:41"", ""張婷婷"", ""執行副總經理"", ""(02)26973968"", ""本公司修訂「國內第一次無擔保轉換公司債發行及\r\n轉換辦法」致債權人異議期間屆滿公告"", ""53"", ""115/04/14"", ""1.事實發生日:115/04/14\n2.公司名稱:騰雲科技服務股份有限公司\n3.與公司關係(請輸入本公司或子公司):本公司\n4.相互持股比例:不適用\n5.發生緣由:\n 依本公司115年03月11日發布之重大訊息，公告修訂「國內第一次無擔保轉換公司債發\n 行及轉換辦法」 之債權人公告，訂定債權人異議期間為自公告日(即115年3月11日)起\n 至115年4月13日止。\n6.因應措施:\n (1)截至115年4月13日止，債權人聲明異議期間已屆滿三十日，且無債權人異\n    議聲明通知送達本公司。\n (2)本公司將依照公司法第248條第4項規定，將修訂後「國內第一次無擔保轉\n    換公司債發行及轉換辦法」呈奉證券主管機關申報核准。\n7.其他應敘明事項(若事件發生或決議之主體係屬公開發行以上公司，\n本則重大訊息同時符合證券交易法施行細則第7條第9款所定\n對股東權益或證券價格有重大影響之事項):無。""]], ""footer"": [""以上資料均由各公司依發言當時所屬市場別之規定申報後，由本系統對外公佈，資料如有虛偽不實，均由該公司負責。""], ""header"": {""note"": [], ""subTitle"": [], ""mainTitle"": [""公司當日重大訊息之詳細內容""]}, ""titles"": [{""sub"": [], ""main"": ""序號""}, {""sub"": [], ""main"": ""發言日期""}, {""sub"": [], ""main"": ""發言時間""}, {""sub"": [], ""main"": ""發言人""}, {""sub"": [], ""main"": ""發言人職稱""}, {""sub"": [], ""main"": ""發言人電話""}, {""sub"": [], ""main"": ""主旨""}, {""sub"": [], ""main"": ""符合條款""}, {""sub"": [], ""main"": ""事實發生日""}, {""sub"": [], ""main"": ""說明""}], ""companyAbbreviation"": ""騰雲""}, ""datetime"": ""115/04/14 18:45:19""}",2026-04-14 18:44:51
1150414|otc|6870|2,115/04/14,16:57:25,6870,騰雲,本公司修訂「國內第二次無擔保轉換公司債發行及轉換辦法」致債權人異議期間屆滿公告,公司債,1150414,otc,2,"{""code"": 200, ""message"": ""查詢成功"", ""result"": {""marketName"": ""上櫃公司"", ""companyId"": ""6870"", ""data"": [[2, ""115/04/14"", ""16:57:25"", ""張婷婷"", ""執行副總經理"", ""(02)26973968"", ""本公司修訂「國內第二次無擔保轉換公司債發行及\r\n轉換辦法」致債權人異議期間屆滿公告"", ""53"", ""115/04/14"", ""1.事實發生日:115/04/14\n2.公司名稱:騰雲科技服務股份有限公司\n3.與公司關係(請輸入本公司或子公司):本公司\n4.相互持股比例:不適用\n5.發生緣由:\n 依本公司115年03月11日與115年03月12日發布之重大訊息，公告修訂「國內第二次\n 無擔保轉換公司債發行及轉換辦法」之債權人公告，訂定債權人異議期間為自公告\n 日(即115年3月11日)起至115年4月13日止。\n6.因應措施:\n (1)截至115年4月13日止，債權人聲明異議期間已屆滿三十日，且無債權人異\n    議聲明通知送達本公司。\n (2)本公司將依照公司法第248條第4項規定，將修訂後「國內第二次無擔保轉\n    換公司債發行及轉換辦法」呈奉證券主管機關申報核准。\n7.其他應敘明事項(若事件發生或決議之主體係屬公開發行以上公司，\n本則重大訊息同時符合證券交易法施行細則第7條第9款所定\n對股東權益或證券價格有重大影響之事項):無。""]], ""footer"": [""以上資料均由各公司依發言當時所屬市場別之規定申報後，由本系統對外公佈，資料如有虛偽不實，均由該公司負責。""], ""header"": {""note"": [], ""subTitle"": [], ""mainTitle"": [""公司當日重大訊息之詳細內容""]}, ""titles"": [{""sub"": [], ""main"": ""序號""}, {""sub"": [], ""main"": ""發言日期""}, {""sub"": [], ""main"": ""發言時間""}, {""sub"": [], ""main"": ""發言人""}, {""sub"": [], ""main"": ""發言人職稱""}, {""sub"": [], ""main"": ""發言人電話""}, {""sub"": [], ""main"": ""主旨""}, {""sub"": [], ""main"": ""符合條款""}, {""sub"": [], ""main"": ""事實發生日""}, {""sub"": [], ""main"": ""說明""}], ""companyAbbreviation"": ""騰雲""}, ""datetime"": ""115/04/14 18:45:20""}",2026-04-14 18:44:51
1150414|otc|4745|1,115/04/14,18:03:07,4745,合富-KY,公告本公司第二次買回庫藏股執行結果,庫藏股,1150414,otc,1,"{""code"": 200, ""message"": ""查詢成功"", ""result"": {""marketName"": ""上櫃公司"", ""companyId"": ""4745"", ""data"": [[1, ""115/04/14"", ""18:03:07"", ""王瓊芝"", ""董事長"", ""(02)2325-2008"", ""公告本公司第二次買回庫藏股執行結果"", ""35"", ""115/04/14"", ""1.原預定買回股份總金額上限(元):756,468,000\r\n2.原預定買回之期間:115/03/30~115/05/29\r\n3.原預定買回之數量(股):3,872,000\r\n4.原預定買回區間價格(元):14.00~30.00\r\n5.本次實際買回期間:115/03/30~115/04/14\r\n6.本次已買回股份數量(股):3,872,000\r\n7.本次已買回股份總金額(元):76,757,898\r\n8.本次平均每股買回價格(元):19.82\r\n9.累積已持有自己公司股份數量(股):3,872,000\r\n10.累積已持有自己公司股份數量占公司已發行股份總數之比率(%):5.00\r\n11.本次未執行完畢之原因:\r\n\r\n12.其他應敘明事項:\r\n無""]], ""footer"": [""以上資料均由各公司依發言當時所屬市場別之規定申報後，由本系統對外公佈，資料如有虛偽不實，均由該公司負責。""], ""header"": {""note"": [], ""subTitle"": [], ""mainTitle"": [""公司當日重大訊息之詳細內容""]}, ""titles"": [{""sub"": [], ""main"": ""序號""}, {""sub"": [], ""main"": ""發言日期""}, {""sub"": [], ""main"": ""發言時間""}, {""sub"": [], ""main"": ""發言人""}, {""sub"": [], ""main"": ""發言人職稱""}, {""sub"": [], ""main"": ""發言人電話""}, {""sub"": [], ""main"": ""主旨""}, {""sub"": [], ""main"": ""符合條款""}, {""sub"": [], ""main"": ""事實發生日""}, {""sub"": [], ""main"": ""說明""}], ""companyAbbreviation"": ""合富-KY""}, ""datetime"": ""115/04/14 18:45:21""}",2026-04-14 18:44:51
