key,speech_date,speech_time,company_id,company_name,subject,matched_keywords,enterDate,marketKind,serialNumber,detail_json,fetched_at_tw
1150323|otc|3323|1,115/03/23,19:08:36,3323,加百裕,公告加百裕工業股份有限公司國內第三次無擔保(例：第一次有擔保)轉(交)換公司債(簡稱：加百裕三，代碼：33233)停止受理轉交換及到期日落於停止轉(交)換期間等相關事項。,公司債,1150323,otc,1,"{""code"": 406, ""message"": ""查無相符資料"", ""result"": null, ""datetime"": ""115/03/24 16:07:22""}",2026-03-24 16:07:10
1150318|otc|6561|2,115/03/24,13:32:56,6561,是方,本公司董事會通過提高115年度資本支出預算案,資本支出,1150318,otc,2,"{""code"": 200, ""message"": ""查詢成功"", ""result"": {""marketName"": ""上櫃公司"", ""companyId"": ""6561"", ""data"": [[2, ""115/03/24"", ""13:32:56"", ""劉耀元"", ""總經理"", ""(02)2657-6688"", ""本公司董事會通過提高115年度資本支出預算案"", ""53"", ""115/03/24"", ""1.事實發生日:115/03/24\n2.公司名稱:是方電訊股份有限公司\n3.與公司關係(請輸入本公司或子公司):本公司\n4.相互持股比例:不適用\n5.發生緣由:本公司董事會決議通過，因應新建IDC大樓所需，\n115年度新增資本支出3億元。\n6.因應措施:依董事會決議執行。\n7.其他應敘明事項(若事件發生或決議之主體係屬公開發行以上公司，\n本則重大訊息同時符合證券交易法施行細則第7條第9款所定\n對股東權益或證券價格有重大影響之事項):無。""]], ""footer"": [""以上資料均由各公司依發言當時所屬市場別之規定申報後，由本系統對外公佈，資料如有虛偽不實，均由該公司負責。""], ""header"": {""note"": [], ""subTitle"": [], ""mainTitle"": [""公司當日重大訊息之詳細內容""]}, ""titles"": [{""main"": ""序號"", ""sub"": []}, {""main"": ""發言日期"", ""sub"": []}, {""main"": ""發言時間"", ""sub"": []}, {""main"": ""發言人"", ""sub"": []}, {""main"": ""發言人職稱"", ""sub"": []}, {""main"": ""發言人電話"", ""sub"": []}, {""main"": ""主旨"", ""sub"": []}, {""main"": ""符合條款"", ""sub"": []}, {""main"": ""事實發生日"", ""sub"": []}, {""main"": ""說明"", ""sub"": []}], ""companyAbbreviation"": ""是方""}, ""datetime"": ""115/03/24 16:07:22""}",2026-03-24 16:07:10
1150324|otc|8044|5,115/03/24,15:59:26,8044,網家,公告本公司董事會決議庫藏股註銷減資基準日,庫藏股,1150324,otc,5,"{""code"": 200, ""message"": ""查詢成功"", ""result"": {""marketName"": ""上櫃公司"", ""companyId"": ""8044"", ""data"": [[5, ""115/03/24"", ""15:59:26"", ""林佳慧"", ""協理"", ""2700-0898"", ""公告本公司董事會決議庫藏股註銷減資基準日"", ""11"", ""115/03/24"", ""1.董事會決議日期:115/03/24\n2.減資緣由:本公司110年第一次買回庫藏股\n           五年屆滿辦理註銷減資\n3.減資金額:8790000\n4.消除股份:879000\n5.減資比率:0.43%\n6.減資後股本:204768065\n7.預定股東會日期:NA\n8.預計減資新股上櫃後之上櫃普通股股數:133697482\n9.預計減資新股上櫃後之上櫃普通股股數占已發行普通股比率\n（減資後上櫃普通股股數/減資後已發行普通股):65%\n10.前二項預計減資後上櫃普通股股數未達500萬股且未達25%者，請說明\n股權流通性偏低之因應措施:不適用\n11.減資基準日:115/05/05\n12.其他應敘明事項:因庫藏股屆滿未轉讓""]], ""footer"": [""以上資料均由各公司依發言當時所屬市場別之規定申報後，由本系統對外公佈，資料如有虛偽不實，均由該公司負責。""], ""header"": {""note"": [], ""subTitle"": [], ""mainTitle"": [""公司當日重大訊息之詳細內容""]}, ""titles"": [{""main"": ""序號"", ""sub"": []}, {""main"": ""發言日期"", ""sub"": []}, {""main"": ""發言時間"", ""sub"": []}, {""main"": ""發言人"", ""sub"": []}, {""main"": ""發言人職稱"", ""sub"": []}, {""main"": ""發言人電話"", ""sub"": []}, {""main"": ""主旨"", ""sub"": []}, {""main"": ""符合條款"", ""sub"": []}, {""main"": ""事實發生日"", ""sub"": []}, {""main"": ""說明"", ""sub"": []}], ""companyAbbreviation"": ""網家""}, ""datetime"": ""115/03/24 16:07:23""}",2026-03-24 16:07:10
1150324|otc|6692|2,115/03/24,16:00:39,6692,進能服,公告本公司董事會通過第一次買回庫藏股,庫藏股,1150324,otc,2,"{""code"": 200, ""message"": ""查詢成功"", ""result"": {""marketName"": ""上櫃公司"", ""companyId"": ""6692"", ""data"": [[2, ""115/03/24"", ""16:00:39"", ""厲國欽"", ""總經理"", ""02-87912886"", ""公告本公司董事會通過第一次買回庫藏股"", ""35"", ""115/03/24"", ""1.董事會決議日期:115/03/24\r\n2.買回股份目的:轉讓股份予員工\r\n3.買回股份種類:普通股\r\n4.買回股份總金額上限(元):465,398,482\r\n5.預定買回之期間:115/03/25~115/05/22\r\n6.預定買回之數量(股):1,500,000\r\n7.買回區間價格(元):23.00~46.00，公司股價低於區間價格下限，將繼續買回\r\n8.買回方式:自集中交易市場買回\r\n9.預定買回股份占公司已發行股份總數之比率(%):2.55\r\n10.申報時已持有本公司股份之累積股數(股):0\r\n11.申報前三年內買回公司股份之情形:\r\n無買回\r\n12.已申報買回但未執行完畢之情形:\r\n無。\r\n13.董事會決議買回股份之會議紀錄:\r\n董事會決議買回股份之會議紀錄：\r\n案由：擬買回本公司股份轉讓予員工案，謹提請 審議。\r\n說明：\t\r\n(一)為激勵員工及提升員工向心力，擬依據證券交易法第二十八條之二第一項第一款及「上市上櫃\r\n公司買回本公司股份辦法」 之規定，買回本公司股票，相關條件說明如下：\r\n(1)買回股份之目的：轉讓予員工。\r\n(2)買回股份之種類：普通股。\r\n(3)買回股份之總金額上限：新台幣陸仟玖佰萬元。\r\n(4)預定買回期間：115年3月25日至115年5月22日。\r\n(5)預定買回數量：不超過1,500仟股。\r\n(6)買回之區間價格：每股單價新台幣23元至46元，惟公司股價低於所訂區間價格下限時，本公司\r\n得繼續執 行買回公司股份。\r\n(7)買回方式：自證券集中市場買回。\r\n(8)本公司預計買回股份1,500仟股，僅佔本公司已發行股份58,823,890股(依最近一期變更登記\r\n表股數)之2.55%，佔合併財務報表流動資產1,598,792仟元之4.32%，應不影響本公司財務\r\n狀況及資本之維持。\r\n(二)有關證券承銷商合理性評估意見請參閱附件3(略)。\r\n(三)按上述內容及依據公司財務狀況，擬請董事會同意出具「不影響公司資本維持之聲明書」請參\r\n閱附件4 (略)。\r\n(四)於相關法令許可範圍內，擬請同意授權董事長全權代表本公司處理相關事項及辦理其他未盡事\r\n宜；如嗣後因法令修訂或 主管機關要求而需修正或補充者，亦授權董事長全權處理之。\r\n(五)本案業經第3屆第13次審計委員會審議通過，提請董事會決議。\r\n(六)本案經董事會審議通過後，依法辦理公告作業。\r\n(七)謹提請 表決。\r\n決議：本案經主席徵詢全體出席董事，無異議照案通過。\r\n14.「上市上櫃公司買回本公司股份辦法」第十條規定之轉讓辦法:\r\n第一條 本公司為激勵員工及提升員工向心力，依據證券交易法第28條之2第1項第1款及金融監督管\r\n理委員會發布之「上市上櫃公司買回本公司股份辦法」等相關規定，訂定本公司買回股份轉讓員工\r\n辦法。本公司買回股份(以下簡稱庫藏股)轉讓予員工，除依有關法令規定外，悉依本辦法規定辦\r\n理。 \r\n\r\n（轉讓股份之種類、權利內容及權利受限情形） \r\n第二條 本公司轉讓予員工之股份均為普通股，其權利義務除本辦法另有規定者外，與其他流通在\r\n外之普通股相同。 \r\n\r\n（轉讓期間）\r\n第三條 本公司買回之股份，應依本辦法之規定，自買回股份之日起五年為限，得一次或分次轉讓\r\n予員工。 \r\n\r\n（受讓人之資格）\r\n第四條 凡於認股基準日前到職滿一年或對公司有特殊貢獻經提報董事會同意之本公司員工，均得\r\n享有認購庫藏股之權利。本辦法所稱之員工，係指本公司及直接或間接持有表決權股份超過百分\r\n之五十之海內外子公司領有薪資之全職員工。兼職員工、臨時性員工、短期工讀生及委外勞工均不\r\n適用本辦法。 \r\n第五條 員工得認購股數係依據員工職等、服務年資及對公司之特殊貢獻及兼顧認股基準日時公司\r\n持有之買回股份總額及單一員工認購股數之上限等因素為計算標準，訂定員工得受讓認購股數，報\r\n請董事會核准之。 \r\n\r\n（轉讓之程序）\r\n第六條 本公司買回股份轉讓予員工依以下程序辦理：一、依董事會之決議，公告、申報並於執行\r\n期限內買回本公司股份。二、董事會依本辦法訂定及公布員工認股基準日、得認購數量標準、認\r\n購繳款期間、權利內容及限制條件等作業事項。三、統計實際認購繳款股數，辦理股票轉讓過戶登\r\n記。 \r\n\r\n（約定之每股轉讓價格）\r\n第七條 本次買回股份轉讓予員工，以實際買回之平均價格為轉讓價格。惟在轉讓前，如遇有本公\r\n司已發行之普通股股份增加，得按發行股份增加比率調整之。轉讓買回股份予員工，以員工認股\r\n基準日發行之普通股總數為準。\r\n\r\n（轉讓後之權利義務）\r\n第八條 本公司買回股份轉讓予員工並辦理過戶登記後，除另有規定者外，餘權利義務與原有股份\r\n相同。 \r\n\r\n（其他有關公司與員工權利義務事項）\r\n第九條 本公司買回股份轉讓予員工，相關稅捐仍應依法繳納後始得辦理過戶作業。 \r\n\r\n（其他事項）\r\n第十條 本公司為轉讓股份予員工所買回之股份，應自買回之日起五年內全數轉讓，逾期未轉讓部\r\n份，視為本公司未發行股份，應依法辦理銷除股份變更登記。 \r\n第十一條 本辦法經董事會決議通過後生效，並得報經董事會決議修訂。 \r\n第十二條 本辦法訂定於中華民國一一五年三月二十四日。\r\n15.「上市上櫃公司買回本公司股份辦法」第十一條規定之轉換或認股辦法:\r\n不適用\r\n16.董事會已考慮公司財務狀況，不影響公司資本維持之聲明:\r\n一、本公司經115年03月24日第五屆第十六次董事會三分之二以上董事之出席及出席董事超過二分之\r\n一之同意通過，自申報日起二個月內於集中交易市場﹙證券商營業處所﹚買回本公司股份不超過\r\n1,500仟股。\r\n\r\n二、上述買回股份總數，僅占本公司已發行股份之2.55%，且買回股份所需金額上限僅占本公司流動\r\n資產之4.32%，茲聲明本公司董事會已考慮公司財務狀況，上述股份之買回並不影響本公司資本之維\r\n持。\r\n\r\n三、本聲明書業經本公司上述同次董事會議通過，出席董事九人同意本聲明書之內容，併此聲明。\r\n17.會計師或證券承銷商對買回股份價格之合理性評估意見:\r\n進金生能源服務股份有限公司此次預計買回公司股份所訂定之買回區間價格為每股23元至每股46\r\n元，其對該公司之財務結構、每股淨值、每股盈餘、股東權益報酬率、速動比率、流動比率及現金流\r\n量狀況等項目皆未產生重大影響；另本次所預計買回股份之總金額按每股46元計最高為69,000仟\r\n元，依據該公司一一四年度經會計師核閱之財務報告中顯示，保留盈餘為203,002仟元，加計普通股\r\n股票溢價之資本公積0仟元，扣除依證券交易法第41條第1項規定提列之特別盈餘公積28,744仟元\r\n後，174,258仟元即為可買回股份總金額之上限，經核算並未有逾越「上市上櫃公司買回本公司股份\r\n辦法」所規定之金額，評估其預定買回股份之價格尚屬合理。\r\n18.其他證期局所規定之事項:\r\n不適用""]], ""footer"": [""以上資料均由各公司依發言當時所屬市場別之規定申報後，由本系統對外公佈，資料如有虛偽不實，均由該公司負責。""], ""header"": {""note"": [], ""subTitle"": [], ""mainTitle"": [""公司當日重大訊息之詳細內容""]}, ""titles"": [{""main"": ""序號"", ""sub"": []}, {""main"": ""發言日期"", ""sub"": []}, {""main"": ""發言時間"", ""sub"": []}, {""main"": ""發言人"", ""sub"": []}, {""main"": ""發言人職稱"", ""sub"": []}, {""main"": ""發言人電話"", ""sub"": []}, {""main"": ""主旨"", ""sub"": []}, {""main"": ""符合條款"", ""sub"": []}, {""main"": ""事實發生日"", ""sub"": []}, {""main"": ""說明"", ""sub"": []}], ""companyAbbreviation"": ""進能服""}, ""datetime"": ""115/03/24 16:07:24""}",2026-03-24 16:07:10
1150323|rotc|5246|2,115/03/23,19:09:37,5246,勵威,公告本公司114年現金增資收足股款暨訂定增資基準日,現金增資,1150323,rotc,2,"{""code"": 200, ""message"": ""查詢成功"", ""result"": {""marketName"": ""興櫃公司"", ""companyId"": ""5246"", ""data"": [[2, ""115/03/23"", ""19:09:37"", ""賴志豪"", ""總經理"", ""(03)530-2300"", ""公告本公司114年現金增資收足股款暨訂定增資基準日"", ""44"", ""115/03/23"", ""1.事實發生日:115/03/23\n2.公司名稱:勵威電子股份有限公司\n3.與公司關係(請輸入本公司或子公司):本公司\n4.相互持股比例:不適用\n5.發生緣由:依據「發行人募集與發行有價證券處理準則」規定辦理公告。\n6.因應措施:無\n7.其他應敘明事項(若事件發生或決議之主體係屬公開發行以上公司，\n本則重大訊息同時符合證券交易法施行細則第7條第9款所定\n對股東權益或證券價格有重大影響之事項):\n(1)本公司114年現金增資發行普通股10,000,000股，每股發行價格新台幣20元，\n   實收股款總金額為新台幣200,000,000元，業已全數收足。\n(2)本公司訂定115年03月23日為現金增資基準日。""]], ""footer"": [""以上資料均由各公司依發言當時所屬市場別之規定申報後，由本系統對外公佈，資料如有虛偽不實，均由該公司負責。""], ""header"": {""note"": [], ""subTitle"": [], ""mainTitle"": [""公司當日重大訊息之詳細內容""]}, ""titles"": [{""main"": ""序號"", ""sub"": []}, {""main"": ""發言日期"", ""sub"": []}, {""main"": ""發言時間"", ""sub"": []}, {""main"": ""發言人"", ""sub"": []}, {""main"": ""發言人職稱"", ""sub"": []}, {""main"": ""發言人電話"", ""sub"": []}, {""main"": ""主旨"", ""sub"": []}, {""main"": ""符合條款"", ""sub"": []}, {""main"": ""事實發生日"", ""sub"": []}, {""main"": ""說明"", ""sub"": []}], ""companyAbbreviation"": ""勵威""}, ""datetime"": ""115/03/24 16:07:25""}",2026-03-24 16:07:10
1150323|rotc|2072|2,115/03/23,19:37:11,2072,世紀風電,本公司股票初次上市前現金增資員工認購股款催繳事宜,現金增資,1150323,rotc,2,"{""code"": 200, ""message"": ""查詢成功"", ""result"": {""marketName"": ""興櫃公司"", ""companyId"": ""2072"", ""data"": [[2, ""115/03/23"", ""19:37:11"", ""賴宣邠"", ""業務副總"", ""02-89798698"", ""本公司股票初次上市前現金增資員工認購股款催繳事宜"", ""44"", ""115/03/23"", ""1.事實發生日:115/03/23\n2.公司名稱:世紀離岸風電設備股份有限公司\n3.與公司關係(請輸入本公司或子公司):本公司\n4.相互持股比例:不適用\n5.發生緣由:本公司股票初次上市前現金增資員工認股繳款期限已於115年3月23日下午3時\n30分截止，惟有部分員工尚未繳納現金增資股款，依法辦理催告。\n6.因應措施:\n(1)依公司法第267條第1項準用同法第142條之規定辦理，自115年3月24日起至115年4月\n24日下午3時30分止為股款催繳期間。\n(2)尚未繳款之員工，須於上述期間內持原繳款書至第一商業銀行桃園分行暨全台各分行\n辦理繳款辦理繳款，逾期仍未繳款者即喪失認購新股之權利。\n(3)於催繳期間繳款之員工，俟催繳期間屆滿並經集保公司作業後，依其認購股數撥入認\n股人登記之集保帳戶。\n7.其他應敘明事項(若事件發生或決議之主體係屬公開發行以上公司，\n本則重大訊息同時符合證券交易法施行細則第7條第9款所定\n對股東權益或證券價格有重大影響之事項):無""]], ""footer"": [""以上資料均由各公司依發言當時所屬市場別之規定申報後，由本系統對外公佈，資料如有虛偽不實，均由該公司負責。""], ""header"": {""note"": [], ""subTitle"": [], ""mainTitle"": [""公司當日重大訊息之詳細內容""]}, ""titles"": [{""main"": ""序號"", ""sub"": []}, {""main"": ""發言日期"", ""sub"": []}, {""main"": ""發言時間"", ""sub"": []}, {""main"": ""發言人"", ""sub"": []}, {""main"": ""發言人職稱"", ""sub"": []}, {""main"": ""發言人電話"", ""sub"": []}, {""main"": ""主旨"", ""sub"": []}, {""main"": ""符合條款"", ""sub"": []}, {""main"": ""事實發生日"", ""sub"": []}, {""main"": ""說明"", ""sub"": []}], ""companyAbbreviation"": ""世紀風電""}, ""datetime"": ""115/03/24 16:07:26""}",2026-03-24 16:07:10
1150324|rotc|6648|3,115/03/24,03:31:03,6648,斯其大,公告本公司董事會決議辦理私募普通股案,私募普通股,1150324,rotc,3,"{""code"": 200, ""message"": ""查詢成功"", ""result"": {""marketName"": ""興櫃公司"", ""companyId"": ""6648"", ""data"": [[3, ""115/03/24"", ""03:31:03"", ""代理發言人林偉文"", ""代理發言人"", ""02-77181928"", ""公告本公司董事會決議辦理私募普通股案"", ""9"", ""115/03/23"", ""1.董事會決議日期:115/03/23\n2.私募有價證券種類:普通股\n3.私募對象及其與公司間關係:依證券交易法第 43 條之 6 規定之\n特定人為限。本公司目前尚未洽定特定應募人。\n4.私募股數或張數:不超過10,000仟股。\n5.得私募額度:擬於10,000仟股額度內私募普通股，私募總金額依\n實際私募情形，授權董事會決行。\n6.私募價格訂定之依據及合理性:\n本次私募普通股價格之訂定不得低於參考價格之八成且不低於票面金額10元。\n參考價格以下列二基準計算價格較高者定之：\n(a)以定價日前30個營業日興櫃股票電腦議價點選系統內該興櫃股票普通\n股之每一營業日成交金額之總和除以每一營業日成交股數之總和計算，並扣除\n無償配股除權及配息，暨加回減資反除權後之股價。或\n(b)定價日前最近期經會計師查核簽證或核閱之財務報告顯示之每股淨值。\n實際訂價日及實際私募價格，擬請股東會授權董事會於不低於參考價格之八成\n範圍內，視日後洽特定人情形與市場狀況決定之。上述訂價係依主管機關\n「公開發行公司辦理私募有價證券應注意事項」之價格計算方式\n訂定，參考本公司經營績效、未來展望及最近股價，並考量私募有價證券於\n交付起三年內有轉讓之限制而訂，故應屬合理。\n7.本次私募資金用途:將用於充實營運資金及擴大市場增加國內或海外投資等需求。\n預計能降低營運成本、強化公司競爭力及提升營運效能，對股東權益有正面助益。\n8.不採用公開募集之理由:私募有價證券三年內不得自由轉讓之規定將更可確保公司\n與策略性投資夥伴間之長期合作關係。\n9.獨立董事反對或保留意見:無。\n10.實際定價日:俟股東會通過後授權董事會決定之。\n11.參考價格:俟股東會通過後授權董事會決定之。\n12.實際私募價格、轉換或認購價格:俟股東會通過後授權董事會決定之。\n13.本次私募新股之權利義務:\n與原股份相同，惟依證券交易法第 43 條之 8 規定，本私募普通股於交付後三年\n內，除符合法令規定之特定情形外不得自由轉讓；本\n公司亦擬於該私募普通股交付滿三年後，依相關法令規定向主管機關申請補辦公\n開發行及上市交易。\n14.附有轉換、交換或認股者，其換股基準日:不適用。\n15.附有轉換、交換或認股者，對股權可能稀釋情形:不適用。\n16.其他應敘明事項:不適用。""]], ""footer"": [""以上資料均由各公司依發言當時所屬市場別之規定申報後，由本系統對外公佈，資料如有虛偽不實，均由該公司負責。""], ""header"": {""note"": [], ""subTitle"": [], ""mainTitle"": [""公司當日重大訊息之詳細內容""]}, ""titles"": [{""main"": ""序號"", ""sub"": []}, {""main"": ""發言日期"", ""sub"": []}, {""main"": ""發言時間"", ""sub"": []}, {""main"": ""發言人"", ""sub"": []}, {""main"": ""發言人職稱"", ""sub"": []}, {""main"": ""發言人電話"", ""sub"": []}, {""main"": ""主旨"", ""sub"": []}, {""main"": ""符合條款"", ""sub"": []}, {""main"": ""事實發生日"", ""sub"": []}, {""main"": ""說明"", ""sub"": []}], ""companyAbbreviation"": ""斯其大""}, ""datetime"": ""115/03/24 16:07:27""}",2026-03-24 16:07:10
