key,speech_date,speech_time,company_id,company_name,subject,matched_keywords,enterDate,marketKind,serialNumber,detail_json,fetched_at_tw
1150513|otc|2949|5,115/05/13,18:09:26,2949,欣新網,公告本公司董事會決議第二次買回庫藏股,庫藏股,1150513,otc,5,"{""code"": 200, ""message"": ""查詢成功"", ""result"": {""marketName"": ""上櫃公司"", ""companyId"": ""2949"", ""data"": [[5, ""115/05/13"", ""18:09:26"", ""游偉民"", ""財務長"", ""(02)8768-3830"", ""公告本公司董事會決議第二次買回庫藏股"", ""35"", ""115/05/13"", ""1.董事會決議日期:115/05/13\r\n2.買回股份目的:轉讓股份予員工\r\n3.買回股份種類:普通股\r\n4.買回股份總金額上限(元):783,990,736\r\n5.預定買回之期間:115/05/13~115/07/10\r\n6.預定買回之數量(股):500,000\r\n7.買回區間價格(元):40.00~85.00，公司股價低於區間價格下限，將繼續買回\r\n8.買回方式:自集中交易市場買回\r\n9.預定買回股份占公司已發行股份總數之比率(%):1.63\r\n10.申報時已持有本公司股份之累積股數(股):500,000\r\n11.申報前五年內買回公司股份之情形:\r\n(1)實際買回股份期間：113/10/11 ~ 113/11/29 、預定買回股數(股)：500000 、實際已買回股數\r\n(股)：500000 、執行情形(實際已買回股數占預定買回股數%)：100.00\r\n12.已申報買回但未執行完畢之情形:\r\n不適用\r\n13.董事會決議買回股份之會議紀錄:\r\n本公司經第五屆第七次董事會決議通過在集中交易市場，\r\n於每股新台幣40-85元之間，以新台幣42,500,000元作為買回股份之\r\n總金額上限，買回本公司普通股，預定買回股數為500,000股。\r\n14.「上市上櫃公司買回本公司股份辦法」第十條規定之轉讓辦法:\r\n第一條\r\n本公司為激勵員工及提高員工向心力，依據證券交易法第二十八條之\r\n二第一項第一款及「上市上櫃公\r\n司買回本公司股份辦法」等相關規定，訂定本公司買回股份轉讓員工\r\n辦法。\r\n本公司買回股份轉讓予員工，除依有關法令規定外，悉依本辦法規定\r\n辦理。\r\n\r\n第二條　\r\n本辦法所訂轉讓予員工之庫藏股為普通股、經辦理過戶登記後，其權\r\n利義務除有關法令及本辦法另有\r\n規定外，與其他已發行流通在外普通股相同。\r\n\r\n第三條　\r\n本次買回之股份，得依本辦法之規定，自買回股份起五年內，一次或\r\n分次轉讓予員工。\r\n\r\n第四條\r\n凡於認購配股基準日前到職滿一定期間或對公司有特殊貢獻經提報董\r\n事會同意之員工，得依本辦法第\r\n五條所定認購數額，享有認購資格。本辦法所稱之員工，除本公司員\r\n工外，尚包含本公司直接或間接\r\n持有表決權股份超過百分之五十之海內外子公司領有薪資之全職員工\r\n。\r\n\r\n第五條\r\n員工得認購股數由本公司董事會另訂之。\r\n\r\n第六條\r\n本次買回股份轉讓予員工之作業程序：\r\n一、依董事會之決議、公告、申報並於執行期限內買回本公司股份。\r\n二、訂定有關分次轉讓股數、員工認股基準日、得認購股數標準、認\r\n購繳款期間、認購資格(應包括\r\n個人表及績效等事項)、權利內容及限制條件等作業事項，需提請董\r\n事會決議。\r\n三、統計實際認購繳款股數，辦理股票轉讓過戶登記。\r\n四、轉讓審核程序：\r\n1.經理人：提報薪資報酬委員會討論後再提請董事會決議。\r\n2.非經理人：提報審計委員會討論後再提請董事會決議。\r\n\r\n第七條\r\n本次買回股份轉讓予員工，以實際買回之平均價格為轉讓價格，惟轉\r\n讓前，如遇公司已發行之普通股\r\n股份增加，得按發行股份增加比率範圍內調整之。\r\n\r\n第八條\r\n轉讓股份之權利義務：\r\n本次買回股份轉讓於員工並辦理過戶登記後，除另有規定外，餘權利\r\n義務與原股份同。\r\n\r\n第九條\r\n本辦法經董事會決議通過後生效，並得報經董事會決議修訂。\r\n\r\n第十條\r\n本辦法應提股東會報告，修訂時亦同。\r\n\r\n第十一條\r\n本辦法經董事會決議通過，訂定於113年10月01日。\r\n15.「上市上櫃公司買回本公司股份辦法」第十一條規定之轉換或認股辦法:\r\n不適用\r\n16.董事會已考慮公司財務狀況，不影響公司資本維持之聲明:\r\n上述買回股份總數，僅占本公司已發行股份之百分之1.63，\r\n且買回股份所需金額上限僅占本公司流動資產之百分之1.65，\r\n茲聲明本公司董事會已考慮公司財務狀況，\r\n上述股份之買回並不影響本公司資本之維持。\r\n17.會計師或證券承銷商對買回股份價格之合理性評估意見:\r\n本案經台新綜合證券股份有限公司出具「買回股份區間價格合理性\r\n證券承銷商評估意見書」，認為本公司預計買回其普通股股份之價格\r\n區間尚屬合理，而買回普通股股份數量及買回價格區間對本公司之\r\n財務結構、每股淨值、每股盈餘、股東權益報酬率、流動比率、\r\n速動比率等，並未產生重大影響或變動。\r\n18.其他證期局所規定之事項:\r\n無""]], ""footer"": [""以上資料均由各公司依發言當時所屬市場別之規定申報後，由本系統對外公佈，資料如有虛偽不實，均由該公司負責。""], ""header"": {""note"": [], ""subTitle"": [], ""mainTitle"": [""公司當日重大訊息之詳細內容""]}, ""titles"": [{""main"": ""序號"", ""sub"": []}, {""main"": ""發言日期"", ""sub"": []}, {""main"": ""發言時間"", ""sub"": []}, {""main"": ""發言人"", ""sub"": []}, {""main"": ""發言人職稱"", ""sub"": []}, {""main"": ""發言人電話"", ""sub"": []}, {""main"": ""主旨"", ""sub"": []}, {""main"": ""符合條款"", ""sub"": []}, {""main"": ""事實發生日"", ""sub"": []}, {""main"": ""說明"", ""sub"": []}], ""companyAbbreviation"": ""欣新網""}, ""datetime"": ""115/05/14 04:16:43""}",2026-05-14 04:16:33
1150513|otc|3128|8,115/05/13,18:51:43,3128,昇銳,公告本公司不繼續辦理114年度股東常會通過之私募普通股案,私募普通股,1150513,otc,8,"{""code"": 200, ""message"": ""查詢成功"", ""result"": {""marketName"": ""上櫃公司"", ""companyId"": ""3128"", ""data"": [[8, ""115/05/13"", ""18:51:43"", ""蕭哲彥"", ""總經理"", ""03-3653121分機508"", ""公告本公司不繼續辦理114年度股東常會通過之私募普通股案"", ""16"", ""115/05/13"", ""1.董事會決議變更日期:115/05/13\n2.原計畫申報生效日期:NA\n3.追補發行日期:不適用\n4.變動原因:本公司業經114年6月26日股東常會通過，以私募總股數不超過13,500,000股\n為限，每股面額10元之普通股，並授權董事會於股東常會決議之日起一年內不超過3次募\n集，依證券交易法第43條之6規定有價證券私募得於該股東會決議之日起一年內辦理，惟\n考量一年期限將於115年6月26日屆滿，擬終止私募發行普通股。\n5.歷次變更前後募集資金計畫:不適用\n6.預計執行進度:不適用\n7.預計完成日期:不適用\n8.預計可能產生效益:不適用\n9.與原預計效益產生之差異:不適用\n10.本次變更對股東權益之影響:不適用\n11.原主辦承銷商評估意見摘要:不適用\n12.其他應敘明事項:不適用""]], ""footer"": [""以上資料均由各公司依發言當時所屬市場別之規定申報後，由本系統對外公佈，資料如有虛偽不實，均由該公司負責。""], ""header"": {""note"": [], ""subTitle"": [], ""mainTitle"": [""公司當日重大訊息之詳細內容""]}, ""titles"": [{""main"": ""序號"", ""sub"": []}, {""main"": ""發言日期"", ""sub"": []}, {""main"": ""發言時間"", ""sub"": []}, {""main"": ""發言人"", ""sub"": []}, {""main"": ""發言人職稱"", ""sub"": []}, {""main"": ""發言人電話"", ""sub"": []}, {""main"": ""主旨"", ""sub"": []}, {""main"": ""符合條款"", ""sub"": []}, {""main"": ""事實發生日"", ""sub"": []}, {""main"": ""說明"", ""sub"": []}], ""companyAbbreviation"": ""昇銳""}, ""datetime"": ""115/05/14 04:16:44""}",2026-05-14 04:16:33
1150513|otc|3128|5,115/05/13,19:05:57,3128,昇銳,本公司董事會決議發行國內第三次無擔保轉換公司債,公司債,1150513,otc,5,"{""code"": 200, ""message"": ""查詢成功"", ""result"": {""marketName"": ""上櫃公司"", ""companyId"": ""3128"", ""data"": [[5, ""115/05/13"", ""19:05:57"", ""蕭哲彥"", ""總經理"", ""03-3653121分機508"", ""本公司董事會決議發行國內第三次無擔保轉換公司債"", ""11"", ""115/05/13"", ""1.董事會決議日期:115/05/13\n2.名稱﹝XX公司第X次（有、無）擔保公司債﹞:昇銳智慧科技股份有限公司國內第三次\n無擔保轉換公司債。\n3.是否採總括申報發行公司債(是/否):否\n4.發行總額:發行總面額為新台幣參億元整。\n5.每張面額:新台幣壹拾萬元整。\n6.發行價格:底標以暫定不低於面額之100%為限，\n每張實際發行價格依競價拍賣結果而定。\n7.發行期間:三年。\n8.發行利率:0%。\n9.擔保品之總類、名稱、金額及約定事項:不適用。\n10.募得價款之用途及運用計畫:償還銀行借款。\n11.承銷方式:採競價拍賣方式辦理公開銷售。\n12.公司債受託人:授權董事長全權處理之。\n13.承銷或代銷機構:群益金鼎證券股份有限公司。\n14.發行保證人:不適用。\n15.代理還本付息機構:群益金鼎證券股份有限公司股務代理部。\n16.簽證機構:本次公司債採無實體發行，故不適用。\n17.能轉換股份者，其轉換價格及轉換辦法:相關轉換辦法將依有關法令辦理，並報奉相關\n主管機關核准後另行公告。\n18.賣回條件:相關轉換辦法將依有關法令辦理，並報奉相關主管機關核准後另行公告。\n19.買回條件:相關轉換辦法將依有關法令辦理，並報奉相關主管機關核准後另行公告。\n20.附有轉換、交換或認股者，其換股基準日:相關轉換辦法將依有關法令辦理，並報奉相\n關主管機關核准後另行公告。\n21.附有轉換、交換或認股者，對股權可能稀釋情形:相關轉換辦法將依有關法令辦理，並\n報奉相關主管機關核准後另行公告。\n22.其他應敘明事項:(1)本次轉換公司債於主管機關申報生效發行後，授權董事長另訂發\n行日，並向財團法人中華民國證券櫃檯買賣中心申請為櫃檯買賣。(2)因資本市場籌資\n環境變化快速，為掌握訂定發行條件及實際發行作業之時效，本次辦理轉換公司債有關\n之發行金額、發行條件、發行及轉換辦法之訂定，以及計畫所需資金總額、資金來源、\n計畫項目、資金運用進度、預計可能產生效益及其他相關事宜，如經主管機關指示，\n相關法令規則修正，或因應客觀環境需修訂或修正時，授權本公司董事長辦理，並授權\n本公司董事長代表本公司簽署一切有關發行本次辦理轉換公司債案之契約及文件，並代\n表本公司辦理一切相關發行事宜。""]], ""footer"": [""以上資料均由各公司依發言當時所屬市場別之規定申報後，由本系統對外公佈，資料如有虛偽不實，均由該公司負責。""], ""header"": {""note"": [], ""subTitle"": [], ""mainTitle"": [""公司當日重大訊息之詳細內容""]}, ""titles"": [{""main"": ""序號"", ""sub"": []}, {""main"": ""發言日期"", ""sub"": []}, {""main"": ""發言時間"", ""sub"": []}, {""main"": ""發言人"", ""sub"": []}, {""main"": ""發言人職稱"", ""sub"": []}, {""main"": ""發言人電話"", ""sub"": []}, {""main"": ""主旨"", ""sub"": []}, {""main"": ""符合條款"", ""sub"": []}, {""main"": ""事實發生日"", ""sub"": []}, {""main"": ""說明"", ""sub"": []}], ""companyAbbreviation"": ""昇銳""}, ""datetime"": ""115/05/14 04:16:44""}",2026-05-14 04:16:33
1150513|otc|6160|4,115/05/13,19:37:23,6160,欣技,公告本公司董事會決議辦理現金增資發行新股,現金增資,1150513,otc,4,"{""code"": 200, ""message"": ""查詢成功"", ""result"": {""marketName"": ""上櫃公司"", ""companyId"": ""6160"", ""data"": [[4, ""115/05/13"", ""19:37:23"", ""張家榮"", ""財會處資深經理"", ""02-86471166"", ""公告本公司董事會決議辦理現金增資發行新股"", ""11"", ""115/05/13"", ""1.董事會決議日期:115/05/13\n2.增資資金來源:現金增資發行新股\n3.是否採總括申報發行新股(是，請併敘明預定發行期間/否):否\n4.全案發行總金額及股數(如屬盈餘或公積轉增資，發行股數則不含配發給員工部分):\n擬辦理現金增資發行普通股11,000仟股，每股面額新臺幣10元，計新台幣110,000仟元。\n5.採總括申報發行新股案件，本次發行金額及股數:不適用\n6.採總括申報發行新股案件，本次發行後，剩餘之金額及股數餘額:不適用\n7.每股面額:新台幣10元\n8.發行價格:實際發行價格俟本現金增資案向金管會申報生效後，授權董事長參酌發行\n市場狀況及依相關法令規定，與承銷商商議決定。\n9.員工認購股數或配發金額:1,650,000股\n10.公開銷售股數:1,100,000股\n11.原股東認購或無償配發比例(請註明暫定每仟股認購或配發股數):發行新股總數之75%\n，計8,250仟股由原股東按增資認股基準日股東名簿記載之持股比率認購。\n12.畸零股及逾期未認購股份之處理方式:原股東認購不足一股之畸零股，由股東自停止\n過戶日起五日內自行至本公司股務代理機構辦理拼湊一整股認購。原股東及員工放棄\n認購或拼湊不足一股之畸零股部份，擬請董事會授權董事長洽特定人按發行價格認足。\n13.本次發行新股之權利義務:與原已發行普通股股份之權利義務相同\n14.本次增資資金用途:償還銀行借款及充實營運資金\n15.其他應敘明事項:\n(1)本次計畫之重要內容，包括發行價格、資金來源、計畫項目、資金運用計畫及進度\n、預計可能產生效益及其他相關發行條件等事宜，如有因市場狀況及依主管機關指示\n修正而需修正者，擬請董事會授權董事長全權處理。\n(2)本次現金增資案俟呈主管機關申報生效後，有關認股基準日、增資基準日及其他未\n盡事宜，擬請董事會授權董事長視實際情況依相關法令規定辦理。""]], ""footer"": [""以上資料均由各公司依發言當時所屬市場別之規定申報後，由本系統對外公佈，資料如有虛偽不實，均由該公司負責。""], ""header"": {""note"": [], ""subTitle"": [], ""mainTitle"": [""公司當日重大訊息之詳細內容""]}, ""titles"": [{""main"": ""序號"", ""sub"": []}, {""main"": ""發言日期"", ""sub"": []}, {""main"": ""發言時間"", ""sub"": []}, {""main"": ""發言人"", ""sub"": []}, {""main"": ""發言人職稱"", ""sub"": []}, {""main"": ""發言人電話"", ""sub"": []}, {""main"": ""主旨"", ""sub"": []}, {""main"": ""符合條款"", ""sub"": []}, {""main"": ""事實發生日"", ""sub"": []}, {""main"": ""說明"", ""sub"": []}], ""companyAbbreviation"": ""欣技""}, ""datetime"": ""115/05/14 04:16:45""}",2026-05-14 04:16:33
1150513|otc|5227|6,115/05/13,19:38:10,5227,立凱-KY,公告本公司董事會決議辦理私募普通股增資案,私募普通股,1150513,otc,6,"{""code"": 200, ""message"": ""查詢成功"", ""result"": {""marketName"": ""上櫃公司"", ""companyId"": ""5227"", ""data"": [[6, ""115/05/13"", ""19:38:10"", ""朱瑞陽"", ""總經理兼投資長"", ""03-364-6655"", ""公告本公司董事會決議辦理私募普通股增資案"", ""11"", ""115/05/13"", ""1.董事會決議日期:115/05/13\n2.私募有價證券種類:普通股\n3.私募對象及其與公司間關係:本次募集普通股之對象以符合證券交易法第43條之6及\n金融監督管理委員會112年9月12日金管證發字第1120383220號令規定之特定人為限。\n4.私募股數或張數:以不超過4,000萬股為限\n5.得私募額度:私募總股數以不超過4,000萬股為限，每股面額10元，擬授權董事會，\n於股東常會決議之日起一年內分4次募集。\n6.私募價格訂定之依據及合理性:\n私募參考價格之計算係以下列二基準計算價格較高者訂定之：\n (1)發行價格訂定之依據：本次私募現金增資發行普通股價格，每股價格不低於參考\n    價格之八成，將於定價日決定。參考價格以下列二基準計算價格較高者定之：\n   A.以定價日前1、3或5個營業日擇一計算普通股收盤價簡單算數平均數扣除無償配股\n     除權及配息，並加回減資反除權後之股價。\n   B.定價日前30個營業日普通股收盤價簡單算數平均數扣除無償配股除權及配息，並\n     加回減資反除權後之股價。\n (2)發行價格訂定之合理性：實際發行價格擬授權董事會依法令規定及以不低於股東常\n    會決議成數範圍內，視日後洽特定人情形、市場狀況及公司未來展望決定之。前述\n    私募價格訂定之依據符合主管機關之法令規定，並同時考量私募普通股轉讓時點、\n    對象及數量均有嚴格限制，且三年內不得洽辦上櫃掛牌、流動性較差因素，故本次\n    私募價格成數之訂定應屬合理。\n7.本次私募資金用途:充實營運資金或轉投資或其他因應未來發展之資金需求\n8.不採用公開募集之理由:\n考量籌集資金之時效性、便利性及發行成本等，故擬以私募方式辦理現金增資。\n9.獨立董事反對或保留意見:無\n10.實際定價日:尚未訂定\n11.參考價格:尚未訂定\n12.實際私募價格、轉換或認購價格:尚未訂定\n13.本次私募新股之權利義務:本次私募之普通股，權利義務與已發行股份相同，並於交付\n  日起三年內除依證券交易法第43條之8規定之轉讓對象外，其餘受限不得轉讓，並於交\n  付日滿三年後，擬提請股東常會授權董事會得依相關法令向主管機關申請本次私募普\n  通股上櫃交易。\n14.附有轉換、交換或認股者，其換股基準日:不適用\n15.附有轉換、交換或認股者，對股權可能稀釋情形:不適用\n16.附有轉換或認股者，於私募公司債交付且假設全數轉換或認購普通股後對上櫃普通股\n股權比率之可能影響（上櫃普通股數A、A/已發行普通股）:不適用\n17.前項預計上櫃普通股未達500萬股且未達25%者，請說明股權流通性偏低之因應措施:\n不適用\n18.其他應敘明事項:\n本私募案計畫之主要內容，除私募定價成數外，包括發行價格、股數、發行條件、計畫\n項目、資金運用進度、預計可能產生效益及其他未盡事宜，未來如經主管機關或因客觀\n環境因素變更而有所修正時，擬請授權董事會依相關規定全權處理之。""]], ""footer"": [""以上資料均由各公司依發言當時所屬市場別之規定申報後，由本系統對外公佈，資料如有虛偽不實，均由該公司負責。""], ""header"": {""note"": [], ""subTitle"": [], ""mainTitle"": [""公司當日重大訊息之詳細內容""]}, ""titles"": [{""main"": ""序號"", ""sub"": []}, {""main"": ""發言日期"", ""sub"": []}, {""main"": ""發言時間"", ""sub"": []}, {""main"": ""發言人"", ""sub"": []}, {""main"": ""發言人職稱"", ""sub"": []}, {""main"": ""發言人電話"", ""sub"": []}, {""main"": ""主旨"", ""sub"": []}, {""main"": ""符合條款"", ""sub"": []}, {""main"": ""事實發生日"", ""sub"": []}, {""main"": ""說明"", ""sub"": []}], ""companyAbbreviation"": ""立凱-KY""}, ""datetime"": ""115/05/14 04:16:46""}",2026-05-14 04:16:33
1150511|otc|3455|3,115/05/13,20:07:14,3455,由田,本公司董事會決議辦理現金增資私募普通股,私募普通股|現金增資,1150511,otc,3,"{""code"": 200, ""message"": ""查詢成功"", ""result"": {""marketName"": ""上櫃公司"", ""companyId"": ""3455"", ""data"": [[3, ""115/05/13"", ""20:07:14"", ""張文杰"", ""總經理"", ""02-8226-2088#103"", ""本公司董事會決議辦理現金增資私募普通股"", ""11"", ""115/05/13"", ""1.董事會決議日期:115/05/13\n2.私募有價證券種類:普通股\n3.私募對象及其與公司間關係:依證券交易法第43條之6規定，對特定人進行私募，惟目前\n並無已洽定之應募人。\n4.私募股數或張數:於不超過普通股12,000,000股(含)之額度內，於股東會決議通過之日\n起一年內分三次辦理。\n5.得私募額度:視發行價格及實際發行股數而定。\n6.私募價格訂定之依據及合理性:\n(1)以定價日前1、3或5個營業日擇一計算之普通股收盤價簡單算數平均數扣除無償配股\n除權及配息，並加回減資反除權後之股價，與定價日前30個營業日普通股收盤價簡單算\n數平均數扣除無償配股除權及配息，並加回減資反除權後之股價，以上二基準計算價格\n較高者為參考價格。\n(2)本次私募普通股實際發行價格以不低於參考價格之八成為訂定依據，並擬請股東會\n以不低於參考價格之八成授權董事會訂定實際發行價格。\n(3)前述價格訂定方式係依據相關法令辦理，應屬合理。\n7.本次私募資金用途:\n(1)私募資金用途\n三次辦理私募之資金用途皆為充實營運資金。\n(2)預計達成效益\n三次辦理私募之預計達成效益皆為充實營運資金將強化公司經營體質及競爭力，預計將\n改善財務結構、有助公司營運穩定成長，對股東權益並有正面助益。\n8.不採用公開募集之理由:\n考量募集資本之時效性、便利性及發行成本等因素，且限制三年內不得轉讓有助於公司\n經營權穩定及拓展營運，故擬透過私募方式向特定人籌募款項。\n9.獨立董事反對或保留意見:無。\n10.實際定價日:不適用。\n11.參考價格:不適用。\n12.實際私募價格、轉換或認購價格:不適用。\n13.本次私募新股之權利義務:\n原則上與本公司已發行之普通股相同。惟依證券交易法之規定，本公司私募普通股於交\n付日起三年內，除依證券交易法第43條之8規定之轉讓對象外，餘不得再轉讓。\n14.附有轉換、交換或認股者，其換股基準日:不適用。\n15.附有轉換、交換或認股者，對股權可能稀釋情形:不適用。\n16.附有轉換或認股者，於私募公司債交付且假設全數轉換或認購普通股後對上櫃普通股\n股權比率之可能影響（上櫃普通股數A、A/已發行普通股）:不適用。\n17.前項預計上櫃普通股未達500萬股且未達25%者，請說明股權流通性偏低之因應措施:\n不適用。\n18.其他應敘明事項:本次私募案之發行股數、發行價格、發行條件、募資金額、計畫項目\n、資金運用進度、預計可能產生效益或其他相關事宜等，若因法令修正或主管機關規定\n及基於營運評估或客觀環境之影響需變更或修正時，擬請股東會授權董事會得依當時市　\n場狀況修訂之。""]], ""footer"": [""以上資料均由各公司依發言當時所屬市場別之規定申報後，由本系統對外公佈，資料如有虛偽不實，均由該公司負責。""], ""header"": {""note"": [], ""subTitle"": [], ""mainTitle"": [""公司當日重大訊息之詳細內容""]}, ""titles"": [{""main"": ""序號"", ""sub"": []}, {""main"": ""發言日期"", ""sub"": []}, {""main"": ""發言時間"", ""sub"": []}, {""main"": ""發言人"", ""sub"": []}, {""main"": ""發言人職稱"", ""sub"": []}, {""main"": ""發言人電話"", ""sub"": []}, {""main"": ""主旨"", ""sub"": []}, {""main"": ""符合條款"", ""sub"": []}, {""main"": ""事實發生日"", ""sub"": []}, {""main"": ""說明"", ""sub"": []}], ""companyAbbreviation"": ""由田""}, ""datetime"": ""115/05/14 04:16:46""}",2026-05-14 04:16:33
