key,speech_date,speech_time,company_id,company_name,subject,matched_keywords,enterDate,marketKind,serialNumber,detail_json,fetched_at_tw
1150702|sii|2034|1,115/07/02,17:35:06,2034,允強,公告本公司發行國內第四次無擔保轉換公司債轉換價格之調整,公司債,1150702,sii,1,"{""code"": 200, ""message"": ""查詢成功"", ""result"": {""marketName"": ""上市公司"", ""companyId"": ""2034"", ""data"": [[1, ""115/07/02"", ""17:35:06"", ""李兆青"", ""財務主管"", ""04-889-9776"", ""公告本公司發行國內第四次無擔保轉換公司債轉換價格之調整"", ""51"", ""115/07/02"", ""1.事實發生日:115/07/02\n2.公司名稱:允強實業股份有限公司\n3.與公司關係(請輸入本公司或子公司):本公司\n4.相互持股比例:不適用\n5.發生緣由:本公司發行國內第四次無擔保轉換公司債轉換價格之調整。\n6.因應措施:無。\n7.其他應敘明事項(若事件發生或決議之主體係屬公開發行以上公司，本則重大訊息同時\n  符合證券交易法施行細則第7條第9款所定對股東權益或證券價格有重大影響之事項):\n(1)依據本公司國內第四次無擔保轉換公司債發行及轉換辦法第十一條\n規定辦理。\n(2)為配合本公司除息基準日，自115年07月23日起本公司發行國內第四次無擔保轉換\n公司債轉換之價格依上述辦法計算後調整為22.8元。""]], ""footer"": [""以上資料均由各公司依發言當時所屬市場別之規定申報後，由本系統對外公佈，資料如有虛偽不實，均由該公司負責。""], ""header"": {""note"": [], ""subTitle"": [], ""mainTitle"": [""公司當日重大訊息之詳細內容""]}, ""titles"": [{""sub"": [], ""main"": ""序號""}, {""sub"": [], ""main"": ""發言日期""}, {""sub"": [], ""main"": ""發言時間""}, {""sub"": [], ""main"": ""發言人""}, {""sub"": [], ""main"": ""發言人職稱""}, {""sub"": [], ""main"": ""發言人電話""}, {""sub"": [], ""main"": ""主旨""}, {""sub"": [], ""main"": ""符合條款""}, {""sub"": [], ""main"": ""事實發生日""}, {""sub"": [], ""main"": ""說明""}], ""companyAbbreviation"": ""允強""}, ""datetime"": ""115/07/03 01:10:16""}",2026-07-03 01:10:14
1150702|sii|4190|1,115/07/02,17:52:13,4190,佐登-KY,公告本公司中華民國境內第四次有擔保轉換公司債之發行，已依中國證監會發布之『境內企業境外發行證券和上市管理試行辦法』進行備案,公司債,1150702,sii,1,"{""code"": 200, ""message"": ""查詢成功"", ""result"": {""marketName"": ""上市公司"", ""companyId"": ""4190"", ""data"": [[1, ""115/07/02"", ""17:52:13"", ""陳佳琦"", ""集團總經理"", ""04-22922999"", ""公告本公司中華民國境內第四次有擔保轉換公司債之發行，\r\n已依中國證監會發布之『境內企業境外發行證券和上市管理試行\r\n辦法』進行備案"", ""51"", ""115/07/02"", ""1.事實發生日:115/07/02\n2.公司名稱:佐登妮絲集團股份有限公司\n3.與公司關係(請輸入本公司或子公司):本公司\n4.相互持股比例:不適用\n5.發生緣由:\n因應中國證券監督管理委員會發布之『境內企業境外發行證券和上市　\n管理試行辦法』(以下稱『試行辦法』)辦理。\n6.因應措施:\n本公司已於115/07/02依照試行辦法規定，就發行中華\n民國境內第四次有擔保轉換公司債乙案向中國證監會進行備案。\n7.其他應敘明事項(若事件發生或決議之主體係屬公開發行以上公司，本則重大訊息同時\n  符合證券交易法施行細則第7條第9款所定對股東權益或證券價格有重大影響之事項):\n無。""]], ""footer"": [""以上資料均由各公司依發言當時所屬市場別之規定申報後，由本系統對外公佈，資料如有虛偽不實，均由該公司負責。""], ""header"": {""note"": [], ""subTitle"": [], ""mainTitle"": [""公司當日重大訊息之詳細內容""]}, ""titles"": [{""sub"": [], ""main"": ""序號""}, {""sub"": [], ""main"": ""發言日期""}, {""sub"": [], ""main"": ""發言時間""}, {""sub"": [], ""main"": ""發言人""}, {""sub"": [], ""main"": ""發言人職稱""}, {""sub"": [], ""main"": ""發言人電話""}, {""sub"": [], ""main"": ""主旨""}, {""sub"": [], ""main"": ""符合條款""}, {""sub"": [], ""main"": ""事實發生日""}, {""sub"": [], ""main"": ""說明""}], ""companyAbbreviation"": ""佐登-KY""}, ""datetime"": ""115/07/03 01:10:17""}",2026-07-03 01:10:14
1150702|sii|3189|1,115/07/02,17:55:53,3189,景碩,本公司訂購機器設備公告,機器設備,1150702,sii,1,"{""code"": 200, ""message"": ""查詢成功"", ""result"": {""marketName"": ""上市公司"", ""companyId"": ""3189"", ""data"": [[1, ""115/07/02"", ""17:55:53"", ""穆顯爵"", ""資深專案處長"", ""(03)4871919"", ""本公司訂購機器設備公告"", ""20"", ""115/07/02"", ""1.標的物之名稱及性質（如坐落台中市北區ＸＸ段ＸＸ小段土地）:\r\n機器設備\r\n2.事實發生日:114/7/25~115/7/2\r\n3.董事會通過日期: 不適用\r\n4.其他核決日期:\r\n核決層級:董事長\r\n民國115年7月2日\r\n5.交易單位數量（如ＸＸ平方公尺，折合ＸＸ坪）、每單位價格及交易總金額:\r\n一批，總計新台幣3,156,560仟元\n(依上述事實發生日期累計訂單總金額)\r\n6.交易相對人及其與公司之關係（交易相對人如屬自然人，且非公司之關\r\n係人者，得免揭露其姓名）:\r\n盟立自動化股份有限公司，非關係人\r\n7.交易相對人為關係人者，並應公告選定關係人為交易對象之原因及前次移轉之\r\n所有人、前次移轉之所有人與公司及交易相對人間相互之關係、前次移轉日期\r\n及移轉金額:\r\n不適用\r\n8.交易標的最近五年內所有權人曾為公司之關係人者，尚應公告關係\r\n人之取得及處分日期、價格及交易當時與公司之關係:\r\n不適用\r\n9.預計處分利益（或損失）（取得資產者不適用）（遞延者應列表說明\r\n認列情形）:\r\n不適用\r\n10.交付或付款條件（含付款期間及金額）、契約限制條款及其他重要約定\r\n事項:\r\n依合約付款條件\r\n11.本次交易之決定方式（如招標、比價或議價）、價格決定之參考依據及\r\n決策單位:\r\n比價及議價，依本公司核決權限規定辦理\r\n12.專業估價者事務所或公司名稱及其估價金額:\r\n不適用\r\n13.專業估價師姓名:\r\n不適用\r\n14.專業估價師開業證書字號:\r\n不適用\r\n15.估價報告是否為限定價格、特定價格或特殊價格:否或不適用\r\n16.是否尚未取得估價報告:是\r\n17.尚未取得估價報告之原因:\r\n不適用\r\n18.估價結果有重大差異時，其差異原因及會計師意見:\r\n不適用\r\n19.會計師事務所名稱:\r\n不適用\r\n20.會計師姓名:\r\n不適用\r\n21.會計師開業證書字號:\r\n不適用\r\n22.經紀人及經紀費用:\r\n無\r\n23.取得或處分之具體目的或用途:\r\n供生產用\r\n24.本次交易表示異議之董事之意見:\r\n不適用\r\n25.本次交易為關係人交易:否\r\n26.監察人承認或審計委員會同意日期:\r\n不適用\r\n27.本次交易係向關係人取得不動產或其使用權資產:否\r\n28.依「公開發行公司取得或處分資產處理準則」第十六條規定\r\n評估之價格:不適用\r\n29.依前項評估之價格較交易價格為低者，依同準則第十七條規\r\n定評估之價格:不適用\r\n30.前已就同一件事件發布重大訊息日期: 不適用\r\n31.其他敘明事項:\r\n無""]], ""footer"": [""以上資料均由各公司依發言當時所屬市場別之規定申報後，由本系統對外公佈，資料如有虛偽不實，均由該公司負責。""], ""header"": {""note"": [], ""subTitle"": [], ""mainTitle"": [""公司當日重大訊息之詳細內容""]}, ""titles"": [{""sub"": [], ""main"": ""序號""}, {""sub"": [], ""main"": ""發言日期""}, {""sub"": [], ""main"": ""發言時間""}, {""sub"": [], ""main"": ""發言人""}, {""sub"": [], ""main"": ""發言人職稱""}, {""sub"": [], ""main"": ""發言人電話""}, {""sub"": [], ""main"": ""主旨""}, {""sub"": [], ""main"": ""符合條款""}, {""sub"": [], ""main"": ""事實發生日""}, {""sub"": [], ""main"": ""說明""}], ""companyAbbreviation"": ""景碩""}, ""datetime"": ""115/07/03 01:10:17""}",2026-07-03 01:10:14
1150702|sii|3028|1,115/07/02,17:59:40,3028,增你強,公告本公司訂定115年現金增資認股基準日等相關事宜,現金增資,1150702,sii,1,"{""code"": 200, ""message"": ""查詢成功"", ""result"": {""marketName"": ""上市公司"", ""companyId"": ""3028"", ""data"": [[1, ""115/07/02"", ""17:59:40"", ""周俊賢"", ""共同執行長兼總經理"", ""(02)2792-8788"", ""公告本公司訂定115年現金增資認股基準日等相關事宜"", ""11"", ""115/07/02"", ""1.董事會決議或公司決定增資基準日期:115/07/02\n2.是否採總括申報發行新股(是，請併敘明預定發行期間/否):否\n3.主管機關申報生效日期:115/06/24\n4.董事會決議(追補)發行日期:115/05/08\n5.發行總金額及股數:\n發行總金額:發行總面額新台幣237,240,000元\n發行股數:23,724,000股\n6.採總括申報發行新股案件，本次發行金額及股數:不適用\n7.採總括申報發行新股案件，本次發行後，剩餘之金額及股數餘額:不適用\n8.每股面額:新台幣10元\n9.發行價格:俟定價後另行公告\n10.員工認股股數:依公司法第267條規定，保留增資發行新股之10%，計2,372,400股\n由本公司員工認購。\n11.原股東認購比率:依公司法第267條規定，增資發行新股之80%，計18,979,200股，\n由原股東按增資認股基準日股東名簿記載之股東及其持股比例分別認購，依本公司\n目前流通在外股數237,241,193股計算，原股東每仟股得認購79.99959770 股。\n如嗣後因本公司普通股發生變動影響流通在外股份數量，致原股東認股比率因此發\n生變動時，由董事長辦理相關調整事宜。\n12.公開銷售方式及股數:依證券交易法第28條之1規定，提撥本次增資發行新股之10%，\n計2,372,400股，採公開申購方式公開銷售。\n13.畸零股及逾期未認購股份之處理方式:原股東認購不足一股之畸零股，自停止過戶日\n起五日內由股東逕向本公司股務代理機構辦理拼湊整股認購，其拼湊不足一股之畸零\n股及原股東、員工放棄認購或認購不足及逾期未拼湊之部分，擬授權董事長洽特定人\n按發行價格認購。\n14.本次發行新股之權利義務:與原發行之普通股份相同。\n15.本次增資資金用途:償還銀行借款\n16.現金增資認股基準日:115/07/25\n17.最後過戶日:115/07/20\n18.停止過戶起始日期:115/07/21\n19.停止過戶截止日期:115/07/25\n20.股款繳納期間:\n(1)原股東及員工股款繳納期間:115/7/31~115/8/6\n(2)特定人認股繳款期間:115/8/7~115/8/13\n21.與代收及專戶存儲價款行庫訂約日期:俟正式簽約後另行公告\n22.委託代收存款機構:俟正式簽約後另行公告\n23.委託存儲款項機構:俟正式簽約後另行公告\n24.其他應敘明事項:\n(1)本公司辦理115年現金增資發行普通股23,724,000股乙案，業經金融監督管理委員會\n115年6月24日金管證發字第1150346570號函申報生效在案。\n(2)本次現金增資未盡事宜或以上日期或期限如因法令或客觀環境而需變更，由董事長\n全權處理。""]], ""footer"": [""以上資料均由各公司依發言當時所屬市場別之規定申報後，由本系統對外公佈，資料如有虛偽不實，均由該公司負責。""], ""header"": {""note"": [], ""subTitle"": [], ""mainTitle"": [""公司當日重大訊息之詳細內容""]}, ""titles"": [{""sub"": [], ""main"": ""序號""}, {""sub"": [], ""main"": ""發言日期""}, {""sub"": [], ""main"": ""發言時間""}, {""sub"": [], ""main"": ""發言人""}, {""sub"": [], ""main"": ""發言人職稱""}, {""sub"": [], ""main"": ""發言人電話""}, {""sub"": [], ""main"": ""主旨""}, {""sub"": [], ""main"": ""符合條款""}, {""sub"": [], ""main"": ""事實發生日""}, {""sub"": [], ""main"": ""說明""}], ""companyAbbreviation"": ""增你強""}, ""datetime"": ""115/07/03 01:10:18""}",2026-07-03 01:10:14
1150702|sii|3717|2,115/07/02,19:40:58,3717,聯嘉投控,公告本公司114年度現金增資發行新股暨國內第一次有擔保轉換公司債資金運用計畫變更案,現金增資|公司債,1150702,sii,2,"{""code"": 200, ""message"": ""查詢成功"", ""result"": {""marketName"": ""上市公司"", ""companyId"": ""3717"", ""data"": [[2, ""115/07/02"", ""19:40:58"", ""吳俊德"", ""副總經理"", ""(037)539000"", ""公告本公司114年度現金增資發行新股暨國內第一次\r\n有擔保轉換公司債資金運用計畫變更案"", ""16"", ""115/07/02"", ""1.董事會決議變更日期:115/07/02\n2.原計畫申報生效之日期:114/12/18\n3.追補發行之日期:不適用\n4.變動原因:\na.本公司於114年11月13日董事會決議辦理114年度現金增資\n發行新股暨國內第一次有擔保轉換公司債，原計畫所需資金\n總額1,400,000仟元，全數用於轉投資子公司聯嘉光電股份有限\n公司以償還其銀行借款。\nb.本公司國內第一次有擔保轉換公司債，每張債券發行面額為\n100千元整，發行總面額為700,000千元整，票面利率0%，\n發行期間3年，採競價拍賣方式辦理公開承銷，每張實際發行價格\n依面額之105.57%發行，實際募集總金額為738,998千元，\n並於115年第一季執行完畢，其中700,000千元用於轉投資子公司\n聯嘉光電股份有限公司以償還其銀行借款，餘38,998千用於充實\n本公司營運資金。\nc.本公司114年度現金增資發行新股因考量募集期間資本市場波\n動劇烈、募資環境變化及維護公司股東權益，本公司董事長115年\n06月12日依本公司114年11月13日董事會之授權，代表本公司\n撤銷114年度現金增資發行新股案，向金融監督管理委員會申請\n撤銷本次現金增資發行新股案，業經金融監督管理委員會\n115年6月23日金管證發字第1150347329號同意在案，\n並於115年07月02日董事會通過辦理計畫金額變更。\n5.歷次變更前後募集資金計畫:\n                                         單位:新臺幣千元\n計劃項目     原幕資計畫金額    變動金額   計畫變更後金額\n轉投資子公司\n聯嘉光電        1,400,000      (700,000)       700,000\n充實營運資金       38,998             -         38,998\n合計            1,438,998      (700,000)       738,998\n6.預計執行進度:變更後之計畫已於115年第一季執行完畢\n7.預計完成日期:變更後之計畫已於115年第一季執行完畢\n8.預計可能產生效益:\n本次募資計劃所需資金738,998仟元，已於115年01月20日募集\n完成，其中700,000千元用於轉投資子公司聯嘉光電股份有限\n公司以償還其銀行借款，餘38,998千用於充實本公司營運資金\n，皆於115年第一季執行完畢。本公司本次募集資金轉投資\n子公司聯嘉光電以償還其銀行借款，可減少利息支出，並可提升\n償債能力，若以聯嘉光電擬償還銀行借款之利率設算，預估115\n年度可節省之利息支出約15,443千元，後續可節省之年度\n利息支出約18,740千元。\n9.與原預計效益產生之差異:\n本公司計畫變更後用途仍為轉投資子公司聯嘉光電股份有限公司\n以償還其銀行借款，故與原預計效益並無重大差異，然因計畫\n變更後之金額減少，故可節省之利息支出亦同步減少，惟仍有\n強化財務結構及提升償債能力，以及節省利息支出，減輕財務\n負擔之效益。\n10.本次變更對股東權益之影響:\n本次辦理計畫金額變更，可避免股本過度擴張顧及股東權益，\n後續再依營運資金需求情形評估辦理增資事宜，對股東權益\n應無重大不利之影響。\n11.原主辦承銷商評估意見摘要:\n聯嘉光電投資控股股份有限公司辦理114年度現金增資發行　\n新股暨發行國內第一次有擔保轉換公司債，其中國內第一次\n有擔保轉換公司債已於115年第一季發行募集資金完成，\n唯114年度現金增資發行新股因募集期間資本市場波動劇烈、\n募資環境變化及維護公司股東權益，且該公司因依核准\n資金之募集期間已不足以調整延後，而需申請撤銷現金增資\n發行新股案並辦理計畫變更，經評估有其必要性及合理性。\n該公司變更後計畫變更後資金用途仍為轉投資子公司\n聯嘉光電股份有限公司以償還其銀行借款，故與原預計效益\n並無重大差異，然因計畫變更後之金額減少，故可節省之利\n息支出亦同步減少，惟仍有強化財務結構及提升償債能力，\n以及節省利息支出，減輕財務負擔之效益，且已於115年\n第一季執行完畢，經評估對該公司股東權益並無負面之影響。\n12.其他應敘明事項:提報最近次股東會追認。""]], ""footer"": [""以上資料均由各公司依發言當時所屬市場別之規定申報後，由本系統對外公佈，資料如有虛偽不實，均由該公司負責。""], ""header"": {""note"": [], ""subTitle"": [], ""mainTitle"": [""公司當日重大訊息之詳細內容""]}, ""titles"": [{""sub"": [], ""main"": ""序號""}, {""sub"": [], ""main"": ""發言日期""}, {""sub"": [], ""main"": ""發言時間""}, {""sub"": [], ""main"": ""發言人""}, {""sub"": [], ""main"": ""發言人職稱""}, {""sub"": [], ""main"": ""發言人電話""}, {""sub"": [], ""main"": ""主旨""}, {""sub"": [], ""main"": ""符合條款""}, {""sub"": [], ""main"": ""事實發生日""}, {""sub"": [], ""main"": ""說明""}], ""companyAbbreviation"": ""聯嘉投控""}, ""datetime"": ""115/07/03 01:10:19""}",2026-07-03 01:10:14
1150702|sii|4169|10,115/07/02,22:41:53,4169,泰宗,本公司董事會決議通過放棄認購子公司台灣基因核酸新藥股份有限公司現金增資案,現金增資,1150702,sii,10,"{""code"": 200, ""message"": ""查詢成功"", ""result"": {""marketName"": ""上市公司"", ""companyId"": ""4169"", ""data"": [[10, ""115/07/02"", ""22:41:53"", ""王雅俊"", ""總經理"", ""02-26972628"", ""本公司董事會決議通過放棄認購子公司\r\n台灣基因核酸新藥股份有限公司現金增資案"", ""51"", ""115/07/02"", ""1.事實發生日:115/07/02\n2.公司名稱:泰宗生物科技股份有限公司\n3.與公司關係(請輸入本公司或子公司):本公司\n4.相互持股比例:不適用\n5.發生緣由:\n為配合子公司台灣基因核酸新藥股份有限公司（非重要子公司，簡稱台基核）營運發展\n及其吸收與留任專業人才暨整合外部資源引進策略性投資人，藉以提高營運績效，\n強化其公司競爭力之需求，本公司決議放棄認購本次現金增資案。\n6.因應措施:依台基核董事會授權台基核董事長洽特定人認購之。\n7.其他應敘明事項(若事件發生或決議之主體係屬公開發行以上公司，本則重大訊息同時\n  符合證券交易法施行細則第7條第9款所定對股東權益或證券價格有重大影響之事項):\n對本公司股東權益及財務業務無重大影響""]], ""footer"": [""以上資料均由各公司依發言當時所屬市場別之規定申報後，由本系統對外公佈，資料如有虛偽不實，均由該公司負責。""], ""header"": {""note"": [], ""subTitle"": [], ""mainTitle"": [""公司當日重大訊息之詳細內容""]}, ""titles"": [{""sub"": [], ""main"": ""序號""}, {""sub"": [], ""main"": ""發言日期""}, {""sub"": [], ""main"": ""發言時間""}, {""sub"": [], ""main"": ""發言人""}, {""sub"": [], ""main"": ""發言人職稱""}, {""sub"": [], ""main"": ""發言人電話""}, {""sub"": [], ""main"": ""主旨""}, {""sub"": [], ""main"": ""符合條款""}, {""sub"": [], ""main"": ""事實發生日""}, {""sub"": [], ""main"": ""說明""}], ""companyAbbreviation"": ""泰宗""}, ""datetime"": ""115/07/03 01:10:20""}",2026-07-03 01:10:14
1150702|otc|5475|1,115/07/02,21:14:25,5475,德宏,公告本公司董事會決議辦理現金增資發行新股案,現金增資,1150702,otc,1,"{""code"": 200, ""message"": ""查詢成功"", ""result"": {""marketName"": ""上櫃公司"", ""companyId"": ""5475"", ""data"": [[1, ""115/07/02"", ""21:14:25"", ""陳源水"", ""財務經理"", ""03-4726636#127"", ""公告本公司董事會決議辦理現金增資發行新股案"", ""11"", ""115/07/02"", ""1.董事會決議日期:115/07/02\n2.增資資金來源:現金增資發行新股\n3.是否採總括申報發行新股(是，請併敘明預定發行期間/否):否\n4.全案發行總金額及股數(如屬盈餘或公積轉增資，發行股數則不含配發給員工部分):\n不超過普通股12,000仟股之額度內辦理現金增資發行普通股，實際發行股數授權董事長\n視實際狀況決定之。\n5.採總括申報發行新股案件，本次發行金額及股數:不適用\n6.採總括申報發行新股案件，本次發行後，剩餘之金額及股數餘額:不適用\n7.每股面額:新台幣10元\n8.發行價格:授權董事長參酌發行市場狀況及相關法令規定與主辦承銷商商議決定。\n9.員工認購股數或配發金額:發行新股總額之10%。\n10.公開銷售股數:發行新股總額之10%。\n11.原股東認購或無償配發比例(請註明暫定每仟股認購或配發股數):發行新股總額之80%\n由原股東按照認股基準日股東名簿記載之持股比例認購。\n12.畸零股及逾期未認購股份之處理方式:原股東認購不足一股之畸零股，得由股東自行　\n在停止過戶日起五日內，逕向本公司股務代理機構辦理拼湊成整股認購。其拼湊不足一\n股之畸零股及原股東及員工放棄認股或認購不足及逾期未拼湊之部份，擬授權董事長洽\n特定人按發行價格認購之。\n13.本次發行新股之權利義務:與原已發行普通股股份相同。\n14.本次增資資金用途:購置機器設備、償還銀行借款、充實營運資金。\n15.現金減資後再行募資之合理性及必要性\n(募資當年度及前一年度有辦理現金減資者適用):不適用\n16.其他應敘明事項:\n(1)本次現金增資發行新股案俟奉主管機關申報生效後，董事會授權董事長另訂認股\n基準日、增資基準日、股款繳納期間及其他辦理增資發行相關事項。\n(2)本次現金增資之重要內容，包括實際發行股數、實際發行價格、實際發行計畫、\n計畫項目、資金來源、預定資金運用進度、預計可能產生效益及其他相關事宜，如\n經主管機關指示、相關法令規則修正、或因應客觀環境需變更或修正時，擬授權董\n事長全權處理之。\n(3)為配合前揭現金增資發行新股籌資計畫之相關發行作業，擬授權本公司董事長核決\n並代表本公司簽署一切有關辦理現金增資發行新股之契約及文件，並代表本公司辦理\n相關發行事宜。""]], ""footer"": [""以上資料均由各公司依發言當時所屬市場別之規定申報後，由本系統對外公佈，資料如有虛偽不實，均由該公司負責。""], ""header"": {""note"": [], ""subTitle"": [], ""mainTitle"": [""公司當日重大訊息之詳細內容""]}, ""titles"": [{""sub"": [], ""main"": ""序號""}, {""sub"": [], ""main"": ""發言日期""}, {""sub"": [], ""main"": ""發言時間""}, {""sub"": [], ""main"": ""發言人""}, {""sub"": [], ""main"": ""發言人職稱""}, {""sub"": [], ""main"": ""發言人電話""}, {""sub"": [], ""main"": ""主旨""}, {""sub"": [], ""main"": ""符合條款""}, {""sub"": [], ""main"": ""事實發生日""}, {""sub"": [], ""main"": ""說明""}], ""companyAbbreviation"": ""德宏""}, ""datetime"": ""115/07/03 01:10:20""}",2026-07-03 01:10:14
