key,speech_date,speech_time,company_id,company_name,subject,matched_keywords,enterDate,marketKind,serialNumber,detail_json,fetched_at_tw
1150504|sii|2344|1,115/05/05,15:48:39,2344,華邦電,本公司董事會核准資本支出預算案,資本支出,1150504,sii,1,"{""code"": 200, ""message"": ""查詢成功"", ""result"": {""marketName"": ""上市公司"", ""companyId"": ""2344"", ""data"": [[1, ""115/05/05"", ""15:48:39"", ""范祥雲"", ""執行副總經理"", ""(03)5678168"", ""本公司董事會核准資本支出預算案"", ""15"", ""115/05/05"", ""1.董事會或股東會決議日期:115/05/05\n2.投資計畫內容:資本支出預算新台幣73億800萬元，內容包括\n(1).生產設備\n(2).廠務設施工程\n3.預計投資金額:新台幣73億800萬元\n4.預計投資日期:預計自115年5月起陸續投資\n5.資金來源:自有資金及銀行融資\n6.具體目的:配合營運需求\n7.其他應敘明事項:無""]], ""footer"": [""以上資料均由各公司依發言當時所屬市場別之規定申報後，由本系統對外公佈，資料如有虛偽不實，均由該公司負責。""], ""header"": {""note"": [], ""subTitle"": [], ""mainTitle"": [""公司當日重大訊息之詳細內容""]}, ""titles"": [{""main"": ""序號"", ""sub"": []}, {""main"": ""發言日期"", ""sub"": []}, {""main"": ""發言時間"", ""sub"": []}, {""main"": ""發言人"", ""sub"": []}, {""main"": ""發言人職稱"", ""sub"": []}, {""main"": ""發言人電話"", ""sub"": []}, {""main"": ""主旨"", ""sub"": []}, {""main"": ""符合條款"", ""sub"": []}, {""main"": ""事實發生日"", ""sub"": []}, {""main"": ""說明"", ""sub"": []}], ""companyAbbreviation"": ""華邦電""}, ""datetime"": ""115/05/05 17:26:43""}",2026-05-05 17:26:34
1150505|sii|3665|1,115/05/05,15:58:41,3665,貿聯-KY,公告本公司115年4月份自結合併營收,自結合併,1150505,sii,1,"{""code"": 200, ""message"": ""查詢成功"", ""result"": {""marketName"": ""上市公司"", ""companyId"": ""3665"", ""data"": [[1, ""115/05/05"", ""15:58:41"", ""鄧劍華"", ""總經理"", ""02-8226-1000"", ""公告本公司115年4月份自結合併營收"", ""51"", ""115/05/05"", ""1.事實發生日:115/05/05\n2.公司名稱:BizLink Holding Inc.\n3.與公司關係(請輸入本公司或子公司):本公司\n4.相互持股比例:不適用\n5.發生緣由:無\n6.因應措施:無\n7.其他應敘明事項(若事件發生或決議之主體係屬公開發行以上公司，本則重大訊息同時\n  符合證券交易法施行細則第7條第9款所定對股東權益或證券價格有重大影響之事項):\n本公司115年4月份自結合併營業收入淨額為美金233,178仟元，較去年同期自結數\n增加22.27%。115年累計合併營收為美金892,588仟元，較去年累計自結數合併\n營收增加30.09%。""]], ""footer"": [""以上資料均由各公司依發言當時所屬市場別之規定申報後，由本系統對外公佈，資料如有虛偽不實，均由該公司負責。""], ""header"": {""note"": [], ""subTitle"": [], ""mainTitle"": [""公司當日重大訊息之詳細內容""]}, ""titles"": [{""main"": ""序號"", ""sub"": []}, {""main"": ""發言日期"", ""sub"": []}, {""main"": ""發言時間"", ""sub"": []}, {""main"": ""發言人"", ""sub"": []}, {""main"": ""發言人職稱"", ""sub"": []}, {""main"": ""發言人電話"", ""sub"": []}, {""main"": ""主旨"", ""sub"": []}, {""main"": ""符合條款"", ""sub"": []}, {""main"": ""事實發生日"", ""sub"": []}, {""main"": ""說明"", ""sub"": []}], ""companyAbbreviation"": ""貿聯-KY""}, ""datetime"": ""115/05/05 17:26:44""}",2026-05-05 17:26:34
1150505|sii|6213|2,115/05/05,16:06:10,6213,聯茂,代子公司ITEQCorporation(Thailand)LTD公告對單一廠商取得機器設備達新台幣5億元,機器設備,1150505,sii,2,"{""code"": 200, ""message"": ""查詢成功"", ""result"": {""marketName"": ""上市公司"", ""companyId"": ""6213"", ""data"": [[2, ""115/05/05"", ""16:06:10"", ""蔡馨(日彗)"", ""總經理"", ""03-5887888"", ""代子公司ITEQ Corporation (Thailand) LTD公告對單一廠商取得\r\n機器設備達新台幣5億元"", ""20"", ""115/05/05"", ""1.標的物之名稱及性質（如坐落台中市北區ＸＸ段ＸＸ小段土地）:\r\n供營業之機器設備\r\n2.事實發生日:114/7/29~115/5/5\r\n3.董事會通過日期: 民國115年5月5日\r\n4.其他核決日期: 不適用\r\n5.交易單位數量（如ＸＸ平方公尺，折合ＸＸ坪）、每單位價格及交易總金額:\r\n數量:三批\n交易總金額:約新台幣604,123仟元\r\n6.交易相對人及其與公司之關係（交易相對人如屬自然人，且非公司之關\r\n係人者，得免揭露其姓名）:\r\n亞泰金屬工業股份有限公司;與公司關係:無。\r\n7.交易相對人為關係人者，並應公告選定關係人為交易對象之原因及前次移轉之\r\n所有人、前次移轉之所有人與公司及交易相對人間相互之關係、前次移轉日期\r\n及移轉金額:\r\n不適用\r\n8.交易標的最近五年內所有權人曾為公司之關係人者，尚應公告關係\r\n人之取得及處分日期、價格及交易當時與公司之關係:\r\n不適用\r\n9.預計處分利益（或損失）（取得資產者不適用）（遞延者應列表說明\r\n認列情形）:\r\n不適用\r\n10.交付或付款條件（含付款期間及金額）、契約限制條款及其他重要約定\r\n事項:\r\n依合約條件付款。\r\n11.本次交易之決定方式（如招標、比價或議價）、價格決定之參考依據及\r\n決策單位:\r\n決定方式：比價及議價\n決策單位：依該公司核決權限規定辦理。\r\n12.專業估價者事務所或公司名稱及其估價金額:\r\n不適用\r\n13.專業估價師姓名:\r\n不適用\r\n14.專業估價師開業證書字號:\r\n不適用\r\n15.估價報告是否為限定價格、特定價格或特殊價格:否或不適用\r\n16.是否尚未取得估價報告:否或不適用\r\n17.尚未取得估價報告之原因:\r\n不適用\r\n18.估價結果有重大差異時，其差異原因及會計師意見:\r\n不適用\r\n19.會計師事務所名稱:\r\n不適用\r\n20.會計師姓名:\r\n不適用\r\n21.會計師開業證書字號:\r\n不適用\r\n22.經紀人及經紀費用:\r\n不適用\r\n23.取得或處分之具體目的或用途:\r\n供生產及營運用\r\n24.本次交易表示異議之董事之意見:\r\n不適用\r\n25.本次交易為關係人交易:否\r\n26.監察人承認或審計委員會同意日期:\r\n1.民國 年 月 日\n2.不適用，請寫原因\n(以上文字請自行增刪)\r\n27.本次交易係向關係人取得不動產或其使用權資產:否\r\n28.依「公開發行公司取得或處分資產處理準則」第十六條規定\r\n評估之價格:不適用\r\n29.依前項評估之價格較交易價格為低者，依同準則第十七條規\r\n定評估之價格:不適用\r\n30.前已就同一件事件發布重大訊息日期: 不適用\r\n31.其他敘明事項:\r\n無""]], ""footer"": [""以上資料均由各公司依發言當時所屬市場別之規定申報後，由本系統對外公佈，資料如有虛偽不實，均由該公司負責。""], ""header"": {""note"": [], ""subTitle"": [], ""mainTitle"": [""公司當日重大訊息之詳細內容""]}, ""titles"": [{""main"": ""序號"", ""sub"": []}, {""main"": ""發言日期"", ""sub"": []}, {""main"": ""發言時間"", ""sub"": []}, {""main"": ""發言人"", ""sub"": []}, {""main"": ""發言人職稱"", ""sub"": []}, {""main"": ""發言人電話"", ""sub"": []}, {""main"": ""主旨"", ""sub"": []}, {""main"": ""符合條款"", ""sub"": []}, {""main"": ""事實發生日"", ""sub"": []}, {""main"": ""說明"", ""sub"": []}], ""companyAbbreviation"": ""聯茂""}, ""datetime"": ""115/05/05 17:26:45""}",2026-05-05 17:26:34
1150505|sii|2486|2,115/05/05,16:56:51,2486,一詮,公告一詮精密工業股份有限公司第六次無擔保轉換公司債(簡稱：一詮六，代碼：24866)於櫃檯買賣市場交易達公布注意交易資訊標準，故公布相關訊息，以利投資人區別瞭解。,公司債,1150505,sii,2,"{""code"": 200, ""message"": ""查詢成功"", ""result"": {""marketName"": ""上市公司"", ""companyId"": ""2486"", ""data"": [[2, ""115/05/05"", ""16:56:51"", ""劉秀興"", ""副總經理"", ""2299-0001"", ""公告一詮精密工業股份有限公司第六次無擔保轉換公司債\r\n(簡稱：一詮六，代碼：24866)於櫃檯買賣市場交易達公布注意\r\n交易資訊標準，故公布相關訊息，以利投資人區別瞭解。"", ""51"", ""115/05/05"", ""1.事實發生日:115/05/05\n2.發生緣由:依據證券櫃檯買賣中心通知辦理重大訊息。\n3.公司債相關資訊:\n到期日期:116/07/01\n實際發行總額: 600,000,000元\n本月發行餘額: 510,300,000元(截至115/05/05未轉換金額)\n最新轉(交)換價格:125.2元\n轉換標的收市價格(2486):307元(115/05/05收盤價)\n轉債收市價格(24866):237元(115/05/05收盤價)\n4.其他應敘明事項:無""]], ""footer"": [""以上資料均由各公司依發言當時所屬市場別之規定申報後，由本系統對外公佈，資料如有虛偽不實，均由該公司負責。""], ""header"": {""note"": [], ""subTitle"": [], ""mainTitle"": [""公司當日重大訊息之詳細內容""]}, ""titles"": [{""main"": ""序號"", ""sub"": []}, {""main"": ""發言日期"", ""sub"": []}, {""main"": ""發言時間"", ""sub"": []}, {""main"": ""發言人"", ""sub"": []}, {""main"": ""發言人職稱"", ""sub"": []}, {""main"": ""發言人電話"", ""sub"": []}, {""main"": ""主旨"", ""sub"": []}, {""main"": ""符合條款"", ""sub"": []}, {""main"": ""事實發生日"", ""sub"": []}, {""main"": ""說明"", ""sub"": []}], ""companyAbbreviation"": ""一詮""}, ""datetime"": ""115/05/05 17:26:46""}",2026-05-05 17:26:34
1150505|sii|3003|1,115/05/05,17:01:56,3003,健和興,公告本公司115年04月份自結合併營收概算,自結合併,1150505,sii,1,"{""code"": 200, ""message"": ""查詢成功"", ""result"": {""marketName"": ""上市公司"", ""companyId"": ""3003"", ""data"": [[1, ""115/05/05"", ""17:01:56"", ""曾玉卿"", ""財務總處處長"", ""(04)7580001-310"", ""公告本公司115年04月份自結合併營收概算"", ""51"", ""115/05/05"", ""1.事實發生日:115/05/05\n2.公司名稱:健和興端子股份有限公司\n3.與公司關係(請輸入本公司或子公司):本公司\n4.相互持股比例:不適用\n5.發生緣由:本公司115年04月份自結合併營收情形\n04-04月合併營收：4.81億元，114年同期合併營收：3.92億元。\n01-04月合併營收：17.44億元，114年同期合併營收：13.98億元。\n6.因應措施:無。\n7.其他應敘明事項(若事件發生或決議之主體係屬公開發行以上公司，本則重大訊息同時\n  符合證券交易法施行細則第7條第9款所定對股東權益或證券價格有重大影響之事項):無。""]], ""footer"": [""以上資料均由各公司依發言當時所屬市場別之規定申報後，由本系統對外公佈，資料如有虛偽不實，均由該公司負責。""], ""header"": {""note"": [], ""subTitle"": [], ""mainTitle"": [""公司當日重大訊息之詳細內容""]}, ""titles"": [{""main"": ""序號"", ""sub"": []}, {""main"": ""發言日期"", ""sub"": []}, {""main"": ""發言時間"", ""sub"": []}, {""main"": ""發言人"", ""sub"": []}, {""main"": ""發言人職稱"", ""sub"": []}, {""main"": ""發言人電話"", ""sub"": []}, {""main"": ""主旨"", ""sub"": []}, {""main"": ""符合條款"", ""sub"": []}, {""main"": ""事實發生日"", ""sub"": []}, {""main"": ""說明"", ""sub"": []}], ""companyAbbreviation"": ""健和興""}, ""datetime"": ""115/05/05 17:26:46""}",2026-05-05 17:26:34
1150505|sii|2308|2,115/05/05,17:12:42,2308,台達電,本公司代子公司DeltaElectronics(Thailand)PublicCompanyLimited公告向非關係人取得機器設備,機器設備,1150505,sii,2,"{""code"": 200, ""message"": ""查詢成功"", ""result"": {""marketName"": ""上市公司"", ""companyId"": ""2308"", ""data"": [[2, ""115/05/05"", ""17:12:42"", ""周志宏"", ""永續長"", ""(02)87972088"", ""本公司代子公司Delta Electronics (Thailand) Public Company Limited公告向非關係\r\n人取得機器設備"", ""20"", ""115/05/05"", ""1.標的物之名稱及性質（如坐落台中市北區ＸＸ段ＸＸ小段土地）:\r\n機器設備\r\n2.事實發生日:115/4/16~115/5/5\r\n3.董事會通過日期: 不適用\r\n4.其他核決日期:\r\n核決層級:依內部核決權限規定辦理\r\n民國115年5月5日\r\n5.交易單位數量（如ＸＸ平方公尺，折合ＸＸ坪）、每單位價格及交易總金額:\r\n累計取得機器設備之交易金額約為日幣5,041佰萬元\r\n6.交易相對人及其與公司之關係（交易相對人如屬自然人，且非公司之關\r\n係人者，得免揭露其姓名）:\r\n交易相對人：FUJI CORPORATION\n與公司關係：非本公司關係人\r\n7.交易相對人為關係人者，並應公告選定關係人為交易對象之原因及前次移轉之\r\n所有人、前次移轉之所有人與公司及交易相對人間相互之關係、前次移轉日期\r\n及移轉金額:\r\n不適用\r\n8.交易標的最近五年內所有權人曾為公司之關係人者，尚應公告關係\r\n人之取得及處分日期、價格及交易當時與公司之關係:\r\n不適用\r\n9.預計處分利益（或損失）（取得資產者不適用）（遞延者應列表說明\r\n認列情形）:\r\n不適用\r\n10.交付或付款條件（含付款期間及金額）、契約限制條款及其他重要約定\r\n事項:\r\n電匯\r\n11.本次交易之決定方式（如招標、比價或議價）、價格決定之參考依據及\r\n決策單位:\r\n交易之決定方式：議價\n決策單位：依Delta Electronics (Thailand) Public Company Limited內部核決權限規\n定辦理\r\n12.專業估價者事務所或公司名稱及其估價金額:\r\n不適用\r\n13.專業估價師姓名:\r\n不適用\r\n14.專業估價師開業證書字號:\r\n不適用\r\n15.估價報告是否為限定價格、特定價格或特殊價格:否或不適用\r\n16.是否尚未取得估價報告:否或不適用\r\n17.尚未取得估價報告之原因:\r\n不適用\r\n18.估價結果有重大差異時，其差異原因及會計師意見:\r\n不適用\r\n19.會計師事務所名稱:\r\n不適用\r\n20.會計師姓名:\r\n不適用\r\n21.會計師開業證書字號:\r\n不適用\r\n22.經紀人及經紀費用:\r\n不適用\r\n23.取得或處分之具體目的或用途:\r\n供營業用\r\n24.本次交易表示異議之董事之意見:\r\n不適用\r\n25.本次交易為關係人交易:否\r\n26.監察人承認或審計委員會同意日期:\r\n不適用\r\n27.本次交易係向關係人取得不動產或其使用權資產:否\r\n28.依「公開發行公司取得或處分資產處理準則」第十六條規定\r\n評估之價格:不適用\r\n29.依前項評估之價格較交易價格為低者，依同準則第十七條規\r\n定評估之價格:不適用\r\n30.前已就同一件事件發布重大訊息日期: 不適用\r\n31.其他敘明事項:\r\n無""]], ""footer"": [""以上資料均由各公司依發言當時所屬市場別之規定申報後，由本系統對外公佈，資料如有虛偽不實，均由該公司負責。""], ""header"": {""note"": [], ""subTitle"": [], ""mainTitle"": [""公司當日重大訊息之詳細內容""]}, ""titles"": [{""main"": ""序號"", ""sub"": []}, {""main"": ""發言日期"", ""sub"": []}, {""main"": ""發言時間"", ""sub"": []}, {""main"": ""發言人"", ""sub"": []}, {""main"": ""發言人職稱"", ""sub"": []}, {""main"": ""發言人電話"", ""sub"": []}, {""main"": ""主旨"", ""sub"": []}, {""main"": ""符合條款"", ""sub"": []}, {""main"": ""事實發生日"", ""sub"": []}, {""main"": ""說明"", ""sub"": []}], ""companyAbbreviation"": ""台達電""}, ""datetime"": ""115/05/05 17:26:47""}",2026-05-05 17:26:34
1150505|sii|3716|5,115/05/05,17:16:50,3716,中化控股,公告本公司董事會通過第四次買回庫藏股,庫藏股,1150505,sii,5,"{""code"": 200, ""message"": ""查詢成功"", ""result"": {""marketName"": ""上市公司"", ""companyId"": ""3716"", ""data"": [[5, ""115/05/05"", ""17:16:50"", ""陳誼芬"", ""處長"", ""02-23124200"", ""公告本公司董事會通過第四次買回庫藏股"", ""35"", ""115/05/05"", ""1.董事會決議日期:115/05/05\r\n2.買回股份目的:轉讓股份予員工\r\n3.買回股份種類:普通股\r\n4.買回股份總金額上限(元):5,998,617,899\r\n5.預定買回之期間:115/05/06~115/07/03\r\n6.預定買回之數量(股):1,000,000\r\n7.買回區間價格(元):24.00~42.00\r\n8.買回方式:自集中交易市場買回\r\n9.預定買回股份占公司已發行股份總數之比率(%):0.67\r\n10.申報時已持有本公司股份之累積股數(股):3,211,000\r\n11.申報前五年內買回公司股份之情形:\r\n(1)實際買回股份期間：114/08/12 ~ 114/10/09 、預定買回股數(股)：1000000 、實際已買回\r\n股數(股)：609000 、執行情形(實際已買回股數占預定買回股數%)：61.00\r\n(2)實際買回股份期間：114/04/11 ~ 114/06/09 、預定買回股數(股)：3000000 、實際已買回\r\n股數(股)：1602000 、執行情形(實際已買回股數占預定買回股數%)：53.00\r\n(3)實際買回股份期間：113/12/27 ~ 114/02/26 、預定買回股數(股)：1000000 、實際已買回\r\n股數(股)：1000000 、執行情形(實際已買回股數占預定買回股數%)：100.00\r\n12.已申報買回但未執行完畢之情形:\r\n第2次及第3次未執行完畢之情形:為兼顧市場機制及維護整體股東權益，本公\r\n司視股價變化及成交量狀況執行分批買回，故未予以全部執行完畢。\r\n13.董事會決議買回股份之會議紀錄:\r\n本公司第二屆第十二次董事會決議通過。\r\n14.「上市上櫃公司買回本公司股份辦法」第十條規定之轉讓辦法:\r\n中化控股股份有限公司買回股份轉讓員工辦法:\r\n第一條\t目的\r\n本公司為激勵員工及提昇員工向心力，依據證券交易法第28條之2第1項第1款及金融監督管理委員會\r\n發布之「上市上櫃公司買回本公司股份辦法」等相關規定，訂定本公司買回股份(以下簡稱庫藏股)\r\n轉讓員工辦法。本公司買回股份轉讓予員工，除依有關法令規定外，悉依本辦法規定辦理。\r\n\r\n第二條\t轉讓股份之種類、權利內容及權利受限情形\r\n本公司轉讓予員工之股份均為普通股，其權利義務除有關法令及本辦法另有規定者外，與其他流通在\r\n外普通股相同。\r\n\r\n第三條\t轉讓期間\r\n本公司買回之股份，應依本辦法之規定，自買回股份之日起五年內，得一次或分次轉讓予員工。\r\n\r\n第四條\t受讓人之資格\r\n凡於認股基準日前到職滿半年或對公司有特殊貢獻並經提報董事會\r\n同意之本公司員工，得依本辦法第五條所定認購數額，享有認購庫藏股資格。本辦法所稱之員工，係\r\n指本公司及直接或間接持有表決權股份超過百分之五十之海內外子公司領有薪資之全職員工。兼職員\r\n工、臨時性員工、短期工讀生及委外勞工均不適用本辦法。\r\n\r\n第五條\t受讓股數規定\r\n員工得認購股數係依據員工職等、服務年資及對公司之特殊貢獻及兼顧認股基準日時公司持有之買回\r\n股份總額及單一員工認購股數之上限等因素為計算標準，訂定員工得受讓認購股數，並呈報董事會核\r\n定之。惟認股人具經理人身份者，應先提報薪資報酬委員會審議後，呈送董事會決議。認股人非具經\r\n理人身分者，應先提報審計委員會審議後，送呈董事會決議。員工於認購繳款期間屆滿而未認購繳款\r\n者，視為棄權。認購不足之餘額，可由董事會於當次認購作業另洽其他員工認股並依認股人身份提報\r\n審議委員會或薪資報酬委員會審議後呈報董事會決議。\r\n\r\n第六條\t本公司買回股份轉讓予員工之作業程序：\r\n一、依董事會之決議，公告、申報並於執行期限內買回本公司股份。\r\n二、董事會依本辦法訂定及公布員工認股基準日、得認購股數標準、認購繳款期間、權利內容及限制\r\n條件等作業事項。\r\n三、統計實際認購繳款股數，辦理股票轉讓過戶登記。\r\n\r\n第七條\t約定之每股轉讓價格\r\n本公司買回股份轉讓予員工，以實際買回之平均價格為轉讓價格，惟轉讓前，如遇公司已發行之普通\r\n股股份增加或減少，得按發行股份增加或減少比率調整之。\r\n轉讓價格調整公式：\r\n轉讓價格調整公式=實際買回平均價格*(公司申報買回股份時之普通股股份總數/公司轉讓買回股份\r\n予員工前之普通股股份總數)\r\n\r\n第八條\t轉讓後之權利義務\r\n本公司買回股份轉讓予員工並辦理過戶登記後，除另有規定者外，餘權利義務與原有股份相同。\r\n\r\n第九條\t其他有關公司與員工權利義務事項\r\n本公司買回股份轉讓予員工，其所發生之稅捐及費用應依相關法令由公司或員工各自負擔。\r\n\r\n第十條\t其他事項\r\n  本公司為轉讓股份予員工所買回之股份，應自買回之日起五年內全數轉讓，逾期未轉讓部份，視\r\n  為本公司未發行股份，應依法辦理銷除股份變更登記。本公司如欲提前辦理銷除員工棄權之未轉\r\n  讓部分，可依原訂程序修訂轉讓期間。其他未約定事項悉依相關法令辦理。\r\n\r\n第十一條 生效及修正\r\n本辦法經董事會決議通過後生效，並得報經董事會決議修訂。\r\n15.「上市上櫃公司買回本公司股份辦法」第十一條規定之轉換或認股辦法:\r\n不適用。\r\n16.董事會已考慮公司財務狀況，不影響公司資本維持之聲明:\r\n董事會已考慮公司財務狀況，不影響公司資本維持之聲明：\r\n上述買回股份總數，僅占本公司已發行股份之百分之0.67，且買回股份所需金額上限僅占本公司流動\r\n資產之百分之1.04，茲聲明本公司董事會已考慮公司財務狀況，上述股份之買回並不影響本公司資本\r\n之維持。\r\n17.會計師或證券承銷商對買回股份價格之合理性評估意見:\r\n會計師或證券承銷商對買回股份價格之合理性評估意見：\r\n依富邦綜合證券承銷商之評估意見，中化控股股份有限公司本次買回公司股份訂定之價格區間，其\r\n決策過程具合法性，價格區間之訂定及對公司財務狀況之影響在合理範圍內，尚無重大異常情事。\r\n18.其他證期局所規定之事項:\r\n無。""]], ""footer"": [""以上資料均由各公司依發言當時所屬市場別之規定申報後，由本系統對外公佈，資料如有虛偽不實，均由該公司負責。""], ""header"": {""note"": [], ""subTitle"": [], ""mainTitle"": [""公司當日重大訊息之詳細內容""]}, ""titles"": [{""main"": ""序號"", ""sub"": []}, {""main"": ""發言日期"", ""sub"": []}, {""main"": ""發言時間"", ""sub"": []}, {""main"": ""發言人"", ""sub"": []}, {""main"": ""發言人職稱"", ""sub"": []}, {""main"": ""發言人電話"", ""sub"": []}, {""main"": ""主旨"", ""sub"": []}, {""main"": ""符合條款"", ""sub"": []}, {""main"": ""事實發生日"", ""sub"": []}, {""main"": ""說明"", ""sub"": []}], ""companyAbbreviation"": ""中化控股""}, ""datetime"": ""115/05/05 17:26:48""}",2026-05-05 17:26:34
