key,speech_date,speech_time,company_id,company_name,subject,matched_keywords,enterDate,marketKind,serialNumber,detail_json,fetched_at_tw
1150413|sii|9935|1,115/04/13,17:31:49,9935,慶豐富,本公司董事會決議發行國內第四次無擔保轉換公司債,公司債,1150413,sii,1,"{""code"": 200, ""message"": ""查詢成功"", ""result"": {""marketName"": ""上市公司"", ""companyId"": ""9935"", ""data"": [[1, ""115/04/13"", ""17:31:49"", ""許竣然"", ""總經理"", ""04-7801967"", ""本公司董事會決議發行國內第四次無擔保轉換公司債"", ""11"", ""115/04/13"", ""1.董事會決議日期: 115/04/13\n2.名稱﹝XX公司第X次（有、無）擔保公司債﹞:\n慶豐富實業股份有限公司國內第四次無擔保轉換公司債\n3.是否採總括申報發行公司債(是/否):否\n4.發行總額:發行總面額上限為新臺幣3億元\n5.每張面額:新臺幣10萬元整\n6.發行價格:依票面金額之100.5%發行\n7.發行期間:3年\n8.發行利率:票面利率為0%\n9.擔保品之種類、名稱、金額及約定事項:不適用\n10.募得價款之用途及運用計畫:償還銀行借款\n11.承銷方式:擬採詢價圈購方式辦理公開承銷\n12.公司債受託人: 凱基商業銀行股份有限公司\n13.承銷或代銷機構:凱基證券股份有限公司\n14.發行保證人:不適用\n15.代理還本付息機構:元大證券股份有限公司股務代理部\n16.簽證機構:採無實體發行，故不適用\n17.能轉換股份者，其轉換辦法: 相關辦法將依有關法令辦理，\n並報請主管機關核准後另行公告\n18.賣回條件: 相關辦法將依有關法令辦理，並報請主管機關核准後另行公告\n19.買回條件: 相關辦法將依有關法令辦理，並報請主管機關核准後另行公告\n20.附有轉換、交換或認股者，其換股基準日: 相關辦法將依有關法令辦理，\n並報請主管機關核准後另行公告\n21.附有轉換、交換或認股者，對股權可能稀釋情形: 相關辦法將依有關法令辦理，\n並報請主管機關核准後另行公告\n22.其他應敘明事項:\n(1)因資本市場籌資環境變化快速，為掌握訂定發行條件與實際發行作業時效，\n本次發行國內第四次無擔保轉換公司債之發行面額、募集金額、發行條件、\n轉換辦法與發行價格之訂定及本次計劃所需資金總額、資金來源、計劃項目、\n資金運用進度、預計可能產生效益及其他發行相關事宜，如遇有法令變更，\n經主管機關修正或因應主客觀因素而需修正時，擬授權本公司董事長全權處理之。\n(2)配合本次發行國內第四次無擔保轉換公司債之發行作業，擬授權本公司\n董事長代表本公司簽署一切有關發行國內第四次無擔保轉換公司債所需之契約\n及文件，並代表本公司辦理一切相關發行事宜。""]], ""footer"": [""以上資料均由各公司依發言當時所屬市場別之規定申報後，由本系統對外公佈，資料如有虛偽不實，均由該公司負責。""], ""header"": {""note"": [], ""subTitle"": [], ""mainTitle"": [""公司當日重大訊息之詳細內容""]}, ""titles"": [{""sub"": [], ""main"": ""序號""}, {""sub"": [], ""main"": ""發言日期""}, {""sub"": [], ""main"": ""發言時間""}, {""sub"": [], ""main"": ""發言人""}, {""sub"": [], ""main"": ""發言人職稱""}, {""sub"": [], ""main"": ""發言人電話""}, {""sub"": [], ""main"": ""主旨""}, {""sub"": [], ""main"": ""符合條款""}, {""sub"": [], ""main"": ""事實發生日""}, {""sub"": [], ""main"": ""說明""}], ""companyAbbreviation"": ""慶豐富""}, ""datetime"": ""115/04/14 18:44:54""}",2026-04-14 18:44:51
1150413|sii|2308|3,115/04/13,17:59:28,2308,台達電,本公司代子公司DeltaElectronics(Thailand)PublicCompanyLimited公告向非關係人取得機器設備,機器設備,1150413,sii,3,"{""code"": 200, ""message"": ""查詢成功"", ""result"": {""marketName"": ""上市公司"", ""companyId"": ""2308"", ""data"": [[3, ""115/04/13"", ""17:59:28"", ""周志宏"", ""永續長"", ""(02)87972088"", ""本公司代子公司Delta Electronics (Thailand) Public Company Limited公告向非關係\r\n人取得機器設備"", ""20"", ""115/04/13"", ""1.標的物之名稱及性質（如坐落台中市北區ＸＸ段ＸＸ小段土地）:\r\n機器設備\r\n2.事實發生日:115/3/3~115/4/13\r\n3.董事會通過日期: 不適用\r\n4.其他核決日期:\r\n核決層級:依內部核決權限規定辦理\r\n民國115年4月13日\r\n5.交易單位數量（如ＸＸ平方公尺，折合ＸＸ坪）、每單位價格及交易總金額:\r\n累計取得機器設備之交易金額約為美金32.9佰萬元\r\n6.交易相對人及其與公司之關係（交易相對人如屬自然人，且非公司之關\r\n係人者，得免揭露其姓名）:\r\n交易相對人：CHROMA ATE INC.\n與公司關係：非本公司關係人\r\n7.交易相對人為關係人者，並應公告選定關係人為交易對象之原因及前次移轉之\r\n所有人、前次移轉之所有人與公司及交易相對人間相互之關係、前次移轉日期\r\n及移轉金額:\r\n不適用\r\n8.交易標的最近五年內所有權人曾為公司之關係人者，尚應公告關係\r\n人之取得及處分日期、價格及交易當時與公司之關係:\r\n不適用\r\n9.預計處分利益（或損失）（取得資產者不適用）（遞延者應列表說明\r\n認列情形）:\r\n不適用\r\n10.交付或付款條件（含付款期間及金額）、契約限制條款及其他重要約定\r\n事項:\r\n電匯\r\n11.本次交易之決定方式（如招標、比價或議價）、價格決定之參考依據及\r\n決策單位:\r\n交易之決定方式：議價\n決策單位：依Delta Electronics (Thailand) Public Company Limited內部核決權限規\n定辦理\r\n12.專業估價者事務所或公司名稱及其估價金額:\r\n不適用\r\n13.專業估價師姓名:\r\n不適用\r\n14.專業估價師開業證書字號:\r\n不適用\r\n15.估價報告是否為限定價格、特定價格或特殊價格:否或不適用\r\n16.是否尚未取得估價報告:否或不適用\r\n17.尚未取得估價報告之原因:\r\n不適用\r\n18.估價結果有重大差異時，其差異原因及會計師意見:\r\n不適用\r\n19.會計師事務所名稱:\r\n不適用\r\n20.會計師姓名:\r\n不適用\r\n21.會計師開業證書字號:\r\n不適用\r\n22.經紀人及經紀費用:\r\n不適用\r\n23.取得或處分之具體目的或用途:\r\n供營業用\r\n24.本次交易表示異議之董事之意見:\r\n不適用\r\n25.本次交易為關係人交易:否\r\n26.監察人承認或審計委員會同意日期:\r\n不適用\r\n27.本次交易係向關係人取得不動產或其使用權資產:否\r\n28.依「公開發行公司取得或處分資產處理準則」第十六條規定\r\n評估之價格:不適用\r\n29.依前項評估之價格較交易價格為低者，依同準則第十七條規\r\n定評估之價格:不適用\r\n30.前已就同一件事件發布重大訊息日期: 不適用\r\n31.其他敘明事項:\r\n無""]], ""footer"": [""以上資料均由各公司依發言當時所屬市場別之規定申報後，由本系統對外公佈，資料如有虛偽不實，均由該公司負責。""], ""header"": {""note"": [], ""subTitle"": [], ""mainTitle"": [""公司當日重大訊息之詳細內容""]}, ""titles"": [{""sub"": [], ""main"": ""序號""}, {""sub"": [], ""main"": ""發言日期""}, {""sub"": [], ""main"": ""發言時間""}, {""sub"": [], ""main"": ""發言人""}, {""sub"": [], ""main"": ""發言人職稱""}, {""sub"": [], ""main"": ""發言人電話""}, {""sub"": [], ""main"": ""主旨""}, {""sub"": [], ""main"": ""符合條款""}, {""sub"": [], ""main"": ""事實發生日""}, {""sub"": [], ""main"": ""說明""}], ""companyAbbreviation"": ""台達電""}, ""datetime"": ""115/04/14 18:44:54""}",2026-04-14 18:44:51
1150413|sii|6472|1,115/04/13,18:50:16,6472,保瑞,公告本公司國內第五次無擔保轉換公司債收足應募價款,公司債,1150413,sii,1,"{""code"": 200, ""message"": ""查詢成功"", ""result"": {""marketName"": ""上市公司"", ""companyId"": ""6472"", ""data"": [[1, ""115/04/13"", ""18:50:16"", ""王錦菊"", ""副總經理"", ""(02)27901555"", ""公告本公司國內第五次無擔保轉換公司債收足應募價款"", ""51"", ""115/04/13"", ""1.事實發生日:115/04/13\n2.公司名稱:保瑞藥業股份有限公司\n3.與公司關係(請輸入本公司或子公司):本公司\n4.相互持股比例:不適用\n5.發生緣由:\n依據「發行人募集與發行有價證券處理準則」第九條第一項第二款之規定，本公司發行\n國內第五次無擔保轉換公司債案至公告日止，債款代收銀行業已收足所有應募款項並\n匯撥至專戶存儲銀行，共計新台幣1,079,893,920元整，特此公告。\n6.因應措施:無\n7.其他應敘明事項(若事件發生或決議之主體係屬公開發行以上公司，本則重大訊息同時\n  符合證券交易法施行細則第7條第9款所定對股東權益或證券價格有重大影響之事項):\n無""]], ""footer"": [""以上資料均由各公司依發言當時所屬市場別之規定申報後，由本系統對外公佈，資料如有虛偽不實，均由該公司負責。""], ""header"": {""note"": [], ""subTitle"": [], ""mainTitle"": [""公司當日重大訊息之詳細內容""]}, ""titles"": [{""sub"": [], ""main"": ""序號""}, {""sub"": [], ""main"": ""發言日期""}, {""sub"": [], ""main"": ""發言時間""}, {""sub"": [], ""main"": ""發言人""}, {""sub"": [], ""main"": ""發言人職稱""}, {""sub"": [], ""main"": ""發言人電話""}, {""sub"": [], ""main"": ""主旨""}, {""sub"": [], ""main"": ""符合條款""}, {""sub"": [], ""main"": ""事實發生日""}, {""sub"": [], ""main"": ""說明""}], ""companyAbbreviation"": ""保瑞""}, ""datetime"": ""115/04/14 18:44:55""}",2026-04-14 18:44:51
1150413|sii|2883|1,115/04/13,19:10:18,2883,凱基金,公告本公司暨主要子公司115年3月份自結合併盈餘,自結合併,1150413,sii,1,"{""code"": 200, ""message"": ""查詢成功"", ""result"": {""marketName"": ""上市公司"", ""companyId"": ""2883"", ""data"": [[1, ""115/04/13"", ""19:10:18"", ""黃碧玲"", ""資深副總經理"", ""02-27638800"", ""公告本公司暨主要子公司115年3月份自結合併盈餘"", ""51"", ""115/04/13"", ""1.事實發生日:115/04/13\n2.公司名稱:凱基金融控股股份有限公司(原名稱：中華開發金融控股股份有限公司)\n3.與公司關係(請輸入本公司或子公司):本公司\n4.相互持股比例:不適用\n5.發生緣由:公告本公司暨主要子公司115年3月份自結合併盈餘\n6.因應措施:無\n7.其他應敘明事項(若事件發生或決議之主體係屬公開發行以上公司，本則重大訊息同時\n  符合證券交易法施行細則第7條第9款所定對股東權益或證券價格有重大影響之事項):\n\n                                合併稅後(億元)\n--------------------------------------------------------------------------\n　                     3月份                 累計 1 至 3 月份\n--------------------------------------------------------------------------\n　           總損益   母公司  非控制   總損益   母公司  非控制  稅後每股\n　　　　               業主    權益              業主    權益    盈餘(元)\n--------------------------------------------------------------------------\n凱基金控      20.27    20.26   0.01    116.92   116.90    0.02    0.69\n凱基人壽       7.17     7.17   0.00     47.96    47.96    0.00    0.92\n凱基銀行       7.05     7.05   0.00     20.99    20.99    0.00    0.45\n中華開發資本  -1.48    -1.49   0.01      1.87     1.86    0.01    0.09\n凱基證券      12.07    12.06   0.01     59.07    59.06    0.01    3.25\n上述資料均係公司自結數。\n註1：凱基人壽累計3月未適用外匯價格變動準備金之EPS(元)：1.14\n註2：金控累計3月淨利加計透過其他綜合損益按公允價值衡量之股票累計處分利益\n為262.05億元。""]], ""footer"": [""以上資料均由各公司依發言當時所屬市場別之規定申報後，由本系統對外公佈，資料如有虛偽不實，均由該公司負責。""], ""header"": {""note"": [], ""subTitle"": [], ""mainTitle"": [""公司當日重大訊息之詳細內容""]}, ""titles"": [{""sub"": [], ""main"": ""序號""}, {""sub"": [], ""main"": ""發言日期""}, {""sub"": [], ""main"": ""發言時間""}, {""sub"": [], ""main"": ""發言人""}, {""sub"": [], ""main"": ""發言人職稱""}, {""sub"": [], ""main"": ""發言人電話""}, {""sub"": [], ""main"": ""主旨""}, {""sub"": [], ""main"": ""符合條款""}, {""sub"": [], ""main"": ""事實發生日""}, {""sub"": [], ""main"": ""說明""}], ""companyAbbreviation"": ""凱基金""}, ""datetime"": ""115/04/14 18:44:56""}",2026-04-14 18:44:51
1150413|sii|1598|4,115/04/13,21:55:51,1598,岱宇,公告本公司決議買回國內第四次無擔保轉換公司債,公司債,1150413,sii,4,"{""code"": 200, ""message"": ""查詢成功"", ""result"": {""marketName"": ""上市公司"", ""companyId"": ""1598"", ""data"": [[4, ""115/04/13"", ""21:55:51"", ""邱源聲"", ""副總經理"", ""(02)25152288"", ""公告本公司決議買回國內第四次無擔保轉換公司債"", ""51"", ""115/04/13"", ""1.事實發生日:115/04/13\n2.公司名稱:岱宇國際股份有限公司\n3.與公司關係(請輸入本公司或子公司):本公司\n4.相互持股比例:不適用\n5.發生緣由:\n 本公司決議買回國內第四次無擔保轉換公司債\n   (1)預定買回張數：1,000張。\n   (2)預定買回價格：100元內。\n   (3)預定買回期間：自115年4月14日起至115年10月31日止。\n6.因應措施:無\n7.其他應敘明事項(若事件發生或決議之主體係屬公開發行以上公司，本則重大訊息同時\n  符合證券交易法施行細則第7條第9款所定對股東權益或證券價格有重大影響之事項):無""]], ""footer"": [""以上資料均由各公司依發言當時所屬市場別之規定申報後，由本系統對外公佈，資料如有虛偽不實，均由該公司負責。""], ""header"": {""note"": [], ""subTitle"": [], ""mainTitle"": [""公司當日重大訊息之詳細內容""]}, ""titles"": [{""sub"": [], ""main"": ""序號""}, {""sub"": [], ""main"": ""發言日期""}, {""sub"": [], ""main"": ""發言時間""}, {""sub"": [], ""main"": ""發言人""}, {""sub"": [], ""main"": ""發言人職稱""}, {""sub"": [], ""main"": ""發言人電話""}, {""sub"": [], ""main"": ""主旨""}, {""sub"": [], ""main"": ""符合條款""}, {""sub"": [], ""main"": ""事實發生日""}, {""sub"": [], ""main"": ""說明""}], ""companyAbbreviation"": ""岱宇""}, ""datetime"": ""115/04/14 18:44:57""}",2026-04-14 18:44:51
1150414|sii|2892|1,115/04/14,13:56:26,2892,第一金,公告本公司暨主要子公司115年3月份自結合併盈餘數,自結合併,1150414,sii,1,"{""code"": 200, ""message"": ""查詢成功"", ""result"": {""marketName"": ""上市公司"", ""companyId"": ""2892"", ""data"": [[1, ""115/04/14"", ""13:56:26"", ""李淑玲"", ""副總經理"", ""23111111"", ""公告本公司暨主要子公司115年3月份自結合併盈餘數"", ""51"", ""115/04/14"", ""1.事實發生日:115/04/14\n2.公司名稱:第一金融控股股份有限公司\n3.與公司關係(請輸入本公司或子公司):本公司\n4.相互持股比例:100%\n5.發生緣由:同主旨\n6.因應措施:無\n7.其他應敘明事項(若事件發生或決議之主體係屬公開發行以上公司，本則重大訊息同時\n  符合證券交易法施行細則第7條第9款所定對股東權益或證券價格有重大影響之事項):\n -------------本月自結盈餘      累計自結盈餘      累計EPS\n ------------- 稅前   稅後      稅前    稅後       稅後\n  單 位       (億元) (億元)    (億元)  (億元)      (元)\n--------------------------------------------------------------\n 第一金控     32.28  27.11    100.36    82.44      0.57\n 第一銀行     31.85  26.92     92.19    75.73      0.62\n 第一金證券    1.43   1.19      6.10     5.11      0.76\n 第一金人壽    0.11   0.02      1.90     1.53      0.22\n -------------------------------------------------------------\n\n註：累計1-3月不含外匯價格變動準備金之EPS(元)\n第一金控：0.58\n第一金人壽：0.44""]], ""footer"": [""以上資料均由各公司依發言當時所屬市場別之規定申報後，由本系統對外公佈，資料如有虛偽不實，均由該公司負責。""], ""header"": {""note"": [], ""subTitle"": [], ""mainTitle"": [""公司當日重大訊息之詳細內容""]}, ""titles"": [{""sub"": [], ""main"": ""序號""}, {""sub"": [], ""main"": ""發言日期""}, {""sub"": [], ""main"": ""發言時間""}, {""sub"": [], ""main"": ""發言人""}, {""sub"": [], ""main"": ""發言人職稱""}, {""sub"": [], ""main"": ""發言人電話""}, {""sub"": [], ""main"": ""主旨""}, {""sub"": [], ""main"": ""符合條款""}, {""sub"": [], ""main"": ""事實發生日""}, {""sub"": [], ""main"": ""說明""}], ""companyAbbreviation"": ""第一金""}, ""datetime"": ""115/04/14 18:44:58""}",2026-04-14 18:44:51
1150414|sii|9938|1,115/04/14,14:39:12,9938,百和,公告本公司115年3月份自結合併損益相關資訊,自結合併,1150414,sii,1,"{""code"": 200, ""message"": ""查詢成功"", ""result"": {""marketName"": ""上市公司"", ""companyId"": ""9938"", ""data"": [[1, ""115/04/14"", ""14:39:12"", ""葉桂珠"", ""副總經理"", ""04-7565307"", ""公告本公司115年3月份自結合併損益相關資訊"", ""51"", ""115/04/14"", ""1.事實發生日:115/04/14\n2.公司名稱:台灣百和工業股份有限公司\n3.與公司關係(請輸入本公司或子公司):本公司\n4.相互持股比例:不適用。\n5.發生緣由:公告本公司115年3月份自結合併損益相關資訊。\n6.因應措施:發佈重大訊息說明。\n7.其他應敘明事項(若事件發生或決議之主體係屬公開發行以上公司，本則重大訊息同時\n  符合證券交易法施行細則第7條第9款所定對股東權益或證券價格有重大影響之事項):\n                        當月數　　  　 累計數　　 　  累計數　　　累計數\n     項目         　　 115年3月      115年1-3月     114年1-3月　 差異比率\n------------------  -------------  -------------  -------------　---------\n合併營業收入淨額     $ 1,500,394    $ 4,038,713 　 $ 4,250,077      -5.0%\n(新台幣仟元)\n合併營業淨利         $　 234,761    $   518,876　  $   903,381     -42.6%\n(新台幣仟元)\n合併稅前淨利　     　$ 　228,934 　 $   432,063　  $   778,771     -44.5%\n(新台幣仟元)\n合併稅後淨利         $　 160,187 　 $   297,702　  $   564,274     -47.2%\n(新台幣仟元)\n歸屬於台灣百和淨利　 $   129,451 　 $   259,915　　$   457,380     -43.2%\n(新台幣仟元)\n基本每股盈餘         $      0.43    $      0.87    $      1.54\n(新台幣元)\n註：前述115年財務資料係本公司自結數，尚未經會計師查核(核閱)。""]], ""footer"": [""以上資料均由各公司依發言當時所屬市場別之規定申報後，由本系統對外公佈，資料如有虛偽不實，均由該公司負責。""], ""header"": {""note"": [], ""subTitle"": [], ""mainTitle"": [""公司當日重大訊息之詳細內容""]}, ""titles"": [{""sub"": [], ""main"": ""序號""}, {""sub"": [], ""main"": ""發言日期""}, {""sub"": [], ""main"": ""發言時間""}, {""sub"": [], ""main"": ""發言人""}, {""sub"": [], ""main"": ""發言人職稱""}, {""sub"": [], ""main"": ""發言人電話""}, {""sub"": [], ""main"": ""主旨""}, {""sub"": [], ""main"": ""符合條款""}, {""sub"": [], ""main"": ""事實發生日""}, {""sub"": [], ""main"": ""說明""}], ""companyAbbreviation"": ""百和""}, ""datetime"": ""115/04/14 18:44:58""}",2026-04-14 18:44:51
1150414|sii|8271|1,115/04/14,14:39:22,8271,宇瞻,公告本公司國內第一次無擔保轉換公司債代收價款及存儲專戶行庫,公司債,1150414,sii,1,"{""code"": 200, ""message"": ""查詢成功"", ""result"": {""marketName"": ""上市公司"", ""companyId"": ""8271"", ""data"": [[1, ""115/04/14"", ""14:39:22"", ""賴孜玟"", ""財務長"", ""(02)22678000"", ""公告本公司國內第一次無擔保轉換公司債代收價款及存儲專戶行庫"", ""51"", ""115/04/14"", ""1.事實發生日:115/04/14\n2.公司名稱:宇瞻科技股份有限公司\n3.與公司關係(請輸入本公司或子公司):本公司\n4.相互持股比例:不適用\n5.發生緣由:依據「發行人募集與發行有價證券處理準則」第九條第一項第二款規定辦理\n6.因應措施:不適用\n7.其他應敘明事項(若事件發生或決議之主體係屬公開發行以上公司，本則重大訊息同時\n  符合證券交易法施行細則第7條第9款所定對股東權益或證券價格有重大影響之事項):\n(1)訂約日期:115/04/14\n(2)委託代收價款行庫:凱基商業銀行敦北分行\n(3)委託存儲專戶行庫:台北富邦商業銀行南京東路分行""]], ""footer"": [""以上資料均由各公司依發言當時所屬市場別之規定申報後，由本系統對外公佈，資料如有虛偽不實，均由該公司負責。""], ""header"": {""note"": [], ""subTitle"": [], ""mainTitle"": [""公司當日重大訊息之詳細內容""]}, ""titles"": [{""sub"": [], ""main"": ""序號""}, {""sub"": [], ""main"": ""發言日期""}, {""sub"": [], ""main"": ""發言時間""}, {""sub"": [], ""main"": ""發言人""}, {""sub"": [], ""main"": ""發言人職稱""}, {""sub"": [], ""main"": ""發言人電話""}, {""sub"": [], ""main"": ""主旨""}, {""sub"": [], ""main"": ""符合條款""}, {""sub"": [], ""main"": ""事實發生日""}, {""sub"": [], ""main"": ""說明""}], ""companyAbbreviation"": ""宇瞻""}, ""datetime"": ""115/04/14 18:44:59""}",2026-04-14 18:44:51
