key,speech_date,speech_time,company_id,company_name,subject,matched_keywords,enterDate,marketKind,serialNumber,detail_json,fetched_at_tw
1150409|sii|2722|2,115/04/14,17:04:45,2722,夏都,公告本公司115年03月自結合併損益,自結合併,1150409,sii,2,"{""code"": 200, ""message"": ""查詢成功"", ""result"": {""marketName"": ""上市公司"", ""companyId"": ""2722"", ""data"": [[2, ""115/04/14"", ""17:04:45"", ""陳重憲"", ""副董事長"", ""06-2918188"", ""公告本公司115年03月自結合併損益"", ""51"", ""115/04/14"", ""1.事實發生日:115/04/14\n2.公司名稱:夏都國際開發股份有限公司\n3.與公司關係(請輸入本公司或子公司):本公司\n4.相互持股比例:不適用\n5.發生緣由:公告本公司115年03月自結合併損益\n6.因應措施:無\n7.其他應敘明事項(若事件發生或決議之主體係屬公開發行以上公司，本則重大訊息同時\n  符合證券交易法施行細則第7條第9款所定對股東權益或證券價格有重大影響之事項):\n(1)\n會計科目(單位：仟元)              115年03月     115年01-03月\n-------------------------------  -----------  ---------------\n合併營業收入淨額                    45,504        132,188\n合併營業損益                       (12,107)       (32,469)\n合併稅前損益                       (12,750)       (33,618)\n歸屬予母公司股東稅後損益           (11,886)       (30,149)\n歸屬予母公司股東稅後每股盈餘(元)     (0.08)         (0.21)\n\n(2)自結數尚未經會計師簽證(核閱)，實際數字，以本公司公告\n   經會計師簽證(核閱)之財務報告為主，特此說明。""]], ""footer"": [""以上資料均由各公司依發言當時所屬市場別之規定申報後，由本系統對外公佈，資料如有虛偽不實，均由該公司負責。""], ""header"": {""note"": [], ""subTitle"": [], ""mainTitle"": [""公司當日重大訊息之詳細內容""]}, ""titles"": [{""sub"": [], ""main"": ""序號""}, {""sub"": [], ""main"": ""發言日期""}, {""sub"": [], ""main"": ""發言時間""}, {""sub"": [], ""main"": ""發言人""}, {""sub"": [], ""main"": ""發言人職稱""}, {""sub"": [], ""main"": ""發言人電話""}, {""sub"": [], ""main"": ""主旨""}, {""sub"": [], ""main"": ""符合條款""}, {""sub"": [], ""main"": ""事實發生日""}, {""sub"": [], ""main"": ""說明""}], ""companyAbbreviation"": ""夏都""}, ""datetime"": ""115/04/14 18:45:05""}",2026-04-14 18:44:51
1150414|sii|9933|5,115/04/14,17:05:16,9933,中鼎,本公司董事會決議114年第1次私募普通股定價相關事宜及公告應募人,私募普通股,1150414,sii,5,"{""code"": 200, ""message"": ""查詢成功"", ""result"": {""marketName"": ""上市公司"", ""companyId"": ""9933"", ""data"": [[5, ""115/04/14"", ""17:05:16"", ""李銘賢"", ""總經理"", ""(02)2833-9999"", ""本公司董事會決議114年第1次私募普通股定價相關事宜\r\n及公告應募人"", ""11"", ""115/04/14"", ""1.董事會決議日期:115/04/14\n2.私募有價證券種類:普通股\n3.私募對象及其與公司間關係:\n1.本次私募普通股之對象符合「證券交易法」第43條之6規定之特定人，且\n為策略性投資人。\n2.洽定之應募人：\n應募人                                       應募股數\n------------------------------------      ------------------\n台達電子工業股份有限公司                    28,184,000\n台灣聚合化學品股份有限公司                   4,230,000\n亞洲聚合股份有限公司                         4,230,000\n大亞電線電纜股份有限公司                     8,455,000\n3.私募對象與本公司間關係\n私募對象與其前十大股東與本公司關係：\n台達電子工業股份有限公司與其前十大股東：非本公司內部人且非關係人\n台灣聚合化學品股份有限公司與其前十大股東：非本公司內部人且非關係人\n亞洲聚合股份有限公司與其前十大股東：非本公司內部人且非關係人\n大亞電線電纜股份有限公司與其前十大股東：非本公司內部人且非關係人\n4.私募股數或張數:45,099,000股。\n5.得私募額度:本公司於114年5月28日股東常會決議通過以私募方式辦理現金增\n資發行普通股，私募總額以不超過90,000仟股為限，並授權董事會得於一年內分三次\n辦理。本次預計發行額度為45,099仟股。其餘尚未發行額度，因辦理期限將屆滿\n不再繼續辦理。\n6.私募價格訂定之依據及合理性:\n以115年4月14日為本次私募之定價日。依據本公司114年5月28日股東常會決議私募\n參考價格之計算標準，係以下列二基準計算價格較高者為參考價格：\n(1)定價日前一、三、五個營業日擇一計算普通股收盤價之簡單算數平均數扣除無償\n配股除權及除息，並加回減資反除權後之股價分別為新台幣35.15元、35.37元、\n35.48元。\n(2)依定價日前30個營業日普通股收盤價簡單算術平均數扣除無償配股除權\n及除息，並加回減資反除權後之股價為新台幣34.10元。\n本次私募價格取兩者較高者35.48元為參考價格、私募價格訂為每股35.48元，為\n參考價格之100%，符合股東會決議之授權範圍。\n7.本次私募資金用途:充實營運資金，以因應集團長期發展需求。\n8.不採用公開募集之理由:本公司長期發展引進策略合作對象考量，而經由該等應募人\n對本公司之股權投資，可穩定並深化雙方業務關係，且私募有價證券在三年內之轉讓\n受有限制，更可加強確保該等策略性投資人與本公司間之長期合作關係。\n9.獨立董事反對或保留意見:無\n10.實際定價日:115年4月14日\n11.參考價格:每股新台幣35.48元\n12.實際私募價格、轉換或認購價格:每股新台幣35.48元\n13.本次私募新股之權利義務:於發行後除依證券交易法第43條之8規定，原則上三年內\n不得轉讓，本公司於發行滿三年後，擬依證券交易法等相關規定向主管機關申請本次\n私募之普通股公開發行及上市交易。\n14.附有轉換、交換或認股者，其換股基準日:不適用\n15.附有轉換、交換或認股者，對股權可能稀釋情形:不適用\n16.附有轉換或認股者，於私募公司債交付且假設全數轉換或認購普通股後對\n上市普通股股權比率之可能影響（上市普通股數A、A/已發行普通股):不適用\n17.前項預計上市普通股未達6000萬股且未達25%者，請說明股權流通性偏低之因應措施:\n不適用\n18.其他應敘明事項:\n(1)股款繳納期間：自115年4月15日起至4月29日止\n(2)增資發行新股基準日：115年4月29日\n(3)本次私募現金增資發行普通股如因法令規定、主管機關要求或因應市場狀況或客觀\n環境變動，或因其他事實需要而須修訂股款繳納期間及增資發行新股基準日時，本\n案授權董事長於法定15日繳款期限內調整股款繳納期間及增資發行新股基準日。""]], ""footer"": [""以上資料均由各公司依發言當時所屬市場別之規定申報後，由本系統對外公佈，資料如有虛偽不實，均由該公司負責。""], ""header"": {""note"": [], ""subTitle"": [], ""mainTitle"": [""公司當日重大訊息之詳細內容""]}, ""titles"": [{""sub"": [], ""main"": ""序號""}, {""sub"": [], ""main"": ""發言日期""}, {""sub"": [], ""main"": ""發言時間""}, {""sub"": [], ""main"": ""發言人""}, {""sub"": [], ""main"": ""發言人職稱""}, {""sub"": [], ""main"": ""發言人電話""}, {""sub"": [], ""main"": ""主旨""}, {""sub"": [], ""main"": ""符合條款""}, {""sub"": [], ""main"": ""事實發生日""}, {""sub"": [], ""main"": ""說明""}], ""companyAbbreviation"": ""中鼎""}, ""datetime"": ""115/04/14 18:45:06""}",2026-04-14 18:44:51
1150414|sii|2408|2,115/04/14,17:09:08,2408,南亞科,公告本公司取得廠務設備,廠務設備,1150414,sii,2,"{""code"": 200, ""message"": ""查詢成功"", ""result"": {""marketName"": ""上市公司"", ""companyId"": ""2408"", ""data"": [[2, ""115/04/14"", ""17:09:08"", ""李培瑛"", ""總經理"", ""(02)29045858"", ""公告本公司取得廠務設備"", ""20"", ""115/04/14"", ""1.標的物之名稱及性質（如坐落台中市北區ＸＸ段ＸＸ小段土地）:\r\n廠務設備\r\n2.事實發生日:115/4/14~115/4/14\r\n3.董事會通過日期: 不適用\r\n4.其他核決日期:\r\n核決層級:董事長\r\n民國115年4月14日\r\n5.交易單位數量（如ＸＸ平方公尺，折合ＸＸ坪）、每單位價格及交易總金額:\r\n交易數量：一批\n交易總金額：新台幣307,161,700元\r\n6.交易相對人及其與公司之關係（交易相對人如屬自然人，且非公司之關\r\n係人者，得免揭露其姓名）:\r\n台塑新智能科技股份有限公司；關係人\r\n7.交易相對人為關係人者，並應公告選定關係人為交易對象之原因及前次移轉之\r\n所有人、前次移轉之所有人與公司及交易相對人間相互之關係、前次移轉日期\r\n及移轉金額:\r\n比、議價後決定；\n前次移轉之所有人、移轉日期及移轉金額：不適用\r\n8.交易標的最近五年內所有權人曾為公司之關係人者，尚應公告關係\r\n人之取得及處分日期、價格及交易當時與公司之關係:\r\n不適用\r\n9.預計處分利益（或損失）（取得資產者不適用）（遞延者應列表說明\r\n認列情形）:\r\n不適用\r\n10.交付或付款條件（含付款期間及金額）、契約限制條款及其他重要約定\r\n事項:\r\n不適用\r\n11.本次交易之決定方式（如招標、比價或議價）、價格決定之參考依據及\r\n決策單位:\r\n依訂單條件或合約約定辦理\r\n12.專業估價者事務所或公司名稱及其估價金額:\r\n比、議價：依廠商及其他廠商提供之報價單等作為參考依據，\n並依本公司核決權限規定辦理。\r\n13.專業估價師姓名:\r\n不適用\r\n14.專業估價師開業證書字號:\r\n不適用\r\n15.估價報告是否為限定價格、特定價格或特殊價格:否或不適用\r\n16.是否尚未取得估價報告:否或不適用\r\n17.尚未取得估價報告之原因:\r\n不適用\r\n18.估價結果有重大差異時，其差異原因及會計師意見:\r\n不適用\r\n19.會計師事務所名稱:\r\n不適用\r\n20.會計師姓名:\r\n不適用\r\n21.會計師開業證書字號:\r\n不適用\r\n22.經紀人及經紀費用:\r\n不適用\r\n23.取得或處分之具體目的或用途:\r\n供生產/營運使用\r\n24.本次交易表示異議之董事之意見:\r\n不適用\r\n25.本次交易為關係人交易:是\r\n26.監察人承認或審計委員會同意日期:\r\n將另提審計委員會\r\n27.本次交易係向關係人取得不動產或其使用權資產:否\r\n28.依「公開發行公司取得或處分資產處理準則」第十六條規定\r\n評估之價格:不適用\r\n29.依前項評估之價格較交易價格為低者，依同準則第十七條規\r\n定評估之價格:不適用\r\n30.前已就同一件事件發布重大訊息日期: 不適用\r\n31.其他敘明事項:\r\n無""]], ""footer"": [""以上資料均由各公司依發言當時所屬市場別之規定申報後，由本系統對外公佈，資料如有虛偽不實，均由該公司負責。""], ""header"": {""note"": [], ""subTitle"": [], ""mainTitle"": [""公司當日重大訊息之詳細內容""]}, ""titles"": [{""sub"": [], ""main"": ""序號""}, {""sub"": [], ""main"": ""發言日期""}, {""sub"": [], ""main"": ""發言時間""}, {""sub"": [], ""main"": ""發言人""}, {""sub"": [], ""main"": ""發言人職稱""}, {""sub"": [], ""main"": ""發言人電話""}, {""sub"": [], ""main"": ""主旨""}, {""sub"": [], ""main"": ""符合條款""}, {""sub"": [], ""main"": ""事實發生日""}, {""sub"": [], ""main"": ""說明""}], ""companyAbbreviation"": ""南亞科""}, ""datetime"": ""115/04/14 18:45:06""}",2026-04-14 18:44:51
1150414|sii|5880|1,115/04/14,17:11:21,5880,合庫金,公告本公司暨主要子公司115年3月份自結合併盈餘,自結合併,1150414,sii,1,"{""code"": 200, ""message"": ""查詢成功"", ""result"": {""marketName"": ""上市公司"", ""companyId"": ""5880"", ""data"": [[1, ""115/04/14"", ""17:11:21"", ""陳幼婉"", ""副總經理"", ""(02)2173-8888"", ""公告本公司暨主要子公司115年3月份自結合併盈餘"", ""51"", ""115/04/14"", ""1.事實發生日:115/04/14\n2.公司名稱:合作金庫金融控股股份有限公司\n3.與公司關係(請輸入本公司或子公司):本公司\n4.相互持股比例:無\n5.發生緣由:同主旨\n6.因應措施:不適用\n7.其他應敘明事項(若事件發生或決議之主體係屬公開發行以上公司，本則重大訊息同時\n  符合證券交易法施行細則第7條第9款所定對股東權益或證券價格有重大影響之事項):\n                當月自結  當月自結  累計稅前  累計稅後  累計每股\n                稅前淨利  稅後淨利    淨利      淨利    稅後淨利\n                 (億元)    (億元)    (億元)    (億元)     (元)\n合庫金控(合併)    24.45     19.55     72.44     58.12     0.36\n合庫銀行(合併)    23.38     18.68     63.68     50.85     0.39\n合庫資產(合併)     0.43      0.34      1.14      0.89     0.28\n合庫票券(個別)     0.55      0.44      1.48      1.18     0.24\n合庫證券(合併)     0.99      0.75      4.37      4.00     0.77\n合庫人壽(個別)    -0.22     -0.24      5.29      4.47     0.65\n合庫投信(個別)    0.006     0.004     0.003     0.002     0.01\n註：上述集團獲利資料係屬自結數字，未經會計師查核或核閱；金控合併累計稅後\n淨利歸屬於母公司業主為55.90億元、非控制權益為2.22億元。""]], ""footer"": [""以上資料均由各公司依發言當時所屬市場別之規定申報後，由本系統對外公佈，資料如有虛偽不實，均由該公司負責。""], ""header"": {""note"": [], ""subTitle"": [], ""mainTitle"": [""公司當日重大訊息之詳細內容""]}, ""titles"": [{""sub"": [], ""main"": ""序號""}, {""sub"": [], ""main"": ""發言日期""}, {""sub"": [], ""main"": ""發言時間""}, {""sub"": [], ""main"": ""發言人""}, {""sub"": [], ""main"": ""發言人職稱""}, {""sub"": [], ""main"": ""發言人電話""}, {""sub"": [], ""main"": ""主旨""}, {""sub"": [], ""main"": ""符合條款""}, {""sub"": [], ""main"": ""事實發生日""}, {""sub"": [], ""main"": ""說明""}], ""companyAbbreviation"": ""合庫金""}, ""datetime"": ""115/04/14 18:45:07""}",2026-04-14 18:44:51
1150414|sii|2308|2,115/04/14,17:22:58,2308,台達電,公告本公司取得中鼎工程股份有限公司私募普通股股份,私募普通股,1150414,sii,2,"{""code"": 200, ""message"": ""查詢成功"", ""result"": {""marketName"": ""上市公司"", ""companyId"": ""2308"", ""data"": [[2, ""115/04/14"", ""17:22:58"", ""周志宏"", ""永續長"", ""(02)87972088"", ""公告本公司取得中鼎工程股份有限公司私募普通股股份"", ""24"", ""115/04/14"", ""1.標的物之名稱及性質（屬特別股者，並應標明特別股約定發行條件，\r\n如股息率等）:\r\n中鼎工程股份有限公司（以下稱「中鼎工程」）私募普通股股份\r\n2.事實發生日:115/04/14\r\n3.交易單位數量、每單位價格及交易總金額:\r\n交易單位數量：28,184仟股\r\n每單位價格：每股新台幣35.48元\r\n交易總金額：約新台幣999,968仟元\r\n4.交易相對人及其與公司之關係（交易相對人如屬自然人，且非公司\r\n之關係人者，得免揭露其姓名）:\r\n中鼎工程非本公司之關係人。\r\n5.交易相對人為關係人者，並應公告選定關係人為交易對象之原因及\r\n前次移轉之所有人、前次移轉之所有人與公司及交易相對人間相互之\r\n關係、前次移轉日期及移轉金額:\r\n不適用\r\n6.交易標的最近五年內所有權人曾為公司之關係人者，尚應公告\r\n關係人之取得及處分日期、價格及交易當時與公司之關係:\r\n不適用\r\n7.本次係處分債權之相關事項（含處分之債權附隨擔保品種類、處分\r\n債權如有屬對關係人債權者尚需公告關係人名稱及本次處分該關係人\r\n之債權帳面金額:\r\n不適用\r\n8.處分利益（或損失）（取得有價證券者不適用）（遞延者應列表\r\n說明認列情形）:\r\n不適用\r\n9.交付或付款條件（含付款期間及金額）、契約限制條款及其他重要\r\n約定事項:\r\n交付或付款條件：匯入指定之銀行帳戶\r\n契約限制條款及其他重要約定事項：依證券交易法私募有價證券轉讓限制之規定及雙方\r\n所簽定之協議書辦理\r\n10.本次交易之決定方式、價格決定之參考依據及決策單位:\r\n決策單位：依本公司核決權限規定辦理\r\n價格決定之參考依據：獨立專家出具之交易價格合理性意見書\r\n11.取得或處分有價證券標的公司每股淨值:22.66\r\n12.有價證券標的公司私募參考價格與每股交易金額差距達20%以上:否\r\n13.迄目前為止，累積持有本交易證券（含本次交易）之數量、金額、\r\n持股比例及權利受限情形（如質押情形）:\r\n累積持有本交易證券（含本次交易）之數量：28,184仟股\r\n累積持有本交易證券（含本次交易）之金額：約新台幣999,968仟元\r\n累積持有本交易證券（含本次交易）之持股比例：2.98%\r\n權利受限情形：依證券交易法私募有價證券轉讓限制之規定\r\n14.迄目前為止，私募有價證券投資（含本次交易）占公司最近期財\r\n務報表中總資產及歸屬於母公司業主之權益之比例暨最近期財務報表中營運資金數額:\r\n私募有價證券投資（含本次交易）占總資產比例：70.38%\r\n私募有價證券投資（含本次交易）占歸屬於母公司業主之權益之比例：110.46%\r\n營運資金數額：新台幣-10,463,518仟元(集團之現金足敷支付本案之交易價金)\r\n15.經理人及經紀費用:\r\n無\r\n16.取得或處分之具體目的或用途:\r\n強化本公司解決方案能力\r\n17.本次交易表示異議董事之意見:\r\n無\r\n18.本次交易為關係人交易:\r\n否\r\n19.董事會通過日期:\r\n不適用\r\n20.監察人承認或審計委員會同意日期:\r\n不適用\r\n21.本次交易會計師出具非合理性意見:否\r\n22.會計師事務所名稱:\r\n國富浩華聯合會計師事務所\r\n23.會計師姓名:\r\n吳孟達\r\n24.會計師開業證書字號:\r\n台財證登（六）第三六二二號\r\n25.其他敘明事項:\r\n無""]], ""footer"": [""以上資料均由各公司依發言當時所屬市場別之規定申報後，由本系統對外公佈，資料如有虛偽不實，均由該公司負責。""], ""header"": {""note"": [], ""subTitle"": [], ""mainTitle"": [""公司當日重大訊息之詳細內容""]}, ""titles"": [{""sub"": [], ""main"": ""序號""}, {""sub"": [], ""main"": ""發言日期""}, {""sub"": [], ""main"": ""發言時間""}, {""sub"": [], ""main"": ""發言人""}, {""sub"": [], ""main"": ""發言人職稱""}, {""sub"": [], ""main"": ""發言人電話""}, {""sub"": [], ""main"": ""主旨""}, {""sub"": [], ""main"": ""符合條款""}, {""sub"": [], ""main"": ""事實發生日""}, {""sub"": [], ""main"": ""說明""}], ""companyAbbreviation"": ""台達電""}, ""datetime"": ""115/04/14 18:45:08""}",2026-04-14 18:44:51
1150414|sii|1609|1,115/04/14,17:29:03,1609,大亞,公告本公司取得中鼎工程股份有限公司私募普通股,私募普通股,1150414,sii,1,"{""code"": 200, ""message"": ""查詢成功"", ""result"": {""marketName"": ""上市公司"", ""companyId"": ""1609"", ""data"": [[1, ""115/04/14"", ""17:29:03"", ""陳重光"", ""總管理處處總經理"", ""06-5953131"", ""公告本公司取得中鼎工程股份有限公司私募普通股"", ""24"", ""115/04/14"", ""1.標的物之名稱及性質（屬特別股者，並應標明特別股約定發行條件，\r\n如股息率等）:\r\n中鼎工程股份有限公司私募普通股\r\n2.事實發生日:115/04/14\r\n3.交易單位數量、每單位價格及交易總金額:\r\n交易單位數量：8,455,000股\r\n每單位價格：新台幣35.48元\r\n交易總金額：新台幣299,983,400\r\n4.交易相對人及其與公司之關係（交易相對人如屬自然人，且非公司\r\n之關係人者，得免揭露其姓名）:\r\n中鼎工程股份有限公司，非關係人\r\n5.交易相對人為關係人者，並應公告選定關係人為交易對象之原因及\r\n前次移轉之所有人、前次移轉之所有人與公司及交易相對人間相互之\r\n關係、前次移轉日期及移轉金額:\r\n不適用\r\n6.交易標的最近五年內所有權人曾為公司之關係人者，尚應公告\r\n關係人之取得及處分日期、價格及交易當時與公司之關係:\r\n不適用\r\n7.本次係處分債權之相關事項（含處分之債權附隨擔保品種類、處分\r\n債權如有屬對關係人債權者尚需公告關係人名稱及本次處分該關係人\r\n之債權帳面金額:\r\n不適用\r\n8.處分利益（或損失）（取得有價證券者不適用）（遞延者應列表\r\n說明認列情形）:\r\n不適用\r\n9.交付或付款條件（含付款期間及金額）、契約限制條款及其他重要\r\n約定事項:\r\n股款繳納期間：115/04/15~115/04/29下午3:30止\r\n10.本次交易之決定方式、價格決定之參考依據及決策單位:\r\n交易之決定方式、價格決定之參考依據：依協議書約定\r\n決策單位：董事會\r\n11.取得或處分有價證券標的公司每股淨值:22.70\r\n12.有價證券標的公司私募參考價格與每股交易金額差距達20%以上:不適用\r\n13.迄目前為止，累積持有本交易證券（含本次交易）之數量、金額、\r\n持股比例及權利受限情形（如質押情形）:\r\n1.集中市場買入：1,496,256股，持股比例:0.16%，金額新台幣37,005,526元\r\n2.非於集中市場買入(私募)：8,455,000股，持股比例:0.89%，金額新台幣299,983,400元\r\n3.累積買入：9,951,256股，持股比例:1.05%，金額新台幣336,988,926元\r\n4.權利受限情形：本次私募8,455,000股，依證券交易法第43條之8相關規定辦理。\r\n14.迄目前為止，私募有價證券投資（含本次交易）占公司最近期財\r\n務報表中總資產及歸屬於母公司業主之權益之比例暨最近期財務報表中營運資金數額:\r\n1.佔公司最近期財報總資產比例：0.75%\r\n2.佔歸屬於母公司對權益之比例：1.75%\r\n3.營運資金數額：2,477,103仟元\r\n15.經理人及經紀費用:\r\n無\r\n16.取得或處分之具體目的或用途:\r\n基於整體營運規劃需要\r\n17.本次交易表示異議董事之意見:\r\n無\r\n18.本次交易為關係人交易:\r\n否\r\n19.董事會通過日期:\r\n民國115年4月14日\r\n20.監察人承認或審計委員會同意日期:\r\n民國115年4月14日\r\n21.本次交易會計師出具非合理性意見:不適用\r\n22.會計師事務所名稱:\r\n不適用\r\n23.會計師姓名:\r\n不適用\r\n24.會計師開業證書字號:\r\n不適用\r\n25.其他敘明事項:\r\n無""]], ""footer"": [""以上資料均由各公司依發言當時所屬市場別之規定申報後，由本系統對外公佈，資料如有虛偽不實，均由該公司負責。""], ""header"": {""note"": [], ""subTitle"": [], ""mainTitle"": [""公司當日重大訊息之詳細內容""]}, ""titles"": [{""sub"": [], ""main"": ""序號""}, {""sub"": [], ""main"": ""發言日期""}, {""sub"": [], ""main"": ""發言時間""}, {""sub"": [], ""main"": ""發言人""}, {""sub"": [], ""main"": ""發言人職稱""}, {""sub"": [], ""main"": ""發言人電話""}, {""sub"": [], ""main"": ""主旨""}, {""sub"": [], ""main"": ""符合條款""}, {""sub"": [], ""main"": ""事實發生日""}, {""sub"": [], ""main"": ""說明""}], ""companyAbbreviation"": ""大亞""}, ""datetime"": ""115/04/14 18:45:09""}",2026-04-14 18:44:51
