key,speech_date,speech_time,company_id,company_name,subject,matched_keywords,enterDate,marketKind,serialNumber,detail_json,fetched_at_tw
1150706|sii|3711|11,115/07/06,20:48:02,3711,日月光投控,代子公司矽品精密工業(股)公司公告取得營業用機器設備達十億元,機器設備,1150706,sii,11,"{""code"": 200, ""message"": ""查詢成功"", ""result"": {""marketName"": ""上市公司"", ""companyId"": ""3711"", ""data"": [[11, ""115/07/06"", ""20:48:02"", ""吳田玉"", ""營運長"", ""02-66365678"", ""代子公司矽品精密工業(股)公司公告取得營業用機器設備達十億元"", ""20"", ""115/07/06"", ""1.標的物之名稱及性質（如坐落台中市北區ＸＸ段ＸＸ小段土地）:\r\n營業用機器設備\r\n2.事實發生日:114/7/11~115/7/6\r\n3.董事會通過日期: 不適用\r\n4.其他核決日期:\r\n核決層級:總經理核決\r\n民國115年7月6日\r\n5.交易單位數量（如ＸＸ平方公尺，折合ＸＸ坪）、每單位價格及交易總金額:\r\n取得60批，\n每批平均單價：NTD 46,389,417元，\n交易總金額：NTD 2,783,365,000元。\r\n6.交易相對人及其與公司之關係（交易相對人如屬自然人，且非公司之關\r\n係人者，得免揭露其姓名）:\r\n交易相對人：程泰科技股份有限公司； \n與公司之關係：無\r\n7.交易相對人為關係人者，並應公告選定關係人為交易對象之原因及前次移轉之\r\n所有人、前次移轉之所有人與公司及交易相對人間相互之關係、前次移轉日期\r\n及移轉金額:\r\n不適用\r\n8.交易標的最近五年內所有權人曾為公司之關係人者，尚應公告關係\r\n人之取得及處分日期、價格及交易當時與公司之關係:\r\n不適用\r\n9.預計處分利益（或損失）（取得資產者不適用）（遞延者應列表說明\r\n認列情形）:\r\n不適用\r\n10.交付或付款條件（含付款期間及金額）、契約限制條款及其他重要約定\r\n事項:\r\n電匯。\n契約限制條款：無。\n其他重要約定事項：無。\r\n11.本次交易之決定方式（如招標、比價或議價）、價格決定之參考依據及\r\n決策單位:\r\n交易決定方式：比價/議價。\n價格決定之參考依據：參考歷年交易資料和市場行情。\n決策單位：依公司內部核決權限決定。\r\n12.專業估價者事務所或公司名稱及其估價金額:\r\n不適用\r\n13.專業估價師姓名:\r\n不適用\r\n14.專業估價師開業證書字號:\r\n不適用\r\n15.估價報告是否為限定價格、特定價格或特殊價格:否或不適用\r\n16.是否尚未取得估價報告:否或不適用\r\n17.尚未取得估價報告之原因:\r\n不適用\r\n18.估價結果有重大差異時，其差異原因及會計師意見:\r\n不適用\r\n19.會計師事務所名稱:\r\n不適用\r\n20.會計師姓名:\r\n不適用\r\n21.會計師開業證書字號:\r\n不適用\r\n22.經紀人及經紀費用:\r\n無\r\n23.取得或處分之具體目的或用途:\r\n營業用途\r\n24.本次交易表示異議之董事之意見:\r\n無\r\n25.本次交易為關係人交易:否\r\n26.監察人承認或審計委員會同意日期:\r\n不適用\r\n27.本次交易係向關係人取得不動產或其使用權資產:否\r\n28.依「公開發行公司取得或處分資產處理準則」第十六條規定\r\n評估之價格:不適用\r\n29.依前項評估之價格較交易價格為低者，依同準則第十七條規\r\n定評估之價格:不適用\r\n30.前已就同一件事件發布重大訊息日期: 不適用\r\n31.其他敘明事項:\r\n無""]], ""footer"": [""以上資料均由各公司依發言當時所屬市場別之規定申報後，由本系統對外公佈，資料如有虛偽不實，均由該公司負責。""], ""header"": {""note"": [], ""subTitle"": [], ""mainTitle"": [""公司當日重大訊息之詳細內容""]}, ""titles"": [{""sub"": [], ""main"": ""序號""}, {""sub"": [], ""main"": ""發言日期""}, {""sub"": [], ""main"": ""發言時間""}, {""sub"": [], ""main"": ""發言人""}, {""sub"": [], ""main"": ""發言人職稱""}, {""sub"": [], ""main"": ""發言人電話""}, {""sub"": [], ""main"": ""主旨""}, {""sub"": [], ""main"": ""符合條款""}, {""sub"": [], ""main"": ""事實發生日""}, {""sub"": [], ""main"": ""說明""}], ""companyAbbreviation"": ""日月光投控""}, ""datetime"": ""115/07/06 23:59:32""}",2026-07-06 23:59:16
1150706|sii|3711|12,115/07/06,20:48:16,3711,日月光投控,代子公司矽品精密工業(股)公司公告取得營業用機器設備達十億元,機器設備,1150706,sii,12,"{""code"": 200, ""message"": ""查詢成功"", ""result"": {""marketName"": ""上市公司"", ""companyId"": ""3711"", ""data"": [[12, ""115/07/06"", ""20:48:16"", ""吳田玉"", ""營運長"", ""02-66365678"", ""代子公司矽品精密工業(股)公司公告取得營業用機器設備達十億元"", ""20"", ""115/07/06"", ""1.標的物之名稱及性質（如坐落台中市北區ＸＸ段ＸＸ小段土地）:\r\n營業用機器設備\r\n2.事實發生日:115/6/15~115/7/6\r\n3.董事會通過日期: 不適用\r\n4.其他核決日期:\r\n核決層級:總經理核決\r\n民國115年7月6日\r\n5.交易單位數量（如ＸＸ平方公尺，折合ＸＸ坪）、每單位價格及交易總金額:\r\n取得7批，\n每批平均單價：NTD 270,459,502元，\n交易總金額：NTD 1,893,216,512元。\r\n6.交易相對人及其與公司之關係（交易相對人如屬自然人，且非公司之關\r\n係人者，得免揭露其姓名）:\r\n交易相對人：萬潤科技股份有限公司； \n與公司之關係：無\r\n7.交易相對人為關係人者，並應公告選定關係人為交易對象之原因及前次移轉之\r\n所有人、前次移轉之所有人與公司及交易相對人間相互之關係、前次移轉日期\r\n及移轉金額:\r\n不適用\r\n8.交易標的最近五年內所有權人曾為公司之關係人者，尚應公告關係\r\n人之取得及處分日期、價格及交易當時與公司之關係:\r\n不適用\r\n9.預計處分利益（或損失）（取得資產者不適用）（遞延者應列表說明\r\n認列情形）:\r\n不適用\r\n10.交付或付款條件（含付款期間及金額）、契約限制條款及其他重要約定\r\n事項:\r\n電匯。\n契約限制條款：無。\n其他重要約定事項：無。\r\n11.本次交易之決定方式（如招標、比價或議價）、價格決定之參考依據及\r\n決策單位:\r\n交易決定方式：比價/議價。\n價格決定之參考依據：參考歷年交易資料和市場行情。\n決策單位：依公司內部核決權限決定。\r\n12.專業估價者事務所或公司名稱及其估價金額:\r\n不適用\r\n13.專業估價師姓名:\r\n不適用\r\n14.專業估價師開業證書字號:\r\n不適用\r\n15.估價報告是否為限定價格、特定價格或特殊價格:否或不適用\r\n16.是否尚未取得估價報告:否或不適用\r\n17.尚未取得估價報告之原因:\r\n不適用\r\n18.估價結果有重大差異時，其差異原因及會計師意見:\r\n不適用\r\n19.會計師事務所名稱:\r\n不適用\r\n20.會計師姓名:\r\n不適用\r\n21.會計師開業證書字號:\r\n不適用\r\n22.經紀人及經紀費用:\r\n無\r\n23.取得或處分之具體目的或用途:\r\n營業用途\r\n24.本次交易表示異議之董事之意見:\r\n無\r\n25.本次交易為關係人交易:否\r\n26.監察人承認或審計委員會同意日期:\r\n不適用\r\n27.本次交易係向關係人取得不動產或其使用權資產:否\r\n28.依「公開發行公司取得或處分資產處理準則」第十六條規定\r\n評估之價格:不適用\r\n29.依前項評估之價格較交易價格為低者，依同準則第十七條規\r\n定評估之價格:不適用\r\n30.前已就同一件事件發布重大訊息日期: 不適用\r\n31.其他敘明事項:\r\n無""]], ""footer"": [""以上資料均由各公司依發言當時所屬市場別之規定申報後，由本系統對外公佈，資料如有虛偽不實，均由該公司負責。""], ""header"": {""note"": [], ""subTitle"": [], ""mainTitle"": [""公司當日重大訊息之詳細內容""]}, ""titles"": [{""sub"": [], ""main"": ""序號""}, {""sub"": [], ""main"": ""發言日期""}, {""sub"": [], ""main"": ""發言時間""}, {""sub"": [], ""main"": ""發言人""}, {""sub"": [], ""main"": ""發言人職稱""}, {""sub"": [], ""main"": ""發言人電話""}, {""sub"": [], ""main"": ""主旨""}, {""sub"": [], ""main"": ""符合條款""}, {""sub"": [], ""main"": ""事實發生日""}, {""sub"": [], ""main"": ""說明""}], ""companyAbbreviation"": ""日月光投控""}, ""datetime"": ""115/07/06 23:59:32""}",2026-07-06 23:59:16
1150706|sii|3711|13,115/07/06,20:48:35,3711,日月光投控,代子公司矽品精密工業(股)公司公告取得營業用機器設備達十億元,機器設備,1150706,sii,13,"{""code"": 200, ""message"": ""查詢成功"", ""result"": {""marketName"": ""上市公司"", ""companyId"": ""3711"", ""data"": [[13, ""115/07/06"", ""20:48:35"", ""吳田玉"", ""營運長"", ""02-66365678"", ""代子公司矽品精密工業(股)公司公告取得營業用機器設備達十億元"", ""20"", ""115/07/06"", ""1.標的物之名稱及性質（如坐落台中市北區ＸＸ段ＸＸ小段土地）:\r\n營業用機器設備\r\n2.事實發生日:114/7/7~115/7/6\r\n3.董事會通過日期: 不適用\r\n4.其他核決日期:\r\n核決層級:總經理核決\r\n民國115年7月6日\r\n5.交易單位數量（如ＸＸ平方公尺，折合ＸＸ坪）、每單位價格及交易總金額:\r\n取得19批，\n每批平均單價：NTD 54,093,440元，\n交易總金額：NTD 1,027,775,364元。\r\n6.交易相對人及其與公司之關係（交易相對人如屬自然人，且非公司之關\r\n係人者，得免揭露其姓名）:\r\n交易相對人：聚嶸科技股份有限公司； \n與公司之關係：無\r\n7.交易相對人為關係人者，並應公告選定關係人為交易對象之原因及前次移轉之\r\n所有人、前次移轉之所有人與公司及交易相對人間相互之關係、前次移轉日期\r\n及移轉金額:\r\n不適用\r\n8.交易標的最近五年內所有權人曾為公司之關係人者，尚應公告關係\r\n人之取得及處分日期、價格及交易當時與公司之關係:\r\n不適用\r\n9.預計處分利益（或損失）（取得資產者不適用）（遞延者應列表說明\r\n認列情形）:\r\n不適用\r\n10.交付或付款條件（含付款期間及金額）、契約限制條款及其他重要約定\r\n事項:\r\n電匯。\n契約限制條款：無。\n其他重要約定事項：無。\r\n11.本次交易之決定方式（如招標、比價或議價）、價格決定之參考依據及\r\n決策單位:\r\n交易決定方式：比價/議價。\n價格決定之參考依據：參考歷年交易資料和市場行情。\n決策單位：依公司內部核決權限決定。\r\n12.專業估價者事務所或公司名稱及其估價金額:\r\n不適用\r\n13.專業估價師姓名:\r\n不適用\r\n14.專業估價師開業證書字號:\r\n不適用\r\n15.估價報告是否為限定價格、特定價格或特殊價格:否或不適用\r\n16.是否尚未取得估價報告:否或不適用\r\n17.尚未取得估價報告之原因:\r\n不適用\r\n18.估價結果有重大差異時，其差異原因及會計師意見:\r\n不適用\r\n19.會計師事務所名稱:\r\n不適用\r\n20.會計師姓名:\r\n不適用\r\n21.會計師開業證書字號:\r\n不適用\r\n22.經紀人及經紀費用:\r\n無\r\n23.取得或處分之具體目的或用途:\r\n營業用途\r\n24.本次交易表示異議之董事之意見:\r\n無\r\n25.本次交易為關係人交易:否\r\n26.監察人承認或審計委員會同意日期:\r\n不適用\r\n27.本次交易係向關係人取得不動產或其使用權資產:否\r\n28.依「公開發行公司取得或處分資產處理準則」第十六條規定\r\n評估之價格:不適用\r\n29.依前項評估之價格較交易價格為低者，依同準則第十七條規\r\n定評估之價格:不適用\r\n30.前已就同一件事件發布重大訊息日期: 不適用\r\n31.其他敘明事項:\r\n無""]], ""footer"": [""以上資料均由各公司依發言當時所屬市場別之規定申報後，由本系統對外公佈，資料如有虛偽不實，均由該公司負責。""], ""header"": {""note"": [], ""subTitle"": [], ""mainTitle"": [""公司當日重大訊息之詳細內容""]}, ""titles"": [{""sub"": [], ""main"": ""序號""}, {""sub"": [], ""main"": ""發言日期""}, {""sub"": [], ""main"": ""發言時間""}, {""sub"": [], ""main"": ""發言人""}, {""sub"": [], ""main"": ""發言人職稱""}, {""sub"": [], ""main"": ""發言人電話""}, {""sub"": [], ""main"": ""主旨""}, {""sub"": [], ""main"": ""符合條款""}, {""sub"": [], ""main"": ""事實發生日""}, {""sub"": [], ""main"": ""說明""}], ""companyAbbreviation"": ""日月光投控""}, ""datetime"": ""115/07/06 23:59:33""}",2026-07-06 23:59:16
1150706|sii|3037|1,115/07/06,22:35:58,3037,欣興,公告本公司現金增資發行普通股參與發行海外存託憑證之發行條件,現金增資,1150706,sii,1,"{""code"": 200, ""message"": ""查詢成功"", ""result"": {""marketName"": ""上市公司"", ""companyId"": ""3037"", ""data"": [[1, ""115/07/06"", ""22:35:58"", ""鍾明峰"", ""財務處資深副總經理"", ""03-3500386-29592"", ""公告本公司現金增資發行普通股參與發行\r\n海外存託憑證之發行條件"", ""51"", ""115/07/06"", ""1.事實發生日:115/07/06\n2.公司名稱:欣興電子股份有限公司\n3.與公司關係(請輸入本公司或子公司):本公司\n4.相互持股比例:不適用\n5.發生緣由:公告本公司現金增資發行普通股參與發行海外存託憑證完成訂價\n6.因應措施:無\n7.其他應敘明事項(若事件發生或決議之主體係屬公開發行以上公司，本則重大訊息同時\n  符合證券交易法施行細則第7條第9款所定對股東權益或證券價格有重大影響之事項):\n一、本公司現金增資發行普通股參與發行海外存託憑證之發行條件：\n   (1)發行總金額：1,355,000,000美元\n   (2)單位發行價格:每單位27.1美元\n   (3)單位發行總數:海外存託憑證發行50,000,000單位，表彰50,000,000股普通股\n   (4)訂價日期：115/07/06\n   (5)預定發行日期：115/07/09\n   (6)每單位海外存託憑證表彰股數:1單位海外存託憑證表彰本公司普通股1股\n   (7)每股價格:折合約新台幣868元(以匯率1美元=32.04新台幣轉換)\n二、發行及交易地點:盧森堡證券交易所\n三、發行方式約定由特定人認購之情事：無\n四、資金運用計劃及預計可能產生效益：本次籌資將用於外幣購料。預計外幣購料\n    每年可節省利息支出，並強化公司財務結構，進而提升公司未來營運之競爭力，\n    對公司未來長期營運發展將有正面助益\n五、對股東權益之主要影響：\n    本次辦理現金增資發行普通股50,000,000股參與發行海外存託憑證，\n    股權稀釋比例約為3.05%，不致對股東權益造成重大稀釋""]], ""footer"": [""以上資料均由各公司依發言當時所屬市場別之規定申報後，由本系統對外公佈，資料如有虛偽不實，均由該公司負責。""], ""header"": {""note"": [], ""subTitle"": [], ""mainTitle"": [""公司當日重大訊息之詳細內容""]}, ""titles"": [{""sub"": [], ""main"": ""序號""}, {""sub"": [], ""main"": ""發言日期""}, {""sub"": [], ""main"": ""發言時間""}, {""sub"": [], ""main"": ""發言人""}, {""sub"": [], ""main"": ""發言人職稱""}, {""sub"": [], ""main"": ""發言人電話""}, {""sub"": [], ""main"": ""主旨""}, {""sub"": [], ""main"": ""符合條款""}, {""sub"": [], ""main"": ""事實發生日""}, {""sub"": [], ""main"": ""說明""}], ""companyAbbreviation"": ""欣興""}, ""datetime"": ""115/07/06 23:59:33""}",2026-07-06 23:59:16
1150706|otc|5386|1,115/07/06,17:54:08,5386,青雲,本公司自行撤回115年度現金增資發行新股暨國內第二次無擔保轉換公司債,現金增資|公司債,1150706,otc,1,"{""code"": 200, ""message"": ""查詢成功"", ""result"": {""marketName"": ""上櫃公司"", ""companyId"": ""5386"", ""data"": [[1, ""115/07/06"", ""17:54:08"", ""王龍一"", ""副總經理"", ""02-82273277"", ""本公司自行撤回115年度現金增資發行新股暨國內第二次\r\n無擔保轉換公司債"", ""11"", ""115/07/06"", ""1.事實發生日:115/07/06\n2.原公告申報日期:115/05/06\n3.簡述原公告申報內容:董事會決議現金增資發行新股、發行國內第二次無擔保轉換\n                      公司債。\n4.變動緣由及主要內容:本公司基於營運策略規劃及評估資本市場募資時程，並基於\n                      維護全體股東權益，擬自行撤回115年度現金增資發行新股\n                      暨國內第二次無擔保轉換公司債。\n5.變動後對公司財務業務之影響:無重大影響。\n6.其他應敘明事項:無。""]], ""footer"": [""以上資料均由各公司依發言當時所屬市場別之規定申報後，由本系統對外公佈，資料如有虛偽不實，均由該公司負責。""], ""header"": {""note"": [], ""subTitle"": [], ""mainTitle"": [""公司當日重大訊息之詳細內容""]}, ""titles"": [{""sub"": [], ""main"": ""序號""}, {""sub"": [], ""main"": ""發言日期""}, {""sub"": [], ""main"": ""發言時間""}, {""sub"": [], ""main"": ""發言人""}, {""sub"": [], ""main"": ""發言人職稱""}, {""sub"": [], ""main"": ""發言人電話""}, {""sub"": [], ""main"": ""主旨""}, {""sub"": [], ""main"": ""符合條款""}, {""sub"": [], ""main"": ""事實發生日""}, {""sub"": [], ""main"": ""說明""}], ""companyAbbreviation"": ""青雲""}, ""datetime"": ""115/07/06 23:59:34""}",2026-07-06 23:59:16
1150706|otc|4416|2,115/07/06,18:17:08,4416,三圓,公告本公司普通股公司債到期還款計劃說明,公司債,1150706,otc,2,"{""code"": 200, ""message"": ""查詢成功"", ""result"": {""marketName"": ""上櫃公司"", ""companyId"": ""4416"", ""data"": [[2, ""115/07/06"", ""18:17:08"", ""王朝平"", ""財務部副總"", ""(02)2563-9136"", ""公告本公司普通股公司債到期還款計劃說明"", ""53"", ""115/07/06"", ""1.事實發生日:115/07/06\n2.公司名稱:三圓建設股份有限公司\n3.與公司關係(請輸入本公司或子公司):本公司\n4.相互持股比例:不適用\n5.發生緣由:依115年06月24日證櫃監字第1150201651號函規定辦理說明\n(1)本公司發行112年度第一次有擔保普通公司債，總發行金額新台幣350,000,000元及\n利息新台幣5,775,000元，將於115年09月19日到期\n(2)本公司發行國內第三次有擔保轉換公司債$955,900,000元，將於115年09月30日可執\n行賣回權，若執行賣回權需支付利息新台幣21,700,000元\n(3)償還資金來源：\n本公司擬出售台北之星不動產，支應前述應付公司債之本金及利息\n6.因應措施:無\n7.其他應敘明事項(若事件發生或決議之主體係屬公開發行以上公司，\n本則重大訊息同時符合證券交易法施行細則第7條第9款所定\n對股東權益或證券價格有重大影響之事項):無""]], ""footer"": [""以上資料均由各公司依發言當時所屬市場別之規定申報後，由本系統對外公佈，資料如有虛偽不實，均由該公司負責。""], ""header"": {""note"": [], ""subTitle"": [], ""mainTitle"": [""公司當日重大訊息之詳細內容""]}, ""titles"": [{""sub"": [], ""main"": ""序號""}, {""sub"": [], ""main"": ""發言日期""}, {""sub"": [], ""main"": ""發言時間""}, {""sub"": [], ""main"": ""發言人""}, {""sub"": [], ""main"": ""發言人職稱""}, {""sub"": [], ""main"": ""發言人電話""}, {""sub"": [], ""main"": ""主旨""}, {""sub"": [], ""main"": ""符合條款""}, {""sub"": [], ""main"": ""事實發生日""}, {""sub"": [], ""main"": ""說明""}], ""companyAbbreviation"": ""三圓""}, ""datetime"": ""115/07/06 23:59:35""}",2026-07-06 23:59:16
1150706|otc|3339|1,115/07/06,18:18:15,3339,泰谷,更正公告本公司董事會決議取得泰士科技(股)公司(更名前:正誠)有價證券及認購現金增資普通股,現金增資,1150706,otc,1,"{""code"": 200, ""message"": ""查詢成功"", ""result"": {""marketName"": ""上櫃公司"", ""companyId"": ""3339"", ""data"": [[1, ""115/07/06"", ""18:18:15"", ""黃書群"", ""處長"", ""049-2261626#4618"", ""更正公告本公司董事會決議取得泰士科技(股)公司(更名前:正誠)有價證券\r\n及認購現金增資普通股"", ""20"", ""115/01/27"", ""1.標的物之名稱及性質（屬特別股者，並應標明特別股約定發行條件，如股息率等）:\r\n泰士科技(股)公司(以下簡稱泰士)普通股\r\n2.事實發生日:115/1/27~115/1/27\r\n3.董事會通過日期: 民國115年1月27日\r\n4.其他核決日期: 不適用\r\n5.交易數量、每單位價格及交易總金額:\r\n交易單位數量:7,258,518股\n每單位價格(平均價):新台幣26.55\n交易總金額:新台幣192,712仟元\r\n6.交易相對人及其與公司之關係（交易相對人如屬自然人，且非公司之\r\n關係人者，得免揭露其姓名）:\r\n(1)泰谷光電科技股份有限公司\n(2)本公司為持有98.35%泰士股權之母公司。\r\n7.交易相對人為關係人者，並應公告選定關係人為交易對象之原因及前次移\r\n轉之所有人、前次移轉之所有人與公司及交易相對人間相互之關係、前次\r\n移轉日期及移轉金額:\r\n&#21442;與子公司現金增資。\r\n8.交易標的最近五年內所有權人曾為公司之關係人者，尚應公告關係人之取\r\n得及處分日期、價格及交易當時與公司之關係:\r\n不適用\r\n9.本次係處分債權之相關事項（含處分之債權附隨擔保品種類、處分債權\r\n如有屬對關係人債權者尚需公告關係人名稱及本次處分該關係人之債權\r\n帳面金額:\r\n不適用\r\n10.處分利益（或損失）（取得有價證券者不適用）（原遞延者應列表說明\r\n認列情形）:\r\n不適用\r\n11.交付或付款條件（含付款期間及金額）、契約限制條款及其他重要約定\r\n事項:\r\n(1)依股份買賣協議書\n(2)於現金增資繳款期限內繳足。\r\n12.本次交易之決定方式、價格決定之參考依據及決策單位:\r\n決策單位：依本公司審計委員會及董事會決議\n價格參考依據：(1)會計師出具合理性報告書\n              (2)依泰士董事同意書決議之現金增資條件認購\r\n13.取得或處分有價證券標的公司每股淨值:\r\n17.69元\r\n14.迄目前為止，累積持有本交易證券（含本次交易）之數量、金額、持股\r\n比例及權利受限情形（如質押情形）:\r\n(泰士)\n累計數量：8,933,225 股\n累計金額：新台幣 242,713 仟元\n持股比例：98.35 %\n權利受限情形：無\n\n(子公司)\n無\r\n15.迄目前為止，依「公開發行公司取得或處分資產處理準則」第三條所列\r\n之有價證券投資（含本次交易）占公司最近期財務報表中總資產及歸屬\r\n於母公司業主之權益之比例暨最近期財務報表中營運資金數額（註二）:\r\n占總資產比例：11.44%~19.43 %\n占歸屬於母公司業主之權益比例：20.43%~34.70 %\n營運資金數額：新台幣 253,812 仟元\r\n16.經紀人及經紀費用:\r\n無\r\n17.取得或處分之具體目的或用途:\r\n長期投資\r\n18.本次交易表示異議董事之意見:\r\n無\r\n19.本次交易為關係人交易:是\r\n20.監察人承認或審計委員會同意日期:\r\n114年4月23日及115年1月27日\r\n21.本次交易會計師出具非合理性意見:否\r\n22.會計師事務所名稱:\r\n奕隆聯合會計師事務所\r\n23.會計師姓名:\r\n呂淨君 會計師\r\n24.會計師開業證書字號:\r\n金管會證字第5626號\r\n25.是否涉及營運模式變更:否\r\n26.營運模式變更說明:\r\n不適用\r\n27.過去一年及預計未來一年內與交易相對人交易情形:\r\n不適用\r\n28.資金來源:\r\n自有資金\r\n29.前已就同一件事件發布重大訊息日期:\r\n115年7月3日\r\n30.其他敘明事項:\r\n無""]], ""footer"": [""以上資料均由各公司依發言當時所屬市場別之規定申報後，由本系統對外公佈，資料如有虛偽不實，均由該公司負責。""], ""header"": {""note"": [], ""subTitle"": [], ""mainTitle"": [""公司當日重大訊息之詳細內容""]}, ""titles"": [{""sub"": [], ""main"": ""序號""}, {""sub"": [], ""main"": ""發言日期""}, {""sub"": [], ""main"": ""發言時間""}, {""sub"": [], ""main"": ""發言人""}, {""sub"": [], ""main"": ""發言人職稱""}, {""sub"": [], ""main"": ""發言人電話""}, {""sub"": [], ""main"": ""主旨""}, {""sub"": [], ""main"": ""符合條款""}, {""sub"": [], ""main"": ""事實發生日""}, {""sub"": [], ""main"": ""說明""}], ""companyAbbreviation"": ""泰谷""}, ""datetime"": ""115/07/06 23:59:35""}",2026-07-06 23:59:16
