key,speech_date,speech_time,company_id,company_name,subject,matched_keywords,enterDate,marketKind,serialNumber,detail_json,fetched_at_tw
1150324|sii|3605|3,115/03/24,18:29:35,3605,宏致,公告本公司申請展延114年度現金增資及國內第四次無擔保轉換公司債募集期間經金管會核准,現金增資|公司債,1150324,sii,3,"{""code"": 200, ""message"": ""查詢成功"", ""result"": {""marketName"": ""上市公司"", ""companyId"": ""3605"", ""data"": [[3, ""115/03/24"", ""18:29:35"", ""扶大桂"", ""行政處資深處長"", ""(03)4632808"", ""公告本公司申請展延114年度現金增資及國內第四次無擔保\r\n轉換公司債募集期間經金管會核准"", ""51"", ""115/03/24"", ""1.事實發生日:115/03/24\n2.公司名稱:宏致電子股份有限公司\n3.與公司關係(請輸入本公司或子公司):本公司\n4.相互持股比例:不適用\n5.發生緣由:\n (1)本公司114年度現金增資發行普通股11,000仟股乙案，業經金融監督管理委員會115\n    年1月19日金管證發字第1140369435號函申報生效。\n (2)本公司發行國內第四次無擔保轉換公司債上限總額新台幣10億元乙案，業經金融監\n    督管理委員會115年1月19日金管證發字第11403694351號函申報生效。\n (3)鑒於近期國際經濟環境前景未明，致國內證券市場波動劇烈，為維護股東權益及確\n    保募資完成，本公司向金管會申請展延114年度現金增資及國內第四次無擔保轉換公\n    司債資金募集期間三個月，業經金融監督管理委員會115年3月24日金管證發字第　\n    1150337194號函准予備查在案，募集期間延長至115年7月18日。\n6.因應措施:無。\n7.其他應敘明事項(若事件發生或決議之主體係屬公開發行以上公司，本則重大訊息同時\n  符合證券交易法施行細則第7條第9款所定對股東權益或證券價格有重大影響之事項):\n 無。""]], ""footer"": [""以上資料均由各公司依發言當時所屬市場別之規定申報後，由本系統對外公佈，資料如有虛偽不實，均由該公司負責。""], ""header"": {""note"": [], ""subTitle"": [], ""mainTitle"": [""公司當日重大訊息之詳細內容""]}, ""titles"": [{""main"": ""序號"", ""sub"": []}, {""main"": ""發言日期"", ""sub"": []}, {""main"": ""發言時間"", ""sub"": []}, {""main"": ""發言人"", ""sub"": []}, {""main"": ""發言人職稱"", ""sub"": []}, {""main"": ""發言人電話"", ""sub"": []}, {""main"": ""主旨"", ""sub"": []}, {""main"": ""符合條款"", ""sub"": []}, {""main"": ""事實發生日"", ""sub"": []}, {""main"": ""說明"", ""sub"": []}], ""companyAbbreviation"": ""宏致""}, ""datetime"": ""115/03/25 15:34:48""}",2026-03-25 15:34:47
1150324|sii|3605|2,115/03/24,18:33:15,3605,宏致,公告本公司調整114年度現金增資認股基準日等相關事宜,現金增資,1150324,sii,2,"{""code"": 200, ""message"": ""查詢成功"", ""result"": {""marketName"": ""上市公司"", ""companyId"": ""3605"", ""data"": [[2, ""115/03/24"", ""18:33:15"", ""扶大桂"", ""行政處資深處長"", ""(03)4632808"", ""公告本公司調整114年度現金增資認股基準日等相關事宜"", ""11"", ""115/03/24"", ""1.董事會決議或公司決定增資基準日期:115/03/24\n2.是否採總括申報發行新股(是，請併敘明預定發行期間/否):否\n3.主管機關申報生效日期:115/01/19\n4.董事會決議(追補)發行日期:114/12/22\n5.發行總金額及股數:\n (1)發行總金額:新台幣110,000仟元\n (2)發行股數:普通股11,000仟股\n6.採總括申報發行新股案件，本次發行金額及股數:不適用\n7.採總括申報發行新股案件，本次發行後，剩餘之金額及股數餘額:不適用\n8.每股面額:新台幣10元\n9.發行價格:實際發行價格俟訂定後另行公告\n10.員工認股股數:發行新股總數之15%計1,650,000股由本公司員工認購\n11.原股東認購比率:\n  發行新股總數之75%計8,250,000股，由原股東按認股基準日股東名冊記載之股東持股\n  比例認購，每仟股得認購50.374283股。\n12.公開銷售方式及股數:\n  增資發行股數之10%計1,100,000股，對外公開承銷。\n13.畸零股及逾期未認購股份之處理方式:\n  原股東認購不足一股之畸零股，由股東自停止過戶起五日內至本公司股務代理機構辦\n  理拼湊一整股認購。原股東及員工放棄認購或拼湊不足一股之畸零股部分，授權董事\n  長洽特定人按發行價格承購。\n14.本次發行新股之權利義務:與原已發行之普通股股份相同。\n15.本次增資資金用途:償還銀行借款及充實營運資金\n16.現金增資認股基準日:115/04/29\n17.最後過戶日:115/04/24\n18.停止過戶起始日期:115/04/25\n19.停止過戶截止日期:115/04/29\n20.股款繳納期間:\n  (1)原股東及員工繳款期間：115/05/08~115/05/14\n  (2)原股東及員工未認股洽特定人繳款期間：115/05/15~115/05/18\n21.與代收及專戶存儲價款行庫訂約日期:俟正式簽約後另行公告。\n22.委託代收存款機構:俟正式簽約後另行公告。\n23.委託存儲款項機構:俟正式簽約後另行公告。\n24.其他應敘明事項:\n  (1)本公司辦理現金增資發行普通股11,000,000股乙案，業經金融監督管理委員會115\n     年1月19日金管證發字第1140369435號函申報生效在案，並經金融監督管理委員會\n     115年3月24日金管證發字第1150337194號准予延長募集期間至115年7月18日。\n  (2)本次現金增資計畫有關發行股數、發行價格及發行條件之訂定，以及本計畫所需\n     資金總額、資金來源、計畫項目、資金運用進度、預計可能產生效益及其他相關\n     事宜，如遇法令變更、經主管機關修正、客觀環境改變或因應主客觀環境需要而\n     須修正或調整時，授權董事長得全權辦理修正或調整。\n  (3)本公司國內第三次無擔保轉換公司債停止受理轉換期間為115年4月2日至115年4月\n     29日止，債券持有人如擬申請轉換，最遲應於停止受理轉換登記之始日\n     (115年4月2日)之前一營業日前(115年3月31日)，向往來證券商辦理轉換手續。\n  (4)參與現增之最後買進日：115/04/22。""]], ""footer"": [""以上資料均由各公司依發言當時所屬市場別之規定申報後，由本系統對外公佈，資料如有虛偽不實，均由該公司負責。""], ""header"": {""note"": [], ""subTitle"": [], ""mainTitle"": [""公司當日重大訊息之詳細內容""]}, ""titles"": [{""main"": ""序號"", ""sub"": []}, {""main"": ""發言日期"", ""sub"": []}, {""main"": ""發言時間"", ""sub"": []}, {""main"": ""發言人"", ""sub"": []}, {""main"": ""發言人職稱"", ""sub"": []}, {""main"": ""發言人電話"", ""sub"": []}, {""main"": ""主旨"", ""sub"": []}, {""main"": ""符合條款"", ""sub"": []}, {""main"": ""事實發生日"", ""sub"": []}, {""main"": ""說明"", ""sub"": []}], ""companyAbbreviation"": ""宏致""}, ""datetime"": ""115/03/25 15:34:49""}",2026-03-25 15:34:47
1150324|sii|6472|2,115/03/24,19:28:56,6472,保瑞,公告本公司發行國內第四次及第五次無擔保轉換公司債完成訂價,公司債,1150324,sii,2,"{""code"": 200, ""message"": ""查詢成功"", ""result"": {""marketName"": ""上市公司"", ""companyId"": ""6472"", ""data"": [[2, ""115/03/24"", ""19:28:56"", ""王錦菊"", ""副總經理"", ""(02)27901555"", ""公告本公司發行國內第四次及第五次無擔保轉換公司債完成訂價"", ""51"", ""115/03/24"", ""1.事實發生日:115/03/24\n2.公司名稱:保瑞藥業股份有限公司\n3.與公司關係(請輸入本公司或子公司):本公司\n4.相互持股比例:不適用\n5.發生緣由:依據本公司「國內第四次無擔保轉換公司債發行及轉換辦法」及「國內\n第五次無擔保轉換公司債發行及轉換辦法」訂定轉換價格\n6.因應措施:無\n7.其他應敘明事項(若事件發生或決議之主體係屬公開發行以上公司，本則重大訊息同時\n  符合證券交易法施行細則第7條第9款所定對股東權益或證券價格有重大影響之事項):\n(1)本公司發行國內第四次無擔保轉換公司債業經金融監督管理委員會115年01月19日\n   金管證字第1140369456號函同意申報生效在案。本轉換公司債以115年03月24日為\n   轉換價格訂定基準日，依規定本轉換公司債之轉換價格訂為每股新臺幣500.0元，\n   轉換溢價率105.63%。\n(2)本公司發行國內第五次無擔保轉換公司債業經金融監督管理委員會115年01月19日\n   金管證字第11403694561號函同意申報生效在案。本轉換公司債以115年03月24日為\n   轉換價格訂定基準日，依規定本轉換公司債之轉換價格訂為每股新臺幣485.0元，\n   轉換溢價率102.46%。""]], ""footer"": [""以上資料均由各公司依發言當時所屬市場別之規定申報後，由本系統對外公佈，資料如有虛偽不實，均由該公司負責。""], ""header"": {""note"": [], ""subTitle"": [], ""mainTitle"": [""公司當日重大訊息之詳細內容""]}, ""titles"": [{""main"": ""序號"", ""sub"": []}, {""main"": ""發言日期"", ""sub"": []}, {""main"": ""發言時間"", ""sub"": []}, {""main"": ""發言人"", ""sub"": []}, {""main"": ""發言人職稱"", ""sub"": []}, {""main"": ""發言人電話"", ""sub"": []}, {""main"": ""主旨"", ""sub"": []}, {""main"": ""符合條款"", ""sub"": []}, {""main"": ""事實發生日"", ""sub"": []}, {""main"": ""說明"", ""sub"": []}], ""companyAbbreviation"": ""保瑞""}, ""datetime"": ""115/03/25 15:34:50""}",2026-03-25 15:34:47
1150324|sii|2344|2,115/03/25,00:13:04,2344,華邦電,公告本公司海外第四次無擔保轉換公司債完成定價,公司債,1150324,sii,2,"{""code"": 200, ""message"": ""查詢成功"", ""result"": {""marketName"": ""上市公司"", ""companyId"": ""2344"", ""data"": [[2, ""115/03/25"", ""00:13:04"", ""范祥雲"", ""執行副總經理"", ""(03)5678168"", ""公告本公司海外第四次無擔保轉換公司債完成定價"", ""51"", ""115/03/24"", ""1.事實發生日:115/03/24\n2.公司名稱:華邦電子股份有限公司\n3.與公司關係(請輸入本公司或子公司):本公司\n4.相互持股比例:不適用\n5.發生緣由:本公司海外第四次無擔保轉換公司債完成訂價\n6.因應措施:不適用\n7.其他應敘明事項(若事件發生或決議之主體係屬公開發行以上公司，本則重大訊息同時\n  符合證券交易法施行細則第7條第9款所定對股東權益或證券價格有重大影響之事項):\n本次發行業經金融監督管理委員會115年03月24日金管證發字第1150335327號函\n同意申報生效。\n公告事項：\n一、海外公司債發行總額、債券每張金額、發行價格及預定發行日期：\n    本次發行總額：美金750,000,000元\n    債券每張面額：美金200,000元或如超過美金200,000元，為美金100,000元\n    之整數倍數\n    發行價格：依面額100%發行\n    預定發行日期：115年03月31日\n二、發行利率：票面利率為年利率0%\n三、海外公司債償還方法及期限：本債券除已被提前贖回、買回並註銷或行使轉\n    換權外，本公司應於到期日116年03月31日，按本債券面額加計年利率-1.50%\n    (按半年計算)之收益率，以美金將本債券贖回。到期贖回金額將按訂價日\n    決定之新台幣兌美金匯率(訂為1美元兌換新台幣32.0270元，下稱「固定匯率」)\n    換算為新臺幣，並以該新臺幣金額按贖回當時匯率(參考上午十一時Taipei\n    Forex Inc.所顯示之定盤匯率)換算為美金償還。\n四、轉換辦法及重要約定事項：\n(一)轉換標的：華邦新發行之普通股(以下簡稱「普通股」)。\n(二)轉換程序：債券持有人請求轉換時，應依受託契約之規定檢附轉換通知書及\n    其他依中華民國法令要求之相關文件或證明後，經由中華民國境外之轉換代\n    理人向本公司提出轉換申請。\n(三)轉換期間：除提前將本債券贖回或買回並註銷或法令規定及本債券受託契約\n    （以下簡稱「受託契約」)另行約定之停止過戶期間外，債券持有人得於本\n    債券發行屆滿三個月(不含發行日)之翌日起，至(1)到期日前10日止或(2)債券\n    持有人行使賣回權之賣回日或本公司行使提前贖回權之贖回日(不含本債券\n    到期日)前第5個營業日止，依相關法令及受託契約之規定，隨時向本公司請求\n    將本債券轉換為本公司之普通股。\n(四)轉換價格：以115年03月24日本公司普通股於台灣證券交易所之收盤價加計溢價\n    10.0%訂定。轉換價格為每股新臺幣109.45元。\n(五)轉換普通股股數：轉換時，以本債券發行面額乘以固定匯率，再除以轉換日當時\n    的每股轉換價格，計算出可轉換為本公司之普通股股數。如有不足一股時，其餘\n    數將以美金現金支付，計算至美金元為止，元以下四捨五入。\n(六)轉換價格之調整：本公司債券發行後，轉換價格應依受託契約相關反稀釋條款\n    調整之。\n(七)債券持有人之賣回權\n    除下列情事外，本債券之持有人不得要求本公司於到期日前將其持有本債券全部\n    或部分贖回：\n     (a)若本公司普通股在臺灣證券交易所終止上市，債券持有人得要求本公司依\n        提前贖回金額將本債券全部或部分贖回。\n     (b)若本公司發生受託契約所定義之控制權變動情事時，債券持有人得要求\n        本公司依提前贖回金額將本債券全部或部分贖回。\n\n債券持有人行使前述賣回權，及本公司受理債券持有人之賣回請求，應依據受託契約\n所訂賣回程序為之，本公司將於受託契約所訂之付款日以現金贖回本債券。提前贖回\n金額將按固定匯率換算為新臺幣，並以該新臺幣金額按賣回當時匯率(參考上午十一\n時Taipei Forex Inc.所顯示之定盤匯率)換算為美金償還。\n(八)本公司之提前贖回權\n    (a)本債券發行之日起屆滿三個月之翌日至到期日前，如本公司普通股於台灣證券\n       交易所之收盤價格，連續三十個營業日中有二十個交易日(如遇除權或除息者，\n       於除權或除息交易日至除權或除息基準日之間，採用之收盤價格，應先設算為\n       除權或除息前之價格)達提前贖回金額(定義於後)除以本債券面額再乘以當時\n       轉換價格後所得之總數120%時，本公司得以提前贖回金額贖回全部或部分本\n       債券。\n    (b)百分之九十以上之本債券已被贖回、經債券持有人行使轉換權、買回並註銷時，\n       本公司得依提前贖回金額將尚流通在外之本債券全部贖回。\n    (c)因中華民國稅務法令修正，致使本公司於發行日後因本債券而稅務負擔增加或\n       必須支付額外之利息費用或增加成本時，本公司得依提前贖回金額提前將本\n       債券全部贖回。惟，本公司通知提前贖回時，如本債券流通在外本金金額逾\n       發行日本債券本金金額之百分之十，則債券持有人得選擇是否參與贖回。倘\n       債券持有人不參與贖回，該債券持有人不得請求本公司負擔額外之稅賦或費用。\n\n「提前贖回金額」係指本公司依本債券面額加計年利率-1.50%之利息補償金，且以每\n半年為計算基礎所得之金額。提前贖回金額將按固定匯率換算為新臺幣，並以該金額\n按贖回當時匯率(參考上午十一時Taipei Forex Inc.所顯示之定盤匯率)換算為美金\n償還。\n五、發行及交易地點：新加坡證券交易所。\n六、發行方式約定由特定人認購之情事：無。\n七、資金運用計劃及預計可能產生效益：因應未來產能擴充及提升製程支應外幣購置\n    機器設備之資金需求。\n八、對股東權益之主要影響：本次所發行之海外無擔保轉換公司債若按發行時轉換價格\n    全數轉換為普通股，則原股東股權之稀釋比率約為4.65%，其對原股東股權稀釋\n    比例效果尚屬有限。""]], ""footer"": [""以上資料均由各公司依發言當時所屬市場別之規定申報後，由本系統對外公佈，資料如有虛偽不實，均由該公司負責。""], ""header"": {""note"": [], ""subTitle"": [], ""mainTitle"": [""公司當日重大訊息之詳細內容""]}, ""titles"": [{""main"": ""序號"", ""sub"": []}, {""main"": ""發言日期"", ""sub"": []}, {""main"": ""發言時間"", ""sub"": []}, {""main"": ""發言人"", ""sub"": []}, {""main"": ""發言人職稱"", ""sub"": []}, {""main"": ""發言人電話"", ""sub"": []}, {""main"": ""主旨"", ""sub"": []}, {""main"": ""符合條款"", ""sub"": []}, {""main"": ""事實發生日"", ""sub"": []}, {""main"": ""說明"", ""sub"": []}], ""companyAbbreviation"": ""華邦電""}, ""datetime"": ""115/03/25 15:34:51""}",2026-03-25 15:34:47
1150324|sii|3715|1,115/03/25,13:09:32,3715,定穎投控,公告本公司發行國內第二次無擔保轉換公司債已依中國證監會發佈之「境內企業境外發行證券和上市管理試行辦法」進行備案,公司債,1150324,sii,1,"{""code"": 200, ""message"": ""查詢成功"", ""result"": {""marketName"": ""上市公司"", ""companyId"": ""3715"", ""data"": [[1, ""115/03/25"", ""13:09:32"", ""劉國瑾"", ""總經理"", ""03-3493300"", ""公告本公司發行國內第二次無擔保轉換公司債已依中國\r\n證監會發佈之「境內企業境外發行證券和上市管理試行辦法」\r\n進行備案"", ""51"", ""115/03/25"", ""1.事實發生日:115/03/25\n2.公司名稱:定穎投資控股股份有限公司\n3.與公司關係(請輸入本公司或子公司):本公司\n4.相互持股比例:不適用\n5.發生緣由:\n 因應中國證券監督管理委員會發布之「境內企業境外發行證券和上市　\n 管理試行辦法」辦理。\n6.因應措施:\n 本公司因發行國內第二次無擔保轉換公司債，依中國證券監督管理委員會發布之\n「境內企業境外發行證券和上市管理試行辦法」規定，已於115年03月25日向中國\n 證監會進行備案。\n7.其他應敘明事項(若事件發生或決議之主體係屬公開發行以上公司，本則重大訊息同時\n  符合證券交易法施行細則第7條第9款所定對股東權益或證券價格有重大影響之事項):無""]], ""footer"": [""以上資料均由各公司依發言當時所屬市場別之規定申報後，由本系統對外公佈，資料如有虛偽不實，均由該公司負責。""], ""header"": {""note"": [], ""subTitle"": [], ""mainTitle"": [""公司當日重大訊息之詳細內容""]}, ""titles"": [{""main"": ""序號"", ""sub"": []}, {""main"": ""發言日期"", ""sub"": []}, {""main"": ""發言時間"", ""sub"": []}, {""main"": ""發言人"", ""sub"": []}, {""main"": ""發言人職稱"", ""sub"": []}, {""main"": ""發言人電話"", ""sub"": []}, {""main"": ""主旨"", ""sub"": []}, {""main"": ""符合條款"", ""sub"": []}, {""main"": ""事實發生日"", ""sub"": []}, {""main"": ""說明"", ""sub"": []}], ""companyAbbreviation"": ""定穎投控""}, ""datetime"": ""115/03/25 15:34:52""}",2026-03-25 15:34:47
1150325|sii|4722|2,115/03/25,14:02:54,4722,國精化,更正公開資訊觀測站私募專區可轉換公司債董事會決議日起兩日內應申報相關資訊,公司債,1150325,sii,2,"{""code"": 200, ""message"": ""查詢成功"", ""result"": {""marketName"": ""上市公司"", ""companyId"": ""4722"", ""data"": [[2, ""115/03/25"", ""14:02:54"", ""何印唐"", ""協理"", ""(07)623-6199"", ""更正公開資訊觀測站私募專區可轉換公司債董事會決議日起\r\n兩日內應申報相關資訊"", ""51"", ""115/03/25"", ""1.事實發生日:115/03/25\n2.公司名稱:國精化學股份有限公司\n3.與公司關係(請輸入本公司或子公司):本公司\n4.相互持股比例:不適用\n5.發生緣由:配合財團法人證券投資人及期貨交易人保護中心要求，補充私募專區董事\n會決議日起兩日內應申報相關資訊\n6.更正資訊項目/報表名稱:董事會決議日起兩日內應申報之股東會應充分說明事項\n(私募可轉換公司債適用)\n7.更正前金額/內容/頁次:\n(一)定價方式之依據及合理性(註一)(註二)\n私募國內可轉換公司債發行價格之訂定，以不低於該等公司債理論 價格之八成訂定\n之。轉換價格係以下列二基準計算價格較高者定之，並以不低於參考價格之八成為\n訂定依據：\n(1)依定價日前一、三或五個營業日擇一計算之普通股收盤價簡單算數平均數扣除\n無償配股除權及配息，並加回減資反除權後之股價。\n(2)定價日前三十個營業日之普通股收盤價簡單算數平均數扣除無償配股除權及配\n息，並加回減資反除權後之股價。\n(二)辦理私募之資金用途及預計達成效益(註八)\n各分次之資金用途及預計達成效益均為充實營運資金及償還銀行借款，以因應產業變化\n及強化本公司經營體質及競爭力，預計將將有助於公司之經營及業務發展，並可健全公\n司財務結構及營運穩定成長。\n8.更正後金額/內容/頁次:\n(一)定價方式之依據及合理性(註一)(註二)\n私募國內可轉換公司債\n1.每張面額：新台幣100,000元或其整倍數\n2.發行期間：自發行日起算不超過3年\n3.票面利率：0%\n4.私募國內可轉換公司債發行價格之訂定，以不低於該等公司債理論 價格之八成訂定\n之。轉換價格係以下列二基準計算價格較高者定之，並以不低於參考價格之八成為訂定\n依據：\n(1)依定價日前一、三或五個營業日擇一計算之普通股收盤價簡單算數平均數扣除無償\n配股除權及配息，並加回減資反除權後之股價。\n(2)定價日前三十個營業日之普通股收盤價簡單算數平均數扣除無償配股除權及配息，\n並加回減資反除權後之股價。\n5.本次私募國內可轉換公司債轉換價格之定價符合法令規定及參考本公司目前情況、未\n來展望，再加上考量證券交易法對私募有價證券有三年轉讓限制而定，又本公司針對前\n述私募有價證券之價格訂定依據均符合「公開發行公司辦理私募有價證券應注意事項」\n之規定，尚不致有重大損害股東權益之情形，應屬合理。\n6.本公司私募前述有價證券之實際定價日及實際私募價格，擬提請股東會授權董事會依\n法令規定及於不低於股東會所決議訂價依據與成數範圍內，視日後洽定特定人情形及當\n時市場狀況訂定之。\n7.若日後受證券市場變化因素影響，致訂定之每股發行之實際價格或每股轉換價格低於\n股票面額時，因已依據法令規定之定價依據辦理且已反映市場價格狀況，係為順利募得\n資金，有利公司長遠穩定成長之必要，其價格之訂定，應屬必要及合理。若有每股價格\n及轉換價格低於面額之情形者造成累積虧損增加對股東權益產生影響，將於未來年度股\n東會時依年度營業結果由股東評估並討論應否減資或其他法定方式彌補虧損。\n(二)辦理私募之資金用途及預計達成效益(註八)\n各分次之資金用途及預計達成效益均為充實營運資金及償還銀行借款，以因應產業變化\n及強化本公司經營體質及競爭力，預計將將有助於公司之經營及業務發展，並可健全公\n司財務結構及營運穩定成長。\n本公司將視市場、公司實際需要急洽特定人之狀況，於股東會決議之日起一年內擇一或\n以搭配方式分次(最多不超過三次)辦理。\n9.因應措施:更正後重新上傳至公開資訊觀測站\n10.其他應敘明事項:無。""]], ""footer"": [""以上資料均由各公司依發言當時所屬市場別之規定申報後，由本系統對外公佈，資料如有虛偽不實，均由該公司負責。""], ""header"": {""note"": [], ""subTitle"": [], ""mainTitle"": [""公司當日重大訊息之詳細內容""]}, ""titles"": [{""main"": ""序號"", ""sub"": []}, {""main"": ""發言日期"", ""sub"": []}, {""main"": ""發言時間"", ""sub"": []}, {""main"": ""發言人"", ""sub"": []}, {""main"": ""發言人職稱"", ""sub"": []}, {""main"": ""發言人電話"", ""sub"": []}, {""main"": ""主旨"", ""sub"": []}, {""main"": ""符合條款"", ""sub"": []}, {""main"": ""事實發生日"", ""sub"": []}, {""main"": ""說明"", ""sub"": []}], ""companyAbbreviation"": ""國精化""}, ""datetime"": ""115/03/25 15:34:53""}",2026-03-25 15:34:47
