key,speech_date,speech_time,company_id,company_name,subject,matched_keywords,enterDate,marketKind,serialNumber,detail_json,fetched_at_tw
1150513|otc|4523|5,115/05/13,20:07:30,4523,永彰,公告本公司董事會決議現金增資子公司「永雋科技股份有限公司」,現金增資,1150513,otc,5,"{""code"": 200, ""message"": ""查詢成功"", ""result"": {""marketName"": ""上櫃公司"", ""companyId"": ""4523"", ""data"": [[5, ""115/05/13"", ""20:07:30"", ""謝淑蘭"", ""財務、會計主管"", ""03-498-2821"", ""公告本公司董事會決議現金增資子公司「永雋科技股份有限公司」"", ""20"", ""115/05/13"", ""1.標的物之名稱及性質（屬特別股者，並應標明特別股約定發行條件，如股息率等）:\r\n(1)標的物之名稱: 永雋科技股份有限公司\n(2)標的物之性質: 現金增資發行新股\r\n2.事實發生日:115/5/13~115/5/13\r\n3.董事會通過日期: 民國115年5月13日\r\n4.其他核決日期: 不適用\r\n5.交易數量、每單位價格及交易總金額:\r\n(1)交易單位數量：35,000,000 股\n(2)每單位價格：每股新台幣 10 元\n(3)交易總金額：新台幣 350,000,000 元\r\n6.交易相對人及其與公司之關係（交易相對人如屬自然人，且非公司之\r\n關係人者，得免揭露其姓名）:\r\n永雋科技股份有限公司為本公司直接持股45.067%之子公司\r\n7.交易相對人為關係人者，並應公告選定關係人為交易對象之原因及前次移\r\n轉之所有人、前次移轉之所有人與公司及交易相對人間相互之關係、前次\r\n移轉日期及移轉金額:\r\n(1)選定關係人為交易對象之原因：子公司現金增資發行新股\n(2)前次移轉之相關揭露資訊：不適用\r\n8.交易標的最近五年內所有權人曾為公司之關係人者，尚應公告關係人之取\r\n得及處分日期、價格及交易當時與公司之關係:\r\n不適用\r\n9.本次係處分債權之相關事項（含處分之債權附隨擔保品種類、處分債權\r\n如有屬對關係人債權者尚需公告關係人名稱及本次處分該關係人之債權\r\n帳面金額:\r\n不適用\r\n10.處分利益（或損失）（取得有價證券者不適用）（原遞延者應列表說明\r\n認列情形）:\r\n不適用\r\n11.交付或付款條件（含付款期間及金額）、契約限制條款及其他重要約定\r\n事項:\r\n(1)交付或付款條件：依永雋科技股份有限公司現金增資時程\n(2)契約限制條款及其他重要約定事項: 無\r\n12.本次交易之決定方式、價格決定之參考依據及決策單位:\r\n(1)交易之決定方式：依本公司取得或處分資產處理程序辦理\n(2)價格決定之參考依據：誠品聯合會計師事務所出具之\n「永雋科技股份有限公司」股權價值評價報告\n(3)決策單位：本公司董事會\r\n13.取得或處分有價證券標的公司每股淨值:\r\n-3.65元\r\n14.迄目前為止，累積持有本交易證券（含本次交易）之數量、金額、持股\r\n比例及權利受限情形（如質押情形）:\r\n(1)累積持有本交易證券（含本次交易）之數量：47,373,125 股\n(2)累積投資金額：新台幣743,925,000元\n(3)持股比例：70.23%\n(4)權利受限情形：無\r\n15.迄目前為止，依「公開發行公司取得或處分資產處理準則」第三條所列\r\n之有價證券投資（含本次交易）占公司最近期財務報表中總資產及歸屬\r\n於母公司業主之權益之比例暨最近期財務報表中營運資金數額（註二）:\r\n(1)有價證券投資（含本次交易）占公司最近期財務報表中\n總資產之比例：52.825%\n(2)有價證券投資（含本次交易）占公司最近期財務報表中\n歸屬於母公司業主之權益之比例：77.245%\n(3)本公司最近期財務報表中營運資金數額：新台幣660,636仟元\r\n16.經紀人及經紀費用:\r\n不適用\r\n17.取得或處分之具體目的或用途:\r\n長期股權投資\r\n18.本次交易表示異議董事之意見:\r\n無\r\n19.本次交易為關係人交易:是\r\n20.監察人承認或審計委員會同意日期:\r\n1.民國115年05月13日\r\n21.本次交易會計師出具非合理性意見:否\r\n22.會計師事務所名稱:\r\n誠品聯合會計師事務所\r\n23.會計師姓名:\r\n賴明陽\r\n24.會計師開業證書字號:\r\n北市會證字第2123號\r\n25.是否涉及營運模式變更:否\r\n26.營運模式變更說明:\r\n不適用\r\n27.過去一年及預計未來一年內與交易相對人交易情形:\r\n不適用\r\n28.資金來源:\r\n自有資金\r\n29.前已就同一件事件發布重大訊息日期: 不適用\r\n30.其他敘明事項:\r\n無""]], ""footer"": [""以上資料均由各公司依發言當時所屬市場別之規定申報後，由本系統對外公佈，資料如有虛偽不實，均由該公司負責。""], ""header"": {""note"": [], ""subTitle"": [], ""mainTitle"": [""公司當日重大訊息之詳細內容""]}, ""titles"": [{""main"": ""序號"", ""sub"": []}, {""main"": ""發言日期"", ""sub"": []}, {""main"": ""發言時間"", ""sub"": []}, {""main"": ""發言人"", ""sub"": []}, {""main"": ""發言人職稱"", ""sub"": []}, {""main"": ""發言人電話"", ""sub"": []}, {""main"": ""主旨"", ""sub"": []}, {""main"": ""符合條款"", ""sub"": []}, {""main"": ""事實發生日"", ""sub"": []}, {""main"": ""說明"", ""sub"": []}], ""companyAbbreviation"": ""永彰""}, ""datetime"": ""115/05/14 04:16:47""}",2026-05-14 04:16:33
1150511|otc|3455|4,115/05/13,20:09:19,3455,由田,本公司董事會決議114年股東常會通過之私募普通股案，發行期間將屆，屆期將不予辦理。,私募普通股,1150511,otc,4,"{""code"": 200, ""message"": ""查詢成功"", ""result"": {""marketName"": ""上櫃公司"", ""companyId"": ""3455"", ""data"": [[4, ""115/05/13"", ""20:09:19"", ""張文杰"", ""總經理"", ""02-8226-2088#103"", ""本公司董事會決議114年股東常會通過之私募普通股案，\r\n發行期間將屆，屆期將不予辦理。"", ""16"", ""115/05/13"", ""1.董事會決議變更日期:115/05/13\n2.原計畫申報生效日期:NA\n3.追補發行日期:NA\n4.變動原因:本公司於114年股東常會通過辦理現金增資私募普通股案，將於115年6月24日\n屆期並失效，經董事會決議通過本次私募普通股得於有效期限屆滿前持續辦理；惟如\n截至期限仍未完成辦理，該私募普通股案即自115年6月24日起失效，屆時將不再辦理。\n5.歷次變更前後募集資金計畫:不適用。\n6.預計執行進度:不適用。\n7.預計完成日期:不適用。\n8.預計可能產生效益:不適用。\n9.與原預計效益產生之差異:不適用。\n10.本次變更對股東權益之影響:不適用。\n11.原主辦承銷商評估意見摘要:不適用。\n12.其他應敘明事項:無。""]], ""footer"": [""以上資料均由各公司依發言當時所屬市場別之規定申報後，由本系統對外公佈，資料如有虛偽不實，均由該公司負責。""], ""header"": {""note"": [], ""subTitle"": [], ""mainTitle"": [""公司當日重大訊息之詳細內容""]}, ""titles"": [{""main"": ""序號"", ""sub"": []}, {""main"": ""發言日期"", ""sub"": []}, {""main"": ""發言時間"", ""sub"": []}, {""main"": ""發言人"", ""sub"": []}, {""main"": ""發言人職稱"", ""sub"": []}, {""main"": ""發言人電話"", ""sub"": []}, {""main"": ""主旨"", ""sub"": []}, {""main"": ""符合條款"", ""sub"": []}, {""main"": ""事實發生日"", ""sub"": []}, {""main"": ""說明"", ""sub"": []}], ""companyAbbreviation"": ""由田""}, ""datetime"": ""115/05/14 04:16:47""}",2026-05-14 04:16:33
1150513|otc|3629|1,115/05/13,20:35:52,3629,地心引力,公告本公司董事會決議辦理現金增資私募普通股,私募普通股|現金增資,1150513,otc,1,"{""code"": 200, ""message"": ""查詢成功"", ""result"": {""marketName"": ""上櫃公司"", ""companyId"": ""3629"", ""data"": [[1, ""115/05/13"", ""20:35:52"", ""陳斐娟"", ""總經理"", ""02-27601859"", ""公告本公司董事會決議辦理現金增資私募普通股"", ""11"", ""115/05/13"", ""1.董事會決議日期:115/05/13\n2.私募有價證券種類:普通股\n3.私募對象及其與公司間關係:符合證券交易法第43條之6及相關規定之特定人。\n4.私募股數或張數:5,000,000股額度範圍內。\n5.得私募額度:5,000,000股額度內辦理之日起一年內分三次辦理。\n6.私募價格訂定之依據及合理性:\n A.本次私募價格之訂定，以不低於參考價格之八成（以召開董事會決議私募價\n    格之當日為定價日）。實際定價日及實際私募價格，擬提請股東會授權董事會\n    視日後洽特定人情形及市場狀況於股東會授權成數以上訂定之。\n B.私募參考價格依下列二項基準計算價格較高者訂定之：\n    (1)定價日前1、3、5個營業日擇一計算之普通股收盤價簡單算數平均數扣除無償\n       配股除權及配息，並加回減資反除權後之每股股價。\n    (2)定價日前30個營業日之普通股收盤價簡單算數平均數扣除無償配股除權及配息\n       ，並加回減資反除權後之每股股價。\n C.訂價之合理性：本次私募普通股實際發行價格之訂定係依據現行法令規定辦理之，\n    故其價格之訂定應有其合理性。\n D.顧及市場瞬息變化因素影響，致本次私募普通股價格訂定未來不排除有低於股票\n    面額之可能性，此係依現行法令規定訂定，且私募發行之股份三年內不得自由轉\n    讓等因素，私募價格若低於面額，係因受市場價格變動影響，故屬合理。\n E.惟本次辦理私募普通股依前述之定價方法致私募價格低於股票面額而造成公司產\n    生累積虧損時，未來將視公司營運及市場狀況，以辦理減資、盈餘或資本公積彌\n    補虧損之方式處理。\n7.本次私募資金用途:預計執行本次私募計畫將可取得穩定長期資金，並為公司充實營\n 運資金，因應未來事業發展所需，故將用以支應營運週轉金。預計其整體效益將助\n 於公司營運穩定成長及改善獲利能力，提升整體股東權益，對公司財務及股東權益\n 有其正面助益。\n8.不採用公開募集之理由:考量籌集資金之時效性、可行性及資本市場之不確定性因素\n ，並有效降低資金成本，擬採私募方式辦理現金增資發行私募普通股。\n9.獨立董事反對或保留意見:無。\n10.實際定價日:不適用。\n11.參考價格:不適用。\n12.實際私募價格、轉換或認購價格:不適用。\n13.本次私募新股之權利義務:\n  本次私募普通股之權利義務與本公司已發行之普通股相同，惟依證券交易法第43條\n  之8規定，本次私募普通股於交付後三年內，除符合法令規定之特定情形外不得自\n  由轉讓。本公司亦擬於該私募普通股交付滿三年後，依相關法令規定向主管機關申\n  請補辦公開發行及上櫃交易。\n14.附有轉換、交換或認股者，其換股基準日:不適用。\n15.附有轉換、交換或認股者，對股權可能稀釋情形:不適用。\n16.附有轉換或認股者，於私募公司債交付且假設全數轉換或認購普通股後對上櫃普通股\n股權比率之可能影響（上櫃普通股數A、A/已發行普通股）:不適用。\n17.前項預計上櫃普通股未達500萬股且未達25%者，請說明股權流通性偏低之因應措施:\n  不適用。\n18.其他應敘明事項:\n  本次私募普通股之應募人為內部人、關係人，未來不排除策略性投資人，惟特定應募\n  人有涉及經營權重大變動者，董事會不予以考慮，因此應無私募後造成經營權將發生\n  重大變動之情事。本公司爰委請獨立專家統一綜合證券股份有限公司就有關辦理私募\n  必要性與合理性出具評估意見書(請參見私募專區)。\n  本私募案計畫之主要內容，包括發行價格、股數、發行條件、計畫項目、資金運用進\n  度、預計可能產生效益及其他未盡事宜，未來如經主管機關或因客觀環境因素變更而\n  有所修正時，擬請股東常會授權董事會依相關規定全權處理之。""]], ""footer"": [""以上資料均由各公司依發言當時所屬市場別之規定申報後，由本系統對外公佈，資料如有虛偽不實，均由該公司負責。""], ""header"": {""note"": [], ""subTitle"": [], ""mainTitle"": [""公司當日重大訊息之詳細內容""]}, ""titles"": [{""main"": ""序號"", ""sub"": []}, {""main"": ""發言日期"", ""sub"": []}, {""main"": ""發言時間"", ""sub"": []}, {""main"": ""發言人"", ""sub"": []}, {""main"": ""發言人職稱"", ""sub"": []}, {""main"": ""發言人電話"", ""sub"": []}, {""main"": ""主旨"", ""sub"": []}, {""main"": ""符合條款"", ""sub"": []}, {""main"": ""事實發生日"", ""sub"": []}, {""main"": ""說明"", ""sub"": []}], ""companyAbbreviation"": ""地心引力""}, ""datetime"": ""115/05/14 04:16:48""}",2026-05-14 04:16:33
1150513|rotc|6734|1,115/05/13,18:18:15,6734,安盛生,公告本公司董事會決議辦理現金增資發行新股,現金增資,1150513,rotc,1,"{""code"": 200, ""message"": ""查詢成功"", ""result"": {""marketName"": ""興櫃公司"", ""companyId"": ""6734"", ""data"": [[1, ""115/05/13"", ""18:18:15"", ""黃舒蘭"", ""財務協理"", ""87511335"", ""公告本公司董事會決議辦理現金增資發行新股"", ""9"", ""115/05/12"", ""1.董事會決議日期:115/05/12\n2.增資資金來源:現金增資發行新股\n3.發行股數(如屬盈餘或公積轉增資，則不含配發給員工部分):14,000,000股\n4.每股面額:新台幣10元\n5.發行總金額:新台幣140,000,000元\n6.發行價格:每股發行價格暫定以新台幣6.5元折價發行。\n7.員工認購股數或配發金額:本次現金增資依公司法第267條之規定，保留發行總數15％，\n計2,100,000股由本公司員工認購。\n8.公開銷售股數:0股。\n9.原股東認購或無償配發比例(請註明暫定每仟股認購或配發股數):餘發行總數85％，\n計11,900,000股由原股東按認股基準日股東名簿記載之持股比例認購之，即每仟股認\n購292.93632股。\n10.畸零股及逾期未認購股份之處理方式:認購不足一股之畸零股，得由股東自停止過戶\n日起五日內，向本公司股務代理機構辦理拼湊整股之登記，其放棄認購或拼湊後仍不足\n一股之畸零股，授權董事長洽特定人按認購價格承購之。\n11.本次發行新股之權利義務:其權利義務與原已發行股份相同\n12.本次增資資金用途:充實營運資金\n13.其他應敘明事項:\n(1)本次現金增資發行新股俟呈主管機關申報生效後，授權董事長訂定認股基準日、\n繳款期、增資基準日及辦理與本次增資相關事宜。\n(2)本次現金增資計畫之重要內容，包括有關於發行股數、發行價格、發行條件之訂定，\n以及本計畫所需資金總額、資金來源、計畫項目、預計進度、預計可能產生效益及其他\n相關事宜等，如遇法令變更、經主管機關指示修正，或因客觀環境而需要變更或調整時\n，授權董事長全權處理之。\n(3)為配合本次現金增資相關發行事宜，授權董事長代表本公司簽署一切有關辦理現金\n增資之契約及文件，並代表本公司辦理相關發行事宜。\n(4)本公司為充實營運資金，並考量資金募集之時效性，於適當時機依公司資金需求及\n市場狀況，考量每股淨值及公司尚在持續投入研發階段，每股發行價格暫定新台幣6元\n折價發行。本次辦理現金增資方式雖使股本膨脹，但可免除利息費用之增加，降低資金\n成本、降低負債比例與降低經營風險，有助於業務競爭力之提昇，以因應日趨激烈之\n經營環境，保障股東權益。""]], ""footer"": [""以上資料均由各公司依發言當時所屬市場別之規定申報後，由本系統對外公佈，資料如有虛偽不實，均由該公司負責。""], ""header"": {""note"": [], ""subTitle"": [], ""mainTitle"": [""公司當日重大訊息之詳細內容""]}, ""titles"": [{""main"": ""序號"", ""sub"": []}, {""main"": ""發言日期"", ""sub"": []}, {""main"": ""發言時間"", ""sub"": []}, {""main"": ""發言人"", ""sub"": []}, {""main"": ""發言人職稱"", ""sub"": []}, {""main"": ""發言人電話"", ""sub"": []}, {""main"": ""主旨"", ""sub"": []}, {""main"": ""符合條款"", ""sub"": []}, {""main"": ""事實發生日"", ""sub"": []}, {""main"": ""說明"", ""sub"": []}], ""companyAbbreviation"": ""安盛生""}, ""datetime"": ""115/05/14 04:16:49""}",2026-05-14 04:16:33
1150513|rotc|4582|3,115/05/13,19:00:44,4582,聚恆,公告本公司股票創新板初次上市前現金增資發行新股承銷價格,現金增資,1150513,rotc,3,"{""code"": 200, ""message"": ""查詢成功"", ""result"": {""marketName"": ""興櫃公司"", ""companyId"": ""4582"", ""data"": [[3, ""115/05/13"", ""19:00:44"", ""周曉艷"", ""總經理"", ""06-2022202"", ""公告本公司股票創新板初次上市前現金增資發行新股\r\n承銷價格"", ""44"", ""115/05/13"", ""1.事實發生日:115/05/13\n2.公司名稱:聚恆科技股份有限公司\n3.與公司關係(請輸入本公司或子公司):本公司\n4.相互持股比例:不適用\n5.發生緣由:公告本公司股票創新板初次上市前現金增資發行新股承銷價格\n6.因應措施:無\n7.其他應敘明事項(若事件發生或決議之主體係屬公開發行以上公司，\n本則重大訊息同時符合證券交易法施行細則第7條第9款所定\n對股東權益或證券價格有重大影響之事項):\n一、本公司為配合初次創新板上市前公開承銷辦理現金增資發行普通股8,880,000股，\n每股面額新台幣10元，總額新台幣88,800,000元，業經臺灣證券交易所股份有限公司\n115年4月20日臺證上二字第1151701034號函申報生效在案。\n二、本次現金增資發行普通股8,880,000股，每股面額新臺幣10元，計新台幣\n88,800,000元，以競價拍賣方式辦理承銷，競價拍賣最低承銷價格為每股新臺幣20元，\n並以最低承銷價格之1.3倍為上限，依投標價格高者優先得標，每一得標人應依其得標\n價格認購，各得標單之價格及其數量加權平均價格為新台幣24.34元，未超過最低承銷\n價格之1.3倍，故公開承銷價格以每股新台幣24.34元溢價發行。\n三、本次現金增資所發行之新股，其權利義務與原發行之普通股股份相同。""]], ""footer"": [""以上資料均由各公司依發言當時所屬市場別之規定申報後，由本系統對外公佈，資料如有虛偽不實，均由該公司負責。""], ""header"": {""note"": [], ""subTitle"": [], ""mainTitle"": [""公司當日重大訊息之詳細內容""]}, ""titles"": [{""main"": ""序號"", ""sub"": []}, {""main"": ""發言日期"", ""sub"": []}, {""main"": ""發言時間"", ""sub"": []}, {""main"": ""發言人"", ""sub"": []}, {""main"": ""發言人職稱"", ""sub"": []}, {""main"": ""發言人電話"", ""sub"": []}, {""main"": ""主旨"", ""sub"": []}, {""main"": ""符合條款"", ""sub"": []}, {""main"": ""事實發生日"", ""sub"": []}, {""main"": ""說明"", ""sub"": []}], ""companyAbbreviation"": ""聚恆""}, ""datetime"": ""115/05/14 04:16:49""}",2026-05-14 04:16:33
