key,speech_date,speech_time,company_id,company_name,subject,matched_keywords,enterDate,marketKind,serialNumber,detail_json,fetched_at_tw
1150518|otc|3073|1,115/05/19,15:08:45,3073,天方能源,公告本公司115年4月份自結合併財務報告之負債比率、流動比率及速動比率,自結合併,1150518,otc,1,"{""code"": 200, ""message"": ""查詢成功"", ""result"": {""marketName"": ""上櫃公司"", ""companyId"": ""3073"", ""data"": [[1, ""115/05/19"", ""15:08:45"", ""徐韋吉"", ""協理"", ""02-2581-7859#5805"", ""公告本公司115年4月份自結合併財務報告之\r\n負債比率、流動比率及速動比率"", ""53"", ""115/05/19"", ""1.事實發生日:115/05/19\n2.發生緣由:因本公司財務報告之負債比率偏高，依櫃買中心\n證櫃監字第1080200697號函要求辦理公告。\n3.財務資訊年度月份::115/04\n4.自結流動比率:85.79%\n5.自結速動比率:58.12%\n6.自結負債比率:71.07%\n7.因應措施:於每月底前公告本公司上月份自結合併財務報告之負債比率、流動比率\n          及速動比率資訊。\n8.其他應敘明事項:無""]], ""footer"": [""以上資料均由各公司依發言當時所屬市場別之規定申報後，由本系統對外公佈，資料如有虛偽不實，均由該公司負責。""], ""header"": {""note"": [], ""subTitle"": [], ""mainTitle"": [""公司當日重大訊息之詳細內容""]}, ""titles"": [{""sub"": [], ""main"": ""序號""}, {""sub"": [], ""main"": ""發言日期""}, {""sub"": [], ""main"": ""發言時間""}, {""sub"": [], ""main"": ""發言人""}, {""sub"": [], ""main"": ""發言人職稱""}, {""sub"": [], ""main"": ""發言人電話""}, {""sub"": [], ""main"": ""主旨""}, {""sub"": [], ""main"": ""符合條款""}, {""sub"": [], ""main"": ""事實發生日""}, {""sub"": [], ""main"": ""說明""}], ""companyAbbreviation"": ""天方能源""}, ""datetime"": ""115/05/19 23:20:52""}",2026-05-19 23:20:37
1150519|otc|3095|1,115/05/19,15:09:10,3095,及成,公告本公司115年4月份自結合併財務報表之流動比率、速動比率及負債比率,自結合併,1150519,otc,1,"{""code"": 200, ""message"": ""查詢成功"", ""result"": {""marketName"": ""上櫃公司"", ""companyId"": ""3095"", ""data"": [[1, ""115/05/19"", ""15:09:10"", ""張宏羽"", ""營運總經理"", ""(02)2222-6638#12000"", ""公告本公司115年4月份自結合併財務報表之流動比率、速動\r\n比率及負債比率"", ""53"", ""115/05/19"", ""1.事實發生日:115/05/19\n2.發生緣由:依據櫃買中心證櫃監字第1020200506號函辦理,公告本\n公司自結合併財務報表之流動比率、速動比率及負債比率\n3.財務資訊年度月份:115年4月份\n4.自結流動比率:252.60%\n5.自結速動比率:204.04%\n6.自結負債比率: 80.62%\n7.因應措施:無\n8.其他應敘明事項:無""]], ""footer"": [""以上資料均由各公司依發言當時所屬市場別之規定申報後，由本系統對外公佈，資料如有虛偽不實，均由該公司負責。""], ""header"": {""note"": [], ""subTitle"": [], ""mainTitle"": [""公司當日重大訊息之詳細內容""]}, ""titles"": [{""sub"": [], ""main"": ""序號""}, {""sub"": [], ""main"": ""發言日期""}, {""sub"": [], ""main"": ""發言時間""}, {""sub"": [], ""main"": ""發言人""}, {""sub"": [], ""main"": ""發言人職稱""}, {""sub"": [], ""main"": ""發言人電話""}, {""sub"": [], ""main"": ""主旨""}, {""sub"": [], ""main"": ""符合條款""}, {""sub"": [], ""main"": ""事實發生日""}, {""sub"": [], ""main"": ""說明""}], ""companyAbbreviation"": ""及成""}, ""datetime"": ""115/05/19 23:20:53""}",2026-05-19 23:20:37
1150519|otc|8091|1,115/05/19,15:56:01,8091,翔名,本公司國內第四次無擔保轉換公司債翔名四(代號:80914)近期達公布注意交易資訊標準，故公告相關訊息，以利投資人區別瞭解,公司債,1150519,otc,1,"{""code"": 200, ""message"": ""查詢成功"", ""result"": {""marketName"": ""上櫃公司"", ""companyId"": ""8091"", ""data"": [[1, ""115/05/19"", ""15:56:01"", ""吳予彤"", ""處長"", ""(03)5384900"", ""本公司國內第四次無擔保轉換公司債翔名四(代號:80914)近\r\n期達公布注意交易資訊標準，故公告相關訊息，以利投資人區別\r\n瞭解"", ""53"", ""115/05/19"", ""1.事實發生日:115/05/19\n2.發生緣由:依財團法人中華民國證券櫃檯買賣中心通知辦理\n3.財務業務資訊:\n翔名四(代號:80914)相關資訊\n到期日期：116/08/15\n實際發行總額：550,000仟元\n本月底發行餘額：492,400仟元(截至115/05/18)\n最新轉(交)換價格：127\n轉換標的收市價格(8091)：263.5(115/05/19)\n轉換債收市價格(80914)：204(115/05/19)\n4.有無「財團法人中華民國證券櫃檯買賣中心對有價證券上櫃公司\n重大訊息之查證暨公開處理程序 」第4條所列重大訊息之情事（如\n「有」，請說明）:無\n5.有無「財團法人中華民國證券櫃檯買賣中心對有價證券上櫃公司\n重大訊息之查證暨公開處理程序」第11條所列重大訊息說明記者會\n之情事:無\n6.其他應敘明事項:無""]], ""footer"": [""以上資料均由各公司依發言當時所屬市場別之規定申報後，由本系統對外公佈，資料如有虛偽不實，均由該公司負責。""], ""header"": {""note"": [], ""subTitle"": [], ""mainTitle"": [""公司當日重大訊息之詳細內容""]}, ""titles"": [{""sub"": [], ""main"": ""序號""}, {""sub"": [], ""main"": ""發言日期""}, {""sub"": [], ""main"": ""發言時間""}, {""sub"": [], ""main"": ""發言人""}, {""sub"": [], ""main"": ""發言人職稱""}, {""sub"": [], ""main"": ""發言人電話""}, {""sub"": [], ""main"": ""主旨""}, {""sub"": [], ""main"": ""符合條款""}, {""sub"": [], ""main"": ""事實發生日""}, {""sub"": [], ""main"": ""說明""}], ""companyAbbreviation"": ""翔名""}, ""datetime"": ""115/05/19 23:20:54""}",2026-05-19 23:20:37
1150519|otc|1599|1,115/05/19,15:59:37,1599,宏佳騰,本公司註銷庫藏股辦理減資變更登記完成,庫藏股,1150519,otc,1,"{""code"": 200, ""message"": ""查詢成功"", ""result"": {""marketName"": ""上櫃公司"", ""companyId"": ""1599"", ""data"": [[1, ""115/05/19"", ""15:59:37"", ""林佳慧"", ""協理"", ""06-5783988"", ""本公司註銷庫藏股辦理減資變更登記完成"", ""36"", ""115/05/19"", ""1.主管機關核准減資日期:115/04/23\n2.辦理資本變更登記完成日期:115/05/15\n3.對財務報告之影響（含實收資本額與流通在外股數之差異與對每股淨值之影響）:\n(1)實收資本額:減資前745,287,640元,減資後730,287,640元。\n(2)流通在外股數:減資前74,528,764股,減資後73,028,764股。\n(3)對每股淨值之影響:減資比率2.0126%,對每股淨值無重大影響。\n4.預計換股作業計畫:不適用\n5.預計減資新股上櫃後之上櫃普通股股數:不適用\n6.預計減資新股上櫃後之上櫃普通股股數占已發行普通股比率\n（減資後上櫃普通股股數/減資後已發行普通股股數）:不適用\n7.前二項預計減資後上櫃普通股股數未達500萬股且未達25%者，\n請說明股權流通性偏低之因應措施:不適用\n8.其他應敘明事項:本公司於115年05月19日接獲經濟部商業司核准文\n發文字號:經授商字第11530060420號""]], ""footer"": [""以上資料均由各公司依發言當時所屬市場別之規定申報後，由本系統對外公佈，資料如有虛偽不實，均由該公司負責。""], ""header"": {""note"": [], ""subTitle"": [], ""mainTitle"": [""公司當日重大訊息之詳細內容""]}, ""titles"": [{""sub"": [], ""main"": ""序號""}, {""sub"": [], ""main"": ""發言日期""}, {""sub"": [], ""main"": ""發言時間""}, {""sub"": [], ""main"": ""發言人""}, {""sub"": [], ""main"": ""發言人職稱""}, {""sub"": [], ""main"": ""發言人電話""}, {""sub"": [], ""main"": ""主旨""}, {""sub"": [], ""main"": ""符合條款""}, {""sub"": [], ""main"": ""事實發生日""}, {""sub"": [], ""main"": ""說明""}], ""companyAbbreviation"": ""宏佳騰""}, ""datetime"": ""115/05/19 23:20:54""}",2026-05-19 23:20:37
1150519|otc|4749|1,115/05/19,17:45:42,4749,新應材,公告本公司因逢股東常會停止過戶60天，故申請延長發行115年度現金增資發行新股募集期間三個月，業經金管會准予備查。,現金增資,1150519,otc,1,"{""code"": 200, ""message"": ""查詢成功"", ""result"": {""marketName"": ""上櫃公司"", ""companyId"": ""4749"", ""data"": [[1, ""115/05/19"", ""17:45:42"", ""呂韶文"", ""董事長室資深處長"", ""03-4072100"", ""公告本公司因逢股東常會停止過戶60天，故申請延長發行\r\n115年度現金增資發行新股募集期間三個月，業經金管會准予\r\n備查。"", ""53"", ""115/05/19"", ""1.事實發生日:115/05/19\n2.公司名稱:新應材股份有限公司\n3.與公司關係(請輸入本公司或子公司):本公司\n4.相互持股比例:不適用\n5.發生緣由:\n(1)本公司申報115年度現金增資發行普通股2,000千股，發行總\n面額為新臺幣20,000千元乙案，業經金融監督管理委員會於115\n年4月20日金管證發字第1150339433號函核准申報生效在案。\n(2)茲因本次現金增資發行普通股之募集，須待本公司115年度股\n東常會停止過戶期間屆滿後始能辦裡，另考量依公司法規定訂定\n原股東及員工認股繳款期限後，致無法於經金融監督管理委員會\n申報生效通知到達之日起三個月內募足並收足現金款項，為順利\n完成資金募集，維護本公司股東及公司整體之最大權益，已依規\n定向主管機關申請延長現金增資發行新股之募集期間三個月；業\n經115年5月13日金管證發字第1150343527號函核准備查在案，募\n集期間延長至115年10月19日。\n6.因應措施:無\n7.其他應敘明事項(若事件發生或決議之主體係屬公開發行以上公司，\n本則重大訊息同時符合證券交易法施行細則第7條第9款所定\n對股東權益或證券價格有重大影響之事項):無。""]], ""footer"": [""以上資料均由各公司依發言當時所屬市場別之規定申報後，由本系統對外公佈，資料如有虛偽不實，均由該公司負責。""], ""header"": {""note"": [], ""subTitle"": [], ""mainTitle"": [""公司當日重大訊息之詳細內容""]}, ""titles"": [{""sub"": [], ""main"": ""序號""}, {""sub"": [], ""main"": ""發言日期""}, {""sub"": [], ""main"": ""發言時間""}, {""sub"": [], ""main"": ""發言人""}, {""sub"": [], ""main"": ""發言人職稱""}, {""sub"": [], ""main"": ""發言人電話""}, {""sub"": [], ""main"": ""主旨""}, {""sub"": [], ""main"": ""符合條款""}, {""sub"": [], ""main"": ""事實發生日""}, {""sub"": [], ""main"": ""說明""}], ""companyAbbreviation"": ""新應材""}, ""datetime"": ""115/05/19 23:20:55""}",2026-05-19 23:20:37
1150519|otc|4523|2,115/05/19,19:56:30,4523,永彰,代重要子公司「永雋科技股份有限公司」公告115年第1次現金增資基準日(調整發行新股股數等相關資訊),現金增資,1150519,otc,2,"{""code"": 200, ""message"": ""查詢成功"", ""result"": {""marketName"": ""上櫃公司"", ""companyId"": ""4523"", ""data"": [[2, ""115/05/19"", ""19:56:30"", ""謝淑蘭"", ""財務、會計主管"", ""03-498-2821"", ""代重要子公司「永雋科技股份有限公司」公告\r\n115年第1次現金增資基準日(調整發行新股股數等相關資訊)"", ""53"", ""115/05/19"", ""1.事實發生日:115/05/19\n2.公司名稱:永雋科技股份有限公司\n3.與公司關係(請輸入本公司或子公司):子公司\n4.相互持股比例:\n本公司對重要子公司「永雋科技股份有限公司」之持股比例為45.067%。\n5.發生緣由:\n1.本公司於民國115年2月10日經董事會決議發行新股普通股40,000,000股，\n每股發行價格新台幣10元，共計400,000,000元。\n2.截至本日為止，本次發行新股之股款尚未收足，為配合子公司改善財務結構，\n將原訂發行普通股新股股數由40,000,000股降低為36,194,262股，\n每股面額及發行價格仍維持10元，共361,942,620元。\n3.訂定增資基準日為115年5月20日。\n6.因應措施:無。\n7.其他應敘明事項(若事件發生或決議之主體係屬公開發行以上公司，\n本則重大訊息同時符合證券交易法施行細則第7條第9款所定\n對股東權益或證券價格有重大影響之事項):無。""]], ""footer"": [""以上資料均由各公司依發言當時所屬市場別之規定申報後，由本系統對外公佈，資料如有虛偽不實，均由該公司負責。""], ""header"": {""note"": [], ""subTitle"": [], ""mainTitle"": [""公司當日重大訊息之詳細內容""]}, ""titles"": [{""sub"": [], ""main"": ""序號""}, {""sub"": [], ""main"": ""發言日期""}, {""sub"": [], ""main"": ""發言時間""}, {""sub"": [], ""main"": ""發言人""}, {""sub"": [], ""main"": ""發言人職稱""}, {""sub"": [], ""main"": ""發言人電話""}, {""sub"": [], ""main"": ""主旨""}, {""sub"": [], ""main"": ""符合條款""}, {""sub"": [], ""main"": ""事實發生日""}, {""sub"": [], ""main"": ""說明""}], ""companyAbbreviation"": ""永彰""}, ""datetime"": ""115/05/19 23:20:56""}",2026-05-19 23:20:37
1150518|rotc|4582|1,115/05/18,18:01:51,4582,聚恆,公告本公司股票初次創新板上市前現金增資員工認購股款催繳相關事宜,現金增資,1150518,rotc,1,"{""code"": 200, ""message"": ""查詢成功"", ""result"": {""marketName"": ""興櫃公司"", ""companyId"": ""4582"", ""data"": [[1, ""115/05/18"", ""18:01:51"", ""周曉艷"", ""總經理"", ""06-2022202"", ""公告本公司股票初次創新板上市前現金增資員工認購\r\n股款催繳相關事宜"", ""44"", ""115/05/18"", ""1.事實發生日:115/05/18\n2.公司名稱:聚恆科技股份有限公司\n3.與公司關係(請輸入本公司或子公司):本公司\n4.相互持股比例:不適用\n5.發生緣由:公告本公司股票初次創新板上市前現金增資員工認股繳款期限已於115年\n5月18日下午3時30分截止，惟員工尚未繳納現金增資股款，提醒於催繳期間完成繳款。\n6.因應措施:\n(1)依公司法第267條第一項準用同法第142條之規定辦理，自115年5月19日起至115年\n6月22日下午3時30分止為股款催繳期間。\n(2)尚未繳款之員工，請於前述期限內，依原繳款書所載明之繳款方式辦理繳款事宜，\n逾期未繳款者即喪失認股權利。\n(3)於催繳期間繳款之員工，俟催繳期間屆滿並經臺灣集中保管結算所(股)公司作業\n後，依其認購股數撥入認股人登記之集保帳戶。\n7.其他應敘明事項(若事件發生或決議之主體係屬公開發行以上公司，\n本則重大訊息同時符合證券交易法施行細則第7條第9款所定\n對股東權益或證券價格有重大影響之事項):無。""]], ""footer"": [""以上資料均由各公司依發言當時所屬市場別之規定申報後，由本系統對外公佈，資料如有虛偽不實，均由該公司負責。""], ""header"": {""note"": [], ""subTitle"": [], ""mainTitle"": [""公司當日重大訊息之詳細內容""]}, ""titles"": [{""sub"": [], ""main"": ""序號""}, {""sub"": [], ""main"": ""發言日期""}, {""sub"": [], ""main"": ""發言時間""}, {""sub"": [], ""main"": ""發言人""}, {""sub"": [], ""main"": ""發言人職稱""}, {""sub"": [], ""main"": ""發言人電話""}, {""sub"": [], ""main"": ""主旨""}, {""sub"": [], ""main"": ""符合條款""}, {""sub"": [], ""main"": ""事實發生日""}, {""sub"": [], ""main"": ""說明""}], ""companyAbbreviation"": ""聚恆""}, ""datetime"": ""115/05/19 23:20:56""}",2026-05-19 23:20:37
1150518|rotc|6983|1,115/05/19,15:40:04,6983,華洋精機,公告本公司股票初次上櫃前現金增資員工認購股款催繳事宜,現金增資,1150518,rotc,1,"{""code"": 200, ""message"": ""查詢成功"", ""result"": {""marketName"": ""興櫃公司"", ""companyId"": ""6983"", ""data"": [[1, ""115/05/19"", ""15:40:04"", ""蕭賢德"", ""總經理"", ""(06)2532626"", ""公告本公司股票初次上櫃前現金增資員工認購股款催繳事宜"", ""44"", ""115/05/19"", ""1.事實發生日:115/05/19\n2.公司名稱:華洋精機股份有限公司\n3.與公司關係(請輸入本公司或子公司):本公司\n4.相互持股比例:不適用\n5.發生緣由:本公司股票初次上櫃前現金增資員工認股繳款期限已於115\n年05月19日下午3時30分截止，依法辦理催告。\n6.因應措施:\n(1)依公司法第267條第1項準用同法第142條之規定辦理，自115年\n05月20日起至115年06月22日下午3時30分止為股款催繳期間。\n(2)尚未繳款之員工，請於上述期間內持原繳款書至玉山商業銀行鹽行分\n行及全國各分行辦理繳款，逾期仍未繳款者即喪失認購新股之權利。\n(3)於催繳期間繳款之員工，俟催繳期間屆滿並經集保公司作業後，依其\n認購股數撥入認股人登記之集保帳戶。\n7.其他應敘明事項(若事件發生或決議之主體係屬公開發行以上公司，\n本則重大訊息同時符合證券交易法施行細則第7條第9款所定\n對股東權益或證券價格有重大影響之事項):無""]], ""footer"": [""以上資料均由各公司依發言當時所屬市場別之規定申報後，由本系統對外公佈，資料如有虛偽不實，均由該公司負責。""], ""header"": {""note"": [], ""subTitle"": [], ""mainTitle"": [""公司當日重大訊息之詳細內容""]}, ""titles"": [{""sub"": [], ""main"": ""序號""}, {""sub"": [], ""main"": ""發言日期""}, {""sub"": [], ""main"": ""發言時間""}, {""sub"": [], ""main"": ""發言人""}, {""sub"": [], ""main"": ""發言人職稱""}, {""sub"": [], ""main"": ""發言人電話""}, {""sub"": [], ""main"": ""主旨""}, {""sub"": [], ""main"": ""符合條款""}, {""sub"": [], ""main"": ""事實發生日""}, {""sub"": [], ""main"": ""說明""}], ""companyAbbreviation"": ""華洋精機""}, ""datetime"": ""115/05/19 23:20:57""}",2026-05-19 23:20:37
1150519|rotc|2761|4,115/05/19,17:41:19,2761,橘焱胡同,公告本公司董事會決議辦理現金增資發行新股,現金增資,1150519,rotc,4,"{""code"": 200, ""message"": ""查詢成功"", ""result"": {""marketName"": ""興櫃公司"", ""companyId"": ""2761"", ""data"": [[4, ""115/05/19"", ""17:41:19"", ""楊哲瑋"", ""總經理"", ""(02)2218-9868"", ""公告本公司董事會決議辦理現金增資發行新股"", ""9"", ""115/05/19"", ""1.董事會決議日期:115/05/19\n2.增資資金來源:現金增資發行普通股\n3.發行股數(如屬盈餘或公積轉增資，則不含配發給員工部分):4,000,000股\n4.每股面額:新台幣10元。\n5.發行總金額:按面額計新台幣40,000,000元整。\n6.發行價格:每股發行價格暫訂新台幣12元。\n7.員工認購股數或配發金額:依公司法第267條規定範圍內，保留發行新股10%，\n計400,000股由本公司員工認購。\n8.公開銷售股數:不適用。\n9.原股東認購或無償配發比例(請註明暫定每仟股認購或配發股數):\n增資發行新股總數90%計3,600,000股，按認股基準日股東名冊記載之股東持股\n比例認購，每仟股約可認購207.65286164股。\n10.畸零股及逾期未認購股份之處理方式:\n原股東認購不足一股之畸零股由股東自行拼湊成整股，其放棄拼湊或拼湊後仍\n不足一股之畸零股授權董事長洽特定人按發行價格認購之。\n11.本次發行新股之權利義務:\n本次現金增資發行之新股，其權利義務與原已發行普通股相同。\n12.本次增資資金用途:充實營運資金。\n13.其他應敘明事項:\n(1)本次現金增資案於呈奉主管機關核准後，授權董事長依相關法令訂定認股基準日\n   、增資基準日、股款繳納期限及其他增資發行等相關事宜。\n(2)本次現金增資計劃之重要內容，包括發行價格及發行條件之訂定，以及本計畫所\n   需資金總額、資金來源、計畫項目、資金運用進度、預計可能產生效益及其他相\n   關事宜，如因客觀環境變動或因應主管機關指示需要修正時，擬授權董事長全權\n   處理之。""]], ""footer"": [""以上資料均由各公司依發言當時所屬市場別之規定申報後，由本系統對外公佈，資料如有虛偽不實，均由該公司負責。""], ""header"": {""note"": [], ""subTitle"": [], ""mainTitle"": [""公司當日重大訊息之詳細內容""]}, ""titles"": [{""sub"": [], ""main"": ""序號""}, {""sub"": [], ""main"": ""發言日期""}, {""sub"": [], ""main"": ""發言時間""}, {""sub"": [], ""main"": ""發言人""}, {""sub"": [], ""main"": ""發言人職稱""}, {""sub"": [], ""main"": ""發言人電話""}, {""sub"": [], ""main"": ""主旨""}, {""sub"": [], ""main"": ""符合條款""}, {""sub"": [], ""main"": ""事實發生日""}, {""sub"": [], ""main"": ""說明""}], ""companyAbbreviation"": ""橘焱胡同""}, ""datetime"": ""115/05/19 23:20:57""}",2026-05-19 23:20:37
