key,speech_date,speech_time,company_id,company_name,subject,matched_keywords,enterDate,marketKind,serialNumber,detail_json,fetched_at_tw
1150327|otc|3691|4,115/03/27,19:08:58,3691,碩禾,公告本公司董事會決議通過對子公司禾迅綠電(股)公司釋股作業暨放棄參與該公司之現金增資計畫,現金增資,1150327,otc,4,"{""code"": 200, ""message"": ""查詢成功"", ""result"": {""marketName"": ""上櫃公司"", ""companyId"": ""3691"", ""data"": [[4, ""115/03/27"", ""19:08:58"", ""陳繼明"", ""董事長"", ""03-5981886"", ""公告本公司董事會決議通過對子公司禾迅綠電(股)公司\r\n釋股作業暨放棄參與該公司之現金增資計畫"", ""53"", ""115/03/27"", ""1.事實發生日:115/03/27\n2.公司名稱:碩禾電子材料(股)公司\n3.與公司關係(請輸入本公司或子公司):本公司\n4.相互持股比例:不適用\n5.發生緣由:\n(一)為配合子公司禾迅綠電股份有限公司（以下簡稱禾迅綠電）營運發展、吸引及留任\n 所需專業人才，及為符合申請股票上市（櫃）法令規定，禾迅綠電於一般板上市（櫃）\n 掛牌時本公司及所有子公司，以及前開公司之董事、監察人、代表人，暨持有公司股份\n 超過股份總額10%之股東，與其關係人總計持有禾迅綠電之股份不得超過一般板上市　\n（櫃）掛牌時已發行股數之70%；若禾迅綠電於創新板上市掛牌時，上開持有股份總額限\n 制對象持有禾迅綠電之股份不得超過創新板上市掛牌時已發行股數之80%。\n(二)前述一所規劃未來申請股票於一般板上市（櫃）或創新板上市之股權分散擬在維持\n 本公司對禾迅綠電控制力（如本案說明四）之情形下，於禾迅綠電於掛牌前一次或分次\n 辦理現金增資發行新股（如有）時，本公司得辦理釋股及/或放棄認購全部或部份股份\n ，並得依下列方式一次或分次處分所持有禾迅綠電之部分股份：\n (1)放棄認購現金增資\n 禾迅綠電現金增資發行價格應不低於禾迅綠電決議現金增資之董事會前禾迅綠電最近一\n 期經會計師查核簽證或核閱之財務報表每股淨值，但如該股票已在證券營業處所買賣者\n ，除不低於前述之淨值外，另應依當時市價議定之，必要時應委由獨立專家就價格合理\n 性出具意見書，做為決議之參考依據。考量其營運發展、吸引及留任專業人才以達提高\n 經營績效之目的，除依法保留現金增資股數10%~15%由禾迅綠電之員工認購以及依證券\n 交易法第28條之1與相關法令規定應全數提撥辦理公開發行與承銷外，本公司得放棄認\n 購禾迅綠電現金增資之股份，由本公司符合資格之股東優先認購，如本公司股東放棄認\n 購或認購不足部分，將促請禾迅綠電在放棄認購股數範圍內以洽特定人認購之方式，交\n 易相對人以禾迅綠電員工、本公司暨關係企業之員工及對禾迅綠電營運發展有助益之策\n 略性投資人或財務性投資人為原則，提出認購要約；其中本公司符合資格之股東係指在\n 可認購禾迅綠電現金增資股份時，本公司最近一次停止過戶日之股東名簿記載之股東，\n 且依其所載持股數按比例計算得認購禾迅綠電現增新股股數達壹仟股（含）以上者（屆\n 時本公司股東得依相關辦法辦理拼湊）。惟實際現金增資發行張數、價格、特定人之洽\n 定及作業時程等事宜應以禾迅綠電董事會之決議為準。\n (2)處分禾迅綠電之股份\n 本公司處分禾迅綠電股份之價格應不低於決議處分禾迅綠電股份之董事會前禾迅綠電最\n 近一期經會計師查核簽證或核閱之財務報表每股淨值，但如該股票已在證券商營業處所\n 買賣者，除不低於前述之淨值外，另應依當時市價議定之，必要時應委由獨立專家就價\n 格合理性出具意見書，做為決議之參考依據。本公司處分禾迅綠電股份，將優先依本公\n 司最近一次停止過戶日之股東名簿記載之股東依得認購時之持股比例優先認購，惟為避\n 免股務成本增加，以最近一次停止過戶之股東名簿記載股東持股比率計算得認購禾迅綠\n 電壹仟股（含）以上之股東為限。其實際交易張數、價格、交易作業時程等事宜，並擬\n 由本公司董事會依當時市場狀況及禾迅綠電營運情形等訂定之，並按本公司當時之取得\n 或處分資產處理程序規定辦理。另考量禾迅綠電營運發展、吸引及留任專業人才以達提\n 高經營績效之目的，如本公司股東放棄認購或認購不足部分擬授權本公司董事長洽特定\n 人認購，交易相對人將以禾迅綠電員工、本公司暨關係企業員工及對禾迅綠電營運發展\n 有助益之策略性投資人或財務性投資人為原則。\n(三)禾迅綠電申請一般板上市（櫃）或創新板上市相關作業所需釋股，本公司應依相關\n 法令及一般板上市（櫃）或創新板上市相關規範提撥股票供券商認購及過額配售等作業\n 程序，提撥股數與價格則依相關法令及一般板上市（櫃）或創新板上市相關規範、當時\n 市場狀況以及禾迅綠電營運情形與承銷商共同議定之。\n(四)辦理完成上述之釋股及/或放棄現金增資認購作業後，本公司對禾迅綠電之直接或間\n 接綜合持股比例，於其一般板上市（櫃）或創新板上市掛牌時，仍應不低於50%，以保\n 持控制力及發揮集團綜效。\n6.因應措施:擬提請本公司股東會授權董事會全權處理。\n7.其他應敘明事項(若事件發生或決議之主體係屬公開發行以上公司，\n本則重大訊息同時符合證券交易法施行細則第7條第9款所定\n對股東權益或證券價格有重大影響之事項):無""]], ""footer"": [""以上資料均由各公司依發言當時所屬市場別之規定申報後，由本系統對外公佈，資料如有虛偽不實，均由該公司負責。""], ""header"": {""note"": [], ""subTitle"": [], ""mainTitle"": [""公司當日重大訊息之詳細內容""]}, ""titles"": [{""sub"": [], ""main"": ""序號""}, {""sub"": [], ""main"": ""發言日期""}, {""sub"": [], ""main"": ""發言時間""}, {""sub"": [], ""main"": ""發言人""}, {""sub"": [], ""main"": ""發言人職稱""}, {""sub"": [], ""main"": ""發言人電話""}, {""sub"": [], ""main"": ""主旨""}, {""sub"": [], ""main"": ""符合條款""}, {""sub"": [], ""main"": ""事實發生日""}, {""sub"": [], ""main"": ""說明""}], ""companyAbbreviation"": ""碩禾""}, ""datetime"": ""115/03/28 23:31:24""}",2026-03-28 23:31:17
1150325|otc|3322|3,115/03/27,20:11:00,3322,建舜電,本公司114年現金增資股款催繳公告,現金增資,1150325,otc,3,"{""code"": 200, ""message"": ""查詢成功"", ""result"": {""marketName"": ""上櫃公司"", ""companyId"": ""3322"", ""data"": [[3, ""115/03/27"", ""20:11:00"", ""黃欽基"", ""總經理"", ""26984882"", ""本公司114年現金增資股款催繳公告"", ""53"", ""115/03/27"", ""1.事實發生日:115/03/27\n2.公司名稱:建舜電子製造股份有限公司\n3.與公司關係(請輸入本公司或子公司):本公司\n4.相互持股比例:不適用\n5.發生緣由:本公司114年現金增資認股繳款期限已於115年3月27日截止，\n惟有部分原股東及員工尚未繳納現金增資股款，特此催告。\n6.因應措施:\n(1)茲依公司法第266條第3項準用第142條之規定辦理，自115年3月28日至\n115年4月27日下午3點30分止為股款催繳期間。\n(2)尚未繳納股款之原股東及員工，請於上述期間依原繳款書所載明之繳款方式\n辦理繳款事宜，逾期未繳款者即喪失認購新股之權利。\n(3)催繳期間繳款之原股東及員工，本公司將於催繳期間屆滿並經集保公司\n作業完備後，依其所認購之股數，撥入認股人所登記之集保帳戶。\n(4)若認股人有任何疑問，請洽詢本公司股務代理機構：\n凱基證券(股)公司股務代理部，\n地址：台北市重慶南路一段二號五樓\n電話： 02-2389-2999\n7.其他應敘明事項(若事件發生或決議之主體係屬公開發行以上公司，\n本則重大訊息同時符合證券交易法施行細則第7條第9款所定\n對股東權益或證券價格有重大影響之事項):無""]], ""footer"": [""以上資料均由各公司依發言當時所屬市場別之規定申報後，由本系統對外公佈，資料如有虛偽不實，均由該公司負責。""], ""header"": {""note"": [], ""subTitle"": [], ""mainTitle"": [""公司當日重大訊息之詳細內容""]}, ""titles"": [{""sub"": [], ""main"": ""序號""}, {""sub"": [], ""main"": ""發言日期""}, {""sub"": [], ""main"": ""發言時間""}, {""sub"": [], ""main"": ""發言人""}, {""sub"": [], ""main"": ""發言人職稱""}, {""sub"": [], ""main"": ""發言人電話""}, {""sub"": [], ""main"": ""主旨""}, {""sub"": [], ""main"": ""符合條款""}, {""sub"": [], ""main"": ""事實發生日""}, {""sub"": [], ""main"": ""說明""}], ""companyAbbreviation"": ""建舜電""}, ""datetime"": ""115/03/28 23:31:25""}",2026-03-28 23:31:17
1150327|rotc|7794|2,115/03/27,17:37:48,7794,宏碁智新,公告本公司初次上櫃現金增資委託代收及存儲價款機構,現金增資,1150327,rotc,2,"{""code"": 200, ""message"": ""查詢成功"", ""result"": {""marketName"": ""興櫃公司"", ""companyId"": ""7794"", ""data"": [[2, ""115/03/27"", ""17:37:48"", ""高國書"", ""總經理"", ""02-26963131"", ""公告本公司初次上櫃現金增資委託代收及存儲價款機構"", ""44"", ""115/03/27"", ""1.事實發生日:115/03/27\n2.公司名稱:宏碁智新股份有限公司\n3.與公司關係(請輸入本公司或子公司):本公司\n4.相互持股比例:不適用\n5.發生緣由:依據「發行人募集與發行有價證券處理準則」第9條第1項第2款規定\n辦理公告\n6.因應措施:無\n7.其他應敘明事項(若事件發生或決議之主體係屬公開發行以上公司，\n本則重大訊息同時符合證券交易法施行細則第7條第9款所定\n對股東權益或證券價格有重大影響之事項):\n(1)委託代收價款機構\n   員工認股代收股款機構：台北富邦商業銀行安和分行\n   競價拍賣及公開申購代收股款機構：台新國際商業銀行敦南分行\n(2)委託存儲專戶機構：台北富邦商業銀行南京東路分行""]], ""footer"": [""以上資料均由各公司依發言當時所屬市場別之規定申報後，由本系統對外公佈，資料如有虛偽不實，均由該公司負責。""], ""header"": {""note"": [], ""subTitle"": [], ""mainTitle"": [""公司當日重大訊息之詳細內容""]}, ""titles"": [{""sub"": [], ""main"": ""序號""}, {""sub"": [], ""main"": ""發言日期""}, {""sub"": [], ""main"": ""發言時間""}, {""sub"": [], ""main"": ""發言人""}, {""sub"": [], ""main"": ""發言人職稱""}, {""sub"": [], ""main"": ""發言人電話""}, {""sub"": [], ""main"": ""主旨""}, {""sub"": [], ""main"": ""符合條款""}, {""sub"": [], ""main"": ""事實發生日""}, {""sub"": [], ""main"": ""說明""}], ""companyAbbreviation"": ""宏碁智新""}, ""datetime"": ""115/03/28 23:31:27""}",2026-03-28 23:31:17
1150327|rotc|6775|1,115/03/27,17:38:16,6775,穎台科技,公告本公司114年現金增資發行新股案向金管會申請調整發行價格,現金增資,1150327,rotc,1,"{""code"": 200, ""message"": ""查詢成功"", ""result"": {""marketName"": ""興櫃公司"", ""companyId"": ""6775"", ""data"": [[1, ""115/03/27"", ""17:38:16"", ""黃子庭"", ""財務長"", ""03-2623311"", ""公告本公司114年現金增資發行新股案向金管會申請調整發行價格"", ""44"", ""115/03/27"", ""1.事實發生日:115/03/27\n2.公司名稱:穎台科技股份有限公司\n3.與公司關係(請輸入本公司或子公司):本公司\n4.相互持股比例:不適用\n5.發生緣由:(1)本公司經114年8月12日董事會決議通過現金增資發行新股案，並於\n114年11月27日董事會決議通過變更現金增資案，授權董事長全權處理及訂定相關事\n宜後，由其確定發行新股12,000,000股，每股發行價格新台幣25元溢價發行，募資總\n金額新台幣300,000,000元，業經金融監督管理委員會114年12月29日金管證發字\n第1140368308號函申報生效在案，及115年3月3日金管證發字第1150334266號函核准\n延長募集期間在案。\n(2)因應近期國際金融市場不確定性及資本市場波動，並為反映本公司股票目前市場\n交易價格及合理評價水準，原定發行價格與現行市場價格已產生落差，另為兼顧原股\n東及員工參與認購之意願，維持原持股比例之考量，故擬向主管機關申請調整發行　\n價格。\n(3)本現金增資變更案俟經主管機關核准後，另行公告價格。\n6.因應措施:向主管機關申請調整114年現金增資每股發行價格。\n7.其他應敘明事項(若事件發生或決議之主體係屬公開發行以上公司，\n本則重大訊息同時符合證券交易法施行細則第7條第9款所定\n對股東權益或證券價格有重大影響之事項):本次現金增資申請調整每股發行價格，將\n檢送相關資料報備金融監督管理委員會，俟取得核准後另行公告之，其他相關事宜如\n經主管機關修正或有未盡事宜，或因客觀環境而需要變更時，授權董事長全權處理。""]], ""footer"": [""以上資料均由各公司依發言當時所屬市場別之規定申報後，由本系統對外公佈，資料如有虛偽不實，均由該公司負責。""], ""header"": {""note"": [], ""subTitle"": [], ""mainTitle"": [""公司當日重大訊息之詳細內容""]}, ""titles"": [{""sub"": [], ""main"": ""序號""}, {""sub"": [], ""main"": ""發言日期""}, {""sub"": [], ""main"": ""發言時間""}, {""sub"": [], ""main"": ""發言人""}, {""sub"": [], ""main"": ""發言人職稱""}, {""sub"": [], ""main"": ""發言人電話""}, {""sub"": [], ""main"": ""主旨""}, {""sub"": [], ""main"": ""符合條款""}, {""sub"": [], ""main"": ""事實發生日""}, {""sub"": [], ""main"": ""說明""}], ""companyAbbreviation"": ""穎台科技""}, ""datetime"": ""115/03/28 23:31:27""}",2026-03-28 23:31:17
1150327|rotc|7794|3,115/03/27,17:39:26,7794,宏碁智新,公告本公司股票初次上櫃前現金增資認股繳款期間暨暫定承銷價相關事宜,現金增資,1150327,rotc,3,"{""code"": 200, ""message"": ""查詢成功"", ""result"": {""marketName"": ""興櫃公司"", ""companyId"": ""7794"", ""data"": [[3, ""115/03/27"", ""17:39:26"", ""高國書"", ""總經理"", ""02-26963131"", ""公告本公司股票初次上櫃前現金增資認股繳款期間暨暫定\r\n承銷價相關事宜"", ""44"", ""115/03/27"", ""1.事實發生日:115/03/27\n2.公司名稱:宏碁智新股份有限公司\n3.與公司關係(請輸入本公司或子公司):本公司\n4.相互持股比例:不適用\n5.發生緣由:公告本公司股票初次上櫃現金增資基準日及現金增資相關事宜\n6.因應措施:無\n7.其他應敘明事項(若事件發生或決議之主體係屬公開發行以上公司，\n本則重大訊息同時符合證券交易法施行細則第7條第9款所定\n對股東權益或證券價格有重大影響之事項):\n一、本公司為配合初次上櫃前公開承銷辦理現金增資發行普通股3,000,000股，\n    每股面額新台幣10元，總額新台幣30,000,000元，業經財團法人中華民國證券櫃\n    檯買賣中心115年03月20日證櫃審字第1150001028號函申報生效在案。\n二、本次現金增資依公司法第267條規定，保留15%計450仟股予本公司員工認購，\n    本次員工放棄認購或認購不足時，授權董事長洽特定人認購之。其餘85%現金增\n    資發行股份計2,550仟股，擬依證券交易法第28條之1規定及114年6月5日股東會\n    決議通過現金增資發行新股為上櫃前公開承銷之股份來源，並由原股東放棄\n    優先認股權利案，不受公司法第267條關於原股東按原有股份比例優先認購之規\n    定限制，並全數委託證券承銷商辦理上櫃前之公開承銷。對外公開承銷認購不足\n    部分，擬依「中華民國證券商業同業公會證券商承銷或再行銷售有價證券處理\n    辦法」規定辦理。\n三、本次現金增資發行普通股3,000,000股，每股面額新台幣10元，同時以競價拍賣\n    及公開申購方式辦理承銷。競價拍賣最低承銷價格係以向中華民國證券商業同\n    業公會申報競價拍賣約定書前興櫃有成交之三十個營業日其成交均價扣除無償\n    配股(或減資除權)及除息後簡單算術平均數之七成為上限，暫訂為每股新台幣\n    28.97元(競價拍賣底價)，依投標價格高者優先得標，每一得標人應依其得標\n    價格認購；公開申購承銷價格則以各得標單之價格及其數量加權平均所得之價\n    格為之，並以最低承銷價格之1.07倍為上限，故每股發行價格暫訂為新台幣\n    31元溢價發行。\n四、本次現金增資募集金額擬用於充實營運資金。\n五、本次現金增資發行新股之認股繳款期間：\n    (1)競價拍賣期間：115年04月01日至115年04月07日。\n    (2)公開申購期間：115年04月08日至115年04月10日。\n    (3)員工認股繳款期間：115年04月10日至115年04月13日。\n    (4)競價拍賣扣款日期：115年04月14日。\n    (5)公開申購扣款日期：115年04月13日。\n    (6)特定人認股繳款期間：115年04月14日至115年04月16日。\n    (7)增資基準日：115年04月16日。\n六、本次現金增資發行新股之權利義務與原已發行普通股相同。""]], ""footer"": [""以上資料均由各公司依發言當時所屬市場別之規定申報後，由本系統對外公佈，資料如有虛偽不實，均由該公司負責。""], ""header"": {""note"": [], ""subTitle"": [], ""mainTitle"": [""公司當日重大訊息之詳細內容""]}, ""titles"": [{""sub"": [], ""main"": ""序號""}, {""sub"": [], ""main"": ""發言日期""}, {""sub"": [], ""main"": ""發言時間""}, {""sub"": [], ""main"": ""發言人""}, {""sub"": [], ""main"": ""發言人職稱""}, {""sub"": [], ""main"": ""發言人電話""}, {""sub"": [], ""main"": ""主旨""}, {""sub"": [], ""main"": ""符合條款""}, {""sub"": [], ""main"": ""事實發生日""}, {""sub"": [], ""main"": ""說明""}], ""companyAbbreviation"": ""宏碁智新""}, ""datetime"": ""115/03/28 23:31:30""}",2026-03-28 23:31:17
