key,speech_date,speech_time,company_id,company_name,subject,matched_keywords,enterDate,marketKind,serialNumber,detail_json,fetched_at_tw
1150407|sii|2476|1,115/04/07,13:37:09,2476,鉅祥,公告本公司115年03月份自結合併營收,自結合併,1150407,sii,1,"{""code"": 200, ""message"": ""查詢成功"", ""result"": {""marketName"": ""上市公司"", ""companyId"": ""2476"", ""data"": [[1, ""115/04/07"", ""13:37:09"", ""廖文(女英)"", ""財務部經理"", ""(03)4775141"", ""公告本公司115年03月份自結合併營收"", ""51"", ""115/04/07"", ""1.事實發生日:115/04/07\n2.公司名稱:鉅祥企業股份有限公司\n3.與公司關係(請輸入本公司或子公司):本公司\n4.相互持股比例:不適用\n5.發生緣由:\n(1)合併營業收入(當月與去年同期比較)(單位：新台幣仟元)\n  項目     115年03月  114年03月  成長率\n--------   ---------  --------- --------\n合併營收    840,594    591,935   42.01%\n(2)合併營業收入(當月與上月比較)(單位：新台幣仟元)\n  項目     115年03月  115年02月  成長率\n--------   ---------  --------- --------\n合併營收    840,594    589,610   42.57%\n(3)累計合併營業收入(單位：新台幣仟元)\n  項目     115年01-03月   114年01-03月  成長率\n--------- -------------  ------------- --------\n合併營收    2,167,648      1,646,431    31.66%\n上列數字係本公司自結數，未經會計師簽證或核閱。\n6.因應措施:發布重大訊息\n7.其他應敘明事項(若事件發生或決議之主體係屬公開發行以上公司，本則重大訊息同時\n  符合證券交易法施行細則第7條第9款所定對股東權益或證券價格有重大影響之事項):\n 無。""]], ""footer"": [""以上資料均由各公司依發言當時所屬市場別之規定申報後，由本系統對外公佈，資料如有虛偽不實，均由該公司負責。""], ""header"": {""note"": [], ""subTitle"": [], ""mainTitle"": [""公司當日重大訊息之詳細內容""]}, ""titles"": [{""sub"": [], ""main"": ""序號""}, {""sub"": [], ""main"": ""發言日期""}, {""sub"": [], ""main"": ""發言時間""}, {""sub"": [], ""main"": ""發言人""}, {""sub"": [], ""main"": ""發言人職稱""}, {""sub"": [], ""main"": ""發言人電話""}, {""sub"": [], ""main"": ""主旨""}, {""sub"": [], ""main"": ""符合條款""}, {""sub"": [], ""main"": ""事實發生日""}, {""sub"": [], ""main"": ""說明""}], ""companyAbbreviation"": ""鉅祥""}, ""datetime"": ""115/04/07 15:55:57""}",2026-04-07 15:55:56
1150407|sii|6873|1,115/04/07,13:38:45,6873,泓德能源,公告本公司董事會決議買回庫藏股,庫藏股,1150407,sii,1,"{""code"": 200, ""message"": ""查詢成功"", ""result"": {""marketName"": ""上市公司"", ""companyId"": ""6873"", ""data"": [[1, ""115/04/07"", ""13:38:45"", ""周仕昌"", ""總經理"", ""(02)28328057#554"", ""公告本公司董事會決議買回庫藏股"", ""35"", ""115/04/07"", ""1.董事會決議日期:115/04/07\r\n2.買回股份目的:轉讓股份予員工\r\n3.買回股份種類:普通股\r\n4.買回股份總金額上限(元):7,918,880,653\r\n5.預定買回之期間:115/04/08~115/06/07\r\n6.預定買回之數量(股):3,000,000\r\n7.買回區間價格(元):65.00~145.00，公司股價低於區間價格下限，將繼續買回\r\n8.買回方式:自集中交易市場買回\r\n9.預定買回股份占公司已發行股份總數之比率(%):2.10\r\n10.申報時已持有本公司股份之累積股數(股):0\r\n11.申報前三年內買回公司股份之情形:\r\n無買回\r\n12.已申報買回但未執行完畢之情形:\r\n初次申報\r\n13.董事會決議買回股份之會議紀錄:\r\n本公司經第五屆第十三次董事會決議通過\r\n案由一：第一次買回本公司股份案\r\n說明：\r\n1.依據證券交易法第28條之2暨「上市上櫃公司買回本公司股份辦法」規定辦理。\r\n2.有關本次擬辦理買回股份之相關事項訂定如下：\r\n(1)買回股份之目的：轉讓股份予員工。\r\n(2)買回股份之種類：本公司普通股。\r\n(3)買回股份之總金額上限：依法令規範，買回股份總金額上限為不超過新台幣7,918,881仟元。本\r\n次買回股份之所需金額上限為新台幣435,000仟元。\r\n(4)預定買回之期間與數量：自115年4月8日起至115年6月7日止買回3,000,000股。\r\n(5)買回之區間價格：每股新台幣65元至145元之間，惟當公司股價低於所定買回區間價格下限時，\r\n將繼續執行買回公司股份。\r\n(6)買回之方式：自集中交易市場買回。\r\n3.本公司買回股份轉讓員工辦法，請詳附件一。\r\n4.本案業已委由元大證券股份有限公司出具針對買回股份價格之合理性評估意見。\r\n5.本次擬買回股份總數，僅占本公司已發行股份之2.10%，且係以自有資金收購本次庫藏股，買回股\r\n份所需金額上限僅占本公司流動資產之3.81%，故本次買回本公司股份業已考量公司財務狀況，並不\r\n足以影響本公司之資本維持，由董事會出具聲明書，請詳附件二。\r\n6.前述未盡事宜，或如因主管機關指示或經評估需修正時，擬授權董事長全權處理之，並提最近期\r\n董事會報告。嗣後依證券交易法第28條之2第七項規定，應將董事會買回股份之決議及實際執行情\r\n形，提報最近一次股東會。\r\n7.本案業經115年4月7日審計委員會決議通過，謹提請 討論。\r\n決議：經主席徵詢全體出席董事無異議照案通過。\r\n14.「上市上櫃公司買回本公司股份辦法」第十條規定之轉讓辦法:\r\n泓德能源科技股份有限公司\r\n買回股份轉讓員工辦法\r\n第一條、發行目的\r\n本公司為激勵員工及提昇員工向心力，依據證券交易法第28條之2第1項第1款及金融監督管理委員會\r\n發布之「上市上櫃公司買回本公司股份辦法」等相關規定，訂定本公司買回股份轉讓員工辦法。本公\r\n司買回股份轉讓予員工，除依有關法令規定外，悉依本辦法規定辦理。\r\n第二條、轉讓股份之種類、權利內容及權利受限情形\r\n本次轉讓予員工之股份為普通股，其權利義務除有關法令及本辦法另有規定者外， 與其他流通在外\r\n普通股相同。\r\n第三條、轉讓期間\r\n本次買回之股份，得依本辦法之規定，自買回股份之日起5年內，一次或分次轉讓予員工。\r\n第四條、受讓人之資格及員工得認購股數\r\n(一)凡於認股基準日前到職滿一年或對公司有特殊貢獻經提報董事會同意之本公司及國內外控制或\r\n從屬公司之全職員工(所稱「控制或從屬公司」，係指金融監督管理委員會107年12月27日金管證發字\r\n第1070121068號函釋規定之)，得依本辦法第四條(二)所定認購數額，享有認購資格。\r\n(二)實際得為認購之員工及其得認購之數量，將參酌年資、職等、工作績效、整體貢獻、特殊功績\r\n或其他管理上需參考之條件等因素擬定之分配標準，並須兼顧認股基準日時公司持有之買回股份總額\r\n及單一員工認購股數之上限等因素，由董事長核定後，並經董事會同意後認定之。惟具經理人身分之\r\n員工或具員工身分之董事者，應先經本公司薪資報酬委員會同意，再提報本公司董事會決議；非具經\r\n理人身分之員工，應先提報本公司審計委員會同意，再提報本公司董事會決議。\r\n第五條、轉讓之程序\r\n本次買回股份轉讓予員工之作業程序：\r\n(一)依董事會之決議，公告、申報並於執行期限內買回本公司股份。\r\n(二)董事會依本辦法訂定及公布員工認股基準日、得認購股數標準、認購繳款期間、權利內容及限\r\n制條件等作業事項。\r\n(三)統計實際認購繳款股數，辦理股票轉讓過戶登記。\r\n第六條、約定之每股轉讓價格\r\n本次買回股份轉讓予員工，以實際買回之平均價格為轉讓價格，惟轉讓前，如遇公司已發行之普通股\r\n股份增加或減少，得按發行股份增加或減少比率調整之。\r\n（一)如遇有本公司已發行之普通股股份增加時（包括現金增資、盈餘轉增資、資本公積轉增資、員\r\n工紅利轉增資、可轉換公司債、公司合併、股票分割或現金增資參與發行海外存託憑證等）或減少\r\n（包括進行分割、現金退還股款或其他情形減資)，致使本公司股價（參考價）調整時，其轉讓予員\r\n工之轉讓價格得於普通股配認股基準日、轉換基準日、合併基準日、分割基準日、現金增資參與發行\r\n海外存託憑證訂價日或減資基準日按發行股份增減比率範圍內調整之：\r\n調整後轉讓價格=實際買回之平均價格×(公司買回股份執行完畢時之普通股股份總數÷公司轉讓買回\r\n股份予員工前之普通股股份總數)\r\n（二）依據本公司章程第七條規定，有以低於實際買回股份之平均價格轉讓予員工者，應於轉讓前，\r\n提經最近一次股東會有代表已發行股份總數過半數股東之出席，出席股東表決權三分之二以上之同\r\n意，並應於該次股東會召集事由中列舉說明「上市上櫃公司買回本公司股份辦法」第10條之1規定事\r\n項，始得辦理。\r\n第七條、轉讓後之權利義務\r\n本次買回股份轉讓予員工並辦理過戶登記後，除另有規定者外，餘權利義務與原有股份相同。\r\n第八條、稅賦\r\n依本辦法所認購之股票及其交易所產生之稅賦，均按照當時中華民國稅法規定辦理。\r\n第九條、保密規定\r\n認購人應遵守保密規定，除法令或主管機關要求外，不得洩露相關內容及數量。\r\n第十條、其他重要事項\r\n本辦法經董事會決議通過後生效，並得報經董事會決議修訂。本辦法如有未盡事宜，悉依相關法令規\r\n定辦理。\r\n15.「上市上櫃公司買回本公司股份辦法」第十一條規定之轉換或認股辦法:\r\n不適用\r\n16.董事會已考慮公司財務狀況，不影響公司資本維持之聲明:\r\n上述買回股份總數，僅占本公司已發行股份之2.10%，且買回股份所需金額上限僅占本公司流動資產之\r\n3.81%，茲聲明本公司董事會業已考量公司財務狀況，並不足以影響本公司之資本維持。\r\n17.會計師或證券承銷商對買回股份價格之合理性評估意見:\r\n該公司依其訂定買回價格區間執行買回股份，主要係造成現金流出，餘對該公司之財務結構、每股淨\r\n值、股東權益報酬率、流動比率及速動比率等雖有變動但對於該公司之財務狀況影響尚為合理。綜上\r\n評估，該公司本次買回公司股份訂定之價格區間，其決策過程具合法性，價格區間之訂定及對公司財\r\n務之影響亦尚屬合理，尚無重大異常情事。\r\n18.其他證期局所規定之事項:\r\n無""]], ""footer"": [""以上資料均由各公司依發言當時所屬市場別之規定申報後，由本系統對外公佈，資料如有虛偽不實，均由該公司負責。""], ""header"": {""note"": [], ""subTitle"": [], ""mainTitle"": [""公司當日重大訊息之詳細內容""]}, ""titles"": [{""sub"": [], ""main"": ""序號""}, {""sub"": [], ""main"": ""發言日期""}, {""sub"": [], ""main"": ""發言時間""}, {""sub"": [], ""main"": ""發言人""}, {""sub"": [], ""main"": ""發言人職稱""}, {""sub"": [], ""main"": ""發言人電話""}, {""sub"": [], ""main"": ""主旨""}, {""sub"": [], ""main"": ""符合條款""}, {""sub"": [], ""main"": ""事實發生日""}, {""sub"": [], ""main"": ""說明""}], ""companyAbbreviation"": ""泓德能源""}, ""datetime"": ""115/04/07 15:55:58""}",2026-04-07 15:55:56
1150407|sii|7730|1,115/04/07,14:35:50,7730,暉盛-創,本公司董事會決議辦理私募現金增資發行普通股案,現金增資,1150407,sii,1,"{""code"": 200, ""message"": ""查詢成功"", ""result"": {""marketName"": ""上市公司"", ""companyId"": ""7730"", ""data"": [[1, ""115/04/07"", ""14:35:50"", ""邱冠陸"", ""行銷部部經理"", ""(06)291-5500"", ""本公司董事會決議辦理私募現金增資發行普通股案"", ""11"", ""115/04/07"", ""1.董事會決議日期:115/04/07\n2.私募有價證券種類:普通股\n3.私募對象及其與公司間關係:\n(1)本次私募普通股之對象以符合證券交易法第43條之6及金融監督管理委員會\n   金管證發字第1120383220號令規定之特定人為限，且須為策略投資人。\n(2)目前並無已洽定之策略投資人。\n4.私募股數或張數:不超過2,000仟股。\n5.得私募額度:\n不超過2,000仟股額度內，每股面額新台幣10元，授權董事會於股東會決議\n之日起一年內以一次或分次辦理私募現金增資發行普通股。\n6.私募價格訂定之依據及合理性:\n(1)本次私募普通股之價格訂定，依據公開發行公司辦理私募有價證券\n   應行注意事項之參考價格規定辦理，應不低於以下列二基準計算價格\n   較高者之八成定之：\n   A.定價日前一、三或五個營業日擇一計算普通股收盤價簡單算數\n     平均數扣除無償配股除權及配息，並加回減資反除權後之股價。\n   B.定價日前三十個營業日普通股收盤價簡單算數平均數扣除無償\n     配股除權及配息，並加回減資反除權後之股價。\n(2)惟實際定價日及實際發行價格，擬提請股東會授權董事會依上述\n   方式及日後洽特定人之情形決定之。\n(3)私募價格之訂定係依據主管機關之法令，再加上考量證券交易法對於\n   私募有價證券禁止三年轉讓限制而定，應屬合理。\n7.本次私募資金用途:\n藉以充實營運資金、擴大市場及償還長期借款等需求。\n8.不採用公開募集之理由:\n考量資本市場狀況、籌募資本之時效性、可行性、發行成本及引進\n策略性投資人之實際需求；且私募有價證券依法令規定於一定期間受\n轉讓限制，可確保本公司與策略性投資人之間長期合作關係；另透過\n董事會視公司營運實際需求辦理私募，將提高本公司籌資之機動性與\n靈活性，故不採用公開募集而以私募方式發行有價證券。\n9.獨立董事反對或保留意見:無。\n10.實際定價日:不適用。\n11.參考價格:不適用。\n12.實際私募價格、轉換或認購價格:不適用。\n13.本次私募新股之權利義務:\n本次私募現金增資發行普通股其權利義務原則上與本公司已發行\n之普通股相同，除符合證券交易法第43條之8規定之轉讓對象外，\n本次私募之普通股於交付日起三年內受限不得轉讓，並於私募\n普通股交付日起滿三年後，若符合相關法令規定始可向證券主管\n機關申請補辦公開發行及申請股票上市交易。\n14.附有轉換、交換或認股者，其換股基準日:不適用。\n15.附有轉換、交換或認股者，對股權可能稀釋情形:不適用。\n16.附有轉換或認股者，於私募公司債交付且假設全數轉換或認購普通股後對\n上市普通股股權比率之可能影響（上市普通股數A、A/已發行普通股):不適用。\n17.前項預計上市普通股未達6000萬股且未達25%者，請說明股權流通性偏低之因應措施:\n不適用。\n18.其他應敘明事項:\n(1)本次私募普通股計畫之主要內容，包括實際私募股數、實際\n   私募價格、應募人之選擇、基準日、發行條件、計畫項目、\n   資金用途及進度、預計產生效益及其他相關事宜，暨其他一切\n   有關發行計畫之事項，擬提請股東會授權董事會視市場狀況調\n   整、訂定及辦理，未來如因法令變更或主管機關要求修正或基於\n   營運評估、或因客觀環境需要變更時，亦授權董事會全權處理之。\n(2)除上述授權範圍外，擬提請股東會授權董事長，代表本公司簽署、\n   商議、變更一切有關私募普通股之契約及文件，並為本公司辦理\n   一切有關發行私募普通股所需之事宜。""]], ""footer"": [""以上資料均由各公司依發言當時所屬市場別之規定申報後，由本系統對外公佈，資料如有虛偽不實，均由該公司負責。""], ""header"": {""note"": [], ""subTitle"": [], ""mainTitle"": [""公司當日重大訊息之詳細內容""]}, ""titles"": [{""sub"": [], ""main"": ""序號""}, {""sub"": [], ""main"": ""發言日期""}, {""sub"": [], ""main"": ""發言時間""}, {""sub"": [], ""main"": ""發言人""}, {""sub"": [], ""main"": ""發言人職稱""}, {""sub"": [], ""main"": ""發言人電話""}, {""sub"": [], ""main"": ""主旨""}, {""sub"": [], ""main"": ""符合條款""}, {""sub"": [], ""main"": ""事實發生日""}, {""sub"": [], ""main"": ""說明""}], ""companyAbbreviation"": ""暉盛-創""}, ""datetime"": ""115/04/07 15:55:59""}",2026-04-07 15:55:56
1150407|otc|4513|1,115/04/07,14:28:57,4513,福裕,公告本公司董事會決議辦理114年第1次私募普通股訂價及相關事宜(更正應募人),私募普通股,1150407,otc,1,"{""code"": 200, ""message"": ""查詢成功"", ""result"": {""marketName"": ""上櫃公司"", ""companyId"": ""4513"", ""data"": [[1, ""115/04/07"", ""14:28:57"", ""張順福"", ""財務協理"", ""(04)799-1126"", ""公告本公司董事會決議辦理114年第1次私募普通股訂價\r\n及相關事宜(更正應募人)"", ""11"", ""115/04/07"", ""1.董事會決議日期:115/04/07\n2.私募有價證券種類:普通股\n3.私募對象及其與公司間關係:\n(1)本次私募普通股之對象依證券交易法第43條之6規定及符合金管會91年06月13日\n(91)台財證一字第0910003455號令規定之特定人為限。\n(2)目前已洽定之私募對象/與公司間之關係:\n   林聰麟/本公司董事長(更正)\n   廣上投資有限公司/該公司負責人為本公司副董事長兼總經理\n4.私募股數或張數:20,000,000股。\n5.得私募額度:\n  不超過30,000,000股之額度內，自股東會決議之日起一年內以一次或分二次辦理。\n6.私募價格訂定之依據及合理性:\n  依據本公司於114年06月25日股東常會決議通過，私募價格訂定之。\n  本公司以115年03月26日為114年第一次發行私募普通股之定價日：\n  (a)以定價日前一、三、五個營業日擇一計算普通股收盤價簡單算數平均數之股價分別\n     為17.6元、17.48元、17.84元，經以定價日前五個營業日普通股收盤價簡單算數\n     平均數扣除無償配股除權及配息，並加回減資反除權後之股價為17.48元；\n  (b)定價日前三十個營業日之普通股收盤價簡單算數平均數扣除無償配股除權及配息，\n     並加回減資反除權後之股價為18.09元，取上述二基準計算價格較高者訂為參考價\n     格，故本次私募參考價格為18.09元。\n7.本次私募資金用途:\n  充實營運資金、償還銀行借款、改善財務結構或支應其他因應本公司未來多角化業務\n  發展之資金需求(包括但不限於轉投資、充實新業務營運資金)。\n8.不採用公開募集之理由:\n  考量籌集資金之時效性、可行性及資本市場之不確定性因素，並有效降低資金成本，\n  擬採私募方式向特定人募集資金。\n9.獨立董事反對或保留意見:無。\n10.實際定價日:115/03/26\n11.參考價格:18.09元\n12.實際私募價格、轉換或認購價格:14.48元(未低於參考價格之八成)\n13.本次私募新股之權利義務:\n  本次私募之普通股之權利義務原則上與本公司已發行之普通股相同。惟依證券交易法\n  之規定，私募普通股自交付日起三年內除依證券交易法第43條之8規定之轉讓對象外，\n  餘不得再行賣出。本次私募普通股，將授權董事會自交付日起滿三年後，依相關規定\n  向主管機關申報補辦公開發行及申請上櫃交易。\n14.附有轉換、交換或認股者，其換股基準日:不適用。\n15.附有轉換、交換或認股者，對股權可能稀釋情形:不適用。\n16.附有轉換或認股者，於私募公司債交付且假設全數轉換或認購普通股後對上櫃普通股\n股權比率之可能影響（上櫃普通股數A、A/已發行普通股）:不適用。\n17.前項預計上櫃普通股未達500萬股且未達25%者，請說明股權流通性偏低之因應措施:\n  不適用。\n18.其他應敘明事項:\n  (1)114年第一次私募普通股之繳款期間：自115年03月26日至115年04月09日。\n  (2)114年第一次私募普通股之增資基準日：115年04月09日。\n  (3)本次私募之有價證券之主要內容和其他未盡事宜，業經本公司114年06月25日股東\n     常會決議通過授權董事會視市場狀況調整、訂定及辦理，未來如因法令變更或主\n     管機關要求修正或基於營運評估、或因客觀環境需要變更時，亦授權董事會全權\n     處理；並於115年03月26日董事會授權董事長代表本公司辦理有關本次私募發行　\n     有價證券所需之事宜。""]], ""footer"": [""以上資料均由各公司依發言當時所屬市場別之規定申報後，由本系統對外公佈，資料如有虛偽不實，均由該公司負責。""], ""header"": {""note"": [], ""subTitle"": [], ""mainTitle"": [""公司當日重大訊息之詳細內容""]}, ""titles"": [{""sub"": [], ""main"": ""序號""}, {""sub"": [], ""main"": ""發言日期""}, {""sub"": [], ""main"": ""發言時間""}, {""sub"": [], ""main"": ""發言人""}, {""sub"": [], ""main"": ""發言人職稱""}, {""sub"": [], ""main"": ""發言人電話""}, {""sub"": [], ""main"": ""主旨""}, {""sub"": [], ""main"": ""符合條款""}, {""sub"": [], ""main"": ""事實發生日""}, {""sub"": [], ""main"": ""說明""}], ""companyAbbreviation"": ""福裕""}, ""datetime"": ""115/04/07 15:56:00""}",2026-04-07 15:55:56
