key,speech_date,speech_time,company_id,company_name,subject,matched_keywords,enterDate,marketKind,serialNumber,detail_json,fetched_at_tw
1150706|sii|2408|1,115/07/06,16:39:04,2408,南亞科,代子公司南亞科技國際有限公司公告董事會決議現金增資,現金增資,1150706,sii,1,"{""code"": 200, ""message"": ""查詢成功"", ""result"": {""marketName"": ""上市公司"", ""companyId"": ""2408"", ""data"": [[1, ""115/07/06"", ""16:39:04"", ""李培瑛"", ""總經理"", ""(02)2904-5858"", ""代子公司南亞科技國際有限公司公告董事會決議現金增資"", ""11"", ""115/07/06"", ""1.董事會決議日期:115/07/06\n2.增資資金來源:母公司現金增資\n3.是否採總括申報發行新股(是，請併敘明預定發行期間/否):否\n4.全案發行總金額及股數(如屬盈餘或公積轉增資，發行股數則不含配發給員工部分):\n 10億美元；1000股\n5.採總括申報發行新股案件，本次發行金額及股數:不適用\n6.採總括申報發行新股案件，本次發行後，剩餘之金額及股數餘額:不適用\n7.每股面額:1佰萬美元\n8.發行價格:每股1佰萬美元\n9.員工認購股數或配發金額:不適用\n10.公開銷售股數:不適用\n11.原股東認購或無償配發比例:100%\n12.畸零股及逾期未認購股份之處理方式:不適用\n13.本次發行新股之權利義務:與原有股份相同\n14.本次增資資金用途:降低母公司外匯避險成本\n15.現金減資後再行募資之合理性及必要性\n(募資當年度及前一年度有辦理現金減資者適用):不適用\n16.其他應敘明事項:無""]], ""footer"": [""以上資料均由各公司依發言當時所屬市場別之規定申報後，由本系統對外公佈，資料如有虛偽不實，均由該公司負責。""], ""header"": {""note"": [], ""subTitle"": [], ""mainTitle"": [""公司當日重大訊息之詳細內容""]}, ""titles"": [{""sub"": [], ""main"": ""序號""}, {""sub"": [], ""main"": ""發言日期""}, {""sub"": [], ""main"": ""發言時間""}, {""sub"": [], ""main"": ""發言人""}, {""sub"": [], ""main"": ""發言人職稱""}, {""sub"": [], ""main"": ""發言人電話""}, {""sub"": [], ""main"": ""主旨""}, {""sub"": [], ""main"": ""符合條款""}, {""sub"": [], ""main"": ""事實發生日""}, {""sub"": [], ""main"": ""說明""}], ""companyAbbreviation"": ""南亞科""}, ""datetime"": ""115/07/06 23:59:25""}",2026-07-06 23:59:16
1150706|sii|6278|1,115/07/06,16:55:21,6278,台表科,台表科115年06月份自結合併營收為新臺幣43.77億元,自結合併,1150706,sii,1,"{""code"": 200, ""message"": ""查詢成功"", ""result"": {""marketName"": ""上市公司"", ""companyId"": ""6278"", ""data"": [[1, ""115/07/06"", ""16:55:21"", ""王嘉真"", ""副總"", ""03-2189988"", ""台表科115年06月份自結合併營收為新臺幣43.77億元"", ""51"", ""115/07/06"", ""1.事實發生日:115/07/06\n2.公司名稱:台灣表面黏著科技股份有限公司\n3.與公司關係(請輸入本公司或子公司):本公司\n4.相互持股比例:不適用\n5.發生緣由:月營收公佈\n6.因應措施:不適用\n7.其他應敘明事項(若事件發生或決議之主體係屬公開發行以上公司，本則重大訊息同時\n  符合證券交易法施行細則第7條第9款所定對股東權益或證券價格有重大影響之事項):\n(1)合併營業收入(當月與去年同月比較)(單位：新臺幣仟元)\n\n  項    目    114年06月     115年06月      成長率%\n  合併營收    4,006,645     4,376,679        9.24%\n\n(2)合併營業收入(當月與上月比較)(單位：新臺幣仟元)\n\n  項    目    115年05月     115年06月      成長率%\n  合併營收    4,348,041     4,376,679        0.66%\n\n(3)累計合併營業收入(單位：新臺幣仟元)\n\n  項    目    114年1~6月    115年1~6月     成長率%\n  合併營收   25,001,879    25,785,584        3.13%\n\n(4)上列數字係本公司自結數，未經會計師簽證或核閱。""]], ""footer"": [""以上資料均由各公司依發言當時所屬市場別之規定申報後，由本系統對外公佈，資料如有虛偽不實，均由該公司負責。""], ""header"": {""note"": [], ""subTitle"": [], ""mainTitle"": [""公司當日重大訊息之詳細內容""]}, ""titles"": [{""sub"": [], ""main"": ""序號""}, {""sub"": [], ""main"": ""發言日期""}, {""sub"": [], ""main"": ""發言時間""}, {""sub"": [], ""main"": ""發言人""}, {""sub"": [], ""main"": ""發言人職稱""}, {""sub"": [], ""main"": ""發言人電話""}, {""sub"": [], ""main"": ""主旨""}, {""sub"": [], ""main"": ""符合條款""}, {""sub"": [], ""main"": ""事實發生日""}, {""sub"": [], ""main"": ""說明""}], ""companyAbbreviation"": ""台表科""}, ""datetime"": ""115/07/06 23:59:25""}",2026-07-06 23:59:16
1150706|sii|3003|1,115/07/06,17:09:21,3003,健和興,公告本公司115年06月份自結合併營收概算,自結合併,1150706,sii,1,"{""code"": 200, ""message"": ""查詢成功"", ""result"": {""marketName"": ""上市公司"", ""companyId"": ""3003"", ""data"": [[1, ""115/07/06"", ""17:09:21"", ""曾玉卿"", ""財務總處處長"", ""(04)7580001-310"", ""公告本公司115年06月份自結合併營收概算"", ""51"", ""115/07/06"", ""1.事實發生日:115/07/06\n2.公司名稱:健和興端子股份有限公司\n3.與公司關係(請輸入本公司或子公司):本公司\n4.相互持股比例:不適用\n5.發生緣由:本公司115年06月份自結合併營收情形\n06-06月合併營收：5.99億元，114年同期合併營收：4.40億元。\n01-06月合併營收：28.77億元，114年同期合併營收：21.88億元。\n6.因應措施:無。\n7.其他應敘明事項(若事件發生或決議之主體係屬公開發行以上公司，本則重大訊息同時\n  符合證券交易法施行細則第7條第9款所定對股東權益或證券價格有重大影響之事項):無。""]], ""footer"": [""以上資料均由各公司依發言當時所屬市場別之規定申報後，由本系統對外公佈，資料如有虛偽不實，均由該公司負責。""], ""header"": {""note"": [], ""subTitle"": [], ""mainTitle"": [""公司當日重大訊息之詳細內容""]}, ""titles"": [{""sub"": [], ""main"": ""序號""}, {""sub"": [], ""main"": ""發言日期""}, {""sub"": [], ""main"": ""發言時間""}, {""sub"": [], ""main"": ""發言人""}, {""sub"": [], ""main"": ""發言人職稱""}, {""sub"": [], ""main"": ""發言人電話""}, {""sub"": [], ""main"": ""主旨""}, {""sub"": [], ""main"": ""符合條款""}, {""sub"": [], ""main"": ""事實發生日""}, {""sub"": [], ""main"": ""說明""}], ""companyAbbreviation"": ""健和興""}, ""datetime"": ""115/07/06 23:59:25""}",2026-07-06 23:59:16
1150706|sii|4958|1,115/07/06,17:09:25,4958,臻鼎-KY,代子公司禮鼎半導體科技(深圳)有限公司公告取得機器設備,機器設備,1150706,sii,1,"{""code"": 200, ""message"": ""查詢成功"", ""result"": {""marketName"": ""上市公司"", ""companyId"": ""4958"", ""data"": [[1, ""115/07/06"", ""17:09:25"", ""凌惇"", ""資深經理"", ""03-3835678"", ""代子公司禮鼎半導體科技(深圳)有限公司公告取得機器設備"", ""20"", ""115/07/06"", ""1.標的物之名稱及性質（如坐落台中市北區ＸＸ段ＸＸ小段土地）:\r\n機器設備\r\n2.事實發生日:115/6/23~115/7/6\r\n3.董事會通過日期: 不適用\r\n4.其他核決日期:\r\n核決層級:總經理核決\r\n民國115年07月06日\r\n5.交易單位數量（如ＸＸ平方公尺，折合ＸＸ坪）、每單位價格及交易總金額:\r\n交易數量:一批\n交易總金額:新台幣1,141,465,050元\r\n6.交易相對人及其與公司之關係（交易相對人如屬自然人，且非公司之關\r\n係人者，得免揭露其姓名）:\r\n交易相對人: TAKEWIN INTERNATIONAL(HK)LIMITED\n與公司之關係:無\r\n7.交易相對人為關係人者，並應公告選定關係人為交易對象之原因及前次移轉之\r\n所有人、前次移轉之所有人與公司及交易相對人間相互之關係、前次移轉日期\r\n及移轉金額:\r\n不適用\r\n8.交易標的最近五年內所有權人曾為公司之關係人者，尚應公告關係\r\n人之取得及處分日期、價格及交易當時與公司之關係:\r\n不適用\r\n9.預計處分利益（或損失）（取得資產者不適用）（遞延者應列表說明\r\n認列情形）:\r\n不適用\r\n10.交付或付款條件（含付款期間及金額）、契約限制條款及其他重要約定\r\n事項:\r\n依採購合約規定\r\n11.本次交易之決定方式（如招標、比價或議價）、價格決定之參考依據及\r\n決策單位:\r\n交易決定方式:比價及議價\n價格決定之參考依據:依市場行情\n決策單位:依公司核決權限決定\r\n12.專業估價者事務所或公司名稱及其估價金額:\r\n不適用\r\n13.專業估價師姓名:\r\n不適用\r\n14.專業估價師開業證書字號:\r\n不適用\r\n15.估價報告是否為限定價格、特定價格或特殊價格:否或不適用\r\n16.是否尚未取得估價報告:否或不適用\r\n17.尚未取得估價報告之原因:\r\n不適用\r\n18.估價結果有重大差異時，其差異原因及會計師意見:\r\n不適用\r\n19.會計師事務所名稱:\r\n不適用\r\n20.會計師姓名:\r\n不適用\r\n21.會計師開業證書字號:\r\n不適用\r\n22.經紀人及經紀費用:\r\n無\r\n23.取得或處分之具體目的或用途:\r\n供營業使用\r\n24.本次交易表示異議之董事之意見:\r\n不適用\r\n25.本次交易為關係人交易:否\r\n26.監察人承認或審計委員會同意日期:\r\n不適用\r\n27.本次交易係向關係人取得不動產或其使用權資產:否\r\n28.依「公開發行公司取得或處分資產處理準則」第十六條規定\r\n評估之價格:不適用\r\n29.依前項評估之價格較交易價格為低者，依同準則第十七條規\r\n定評估之價格:不適用\r\n30.前已就同一件事件發布重大訊息日期: 不適用\r\n31.其他敘明事項:\r\n無""]], ""footer"": [""以上資料均由各公司依發言當時所屬市場別之規定申報後，由本系統對外公佈，資料如有虛偽不實，均由該公司負責。""], ""header"": {""note"": [], ""subTitle"": [], ""mainTitle"": [""公司當日重大訊息之詳細內容""]}, ""titles"": [{""sub"": [], ""main"": ""序號""}, {""sub"": [], ""main"": ""發言日期""}, {""sub"": [], ""main"": ""發言時間""}, {""sub"": [], ""main"": ""發言人""}, {""sub"": [], ""main"": ""發言人職稱""}, {""sub"": [], ""main"": ""發言人電話""}, {""sub"": [], ""main"": ""主旨""}, {""sub"": [], ""main"": ""符合條款""}, {""sub"": [], ""main"": ""事實發生日""}, {""sub"": [], ""main"": ""說明""}], ""companyAbbreviation"": ""臻鼎-KY""}, ""datetime"": ""115/07/06 23:59:26""}",2026-07-06 23:59:16
1150706|sii|3715|1,115/07/06,17:42:28,3715,定穎投控,代子公司超穎電子公告該董事會通過資本支出預算案,資本支出,1150706,sii,1,"{""code"": 200, ""message"": ""查詢成功"", ""result"": {""marketName"": ""上市公司"", ""companyId"": ""3715"", ""data"": [[1, ""115/07/06"", ""17:42:28"", ""劉國瑾"", ""總經理"", ""03-3493300"", ""代子公司超穎電子公告該董事會通過\r\n資本支出預算案"", ""15"", ""115/07/06"", ""1.董事會或股東會決議日期:115/07/06\n2.投資計畫內容:\n 超穎電子董事會決議通過該公司及其子公司定穎電子(昆山)有限公司資本性支出案\n3.預計投資金額:預算分別約人民幣1.77億(約NT$8.34億)及人民幣0.12億(約NT$0.57億)\n4.預計投資日期:於董事會通過後陸續投資\n5.資金來源:自有資金或自籌資金\n6.具體目的:購買固定資產等\n7.其他應敘明事項:\n無""]], ""footer"": [""以上資料均由各公司依發言當時所屬市場別之規定申報後，由本系統對外公佈，資料如有虛偽不實，均由該公司負責。""], ""header"": {""note"": [], ""subTitle"": [], ""mainTitle"": [""公司當日重大訊息之詳細內容""]}, ""titles"": [{""sub"": [], ""main"": ""序號""}, {""sub"": [], ""main"": ""發言日期""}, {""sub"": [], ""main"": ""發言時間""}, {""sub"": [], ""main"": ""發言人""}, {""sub"": [], ""main"": ""發言人職稱""}, {""sub"": [], ""main"": ""發言人電話""}, {""sub"": [], ""main"": ""主旨""}, {""sub"": [], ""main"": ""符合條款""}, {""sub"": [], ""main"": ""事實發生日""}, {""sub"": [], ""main"": ""說明""}], ""companyAbbreviation"": ""定穎投控""}, ""datetime"": ""115/07/06 23:59:27""}",2026-07-06 23:59:16
1150706|sii|7610|1,115/07/06,18:37:58,7610,聯友金屬-創,公告本公司辦理115年現金增資發行新股訂定認股基準日相關事宜(補充公告每股發行價格、代收股款及存儲專戶行庫),現金增資,1150706,sii,1,"{""code"": 200, ""message"": ""查詢成功"", ""result"": {""marketName"": ""上市公司"", ""companyId"": ""7610"", ""data"": [[1, ""115/07/06"", ""18:37:58"", ""廖佩芬"", ""財務長"", ""08-8661018"", ""公告本公司辦理115年現金增資發行新股訂定認股基準日相關事宜\r\n(補充公告每股發行價格、代收股款及存儲專戶行庫)"", ""11"", ""115/07/06"", ""1.董事會決議或公司決定增資基準日期:115/08/28\n2.是否採總括申報發行新股(是，請併敘明預定發行期間/否):否\n3.主管機關申報生效日期:115/04/30\n4.董事會決議(追補)發行日期:115/03/05\n5.發行總金額及股數:\n (1)發行總金額：20,000仟元\n (2)發行股數：2,000仟股\n6.採總括申報發行新股案件，本次發行金額及股數:不適用\n7.採總括申報發行新股案件，本次發行後，剩餘之金額及股數餘額:不適用\n8.每股面額:10元\n9.發行價格:每股發行價格新台幣1,400元。(補充公告)\n10.員工認股股數:發行新股總數15%，計300仟股由本公司員工認購。\n11.原股東認購比率:發行新股總數75%計1,500仟股,由原股東按認股基準日股\n東名簿所載之股東及其持股比例認購，每仟股認購30.87343732股。\n12.公開銷售方式及股數:發行新股總數10%計200仟股對外公開承銷。\n13.畸零股及逾期未認購股份之處理方式:\n原股東認購不足一股之畸零股，得由股東自行在停止過戶日起五日內，逕向本公司\n股務代理機構辦理拼湊成整股認購，其拼湊不足一股之畸零股及原股東、員工放棄\n認購或認購不足及逾期未拼湊之部份，授權董事長洽特定人按發行價格認購。\n14.本次發行新股之權利義務:本次增資發行新股之權利義務與原已發行之普通股相同。\n15.本次增資資金用途:購置廠房、廠房整修、購置機器設備及充實營運資金。\n16.現金增資認股基準日:115/07/19\n17.最後過戶日:115/07/14\n18.停止過戶起始日期:115/07/15\n19.停止過戶截止日期:115/07/19\n20.股款繳納期間:\n原股東及員工股款繳納期間：115/07/24~115/08/24\n特定人認股繳款期間：115/08/25~115/08/27\n21.與代收及專戶存儲價款行庫訂約日期:115/07/06(補充公告)\n22.委託代收存款機構:合作金庫商業銀行枋寮分行(補充公告)\n23.委託存儲款項機構:合作金庫商業銀行潮州分行(補充公告)\n24.其他應敘明事項:\n(1)本公司辦理115年現金增資發行普通股2,000仟股乙案，業經金融監督管理委員會\n中華民國115年04月30日金管證發字第1150340563號函申報生效在案。\n(2)本次現金增資發行相關事宜，如遇法令變更、經主管機關修正或有未盡事宜，\n或因客觀環境而需要變更時，董事會授權董事長全權處理之。\n(3)原每仟股認購30.8734366股，因本公司有1股無權利參與現金增資，\n故每仟股認購變更為30.87343732股。""]], ""footer"": [""以上資料均由各公司依發言當時所屬市場別之規定申報後，由本系統對外公佈，資料如有虛偽不實，均由該公司負責。""], ""header"": {""note"": [], ""subTitle"": [], ""mainTitle"": [""公司當日重大訊息之詳細內容""]}, ""titles"": [{""sub"": [], ""main"": ""序號""}, {""sub"": [], ""main"": ""發言日期""}, {""sub"": [], ""main"": ""發言時間""}, {""sub"": [], ""main"": ""發言人""}, {""sub"": [], ""main"": ""發言人職稱""}, {""sub"": [], ""main"": ""發言人電話""}, {""sub"": [], ""main"": ""主旨""}, {""sub"": [], ""main"": ""符合條款""}, {""sub"": [], ""main"": ""事實發生日""}, {""sub"": [], ""main"": ""說明""}], ""companyAbbreviation"": ""聯友金屬-創""}, ""datetime"": ""115/07/06 23:59:28""}",2026-07-06 23:59:16
1150706|sii|3711|4,115/07/06,20:45:46,3711,日月光投控,代子公司矽品精密工業(股)公司公告取得營業用機器設備達十億元,機器設備,1150706,sii,4,"{""code"": 200, ""message"": ""查詢成功"", ""result"": {""marketName"": ""上市公司"", ""companyId"": ""3711"", ""data"": [[4, ""115/07/06"", ""20:45:46"", ""吳田玉"", ""營運長"", ""02-66365678"", ""代子公司矽品精密工業(股)公司公告取得營業用機器設備達十億元"", ""20"", ""115/07/06"", ""1.標的物之名稱及性質（如坐落台中市北區ＸＸ段ＸＸ小段土地）:\r\n營業用機器設備\r\n2.事實發生日:115/6/15~115/7/6\r\n3.董事會通過日期: 不適用\r\n4.其他核決日期:\r\n核決層級:總經理核決\r\n民國115年7月6日\r\n5.交易單位數量（如ＸＸ平方公尺，折合ＸＸ坪）、每單位價格及交易總金額:\r\n取得7批，\n每批平均單價：NTD 334,743,565元，\n交易總金額：NTD 2,343,204,958元。\r\n6.交易相對人及其與公司之關係（交易相對人如屬自然人，且非公司之關\r\n係人者，得免揭露其姓名）:\r\n交易相對人：KLA Corporation； \n與公司之關係：無\r\n7.交易相對人為關係人者，並應公告選定關係人為交易對象之原因及前次移轉之\r\n所有人、前次移轉之所有人與公司及交易相對人間相互之關係、前次移轉日期\r\n及移轉金額:\r\n不適用\r\n8.交易標的最近五年內所有權人曾為公司之關係人者，尚應公告關係\r\n人之取得及處分日期、價格及交易當時與公司之關係:\r\n不適用\r\n9.預計處分利益（或損失）（取得資產者不適用）（遞延者應列表說明\r\n認列情形）:\r\n不適用\r\n10.交付或付款條件（含付款期間及金額）、契約限制條款及其他重要約定\r\n事項:\r\n電匯。\n契約限制條款：無。\n其他重要約定事項：無。\r\n11.本次交易之決定方式（如招標、比價或議價）、價格決定之參考依據及\r\n決策單位:\r\n交易決定方式：比價/議價。\n價格決定之參考依據：參考歷年交易資料和市場行情。\n決策單位：依公司內部核決權限決定。\r\n12.專業估價者事務所或公司名稱及其估價金額:\r\n不適用\r\n13.專業估價師姓名:\r\n不適用\r\n14.專業估價師開業證書字號:\r\n不適用\r\n15.估價報告是否為限定價格、特定價格或特殊價格:否或不適用\r\n16.是否尚未取得估價報告:否或不適用\r\n17.尚未取得估價報告之原因:\r\n不適用\r\n18.估價結果有重大差異時，其差異原因及會計師意見:\r\n不適用\r\n19.會計師事務所名稱:\r\n不適用\r\n20.會計師姓名:\r\n不適用\r\n21.會計師開業證書字號:\r\n不適用\r\n22.經紀人及經紀費用:\r\n無\r\n23.取得或處分之具體目的或用途:\r\n營業用途\r\n24.本次交易表示異議之董事之意見:\r\n無\r\n25.本次交易為關係人交易:否\r\n26.監察人承認或審計委員會同意日期:\r\n不適用\r\n27.本次交易係向關係人取得不動產或其使用權資產:否\r\n28.依「公開發行公司取得或處分資產處理準則」第十六條規定\r\n評估之價格:不適用\r\n29.依前項評估之價格較交易價格為低者，依同準則第十七條規\r\n定評估之價格:不適用\r\n30.前已就同一件事件發布重大訊息日期: 不適用\r\n31.其他敘明事項:\r\n無""]], ""footer"": [""以上資料均由各公司依發言當時所屬市場別之規定申報後，由本系統對外公佈，資料如有虛偽不實，均由該公司負責。""], ""header"": {""note"": [], ""subTitle"": [], ""mainTitle"": [""公司當日重大訊息之詳細內容""]}, ""titles"": [{""sub"": [], ""main"": ""序號""}, {""sub"": [], ""main"": ""發言日期""}, {""sub"": [], ""main"": ""發言時間""}, {""sub"": [], ""main"": ""發言人""}, {""sub"": [], ""main"": ""發言人職稱""}, {""sub"": [], ""main"": ""發言人電話""}, {""sub"": [], ""main"": ""主旨""}, {""sub"": [], ""main"": ""符合條款""}, {""sub"": [], ""main"": ""事實發生日""}, {""sub"": [], ""main"": ""說明""}], ""companyAbbreviation"": ""日月光投控""}, ""datetime"": ""115/07/06 23:59:28""}",2026-07-06 23:59:16
1150706|sii|3711|5,115/07/06,20:46:10,3711,日月光投控,代子公司矽品精密工業(股)公司公告取得營業用機器設備達十億元,機器設備,1150706,sii,5,"{""code"": 200, ""message"": ""查詢成功"", ""result"": {""marketName"": ""上市公司"", ""companyId"": ""3711"", ""data"": [[5, ""115/07/06"", ""20:46:10"", ""吳田玉"", ""營運長"", ""02-66365678"", ""代子公司矽品精密工業(股)公司公告取得營業用機器設備達十億元"", ""20"", ""115/07/06"", ""1.標的物之名稱及性質（如坐落台中市北區ＸＸ段ＸＸ小段土地）:\r\n營業用機器設備\r\n2.事實發生日:115/1/16~115/7/6\r\n3.董事會通過日期: 不適用\r\n4.其他核決日期:\r\n核決層級:總經理核決\r\n民國115年7月6日\r\n5.交易單位數量（如ＸＸ平方公尺，折合ＸＸ坪）、每單位價格及交易總金額:\r\n取得8批，\n每批平均單價：NTD 283,373,854元，\n交易總金額：NTD 2,266,990,830元。\r\n6.交易相對人及其與公司之關係（交易相對人如屬自然人，且非公司之關\r\n係人者，得免揭露其姓名）:\r\n交易相對人：PSK HOLDINGS INC.； \n與公司之關係：無\r\n7.交易相對人為關係人者，並應公告選定關係人為交易對象之原因及前次移轉之\r\n所有人、前次移轉之所有人與公司及交易相對人間相互之關係、前次移轉日期\r\n及移轉金額:\r\n不適用\r\n8.交易標的最近五年內所有權人曾為公司之關係人者，尚應公告關係\r\n人之取得及處分日期、價格及交易當時與公司之關係:\r\n不適用\r\n9.預計處分利益（或損失）（取得資產者不適用）（遞延者應列表說明\r\n認列情形）:\r\n不適用\r\n10.交付或付款條件（含付款期間及金額）、契約限制條款及其他重要約定\r\n事項:\r\n電匯。\n契約限制條款：無。\n其他重要約定事項：無。\r\n11.本次交易之決定方式（如招標、比價或議價）、價格決定之參考依據及\r\n決策單位:\r\n交易決定方式：比價/議價。\n價格決定之參考依據：參考歷年交易資料和市場行情。\n決策單位：依公司內部核決權限決定。\r\n12.專業估價者事務所或公司名稱及其估價金額:\r\n不適用\r\n13.專業估價師姓名:\r\n不適用\r\n14.專業估價師開業證書字號:\r\n不適用\r\n15.估價報告是否為限定價格、特定價格或特殊價格:否或不適用\r\n16.是否尚未取得估價報告:否或不適用\r\n17.尚未取得估價報告之原因:\r\n不適用\r\n18.估價結果有重大差異時，其差異原因及會計師意見:\r\n不適用\r\n19.會計師事務所名稱:\r\n不適用\r\n20.會計師姓名:\r\n不適用\r\n21.會計師開業證書字號:\r\n不適用\r\n22.經紀人及經紀費用:\r\n無\r\n23.取得或處分之具體目的或用途:\r\n營業用途\r\n24.本次交易表示異議之董事之意見:\r\n無\r\n25.本次交易為關係人交易:否\r\n26.監察人承認或審計委員會同意日期:\r\n不適用\r\n27.本次交易係向關係人取得不動產或其使用權資產:否\r\n28.依「公開發行公司取得或處分資產處理準則」第十六條規定\r\n評估之價格:不適用\r\n29.依前項評估之價格較交易價格為低者，依同準則第十七條規\r\n定評估之價格:不適用\r\n30.前已就同一件事件發布重大訊息日期: 不適用\r\n31.其他敘明事項:\r\n無""]], ""footer"": [""以上資料均由各公司依發言當時所屬市場別之規定申報後，由本系統對外公佈，資料如有虛偽不實，均由該公司負責。""], ""header"": {""note"": [], ""subTitle"": [], ""mainTitle"": [""公司當日重大訊息之詳細內容""]}, ""titles"": [{""sub"": [], ""main"": ""序號""}, {""sub"": [], ""main"": ""發言日期""}, {""sub"": [], ""main"": ""發言時間""}, {""sub"": [], ""main"": ""發言人""}, {""sub"": [], ""main"": ""發言人職稱""}, {""sub"": [], ""main"": ""發言人電話""}, {""sub"": [], ""main"": ""主旨""}, {""sub"": [], ""main"": ""符合條款""}, {""sub"": [], ""main"": ""事實發生日""}, {""sub"": [], ""main"": ""說明""}], ""companyAbbreviation"": ""日月光投控""}, ""datetime"": ""115/07/06 23:59:29""}",2026-07-06 23:59:16
