key,speech_date,speech_time,company_id,company_name,subject,matched_keywords,enterDate,marketKind,serialNumber,detail_json,fetched_at_tw
1150414|sii|2243|1,115/04/14,15:03:21,2243,宏旭-KY,公告董事會決議擬擇一方式一次辦理私募普通股或私募可轉換公司債案,私募普通股|公司債,1150414,sii,1,"{""code"": 200, ""message"": ""查詢成功"", ""result"": {""marketName"": ""上市公司"", ""companyId"": ""2243"", ""data"": [[1, ""115/04/14"", ""15:03:21"", ""蘇德仁"", ""董事會秘書"", ""0901102243"", ""公告董事會決議擬擇一方式一次辦理私募普通股或私募\r\n可轉換公司債案"", ""11"", ""115/04/14"", ""1.董事會決議日期:115/04/14\n2.私募有價證券種類:私募普通股及/或私募可轉換公司債\n3.私募對象及其與公司間關係:本次私募有價證券之對象以符合證券交易法第 43 條之 6\n規定之特定人為限。目前擬洽定之應募人暫訂以內部人、關係人或策略投資人為主。洽\n特定人之相關事宜，提請股東會授權董事會全權處理。\n4.私募股數或張數:私募普通股以 40,000,000 股為上限及私募無擔保國內轉換公司債以\n 4,000 張為上限，擇一或以搭配之方式，擇適當時機並視市場狀況一次辦理，所募集\n之資金有強化本公司競爭力、健全財務結構及提高營運效能之效益。\n5.得私募額度:擬募集總金額 400,000 仟元額度內，提請授權辦理私募普通股以\n40,000,000 股為上限及私募無擔保國內轉換公司債以 4,000 張為上限，擇一或以\n搭配之方式一次辦理。\n6.私募價格訂定之依據及合理性:\n1.本公司私募普通股價格之訂定，以不低於參考價格之八成訂定之。參考價格係\n以定價日前一、三或五個營業日擇一計算普通股收盤價簡單算數平均數扣除無償配股\n除權及配息，並加回減資反除權後之股價，或定價日前三十個營業日普通股收盤價\n簡單算數平均數扣除無償配股除權及配息，並加回減資反除權後之股價，二基\n準計算價格較高者定之。\n2.本公司私募國內轉換公司債發行價格之訂定，以不低於理論價格之八成訂定之。\n理論價格將以涵蓋並同時考量發行條件中包含之各項權利而擇定之計價模型定之。\n轉換價格係以定價日前一、三或五個營業日擇一計算普通股收盤價簡單算術平均數扣除\n無償配股除權及配息，並加回減資反除權後之股價，或定價日前三十個營業日普通股\n收盤價簡單算術平均數扣除無償配股除權及配息，並加回減資反除權後之股價，二基\n準計算價格較高者定之，並以不低於參考價格之八成為訂定依據。\n3.本次私募普通股每股價格與私募國內轉換公司債轉換價格之定價係遵循主管機關之\n相關規定，同時考量本公司營運狀況及普通股市價等因素後決定之，其訂價方式\n應屬合理。因此，實際定價日及實際價格，提請股東會於不低於股東會決議成數範圍\n內授權董事會視當時市場狀況及日後洽定特定人情形決定之。\n7.本次私募資金用途:本次籌資計畫之預計資金用途為充實營運資金、償還公司負債或\n 轉投資、改善財務結構及因應公司未來長期發展所需資金，預計將皆可強化公司競\n 爭力、提升營運效能之效益，對股東權益有正面助益。\n8.不採用公開募集之理由:\n不採用公開募集之理由：擬以私募方式辦理現金發行新股及發行無擔保可轉換公司\n債藉以改善財務結構、充實營運資金、償還公司負債、轉投資、因應產業發展趨勢\n及公司營運需要，因私募作業具有迅速簡便的特性，較易於短期內取得所需資金，\n爰以公司法及證券交易法等相關規定辦理私募。\n9.獨立董事反對或保留意見:無。\n10.實際定價日:\n實際發行價格擬提請股東會授權董事會依法令規定及於不低於股東會所決議訂價\n依據與成數範圍內，參考當時市場及公司狀況為依據訂定之。\n11.參考價格:\n1.本公司私募普通股價格之訂定，以不低於參考價格之八成訂定之。\n參考價格係以定價日前一、三或五個營業日擇一計算普通股收盤價簡單算術平均數\n扣除無償配股除權及配息，並加回減資反除權後之股價，或定價日前三十個營業日\n普通股收盤價簡單算術平均數扣除無償配股除權及配息，並加回減資反除權後\n之股價，二基準計算價格較高者定之。\n2.本公司私募國內轉換公司債發行價格之訂定，以不低於理論價格之八成訂定之。\n理論價格將以涵蓋並同時考量發行條件中包含之各項權利而擇定之計價模型定之。\n轉換價格係以定價日前一、三或五個營業日擇一計算普通股收盤價簡單算術平均數扣除\n無償配股除權及配息，並加回減資反除權後之股價，或定價日前三十個營業日普通股\n收盤價簡單算術平均數扣除無償配股除權及配息，並加回減資反除權後之股價，二基\n準計算價格較高者定之，並以不低於參考價格之八成為訂定依據。\n12.實際私募價格、轉換或認購價格:實際定價日及實際價格，提請股東會於不低於股東\n  會決議成數範圍內授權董事會視當時市場狀況及日後洽定特定人情形決定之。\n13.本次私募新股之權利義務:本次私募普通股、私募無擔保可轉換公司債於交付日起\n三年內除依證券交易法第 43 條之 8 規定之轉讓對象外，其餘受限不得轉讓，並於\n私募普通股交付日滿三年後，依相關法令規定取具台灣證券交易所或櫃檯買賣中心\n核發符合上市櫃標準之同意函，並據以向主管機關完成申報補辦公開發行審核程序後，\n始得提出上市櫃交易申請。\n14.附有轉換、交換或認股者，其換股基準日:不適用。\n15.附有轉換、交換或認股者，對股權可能稀釋情形:不適用。\n16.附有轉換或認股者，於私募公司債交付且假設全數轉換或認購普通股後對\n上市普通股股權比率之可能影響（上市普通股數A、A/已發行普通股):不適用。\n17.前項預計上市普通股未達6000萬股且未達25%者，請說明股權流通性偏低之因應措施:\n  不適用。\n18.其他應敘明事項:本次私募普通股與國內轉換公司債之主要內容，除私募訂價成數外，\n包括實際發行次數、發行條件及轉換辦法、發行價格及實際每股轉換價格、擔保條件\n、發行股數、募集總金額、計劃項目、資金運用進度、預計可能產生效益、增資基準日\n及其他相關事宜，包括未來如因法令變更或主管機關指示或因應營運評估或因客觀環境\n變動而須修正者，提請股東會授權董事會全權處理之。""]], ""footer"": [""以上資料均由各公司依發言當時所屬市場別之規定申報後，由本系統對外公佈，資料如有虛偽不實，均由該公司負責。""], ""header"": {""note"": [], ""subTitle"": [], ""mainTitle"": [""公司當日重大訊息之詳細內容""]}, ""titles"": [{""sub"": [], ""main"": ""序號""}, {""sub"": [], ""main"": ""發言日期""}, {""sub"": [], ""main"": ""發言時間""}, {""sub"": [], ""main"": ""發言人""}, {""sub"": [], ""main"": ""發言人職稱""}, {""sub"": [], ""main"": ""發言人電話""}, {""sub"": [], ""main"": ""主旨""}, {""sub"": [], ""main"": ""符合條款""}, {""sub"": [], ""main"": ""事實發生日""}, {""sub"": [], ""main"": ""說明""}], ""companyAbbreviation"": ""宏旭-KY""}, ""datetime"": ""115/04/14 18:45:00""}",2026-04-14 18:44:51
1150414|sii|3518|2,115/04/14,15:48:55,3518,柏騰,本公司董事會決議通過不繼續辦理114年股東常會通過之以私募方式辦理現金增資發行普通股案,現金增資,1150414,sii,2,"{""code"": 200, ""message"": ""查詢成功"", ""result"": {""marketName"": ""上市公司"", ""companyId"": ""3518"", ""data"": [[2, ""115/04/14"", ""15:48:55"", ""劉明怡"", ""財務處副總經理"", ""(03)212-8833"", ""本公司董事會決議通過不繼續辦理114年股東常會通過之\r\n以私募方式辦理現金增資發行普通股案"", ""16"", ""115/04/14"", ""1.董事會決議變更日期:115/04/14\n2.原計畫申報生效之日期:不適用\n3.追補發行之日期:不適用\n4.變動原因:\n一、依據證券交易法第43條之6第7項規定私募普通股得於股東會\n    決議之日起1年內分次辦理，本公司114年股東常會決議以不\n    超過25,000,000股額度內之範圍分二次辦理。\n二、本私募案將於115年6月10日到期屆滿，未辦理完成之普通股\n    20,000,000股，因期限將屆滿，於剩餘期限內不繼續辦理，\n    並提115年股東會報告。\n5.歷次變更前後募集資金計畫:不適用\n6.預計執行進度:不適用\n7.預計完成日期:不適用\n8.預計可能產生效益:不適用\n9.與原預計效益產生之差異:不適用\n10.本次變更對股東權益之影響:不適用\n11.原主辦承銷商評估意見摘要:不適用\n12.其他應敘明事項:無""]], ""footer"": [""以上資料均由各公司依發言當時所屬市場別之規定申報後，由本系統對外公佈，資料如有虛偽不實，均由該公司負責。""], ""header"": {""note"": [], ""subTitle"": [], ""mainTitle"": [""公司當日重大訊息之詳細內容""]}, ""titles"": [{""sub"": [], ""main"": ""序號""}, {""sub"": [], ""main"": ""發言日期""}, {""sub"": [], ""main"": ""發言時間""}, {""sub"": [], ""main"": ""發言人""}, {""sub"": [], ""main"": ""發言人職稱""}, {""sub"": [], ""main"": ""發言人電話""}, {""sub"": [], ""main"": ""主旨""}, {""sub"": [], ""main"": ""符合條款""}, {""sub"": [], ""main"": ""事實發生日""}, {""sub"": [], ""main"": ""說明""}], ""companyAbbreviation"": ""柏騰""}, ""datetime"": ""115/04/14 18:45:01""}",2026-04-14 18:44:51
1150414|sii|2886|1,115/04/14,16:00:46,2886,兆豐金,公告本公司暨主要子公司115年3月份自結合併盈餘,自結合併,1150414,sii,1,"{""code"": 200, ""message"": ""查詢成功"", ""result"": {""marketName"": ""上市公司"", ""companyId"": ""2886"", ""data"": [[1, ""115/04/14"", ""16:00:46"", ""丁涵茵"", ""副總經理"", ""23578888#116"", ""公告本公司暨主要子公司115年3月份自結合併盈餘"", ""51"", ""115/04/14"", ""1.事實發生日:115/04/14\n2.公司名稱:兆豐金融控股股份有限公司\n3.與公司關係(請輸入本公司或子公司):本公司\n4.相互持股比例:不適用\n5.發生緣由:公告本公司暨主要子公司115年3月份自結合併盈餘\n6.因應措施:無\n7.其他應敘明事項(若事件發生或決議之主體係屬公開發行以上公司，本則重大訊息同時\n  符合證券交易法施行細則第7條第9款所定對股東權益或證券價格有重大影響之事項):\n公告本公司暨主要子公司115年3月份業績資料：\n　　　　　　　當月稅前 當月稅後 累積稅前  累積稅後  累積每股\n　　　　　　　　盈餘     盈餘     盈餘      盈餘    稅後盈餘\n　　　　　　　 (億元)   (億元)   (億元)    (億元)     (元)\n兆豐金控        28.67    24.01   112.20     93.97     0.63\n兆豐銀行        19.21    15.92    85.17     70.80     0.71\n兆豐證券         5.54     5.00    14.89     13.46     1.15\n兆豐票券         3.52     2.81    10.35      8.27     0.55\n兆豐產險         1.02     0.82     2.91      2.33     0.71\n註:兆豐金控115年3月31日每股淨值27.10元。\n註:累計至3月未適用巨災保險準備金之累計每股稅後盈餘\n   兆豐金控為0.63元、兆豐產險為0.71元。\n上述資料均係自結數字，未經會計師查核或核閱。""]], ""footer"": [""以上資料均由各公司依發言當時所屬市場別之規定申報後，由本系統對外公佈，資料如有虛偽不實，均由該公司負責。""], ""header"": {""note"": [], ""subTitle"": [], ""mainTitle"": [""公司當日重大訊息之詳細內容""]}, ""titles"": [{""sub"": [], ""main"": ""序號""}, {""sub"": [], ""main"": ""發言日期""}, {""sub"": [], ""main"": ""發言時間""}, {""sub"": [], ""main"": ""發言人""}, {""sub"": [], ""main"": ""發言人職稱""}, {""sub"": [], ""main"": ""發言人電話""}, {""sub"": [], ""main"": ""主旨""}, {""sub"": [], ""main"": ""符合條款""}, {""sub"": [], ""main"": ""事實發生日""}, {""sub"": [], ""main"": ""說明""}], ""companyAbbreviation"": ""兆豐金""}, ""datetime"": ""115/04/14 18:45:02""}",2026-04-14 18:44:51
1150414|sii|3518|3,115/04/14,16:09:17,3518,柏騰,本公司董事會決議通過以私募方式辦理現金增資發行普通股案,現金增資,1150414,sii,3,"{""code"": 200, ""message"": ""查詢成功"", ""result"": {""marketName"": ""上市公司"", ""companyId"": ""3518"", ""data"": [[3, ""115/04/14"", ""16:09:17"", ""劉明怡"", ""財務處副總經理"", ""(03)212-8833"", ""本公司董事會決議通過以私募方式辦理現金增資發行普通股案"", ""11"", ""115/04/14"", ""1.董事會決議日期:115/04/14\n2.私募有價證券種類:普通股\n3.私募對象及其與公司間關係:\n以符合證券交易法第43條之6及金融監督管理委員會112年9月12日金管證發字第\n1120383220號令及「公開發行公司辦理私募有價證券應注意事項」等相關函令規\n定之特定人為限，並以對本公司長期發展及競爭力與既有股東權益能產生效益者\n為優先。\n4.私募股數或張數:25,000,000股額度內\n5.得私募額度:不超過25,000,000股之額度內，授權董事會自股東會決議之日起\n一年內分二次辦理。\n6.私募價格訂定之依據及合理性:\n(1)本次私募普通股認股價格訂定之參考價格，以定價日前一、三或五個營業日擇一\n   計算普通股收盤價簡單算數平均數扣除無償配股除權及配息，並加回減資反除權後之\n   股價或定價日前三十個營業日之普通股收盤價簡單算數平均數扣除無償配股除權及配\n   息，並加回減資反除權後股價計算之，二基準計算價格以較高者為參考價格。\n(2)本次私募普通股認股價格，擬提請股東會授權董事會依據上述規定，以不低於參\n   考價格之八成為訂定私募價格之依據，視日後洽特定人情形及市場狀況定之。\n(3)前述私募普通股之認股價格之價格訂定係分別參考公司經營績效、未來展望及最近\n   股價，並考量私募有價證券於交付日起三年轉讓限制而定，故應屬合理。\n7.本次私募資金用途:充實營運資金、因應公司長期發展之資金需求及償還銀行借款。\n8.不採用公開募集之理由:\n考量目前資本市場狀況及為掌握募集資本之時效性及可行性，以便於最短期限內取得所\n需之資金，以利達成引進投資人之目的，且私募股票有限制轉讓的規定，較可確保公司\n與投資人間之長期合作關係。\n9.獨立董事反對或保留意見:無\n10.實際定價日:尚未發行　\n11.參考價格:尚未發行　\n12.實際私募價格、轉換或認購價格:尚未發行　\n13.本次私募新股之權利義務:\n與本公司已發行之普通股相同。惟本次私募之有價證券於交付後三年內，除依證券交易\n法第 43條之 8 規定之轉讓對象外，其餘受限不得轉讓。\n14.附有轉換、交換或認股者，其換股基準日:不適用\n15.附有轉換、交換或認股者，對股權可能稀釋情形:不適用\n16.附有轉換或認股者，於私募公司債交付且假設全數轉換或認購普通股後對\n上市普通股股權比率之可能影響（上市普通股數A、A/已發行普通股):不適用\n17.前項預計上市普通股未達6000萬股且未達25%者，請說明股權流通性偏低之因應措施:\n不適用\n18.其他應敘明事項:\n一、關於本次籌資之發行或私募條件、資金運用計畫、資金用途、預定進度、預計可能\n產生效益及其他相關事項等，擬提請股東會授權董事會依公司實際需求、市場狀況及相\n關法令訂定、調整並全權處理之。未來如經主管機關修正或基於營運評估或因客觀環境\n變化而修正時，則授權董事會依當時市場狀況及法令規定全權處理。\n二、為完成籌資計畫，擬授權董事長或其指定之人代表本公司簽署一切有關發行本次私\n募普通股之契約或文件、辦理一切有關發行本次私募普通股所需作業及其他未盡事宜。""]], ""footer"": [""以上資料均由各公司依發言當時所屬市場別之規定申報後，由本系統對外公佈，資料如有虛偽不實，均由該公司負責。""], ""header"": {""note"": [], ""subTitle"": [], ""mainTitle"": [""公司當日重大訊息之詳細內容""]}, ""titles"": [{""sub"": [], ""main"": ""序號""}, {""sub"": [], ""main"": ""發言日期""}, {""sub"": [], ""main"": ""發言時間""}, {""sub"": [], ""main"": ""發言人""}, {""sub"": [], ""main"": ""發言人職稱""}, {""sub"": [], ""main"": ""發言人電話""}, {""sub"": [], ""main"": ""主旨""}, {""sub"": [], ""main"": ""符合條款""}, {""sub"": [], ""main"": ""事實發生日""}, {""sub"": [], ""main"": ""說明""}], ""companyAbbreviation"": ""柏騰""}, ""datetime"": ""115/04/14 18:45:03""}",2026-04-14 18:44:51
1150414|sii|4960|3,115/04/14,16:14:56,4960,誠美材,公告本公司購置機器設備,機器設備,1150414,sii,3,"{""code"": 200, ""message"": ""查詢成功"", ""result"": {""marketName"": ""上市公司"", ""companyId"": ""4960"", ""data"": [[3, ""115/04/14"", ""16:14:56"", ""楊朝智"", ""財務處長"", ""(06)5889988"", ""公告本公司購置機器設備"", ""20"", ""115/04/14"", ""1.標的物之名稱及性質（如坐落台中市北區ＸＸ段ＸＸ小段土地）:\r\n機器設備\r\n2.事實發生日:115/4/14~115/4/14\r\n3.董事會通過日期: 民國115年4月14日\r\n4.其他核決日期: 不適用\r\n5.交易單位數量（如ＸＸ平方公尺，折合ＸＸ坪）、每單位價格及交易總金額:\r\n交易單位數量：乙批；\n每單位價格：不適用；\n交易總金額：不超過新臺幣664,216,200元\r\n6.交易相對人及其與公司之關係（交易相對人如屬自然人，且非公司之關\r\n係人者，得免揭露其姓名）:\r\n彩源科技股份有限公司；\n其與公司關係：無\r\n7.交易相對人為關係人者，並應公告選定關係人為交易對象之原因及前次移轉之\r\n所有人、前次移轉之所有人與公司及交易相對人間相互之關係、前次移轉日期\r\n及移轉金額:\r\n不適用\r\n8.交易標的最近五年內所有權人曾為公司之關係人者，尚應公告關係\r\n人之取得及處分日期、價格及交易當時與公司之關係:\r\n不適用\r\n9.預計處分利益（或損失）（取得資產者不適用）（遞延者應列表說明\r\n認列情形）:\r\n不適用\r\n10.交付或付款條件（含付款期間及金額）、契約限制條款及其他重要約定\r\n事項:\r\n依合約規定辦理交付；\n契約限制條款：無；\n其他重要約定事項：無\r\n11.本次交易之決定方式（如招標、比價或議價）、價格決定之參考依據及\r\n決策單位:\r\n交易決定方式:議價；\n價格決定之參考依據:按市場行情；\n決策單位：董事會\r\n12.專業估價者事務所或公司名稱及其估價金額:\r\n不適用\r\n13.專業估價師姓名:\r\n不適用\r\n14.專業估價師開業證書字號:\r\n不適用\r\n15.估價報告是否為限定價格、特定價格或特殊價格:否或不適用\r\n16.是否尚未取得估價報告:否或不適用\r\n17.尚未取得估價報告之原因:\r\n不適用\r\n18.估價結果有重大差異時，其差異原因及會計師意見:\r\n不適用\r\n19.會計師事務所名稱:\r\n不適用\r\n20.會計師姓名:\r\n不適用\r\n21.會計師開業證書字號:\r\n不適用\r\n22.經紀人及經紀費用:\r\n無\r\n23.取得或處分之具體目的或用途:\r\n供生產使用之機器設備\r\n24.本次交易表示異議之董事之意見:\r\n無\r\n25.本次交易為關係人交易:否\r\n26.監察人承認或審計委員會同意日期:\r\n民國115年04月14日\r\n27.本次交易係向關係人取得不動產或其使用權資產:否\r\n28.依「公開發行公司取得或處分資產處理準則」第十六條規定\r\n評估之價格:不適用\r\n29.依前項評估之價格較交易價格為低者，依同準則第十七條規\r\n定評估之價格:不適用\r\n30.前已就同一件事件發布重大訊息日期: 不適用\r\n31.其他敘明事項:\r\n無""]], ""footer"": [""以上資料均由各公司依發言當時所屬市場別之規定申報後，由本系統對外公佈，資料如有虛偽不實，均由該公司負責。""], ""header"": {""note"": [], ""subTitle"": [], ""mainTitle"": [""公司當日重大訊息之詳細內容""]}, ""titles"": [{""sub"": [], ""main"": ""序號""}, {""sub"": [], ""main"": ""發言日期""}, {""sub"": [], ""main"": ""發言時間""}, {""sub"": [], ""main"": ""發言人""}, {""sub"": [], ""main"": ""發言人職稱""}, {""sub"": [], ""main"": ""發言人電話""}, {""sub"": [], ""main"": ""主旨""}, {""sub"": [], ""main"": ""符合條款""}, {""sub"": [], ""main"": ""事實發生日""}, {""sub"": [], ""main"": ""說明""}], ""companyAbbreviation"": ""誠美材""}, ""datetime"": ""115/04/14 18:45:04""}",2026-04-14 18:44:51
1150414|sii|2486|5,115/04/14,16:32:53,2486,一詮,本公司董事會決議發行國內第七次無擔保轉換公司債,公司債,1150414,sii,5,"{""code"": 200, ""message"": ""查詢成功"", ""result"": {""marketName"": ""上市公司"", ""companyId"": ""2486"", ""data"": [[5, ""115/04/14"", ""16:32:53"", ""劉秀興"", ""副總經理"", ""2299-0001"", ""本公司董事會決議發行國內第七次無擔保轉換公司債"", ""11"", ""115/04/14"", ""1.董事會決議日期:115/04/14\n2.名稱﹝XX公司第X次（有、無）擔保公司債﹞:\n 一詮精密工業股份有限公司國內第七次無擔保轉換公司債\n3.是否採總括申報發行公司債(是/否):否\n4.發行總額:發行總面額新台幣貳拾億元。\n5.每張面額:新台幣壹拾萬元整。\n6.發行價格:依票面金額100%~101%發行。\n7.發行期間:三年\n8.發行利率:票面年利率0%。\n9.擔保品之種類、名稱、金額及約定事項:不適用。\n10.募得價款之用途及運用計畫:償還銀行借款及充實營運資金。\n11.承銷方式:以詢價圈購方式全數對外公開承銷。\n12.公司債受託人:兆豐國際商業銀行。\n13.承銷或代銷機構:中國信託綜合證券股份有限公司。\n14.發行保證人:不適用。\n15.代理還本付息機構:福邦證券股份有限公司股務代理部。\n16.簽證機構:本次公司債無實體發行，故不適用。\n17.能轉換股份者，其轉換辦法:\n  相關轉換辦法將依有關法令辦理，並報准證券主管機關後另行公告。\n18.賣回條件:相關轉換辦法將依有關法令辦理，並報准證券主管機關後另行公告。\n19.買回條件:相關轉換辦法將依有關法令辦理，並報准證券主管機關後另行公告。\n20.附有轉換、交換或認股者，其換股基準日:\n  相關轉換辦法將依有關法令辦理，並報准證券主管機關後另行公告。\n21.附有轉換、交換或認股者，對股權可能稀釋情形:\n  相關轉換辦法將依有關法令辦理，並報准證券主管機關後另行公告。\n22.其他應敘明事項:\n  (1)本次發行轉換公司債案俟呈報主管機關申報生效後，擬授權董事長另訂發\n     行日，並自發行日起於中華民國證券櫃檯買賣中心上櫃交易。\n  (2)本次發行轉換公司債有關之發行及轉換辦法、發行金額、發行時程、發行\n     條件、資金運用計畫項目、所需資金總額、資金來源、預計資金運用進度\n    、預計可能產生效益及其他發行相關事宜，如遇法令變更或經主管機關指\n     示修正，或因應客觀環境變化而需訂定或修正時，擬授權董事長全權處理\n     之。""]], ""footer"": [""以上資料均由各公司依發言當時所屬市場別之規定申報後，由本系統對外公佈，資料如有虛偽不實，均由該公司負責。""], ""header"": {""note"": [], ""subTitle"": [], ""mainTitle"": [""公司當日重大訊息之詳細內容""]}, ""titles"": [{""sub"": [], ""main"": ""序號""}, {""sub"": [], ""main"": ""發言日期""}, {""sub"": [], ""main"": ""發言時間""}, {""sub"": [], ""main"": ""發言人""}, {""sub"": [], ""main"": ""發言人職稱""}, {""sub"": [], ""main"": ""發言人電話""}, {""sub"": [], ""main"": ""主旨""}, {""sub"": [], ""main"": ""符合條款""}, {""sub"": [], ""main"": ""事實發生日""}, {""sub"": [], ""main"": ""說明""}], ""companyAbbreviation"": ""一詮""}, ""datetime"": ""115/04/14 18:45:04""}",2026-04-14 18:44:51
