key,speech_date,speech_time,company_id,company_name,subject,matched_keywords,enterDate,marketKind,serialNumber,detail_json,fetched_at_tw
1150504|otc|5347|1,115/05/04,17:34:32,5347,世界,本公司董事會同意本公司及子公司機器設備及相關廠務設備資本預算,廠務設備|機器設備,1150504,otc,1,"{""code"": 200, ""message"": ""查詢成功"", ""result"": {""marketName"": ""上櫃公司"", ""companyId"": ""5347"", ""data"": [[1, ""115/05/04"", ""17:34:32"", ""黃惠蘭"", ""副總經理暨財務長"", ""(03)5770355"", ""本公司董事會同意本公司及子公司機器設備及相關廠務設備資本預算"", ""20"", ""115/05/04"", ""1.標的物之名稱及性質（如坐落台中市北區ＸＸ段ＸＸ小段土地）:\r\n(1)8吋機器設備及相關廠務設備\n(2)12吋機器設備及相關廠務設備\r\n2.事實發生日:115/5/4~115/5/4\r\n3.董事會通過日期: 民國115年5月4日\r\n4.其他核決日期: 不適用\r\n5.交易單位數量（如ＸＸ平方公尺，折合ＸＸ坪）、每單位價格及交易總金額:\r\n(1)8吋機器設備及相關廠務設備: 新台幣3,630佰萬元\n(2)12吋機器設備及相關廠務設備: 新台幣4,929佰萬元\r\n6.交易相對人及其與公司之關係（交易相對人如屬自然人，且非公司之關\r\n係人者，得免揭露其姓名）:\r\n(1)8吋機器設備及相關廠務設備:\n威迪諾科技有限公司與其關係企業;英堡科技工程有限公司與其關係企業;\n統怡工程有限公司與其關係企業;仲棠工程股份有限公司與其關係企業;\n新富垣機械工程有限公司與其關係企業;竑翔配管科技有限公司與其關係企業;\n育朋科技有限公司與其關係企業;啟鋒科技股份有限公司與其關係企業;\n譜榮系統科技股份有限公司與其關係企業;哲毅機電工程股份有限公司與其關係企業;\n宏晟科技股份有限公司;宏洋有限公司;騰齊科技有限公司;正德防火工業股份\n有限公司與其關係企業;西門子股份有限公司與其關係企業;東麟系統有限公司\n與其關係企業;聯宇工程有限公司與其關係企業;台灣矽科宏晟科技股份\n有限公司與其關係企業;漢科系統科技股份有限公司與其關係企業;\n山田興有限公司與其關係企業;大川工程科技有限公司與其關係企業;\n高信工程股份有限公司與其關係企業;巨茂應用材料股份有限公司與其關係企業;\n英堡裝潢工程行與其關係企業; 本因消防工程有限公司與其關係企業; \n吳&#28018;楙建築師事務所;程閎科技工程有限公司與其關係企業;台灣純水科技股份\n有限公司與其關係企業;菱洋國際工程股份有限公司與其關係企業;研華股份\n有限公司與其關係企業;寶虹科技股份有限公司與其關係企業;橙旭科技有限\n公司與其關係企業;宇謙科技股份有限公司與其關係企業;長興國際系統有限\n公司與其關係企業;亦立科技股份有限公司與其關係企業;吉利康股份有限公司\n與其關係企業;京英機械工程有限公司與其關係企業;研宏國際股份有限公司\n與其關係企業;靖洋科技股份有限公司與其關係企業;啟德機械起重工程股份\n有限公司與其關係企業;GATE SEMICONDUCTOR CO. LIMITED與其關係企業;\nAPET CO., LTD.與其關係企業;KLA CORPORATION與其關係企業;台灣荏原\n精密股份有限公司與其關係企業;潔恩科技股份有限公司與其關係企業;\n虹鳴科技股份有限公司與其關係企業;訊通機械工程有限公司與其關係企業;\n鑽全科技股份有限公司與其關係企業;曜禾有限公司與其關係企業;\nSPTS TECHNOLOGIES LIMITED與其關係企業;鼎鴻精密有限公司與其關係企業;\nAPPLIED MATERIALS SOUTH EAST ASIA PTE. LTD. 與其關係企業;\n弘景興業有限公司與其關係企業;茂德科技股份有限公司與其關係企業\n\n(2)12吋機器設備及相關廠務設備:\nAPPLIED MATERIALS SOUTH EAST ASIA PTE. LTD and Affiliated company; \nADVANCED MICRO-FABRICATION EQUIPMENT INTERNATIONAL PTE. LTD. and \nAffiliated company;ASML SINGAPORE PTE LTD and Affiliated company;\nAXCELIS TECHNOLOGIES, INC. and Affiliated company;BROOKS \nAUTOMATION US, LLC;EBARA CORPORATION and Affiliated company;\nGATE SEMICONDUCTOR CO. LIMITED and Affiliated company;\nHITACHI HIGH-TECH (SINGAPORE) PTE. LTD. and Affiliated company;\n漢辰科技股份有限公司與其關係企業;KOKUSAI ELECTRIC CORPORATION. \nand Affiliated company; KEYSIGHT TECHNOLOGIES SINGAPORE (SALES) \nPTE. LTD. and Affiliated company;KLA CORPORATION and Affiliated \ncompany;LAM RESEARCH INTERNATIONAL SDN BHD and Affiliated company;\nMATTSON TECHNOLOGY, INC.;NIKON CORPORATION and Affiliated company;\nNOVA LTD.; ONTO INNOVATION, INC. and Affiliated company;\n台灣帕科股份有限公司與其關係企業;普發真空科技股份有限公司與其關係企業;\nRIGAKU CORPORATION;SCREEN SEMICONDUCTOR SOLUTIONS CO., LTD. and \nAffiliated company;SEMILAB USA LLC and Affiliated company;\n（二中）成股份有限公司與其關係企業;SUMITOMO HEAVY INDUSTRIES ION \nTECHNOLOGY CO., LTD. and Affiliated company;TOKYO ELECTRON LIMITED \nand Affiliated company;TPC SYSTEM TECHNOLOGY (SINGAPORE) PTE. LTD. \nand Affiliated company;T AND K WORLDWIDE COMMERCE PTE LTD and \nAffiliated company;MARKETECH INTEGRATED PTE LTD and Affiliated company;\nKUN LUN GLOBAL PTE LTD and Affiliated company ; \nB H S KINETIC PTE. LTD. and Affiliated company ; \nCHASEN LOGISTICS SERVICES LIMITED and Affiliated company ; \nUNITED INTEGRATED SERVICES PTE. LTD. and Affiliated company; \nWHOLETECH SYSTEM HITECH (S) PTE LTD and Affiliated company;\nDAIFUKU MECHATRONICS (S) PTE LTD and Affiliated company; \nDAIFUKU CO., LTD. and Affiliated company; L & K ENGINEERING CO., \nLTD (SINGAPORE BRANCH) and Affiliated company; GENII IDEAS (S) \nPTE. LTD. and Affiliated company;AMPOWER INTERNATIONAL \nENTERPRISE CO.,LTD. and Affiliated company;SUCAN PTE LTD and \nAffiliated company; ARCHCYBER TECHNOLOGY PTE. LTD. and \nAffiliated company; Topco Scientific Co., Ltd. and Affiliated company;\nMEGA UNION TECHNOLOGY INCORPPORATED and Affiliated company; \nNomura Micro Science Engineering Co.,Ltd; Chen Yuan International \nCo., Ltd. and Affiliated company; Taiyo Nippon Sanso Engineering \nTaiwan ,Inc. and Affiliated company; Nova Technology Corp. and \nAffiliated company; ID ARCHITECTS PTE LTD and Affiliated company; \nSurbana Jurong Private Limited and Affiliated company; \n研創設計顧問有限公司與其關係企業;銳澤實業股份有限公司與其關係企業; \n聚賢研發股份有限公司與其關係企業; 漢唐集成股份有限公司與其關係企業; \n協崑股份有限公司與其關係企業;台灣國際商業機器股份有限公司與其關係企業; \n新加坡商應用材料股份有限公司台灣分公司與其關係企業; 敦陽科技股份有限公司\n與其關係企業; IBM Singapore and Affiliated company; \nPDF Solutions, Inc. and Affiliated company; Oracle Corporation and \nAffiliated company; VMware Inc. and Affiliated company; 擎昊科技股份\n有限公司與其關係企業; DELL Inc.; Daifuku Co., Ltd. and Affiliated company;\n MURATEC,MURATA MACHINERY, LTD and Affiliated company.; \nThermoFisher and Affiliated company; Sela and Affiliated company; \nIAS Inc.; Keysight; Daifuku Mechatronics (Singapore) Pte. Ltd. and \nAffiliated company; 盟立自動化股份有限公司與其關係企業; \n廣運機械工程股份有限公司與其關係企業; 旭東機械工業股份有限公司與其關係企業; \n崇越科技股份有限公司與其關係企業; 友上科技股份有限公司與其關係企業;\n聚達系統股份有限公司與其關係企業; EDWARDS VACUUM and Affiliated company; \n順芯科技有限公司與其關係企業; SILICON STORAGE TECHNOLOGY,INC. and Affiliated\ncompany; 元烽企業有限公司與其關係企業; ARCHCYBER TECHNOLOGY PTE. LTD. and\nAffiliated company\n\n與公司關係：皆無\r\n7.交易相對人為關係人者，並應公告選定關係人為交易對象之原因及前次移轉之\r\n所有人、前次移轉之所有人與公司及交易相對人間相互之關係、前次移轉日期\r\n及移轉金額:\r\n不適用\r\n8.交易標的最近五年內所有權人曾為公司之關係人者，尚應公告關係\r\n人之取得及處分日期、價格及交易當時與公司之關係:\r\n不適用\r\n9.預計處分利益（或損失）（取得資產者不適用）（遞延者應列表說明\r\n認列情形）:\r\n不適用\r\n10.交付或付款條件（含付款期間及金額）、契約限制條款及其他重要約定\r\n事項:\r\n(1)交付或付款條件：依訂單條件付款\n(2)契約限制條款：無\n(3)其他重要約定事項：無\r\n11.本次交易之決定方式（如招標、比價或議價）、價格決定之參考依據及\r\n決策單位:\r\n(1)決定方式：議價\n(2)價格決定之參考依據：按市場行情\n(3)決策單位：依本公司董事會決議及採購核定會議決定\r\n12.專業估價者事務所或公司名稱及其估價金額:\r\n不適用\r\n13.專業估價師姓名:\r\n不適用\r\n14.專業估價師開業證書字號:\r\n不適用\r\n15.估價報告是否為限定價格、特定價格或特殊價格:否或不適用\r\n16.是否尚未取得估價報告:否或不適用\r\n17.尚未取得估價報告之原因:\r\n不適用\r\n18.估價結果有重大差異時，其差異原因及會計師意見:\r\n不適用\r\n19.會計師事務所名稱:\r\n不適用\r\n20.會計師姓名:\r\n不適用\r\n21.會計師開業證書字號:\r\n不適用\r\n22.經紀人及經紀費用:\r\n無\r\n23.取得或處分之具體目的或用途:\r\n因應公司業務成長需要供生產用\r\n24.本次交易表示異議之董事之意見:\r\n無\r\n25.本次交易為關係人交易:否\r\n26.監察人承認或審計委員會同意日期:\r\n\r\n27.本次交易係向關係人取得不動產或其使用權資產:否\r\n28.依「公開發行公司取得或處分資產處理準則」第十六條規定\r\n評估之價格:不適用\r\n29.依前項評估之價格較交易價格為低者，依同準則第十七條規\r\n定評估之價格:不適用\r\n30.前已就同一件事件發布重大訊息日期: 不適用\r\n31.其他敘明事項:\r\n無""]], ""footer"": [""以上資料均由各公司依發言當時所屬市場別之規定申報後，由本系統對外公佈，資料如有虛偽不實，均由該公司負責。""], ""header"": {""note"": [], ""subTitle"": [], ""mainTitle"": [""公司當日重大訊息之詳細內容""]}, ""titles"": [{""main"": ""序號"", ""sub"": []}, {""main"": ""發言日期"", ""sub"": []}, {""main"": ""發言時間"", ""sub"": []}, {""main"": ""發言人"", ""sub"": []}, {""main"": ""發言人職稱"", ""sub"": []}, {""main"": ""發言人電話"", ""sub"": []}, {""main"": ""主旨"", ""sub"": []}, {""main"": ""符合條款"", ""sub"": []}, {""main"": ""事實發生日"", ""sub"": []}, {""main"": ""說明"", ""sub"": []}], ""companyAbbreviation"": ""世界""}, ""datetime"": ""115/05/05 17:26:50""}",2026-05-05 17:26:34
1150504|otc|5299|1,115/05/04,18:52:52,5299,杰力,公告本公司參與認購富邦人壽保險股份有限公司一一五年度第一期無擔保次順位普通公司債,公司債,1150504,otc,1,"{""code"": 200, ""message"": ""查詢成功"", ""result"": {""marketName"": ""上櫃公司"", ""companyId"": ""5299"", ""data"": [[1, ""115/05/04"", ""18:52:52"", ""陳倩姮"", ""財務會計主管"", ""03-5600689"", ""公告本公司參與認購富邦人壽保險股份有限公司一一五年度\r\n第一期無擔保次順位普通公司債"", ""20"", ""115/05/06"", ""1.標的物之名稱及性質（屬特別股者，並應標明特別股約定發行條件，如股息率等）:\r\n富邦人壽保險股份有限公司無擔保累積次順位普通公司債\r\n2.事實發生日:115/1/6~115/5/6\r\n3.董事會通過日期: 民國115年4月23日\r\n4.其他核決日期: 不適用\r\n5.交易數量、每單位價格及交易總金額:\r\n本次取得交易單位數量：100張\n每單位價格：新台幣壹百萬元整\n票面利率:3.7%\n交易總金額：新台幣壹億元整\r\n6.交易相對人及其與公司之關係（交易相對人如屬自然人，且非公司之\r\n關係人者，得免揭露其姓名）:\r\n台北富邦銀行；非關係人\r\n7.交易相對人為關係人者，並應公告選定關係人為交易對象之原因及前次移\r\n轉之所有人、前次移轉之所有人與公司及交易相對人間相互之關係、前次\r\n移轉日期及移轉金額:\r\n不適用。\r\n8.交易標的最近五年內所有權人曾為公司之關係人者，尚應公告關係人之取\r\n得及處分日期、價格及交易當時與公司之關係:\r\n不適用。\r\n9.本次係處分債權之相關事項（含處分之債權附隨擔保品種類、處分債權\r\n如有屬對關係人債權者尚需公告關係人名稱及本次處分該關係人之債權\r\n帳面金額:\r\n不適用。\r\n10.處分利益（或損失）（取得有價證券者不適用）（原遞延者應列表說明\r\n認列情形）:\r\n不適用。\r\n11.交付或付款條件（含付款期間及金額）、契約限制條款及其他重要約定\r\n事項:\r\n交付或付款條件：於交割日一次付清。\n契約限制條款及其他重要約定事項：依發行公司之公開說明書所載。\r\n12.本次交易之決定方式、價格決定之參考依據及決策單位:\r\n依發行單位發行價格認購；依公司核決權限辦理\r\n13.取得或處分有價證券標的公司每股淨值:\r\n不適用\r\n14.迄目前為止，累積持有本交易證券（含本次交易）之數量、金額、持股\r\n比例及權利受限情形（如質押情形）:\r\n累計持有本交易證券：\n數量：170張\n累計總金額新台幣為170,280,000元\r\n15.迄目前為止，依「公開發行公司取得或處分資產處理準則」第三條所列\r\n之有價證券投資（含本次交易）占公司最近期財務報表中總資產及歸屬\r\n於母公司業主之權益之比例暨最近期財務報表中營運資金數額（註二）:\r\n佔總資產比例：4.5%\n佔業主權益比例：5.22%\n營運資金數額：NT$1,477,188仟元\r\n16.經紀人及經紀費用:\r\n不適用\r\n17.取得或處分之具體目的或用途:\r\n固定收益投資。\r\n18.本次交易表示異議董事之意見:\r\n無。\r\n19.本次交易為關係人交易:否\r\n20.監察人承認或審計委員會同意日期:\r\n不適用。\r\n21.本次交易會計師出具非合理性意見:不適用\r\n22.會計師事務所名稱:\r\n不適用\r\n23.會計師姓名:\r\n不適用\r\n24.會計師開業證書字號:\r\n不適用\r\n25.是否涉及營運模式變更:否\r\n26.營運模式變更說明:\r\n不適用\r\n27.過去一年及預計未來一年內與交易相對人交易情形:\r\n不適用\r\n28.資金來源:\r\n自有資金\r\n29.前已就同一件事件發布重大訊息日期: 不適用\r\n30.其他敘明事項:\r\n無。""]], ""footer"": [""以上資料均由各公司依發言當時所屬市場別之規定申報後，由本系統對外公佈，資料如有虛偽不實，均由該公司負責。""], ""header"": {""note"": [], ""subTitle"": [], ""mainTitle"": [""公司當日重大訊息之詳細內容""]}, ""titles"": [{""main"": ""序號"", ""sub"": []}, {""main"": ""發言日期"", ""sub"": []}, {""main"": ""發言時間"", ""sub"": []}, {""main"": ""發言人"", ""sub"": []}, {""main"": ""發言人職稱"", ""sub"": []}, {""main"": ""發言人電話"", ""sub"": []}, {""main"": ""主旨"", ""sub"": []}, {""main"": ""符合條款"", ""sub"": []}, {""main"": ""事實發生日"", ""sub"": []}, {""main"": ""說明"", ""sub"": []}], ""companyAbbreviation"": ""杰力""}, ""datetime"": ""115/05/05 17:26:51""}",2026-05-05 17:26:34
1150504|otc|3163|4,115/05/04,20:38:59,3163,波若威,本公司董事會決議以私募方式辦理現金增資發行普通股案,現金增資,1150504,otc,4,"{""code"": 200, ""message"": ""查詢成功"", ""result"": {""marketName"": ""上櫃公司"", ""companyId"": ""3163"", ""data"": [[4, ""115/05/04"", ""20:38:59"", ""張文樵"", ""副總經理"", ""035630099"", ""本公司董事會決議以私募方式辦理現金增資發行普通股案"", ""11"", ""115/05/04"", ""1.董事會決議日期:115/05/04\n2.私募有價證券種類:普通股\n3.私募對象及其與公司間關係:策略性投資人;無。\n4.私募股數或張數:不逾21,000,000股之普通股額度內，一次或分次(最多不超過3次)辦理\n5.得私募額度:依實際私募每股價格計算。\n6.私募價格訂定之依據及合理性:以定價日前1、3或5個營業日擇一計算普通股收盤價簡\n單算數平均數扣除無償配股除權及配息，並加回減資反除權後之股價，或定價日\n前30個營業日普通股收盤價簡單算數平均數扣除無償配股除權及配息，並加回減資\n反除權後之股價，二基準計算價格較高者為參考價格，實際發行價格不得低於參考\n價格之八成。考量私募有價證券之轉讓時點、對象及數量均有嚴格限制，且三年內\n不得洽辦上櫃掛牌，流動性較差等因素，訂定私募價格依據公開發行公司辦理私募\n有價證券應注意事項規定，應屬合理。\n7.本次私募資金用途:為因應公司長期發展需求，擬以私募方式辦理現金增資發行新\n股，以引進策略性投資人，進行產業垂直整合或共同研究開發市場等策略性目標。\n8.不採用公開募集之理由:考量募集資本之時效性、便利性、發行成本，故擬以私\n募方式辦理現金增資發行新股。\n9.獨立董事反對或保留意見:無。\n10.實際定價日:不適用。\n11.參考價格:不適用。\n12.實際私募價格、轉換或認購價格:不適用。\n13.本次私募新股之權利義務:本次私募新股之權利義務與本公司已發行之普通股相同。\n14.附有轉換、交換或認股者，其換股基準日:不適用。\n15.附有轉換、交換或認股者，對股權可能稀釋情形:不適用。\n16.附有轉換或認股者，於私募公司債交付且假設全數轉換或認購普通股後對上櫃普通股\n股權比率之可能影響（上櫃普通股數A、A/已發行普通股）:不適用。\n17.前項預計上櫃普通股未達500萬股且未達25%者，請說明股權流通性偏低之因應措施:\n不適用。\n18.其他應敘明事項:無。""]], ""footer"": [""以上資料均由各公司依發言當時所屬市場別之規定申報後，由本系統對外公佈，資料如有虛偽不實，均由該公司負責。""], ""header"": {""note"": [], ""subTitle"": [], ""mainTitle"": [""公司當日重大訊息之詳細內容""]}, ""titles"": [{""main"": ""序號"", ""sub"": []}, {""main"": ""發言日期"", ""sub"": []}, {""main"": ""發言時間"", ""sub"": []}, {""main"": ""發言人"", ""sub"": []}, {""main"": ""發言人職稱"", ""sub"": []}, {""main"": ""發言人電話"", ""sub"": []}, {""main"": ""主旨"", ""sub"": []}, {""main"": ""符合條款"", ""sub"": []}, {""main"": ""事實發生日"", ""sub"": []}, {""main"": ""說明"", ""sub"": []}], ""companyAbbreviation"": ""波若威""}, ""datetime"": ""115/05/05 17:26:51""}",2026-05-05 17:26:34
1150504|otc|2755|1,115/05/05,13:36:10,2755,揚秦,公告本公司董事會訂定國內第一次無擔保轉換公司債轉換發行新股之增資基準日,公司債,1150504,otc,1,"{""code"": 200, ""message"": ""查詢成功"", ""result"": {""marketName"": ""上櫃公司"", ""companyId"": ""2755"", ""data"": [[1, ""115/05/05"", ""13:36:10"", ""蔡國憲"", ""總經理室專案處長"", ""03-3412298"", ""公告本公司董事會訂定國內第一次\r\n無擔保轉換公司債轉換發行新股之增資基準日"", ""11"", ""115/05/05"", ""1.董事會決議日期:115/05/05\n2.增資資金來源:國內第一次無擔保轉換公司債轉換。\n3.是否採總括申報發行新股(是，請併敘明預定發行期間/否):否\n4.全案發行總金額及股數(如屬盈餘或公積轉增資，發行股數則不含配發給員工部分):\n發行總金額:新台幣3,679,210元\n發行股數: 367,921股\n5.採總括申報發行新股案件，本次發行金額及股數:不適用。\n6.採總括申報發行新股案件，本次發行後，剩餘之金額及股數餘額:不適用。\n7.每股面額:新台幣10元。\n8.發行價格:不適用。\n9.員工認購股數或配發金額:不適用。\n10.公開銷售股數:不適用。\n11.原股東認購或無償配發比例(請註明暫定每仟股認購或配發股數):不適用。\n12.畸零股及逾期未認購股份之處理方式:不適用。\n13.本次發行新股之權利義務:與原流通在外股份相同。\n14.本次增資資金用途:不適用。\n15.其他應敘明事項:\n訂定115年05月06日為公司債轉換普通股之增資基準日\n，並依法令規定辦理相關變更登記事宜。""]], ""footer"": [""以上資料均由各公司依發言當時所屬市場別之規定申報後，由本系統對外公佈，資料如有虛偽不實，均由該公司負責。""], ""header"": {""note"": [], ""subTitle"": [], ""mainTitle"": [""公司當日重大訊息之詳細內容""]}, ""titles"": [{""main"": ""序號"", ""sub"": []}, {""main"": ""發言日期"", ""sub"": []}, {""main"": ""發言時間"", ""sub"": []}, {""main"": ""發言人"", ""sub"": []}, {""main"": ""發言人職稱"", ""sub"": []}, {""main"": ""發言人電話"", ""sub"": []}, {""main"": ""主旨"", ""sub"": []}, {""main"": ""符合條款"", ""sub"": []}, {""main"": ""事實發生日"", ""sub"": []}, {""main"": ""說明"", ""sub"": []}], ""companyAbbreviation"": ""揚秦""}, ""datetime"": ""115/05/05 17:26:52""}",2026-05-05 17:26:34
1150504|otc|2755|5,115/05/05,13:38:42,2755,揚秦,公告本公司113年國內第一次無擔保轉換公司債資金運用計畫項目內容變更,公司債,1150504,otc,5,"{""code"": 200, ""message"": ""查詢成功"", ""result"": {""marketName"": ""上櫃公司"", ""companyId"": ""2755"", ""data"": [[5, ""115/05/05"", ""13:38:42"", ""蔡國憲"", ""總經理室專案處長"", ""03-3412298"", ""公告本公司113年國內第一次無擔保轉換公司債資金運用計畫\r\n項目內容變更"", ""16"", ""115/05/05"", ""1.董事會決議變更日期:115/05/05\n2.原計畫申報生效日期:113/12/17\n3.追補發行日期:不適用\n4.變動原因:本公司113年發行國內第一次無擔保轉換公司債案業經\n金融監督管理委員會民國113年12月17日金管證發字第1130365842號\n函核准申報生效，原資金運用計畫項目二：36,000千元係用於\n「涮金鍋」品牌3家門市展店使用，相關展店支出已於115年第一季\n支用完畢，尚餘3,061千元未支用，為有效利用資金，以提升經營效\n益，經董事會決議通過變更發行國內第一次無擔保轉換公司債之資\n金運用計畫項目內容，將未支用資金變更用途為充實本公司營運資金。\n5.歷次變更前後募集資金計畫:\n(1)變更前\n償還銀行借款：新台幣166,000千元\n展店：新台幣36,000千元\n充實營運資金：2,267千元\n(2)變更後\n償還銀行借款：新台幣166,000千元\n展店：新台幣32,939千元(較變更前減少3,061千元)\n充實營運資金：5,328千元(較變更前增加3,061千元)\n6.預計執行進度:變更後之計畫預計於115年第二季執行完畢。\n7.預計完成日期:115年第二季\n8.預計可能產生效益:預計可節省銀行借款利息支出\n9.與原預計效益產生之差異:\n原計畫用於展店，由於展店計畫皆已完成，故將尚未支用款項變更用途\n為充實營運資金，以支應日常營運需求，節省利息支出。\n10.本次變更對股東權益之影響:無重大影響。\n11.原主辦承銷商評估意見摘要:不適用。\n12.其他應敘明事項:\n本次計畫項目變更致原個別項目金額減少合計數或增加金額合計數，未達所募集資金總\n額之20%以上，故非屬重大計劃變更。""]], ""footer"": [""以上資料均由各公司依發言當時所屬市場別之規定申報後，由本系統對外公佈，資料如有虛偽不實，均由該公司負責。""], ""header"": {""note"": [], ""subTitle"": [], ""mainTitle"": [""公司當日重大訊息之詳細內容""]}, ""titles"": [{""main"": ""序號"", ""sub"": []}, {""main"": ""發言日期"", ""sub"": []}, {""main"": ""發言時間"", ""sub"": []}, {""main"": ""發言人"", ""sub"": []}, {""main"": ""發言人職稱"", ""sub"": []}, {""main"": ""發言人電話"", ""sub"": []}, {""main"": ""主旨"", ""sub"": []}, {""main"": ""符合條款"", ""sub"": []}, {""main"": ""事實發生日"", ""sub"": []}, {""main"": ""說明"", ""sub"": []}], ""companyAbbreviation"": ""揚秦""}, ""datetime"": ""115/05/05 17:26:52""}",2026-05-05 17:26:34
