key,speech_date,speech_time,company_id,company_name,subject,matched_keywords,enterDate,marketKind,serialNumber,detail_json,fetched_at_tw
1150324|sii|4807|1,115/03/25,14:50:57,4807,日成-KY,公告本公司114年現金增資收足股款暨增資基準日,現金增資,1150324,sii,1,"{""code"": 200, ""message"": ""查詢成功"", ""result"": {""marketName"": ""上市公司"", ""companyId"": ""4807"", ""data"": [[1, ""115/03/25"", ""14:50:57"", ""林如茵"", ""總經理"", ""(662)420-7440"", ""公告本公司114年現金增資收足股款暨增資基準日"", ""51"", ""115/03/25"", ""1.事實發生日:115/03/25\n2.公司名稱:日成控股股份有限公司\n3.與公司關係(請輸入本公司或子公司):本公司\n4.相互持股比例:不適用\n5.發生緣由:依據「外國發行人募集與發行有價證券處理準則」第十條第一項\n第一款規定辦理\n(1)本公司114年現金增資發行普通股10,600,000股,每股認購價格新台幣14.2元,\n   實收股款總額新台幣150,520,000元,業已全數收足。\n(2)茲訂定現金增資基準日為115年03月25日。\n(3)預定新股上市日期為115年03月30日。\n6.因應措施:無\n7.其他應敘明事項(若事件發生或決議之主體係屬公開發行以上公司，本則重大訊息同時\n  符合證券交易法施行細則第7條第9款所定對股東權益或證券價格有重大影響之事項):無""]], ""footer"": [""以上資料均由各公司依發言當時所屬市場別之規定申報後，由本系統對外公佈，資料如有虛偽不實，均由該公司負責。""], ""header"": {""note"": [], ""subTitle"": [], ""mainTitle"": [""公司當日重大訊息之詳細內容""]}, ""titles"": [{""main"": ""序號"", ""sub"": []}, {""main"": ""發言日期"", ""sub"": []}, {""main"": ""發言時間"", ""sub"": []}, {""main"": ""發言人"", ""sub"": []}, {""main"": ""發言人職稱"", ""sub"": []}, {""main"": ""發言人電話"", ""sub"": []}, {""main"": ""主旨"", ""sub"": []}, {""main"": ""符合條款"", ""sub"": []}, {""main"": ""事實發生日"", ""sub"": []}, {""main"": ""說明"", ""sub"": []}], ""companyAbbreviation"": ""日成-KY""}, ""datetime"": ""115/03/25 15:34:53""}",2026-03-25 15:34:47
1150325|sii|1727|1,115/03/25,15:00:59,1727,中華化,公告本公司辦理國內第二次無擔保轉換公司債，向金管會申請延長募集期間三個月,公司債,1150325,sii,1,"{""code"": 200, ""message"": ""查詢成功"", ""result"": {""marketName"": ""上市公司"", ""companyId"": ""1727"", ""data"": [[1, ""115/03/25"", ""15:00:59"", ""干凱恩"", ""總經理"", ""03-4761266-12350"", ""公告本公司辦理國內第二次無擔保轉換公司債，\r\n向金管會申請延長募集期間三個月"", ""51"", ""115/03/25"", ""1.事實發生日:115/03/25\n2.公司名稱:臺灣中華化學工業股份有限公司\n3.與公司關係(請輸入本公司或子公司):本公司\n4.相互持股比例:不適用\n5.發生緣由:\n (1)本公司發行國內第二次無擔保轉換公司債，每張面額新臺幣100,000元，\n 發行總面額上限新臺幣600,000,000元，業經金管會115年1月14日金管證發字\n 第1140369068號函同意申報生效在案。\n (2)本公司考量近期國際政經情勢變化較劇，致資本市場行情變化不定，\n 為尋求較佳發行時點並順利完成資金募集，以維護股東權益，故擬向金融監督\n 管理委員會申請延長募集期間三個月。\n6.因應措施:無。\n7.其他應敘明事項(若事件發生或決議之主體係屬公開發行以上公司，本則重大訊息同時\n  符合證券交易法施行細則第7條第9款所定對股東權益或證券價格有重大影響之事項):\n 無。""]], ""footer"": [""以上資料均由各公司依發言當時所屬市場別之規定申報後，由本系統對外公佈，資料如有虛偽不實，均由該公司負責。""], ""header"": {""note"": [], ""subTitle"": [], ""mainTitle"": [""公司當日重大訊息之詳細內容""]}, ""titles"": [{""main"": ""序號"", ""sub"": []}, {""main"": ""發言日期"", ""sub"": []}, {""main"": ""發言時間"", ""sub"": []}, {""main"": ""發言人"", ""sub"": []}, {""main"": ""發言人職稱"", ""sub"": []}, {""main"": ""發言人電話"", ""sub"": []}, {""main"": ""主旨"", ""sub"": []}, {""main"": ""符合條款"", ""sub"": []}, {""main"": ""事實發生日"", ""sub"": []}, {""main"": ""說明"", ""sub"": []}], ""companyAbbreviation"": ""中華化""}, ""datetime"": ""115/03/25 15:34:54""}",2026-03-25 15:34:47
1150325|otc|4139|1,115/03/25,14:42:42,4139,馬光-KY,公告本公司115年1月份自結合併財務報告之負債比率、流動比率及速動比率,自結合併,1150325,otc,1,"{""code"": 200, ""message"": ""查詢成功"", ""result"": {""marketName"": ""上櫃公司"", ""companyId"": ""4139"", ""data"": [[1, ""115/03/25"", ""14:42:42"", ""于倩"", ""總經理"", ""(07)555-0864"", ""公告本公司115年1月份自結合併財務報告之\r\n負債比率、流動比率及速動比率"", ""53"", ""115/03/25"", ""1.事實發生日:115/03/25\n2.發生緣由:依櫃買中心證櫃監字第1120200683號函要求辦理公告\n3.財務資訊年度月份:115/02\n4.自結流動比率:50.47%\n5.自結速動比率:40.92%\n6.自結負債比率:65.65%\n7.因應措施:每月底前公告本公司上月份自結合併財務報告之負債比率、\n流動比率及速動比率。\n8.其他應敘明事項:無。""]], ""footer"": [""以上資料均由各公司依發言當時所屬市場別之規定申報後，由本系統對外公佈，資料如有虛偽不實，均由該公司負責。""], ""header"": {""note"": [], ""subTitle"": [], ""mainTitle"": [""公司當日重大訊息之詳細內容""]}, ""titles"": [{""main"": ""序號"", ""sub"": []}, {""main"": ""發言日期"", ""sub"": []}, {""main"": ""發言時間"", ""sub"": []}, {""main"": ""發言人"", ""sub"": []}, {""main"": ""發言人職稱"", ""sub"": []}, {""main"": ""發言人電話"", ""sub"": []}, {""main"": ""主旨"", ""sub"": []}, {""main"": ""符合條款"", ""sub"": []}, {""main"": ""事實發生日"", ""sub"": []}, {""main"": ""說明"", ""sub"": []}], ""companyAbbreviation"": ""馬光-KY""}, ""datetime"": ""115/03/25 15:34:55""}",2026-03-25 15:34:47
1150325|otc|4804|1,115/03/25,15:02:10,4804,大略-KY,公告本公司董事會決議114年第五次私募普通股定價及應募人資訊,私募普通股,1150325,otc,1,"{""code"": 200, ""message"": ""查詢成功"", ""result"": {""marketName"": ""上櫃公司"", ""companyId"": ""4804"", ""data"": [[1, ""115/03/25"", ""15:02:10"", ""張右坪"", ""無"", ""(02)2701-1052"", ""公告本公司董事會決議114年第五次私募普通股定價及\r\n應募人資訊"", ""11"", ""115/03/25"", ""1.董事會決議日期:115/03/25\n2.私募有價證券種類:普通股\n3.私募對象及其與公司間關係:\n(1)符合證券交易法第43條之6及及金融監督管理委員會112年9月12日金管證發字第\n1120383220號令規定之特定人。\n(2)股東會通過得私募之內部人：華龍國際投資有限公司-本公司法人董事\n4.私募股數或張數:不超過普通股30,000,000股\n5.得私募額度:本公司於114年06月27日股東會決議通過於一年內分五次辦理私募普通股\n100,000,000股。上述私募發行普通股，經114年7月18日、114年12月12日及114年12月\n26日董事會審議通過及定價，並完成共計22,989,000股私募普通股發行，於扣除前述\n已發行股數後，本次可發行總股數上限為77,011,000股。\n6.私募價格訂定之依據及合理性:\n(1)私募普通股之價格：以115年3月25日董事會為定價日，不得低於定價日前1、3或5\n個營業日擇一計算普通股收盤價簡單算數平均數扣除無償配股除權及配息，並加回減\n資反除權後之股價，或定價日前30個營業日普通股收盤價簡單算數平均數扣除無償配\n股除權及配息，並加回減資反除權後之股價，二基準計算價格較高者之八成訂定之。\n私募普通股價格為每股新台幣5.00元。\n(2)本次私募普通股實際發行價格之訂定係參考本公司營運狀況、未來展望以及最近股\n價情形，並依據「公開發行公司辦理私募有價證券應注意事項」辦理之，故其價格之訂\n定應有其合理性。\n7.本次私募資金用途:展開台灣地區業務及充實營運資金。\n8.不採用公開募集之理由:考量籌資所需資金之時效性、便利性及可行性，故擬以私募方\n式於適當時機向特定人籌措資金，以達到迅速挹注所需資金之目的，以維繫公司營運及\n維護股東權益。\n9.獨立董事反對或保留意見:無。\n10.實際定價日:115/03/25\n11.參考價格:每股新台幣5.701元\n12.實際私募價格、轉換或認購價格:每股新台幣5.00元\n13.本次私募新股之權利義務:原則上與本公司已發行之普通股相同，惟本次私募之普通\n股於交付日起三年內除依據證券交易法第四十三條之八規定外，均不得自由轉讓，並於\n私募普通股交付日滿三年之後，依相關法令規定申請補辦公開發行程序及上市（櫃）交\n易。\n14.附有轉換、交換或認股者，其換股基準日:不適用。\n15.附有轉換、交換或認股者，對股權可能稀釋情形:不適用。\n16.附有轉換或認股者，於私募公司債交付且假設全數轉換或認購普通股後對上櫃普通股\n股權比率之可能影響（上櫃普通股數A、A/已發行普通股）:不適用。\n17.前項預計上櫃普通股未達500萬股且未達25%者，請說明股權流通性偏低之因應措施:\n不適用。\n18.其他應敘明事項:\n(1)為配合本次私募普通股，授權董事長或其指定之對象，對外代表本公司簽署、商議、\n變更一切有關之契約及文件，如有其他未盡事宜即因法令修正或主管機關要求而有所\n變更之必要時，授權董事長全權處理之。\n(2)董事會授權董事長決定本次私募之應募對象及其應募金額。\n(3)本次私募之股款繳納期限為115年3月25日至115年4月8日止。\n(4)如預期無法於期限內辦理完成本次全數私募股數，但原計畫仍屬可行時，則視為已\n收足私募有價證券之股款，且本次未發行之股數得與後續預計發行股數併同發行，惟\n合計發行總股數不得超過114年06月27日股東會決議通過之總股數上限。\n(5)私募增資基準日：115/04/08。\n   (實際作業時程如有變動時，授權董事長視實際情形調整)""]], ""footer"": [""以上資料均由各公司依發言當時所屬市場別之規定申報後，由本系統對外公佈，資料如有虛偽不實，均由該公司負責。""], ""header"": {""note"": [], ""subTitle"": [], ""mainTitle"": [""公司當日重大訊息之詳細內容""]}, ""titles"": [{""main"": ""序號"", ""sub"": []}, {""main"": ""發言日期"", ""sub"": []}, {""main"": ""發言時間"", ""sub"": []}, {""main"": ""發言人"", ""sub"": []}, {""main"": ""發言人職稱"", ""sub"": []}, {""main"": ""發言人電話"", ""sub"": []}, {""main"": ""主旨"", ""sub"": []}, {""main"": ""符合條款"", ""sub"": []}, {""main"": ""事實發生日"", ""sub"": []}, {""main"": ""說明"", ""sub"": []}], ""companyAbbreviation"": ""大略-KY""}, ""datetime"": ""115/03/25 15:34:55""}",2026-03-25 15:34:47
1150324|rotc|7822|2,115/03/24,17:36:22,7822,倍利科,公告本公司股票初次上市前現金增資員工認購股款催繳事宜,現金增資,1150324,rotc,2,"{""code"": 200, ""message"": ""查詢成功"", ""result"": {""marketName"": ""興櫃公司"", ""companyId"": ""7822"", ""data"": [[2, ""115/03/24"", ""17:36:22"", ""黃建中"", ""總經理"", ""03-6233089"", ""公告本公司股票初次上市前現金增資員工認購股款催繳事宜"", ""44"", ""115/03/24"", ""1.事實發生日:115/03/24\n2.公司名稱:倍利科技股份有限公司\n3.與公司關係(請輸入本公司或子公司):本公司\n4.相互持股比例:不適用\n5.發生緣由:本公司股票初次上市前現金增資員工認股繳款期限已於115年03月24日下午\n3時30分截止，惟有部份員工尚未繳納現金增資股款，依法辦理催告。\n6.因應措施:\n(1)依公司法第267條第1項準用同法第142條之規定辦理，自115年03月27日起至115年\n04月27日下午3時30分止為股款催繳期間。\n(2)尚未繳款之員工，須於上述期間內持原繳款書至兆豐國際商業銀行北新竹分行及全台\n各分行辦理繳款，逾期仍未繳款者即喪失認購新股之權利。\n(3)於催繳期間繳款之員工，俟催繳期間屆滿並經集保公司作業後，依其認購股數撥入\n認股人登記之集保帳戶。\n7.其他應敘明事項(若事件發生或決議之主體係屬公開發行以上公司，\n本則重大訊息同時符合證券交易法施行細則第7條第9款所定\n對股東權益或證券價格有重大影響之事項):無""]], ""footer"": [""以上資料均由各公司依發言當時所屬市場別之規定申報後，由本系統對外公佈，資料如有虛偽不實，均由該公司負責。""], ""header"": {""note"": [], ""subTitle"": [], ""mainTitle"": [""公司當日重大訊息之詳細內容""]}, ""titles"": [{""main"": ""序號"", ""sub"": []}, {""main"": ""發言日期"", ""sub"": []}, {""main"": ""發言時間"", ""sub"": []}, {""main"": ""發言人"", ""sub"": []}, {""main"": ""發言人職稱"", ""sub"": []}, {""main"": ""發言人電話"", ""sub"": []}, {""main"": ""主旨"", ""sub"": []}, {""main"": ""符合條款"", ""sub"": []}, {""main"": ""事實發生日"", ""sub"": []}, {""main"": ""說明"", ""sub"": []}], ""companyAbbreviation"": ""倍利科""}, ""datetime"": ""115/03/25 15:34:56""}",2026-03-25 15:34:47
1150324|rotc|7899|3,115/03/24,17:39:56,7899,景美,公告本公司董事會通過擬辦理初次上市(櫃)掛牌前之現金增資，並提請全體股東放棄優先認購權案,現金增資,1150324,rotc,3,"{""code"": 200, ""message"": ""查詢成功"", ""result"": {""marketName"": ""興櫃公司"", ""companyId"": ""7899"", ""data"": [[3, ""115/03/24"", ""17:39:56"", ""鄭雅文"", ""品牌總經理"", ""02-22671886"", ""公告本公司董事會通過擬辦理初次上市(櫃)掛牌前之現金增資，\r\n並提請全體股東放棄優先認購權案"", ""9"", ""115/03/24"", ""1.董事會決議日期:115/03/24\n2.增資資金來源:現金增資\n3.發行股數(如屬盈餘或公積轉增資，則不含配發給員工部分):未定\n4.每股面額:新台幣10元\n5.發行總金額:未定\n6.發行價格:未定\n7.員工認購股數或配發金額:依公司法第267條規定，保留發行新股之10%~15%。\n8.公開銷售股數:未定\n9.原股東認購或無償配發比例(請註明暫定每仟股認購或配發股數):\n原有股東放棄優先認購權以供全數提撥辦理公開承銷之用。\n10.畸零股及逾期未認購股份之處理方式:\n員工放棄認購或認購不足部分授權董事長洽特定人認購之。\n11.本次發行新股之權利義務:本次現金增資發行新股其權利義務與已發行股份相同。\n12.本次增資資金用途:供本公司初次上市（櫃）前提出公開承銷之新股來源。\n13.其他應敘明事項:本次現金增資擬俟主管機關核准上市（櫃）後，\n於適當時機辦理現金增資發行新股；另本次增資新股之發行條件、發行股數、\n發行金額暨其他相關事宜如經主管機關修正、或為因應客觀環境而需變更時，\n擬提請股東會授權董事會全權處理之。""]], ""footer"": [""以上資料均由各公司依發言當時所屬市場別之規定申報後，由本系統對外公佈，資料如有虛偽不實，均由該公司負責。""], ""header"": {""note"": [], ""subTitle"": [], ""mainTitle"": [""公司當日重大訊息之詳細內容""]}, ""titles"": [{""main"": ""序號"", ""sub"": []}, {""main"": ""發言日期"", ""sub"": []}, {""main"": ""發言時間"", ""sub"": []}, {""main"": ""發言人"", ""sub"": []}, {""main"": ""發言人職稱"", ""sub"": []}, {""main"": ""發言人電話"", ""sub"": []}, {""main"": ""主旨"", ""sub"": []}, {""main"": ""符合條款"", ""sub"": []}, {""main"": ""事實發生日"", ""sub"": []}, {""main"": ""說明"", ""sub"": []}], ""companyAbbreviation"": ""景美""}, ""datetime"": ""115/03/25 15:34:58""}",2026-03-25 15:34:47
1150324|rotc|5267|3,115/03/24,18:05:01,5267,龍翩,公告本公司董事會決議買回庫藏股事宜,庫藏股,1150324,rotc,3,"{""code"": 200, ""message"": ""查詢成功"", ""result"": {""marketName"": ""興櫃公司"", ""companyId"": ""5267"", ""data"": [[3, ""115/03/24"", ""18:05:01"", ""楊吉祥"", ""法人董事之代表人"", ""(04)26595018"", ""公告本公司董事會決議買回庫藏股事宜"", ""41"", ""115/03/24"", ""1.董事會決議日期:115/03/24\n2.買回股份目的:為轉讓股份予員工\n3.買回股份種類:普通股\n4.買回股份總金額上限(元):新臺幣20,220,000元整\n5.預定買回之期間:115/03/25~115/05/22\n6.預定買回之數量(股):500,000股\n7.買回區間價格(元):預定買回區間價格每股新臺幣17.99元至40.44元間\n，惟當公司股價低於所定區間價格下限時，公司將繼續執行買回股份。\n8.買回方式:自興櫃市場買回。\n9.預定買回股份占公司已發行股份總數之比率(%):1.98%\n10.申報時已持有本公司股份之累積股數(股):199,000股\n11.申報前三年內買回公司股份之情形:\n買回次數：第1次\n實際買回股份期間：114/04/21~114/05/29\n實際買回數量(股)：112,000股。\n實際買回總金額(元):新臺幣3,518,399元整\n買回次數：第2次\n實際買回股份期間：114/09/10~114/10/23\n實際買回數量(股)：87,000股。\n實際買回總金額(元):新臺幣2,620,743元整\n12.已申報買回但未執行完畢之情形:無。\n13.其他應敘明事項:無。""]], ""footer"": [""以上資料均由各公司依發言當時所屬市場別之規定申報後，由本系統對外公佈，資料如有虛偽不實，均由該公司負責。""], ""header"": {""note"": [], ""subTitle"": [], ""mainTitle"": [""公司當日重大訊息之詳細內容""]}, ""titles"": [{""main"": ""序號"", ""sub"": []}, {""main"": ""發言日期"", ""sub"": []}, {""main"": ""發言時間"", ""sub"": []}, {""main"": ""發言人"", ""sub"": []}, {""main"": ""發言人職稱"", ""sub"": []}, {""main"": ""發言人電話"", ""sub"": []}, {""main"": ""主旨"", ""sub"": []}, {""main"": ""符合條款"", ""sub"": []}, {""main"": ""事實發生日"", ""sub"": []}, {""main"": ""說明"", ""sub"": []}], ""companyAbbreviation"": ""龍翩""}, ""datetime"": ""115/03/25 15:34:59""}",2026-03-25 15:34:47
1150324|rotc|2237|1,115/03/24,18:59:54,2237,華德動能,本公司董事會決議辦理初次創新板上市掛牌前現金增資發行新股案,現金增資,1150324,rotc,1,"{""code"": 200, ""message"": ""查詢成功"", ""result"": {""marketName"": ""興櫃公司"", ""companyId"": ""2237"", ""data"": [[1, ""115/03/24"", ""18:59:54"", ""楊誌榮"", ""總經理(桃園廠)"", ""03-381-1863"", ""本公司董事會決議辦理初次創新板上市掛牌前現金增資發行新股案"", ""9"", ""115/03/05"", ""1.董事會決議日期:115/03/05\n2.增資資金來源:現金增資發行新股\n3.發行股數(如屬盈餘或公積轉增資，則不含配發給員工部分):7,165,000股\n4.每股面額:新台幣10元\n5.發行總金額:視實際發行價格而定\n6.發行價格:每股發行價格區間暫定為新台幣30元，惟實際發行價格及公開承銷之方式\n授權董事長依相關法令及當時市場情形與證券承銷商共同議定之。\n7.員工認購股數或配發金額:依公司法第267條規定，保留本次發行股數百分之十，計\n716,500股由本公司員工承購。\n8.公開銷售股數:6,448,500股\n9.原股東認購或無償配發比例(請註明暫定每仟股認購或配發股數):依公司法第267條\n規定，保留本次發行股數百分之十，計716,500股由員工認購，其餘90%計6,448,500\n股，依證券交易法第28-1條規定與本公司113年6月13日股東會決議通過，原股東放棄\n優先認購權利辦理上市前之公開承銷，不受公司法267條第三項原股東優先認購權利\n規定之限制。\n10.畸零股及逾期未認購股份之處理方式:(1)員工認購不足或放棄認購之部分，擬授\n權董事長洽特定人認購。\n(2)對外公開承銷認購不足部分，擬依「中華民國證券商業同業公會證券商承銷或再\n行銷售有價證券處理辦法」規定辦理之。\n11.本次發行新股之權利義務:與已發行股份之權利義務相同。\n12.本次增資資金用途:充實營運資金\n13.其他應敘明事項:(1) 本案俟呈報主管機關核准後，授權董事長訂定增資基準日、\n掛牌日及辦理其他現金增資發行新股及股票上市相關作業事宜。""]], ""footer"": [""以上資料均由各公司依發言當時所屬市場別之規定申報後，由本系統對外公佈，資料如有虛偽不實，均由該公司負責。""], ""header"": {""note"": [], ""subTitle"": [], ""mainTitle"": [""公司當日重大訊息之詳細內容""]}, ""titles"": [{""main"": ""序號"", ""sub"": []}, {""main"": ""發言日期"", ""sub"": []}, {""main"": ""發言時間"", ""sub"": []}, {""main"": ""發言人"", ""sub"": []}, {""main"": ""發言人職稱"", ""sub"": []}, {""main"": ""發言人電話"", ""sub"": []}, {""main"": ""主旨"", ""sub"": []}, {""main"": ""符合條款"", ""sub"": []}, {""main"": ""事實發生日"", ""sub"": []}, {""main"": ""說明"", ""sub"": []}], ""companyAbbreviation"": ""華德動能""}, ""datetime"": ""115/03/25 15:35:00""}",2026-03-25 15:34:47
1150323|rotc|7772|2,115/03/25,14:16:04,7772,耀穎,公告本公司辦理初次上櫃掛牌前現金增資發行新股,現金增資,1150323,rotc,2,"{""code"": 200, ""message"": ""查詢成功"", ""result"": {""marketName"": ""興櫃公司"", ""companyId"": ""7772"", ""data"": [[2, ""115/03/25"", ""14:16:04"", ""甘炎恩"", ""總經理特別助理"", ""(03)323-8118"", ""公告本公司辦理初次上櫃掛牌前現金增資發行新股"", ""9"", ""115/03/25"", ""1.董事會決議日期:115/03/25\n2.增資資金來源:現金增資發行新股\n3.發行股數(如屬盈餘或公積轉增資，則不含配發給員工部分): 2,420,000股\n4.每股面額:10元\n5.發行總金額:24,200,000元(以總面額計算)\n6.發行價格:暫定發行價格為每股新臺幣65元溢價發行，實際發行需依公開承銷時之\n 新股承銷價而定，惟向金融監督管理委員會委託之機構申報之實際發行價格擬授權董\n 事長參酌市場狀況，並依相關證券法令與主辦證券承銷商共同議定之。\n7.員工認購股數或配發金額: 363,000股\n8.公開銷售股數:2,057,000股\n9.原股東認購或無償配發比例(請註明暫定每仟股認購或配發股數):\n依公司法第267條規定，保留發行新股總數之15%，計363,000股由本公司員工認購，\n其餘85%計2,057,000股依證券交易法第28條之1規定及本公司民國113年10月18日股東臨\n會之決議，由原股東放棄優先認股之權利，全數提撥供本公司辦理上櫃前之公開承銷，\n不受公司法第267條關於原股東優先分認之限制。\n10.畸零股及逾期未認購股份之處理方式:\n(1)員工認購不足或放棄認購部分，授權董事長洽特定人認購之。\n(2)對外公開承銷認購不足部分，依「中華民國證券商業同業公會證券承銷或再行銷售\n有價證券處理辦法」規定辦理。\n11.本次發行新股之權利義務:\n本次增資發行之新股，其權利義務與已發行普通股相同，並採無實體發行。\n12.本次增資資金用途:充實營運資金。\n13.其他應敘明事項:\n(1)本次現金增資案俟主管機關申報生效後，授權董事長訂定增資基準日及\n繳款期間等發行新股之相關事宜。\n(2)本次現金增資發行新股所定發行股份、發行價格、發行條件及其他相關事項，如\n因法律規定或主管機關要求，基於營運評估或是客觀環境需予修正變更時，授權\n董事長全權處理。""]], ""footer"": [""以上資料均由各公司依發言當時所屬市場別之規定申報後，由本系統對外公佈，資料如有虛偽不實，均由該公司負責。""], ""header"": {""note"": [], ""subTitle"": [], ""mainTitle"": [""公司當日重大訊息之詳細內容""]}, ""titles"": [{""main"": ""序號"", ""sub"": []}, {""main"": ""發言日期"", ""sub"": []}, {""main"": ""發言時間"", ""sub"": []}, {""main"": ""發言人"", ""sub"": []}, {""main"": ""發言人職稱"", ""sub"": []}, {""main"": ""發言人電話"", ""sub"": []}, {""main"": ""主旨"", ""sub"": []}, {""main"": ""符合條款"", ""sub"": []}, {""main"": ""事實發生日"", ""sub"": []}, {""main"": ""說明"", ""sub"": []}], ""companyAbbreviation"": ""耀穎""}, ""datetime"": ""115/03/25 15:35:00""}",2026-03-25 15:34:47
