key,speech_date,speech_time,company_id,company_name,subject,matched_keywords,enterDate,marketKind,serialNumber,detail_json,fetched_at_tw
1150327|sii|6414|4,115/03/27,17:37:30,6414,樺漢,公告本公司董事會決議第二次買回庫藏股事宜,庫藏股,1150327,sii,4,"{""code"": 200, ""message"": ""查詢成功"", ""result"": {""marketName"": ""上市公司"", ""companyId"": ""6414"", ""data"": [[4, ""115/03/27"", ""17:37:30"", ""莊宗憲"", ""財務長"", ""02-5590-8050"", ""公告本公司董事會決議第二次買回庫藏股事宜"", ""35"", ""115/03/27"", ""1.董事會決議日期:115/03/27\r\n2.買回股份目的:轉讓股份予員工\r\n3.買回股份種類:普通股\r\n4.買回股份總金額上限(元):24,078,682,000\r\n5.預定買回之期間:115/03/30~115/05/29\r\n6.預定買回之數量(股):1,000,000\r\n7.買回區間價格(元):240.00~320.00，公司股價低於區間價格下限，將繼續買回\r\n8.買回方式:自集中交易市場買回\r\n9.預定買回股份占公司已發行股份總數之比率(%):0.69\r\n10.申報時已持有本公司股份之累積股數(股):0\r\n11.申報前三年內買回公司股份之情形:\r\n無買回\r\n12.已申報買回但未執行完畢之情形:\r\n第一次預計買回1,500,000股，實際買回1,000,000股\r\n未執行完畢原因：為有效運用資金，故未予以執行完畢。\r\n13.董事會決議買回股份之會議紀錄:\r\n案  由：\t本公司擬買回公司股份轉讓予員工案，提請　討論。\r\n說  明：\t\r\n一、依「證券交易法」第二十八條之二第一項第一款及「上市上櫃公司買回本公司股份辦法」之規定\r\n辦理。\r\n二、為激勵員工士氣留任優秀人才，並積極配合主管機關政策需要，本公司擬自集中交易市場買回公\r\n司股份作為轉讓予員工之股票來源，相關內容說明如下：\r\n(一)買回股份之目的：轉讓股份予員工。\r\n(二)買回股份之種類：普通股。\r\n(三)買回股份之總股數上限：14,588仟股。\r\n(四)買回股份之總金額上限(保留盈餘加發行股份溢價加已實現資本公積扣除已決議分派盈餘）：新\r\n台幣24,078,682,000元。\r\n(五)預計買回之期間及數量：本公司預定本次買回1,000仟股，並視公司資金運作需要自115年3月\r\n30日至115年5月29日止執行完畢。\r\n(六)買回之區間價格：預計買回每股價格為新台幣240元至320元。\r\n惟當公司股價低於所定買回區間價格下限時，將繼續執行買回股份。\r\n(七)買回之方式：自集中交易市場買回。\r\n三、本次預定買回本公司股份總數僅占本公司已發行股份之0.69%，且買回股份所需金額上限僅占本\r\n公司114年第4季財務報告流動資產之0.3%，經評估已考量公司財務狀況並出具不影響本公司資本\r\n維持之聲明書，請參閱附件。\r\n四、委請凱基證券對本公司本次買回股份價格之合理性出具評估意見，請參閱附件。\r\n五、本公司已編製樺漢科技第二次買回股份轉讓員工辦法，請參閱附件。\r\n六、本次執行買回本公司股份案，若因法令修改或主管機關規定及基於營運評估或客觀環境之影響變\r\n更或修正時，擬請董事會授權董事長全權處理之。\r\n七、將依規定於董事會通過後公告，並向主管機關辦理申報作業。\r\n八、本案業經審計委員會決議通過，依法提請董事會決議。\r\n決  議：本案經主席徵詢全體出席董事同意照案通過。\r\n14.「上市上櫃公司買回本公司股份辦法」第十條規定之轉讓辦法:\r\n樺漢科技股份有限公司第二次買回股份轉讓員工辦法\r\n\r\n第一條：\t本公司為激勵員工及留任優秀人才，依據證券交易法第28條之2第1項第1款及金融監督管\r\n理委員會發布之「上市上櫃公司買回本公司股份辦法」等相關規定，訂定本公司買回股份轉讓員工辦\r\n法。本公司買回股份轉讓予員工，除依有關法令規定外，悉依本辦法規定辦理。\r\n第二條：\t本次轉讓予員工之股份為普通股，其權利義務除有關法令及本辦法另有規定者外，與其他\r\n流通在外普通股相同。\r\n第三條：\t本次買回之股份，得依本辦法之規定，自買回股份之日起五年內，一次或分次轉讓予員\r\n工。\r\n第四條：\t凡於員工認股基準日仍在職（以本公司及從屬公司正式編制內之全職員工為限）之正式員\r\n工，得依本辦法第五條所定認購數額，享有認購資格。\r\n第五條：\t依據員工職等、服務&#63886;資及對公司之特殊貢獻等標準，並須兼顧認股基準日時公司持有之\r\n買回股份總額及單一員工認購股&#63849;之上限等因素，訂定實際得為認股權人之員工及得認股之數量，經\r\n由董事長核定後，提報審計委員會及董事會通過；惟具經理人身分、具員工身分之董事者，應提報薪\r\n資報酬委員會及董事會通過。\r\n第六條：\t本次買回股份轉讓予員工之作業程序：\r\n一、依董事會之決議，公告、申報並於執行期限內買回本公司股份。\r\n二、董事會依本辦法訂定及公布員工認股基準日、得認購股數、認購繳款期間、權利內容及限制條件\r\n等作業事項。\r\n三、統計實際認購繳款股數，辦理股票轉讓過戶登記。\r\n第七條：\t本次買回股份轉讓予員工，以實際買回之平均價格為轉讓價格。惟轉讓前，如遇公司已發\r\n行之普通股股份增加或減少，得按發行股份增減比率調整之。\r\n轉讓價格調整公式： \r\n調整後轉讓價格 = 實際買回股份之平均價格X(申報買回股份時已發行之普通股總數÷轉讓買回股份\r\n予員工前已發行之普通股總數)\r\n上列公式：已發行股數係指普通股已發行股份總數減除本公司買回惟尚未註銷或轉讓之庫藏股股數。\r\n第八條：\t本次買回股份轉讓予員工並辦理過戶登記後，除另有規定者外，餘權利義務與原有股份相\r\n同。\r\n第九條：\t本次買回之股份，應自買回之日起五年內全數轉讓與員工，逾期未轉讓部分，視為本公司\r\n未發行股份，應依法辦理註銷股份變更登記。\r\n轉讓之對象於員工認股基準日至認購繳款截止日期間離職者，喪失認購資格。\r\n員工於繳款期限屆滿而未認購繳款者，視為棄權論；認購不足之餘額，授權董事長另洽其他員工認購\r\n之。\r\n第十條：\t公司可斟酌需要與員工約定相關權利義務事項，惟不得違反證券交易法及公司法等相關法\r\n令規定。\r\n第十一條：本辦法經董事會決議通過後生效，並得報經董事會決議修訂。\r\n15.「上市上櫃公司買回本公司股份辦法」第十一條規定之轉換或認股辦法:\r\n不適用\r\n16.董事會已考慮公司財務狀況，不影響公司資本維持之聲明:\r\n樺漢科技股份有限公司董事會聲明書\r\n\r\n一、本公司經民國115年3月27日第十一屆第七次董事會三分之二以上董事之出席及出席董事超過二\r\n分之一之同意通過，自申報日起二個月內於集中交易市場買回本公司股份1,000,000股。\r\n二、上述買回股份總數，僅占本公司已發行股份之0.69%，且買回股份所需金額上限僅占本公司114\r\n年度財務報告流動資產之0.3%，茲聲明本公司董事會已考慮公司財務狀況，上述股份之買回並不影\r\n響本公司資本之維持。\r\n三、本聲明書業經本公司上述同次董事會議通過，出席董事七人同意本聲明書之內容，併此聲明。\r\n17.會計師或證券承銷商對買回股份價格之合理性評估意見:\r\n凱基證券股份有限公司評估本次買回公司股份訂定之價格區間，其決策過程具合法性，價格區間之訂定\r\n及對公司財務之影響亦尚屬合理，尚無重大異常情事。\r\n18.其他證期局所規定之事項:\r\n無。""]], ""footer"": [""以上資料均由各公司依發言當時所屬市場別之規定申報後，由本系統對外公佈，資料如有虛偽不實，均由該公司負責。""], ""header"": {""note"": [], ""subTitle"": [], ""mainTitle"": [""公司當日重大訊息之詳細內容""]}, ""titles"": [{""sub"": [], ""main"": ""序號""}, {""sub"": [], ""main"": ""發言日期""}, {""sub"": [], ""main"": ""發言時間""}, {""sub"": [], ""main"": ""發言人""}, {""sub"": [], ""main"": ""發言人職稱""}, {""sub"": [], ""main"": ""發言人電話""}, {""sub"": [], ""main"": ""主旨""}, {""sub"": [], ""main"": ""符合條款""}, {""sub"": [], ""main"": ""事實發生日""}, {""sub"": [], ""main"": ""說明""}], ""companyAbbreviation"": ""樺漢""}, ""datetime"": ""115/03/28 23:31:19""}",2026-03-28 23:31:17
1150327|sii|2406|4,115/03/27,21:37:57,2406,國碩,公告本公司董事會決議辦理私募普通股,私募普通股,1150327,sii,4,"{""code"": 200, ""message"": ""查詢成功"", ""result"": {""marketName"": ""上市公司"", ""companyId"": ""2406"", ""data"": [[4, ""115/03/27"", ""21:37:57"", ""陳繼明"", ""董事長"", ""03-5985510"", ""公告本公司董事會決議辦理私募普通股"", ""11"", ""115/03/27"", ""1.董事會決議日期:115/03/27\n2.私募有價證券種類:普通股\n3.私募對象及其與公司間關係:\n (1)依證券交易法第43 條之6規定選擇特定人，以策略性投資人為限。\n (2)應募人為策略性投資人時，以協助本公司提升競爭優勢，擴大業務及產品市場，對\n 本公司未來營運產生直接或間接助益為之，並以符合主管機關規定之各項特定人中選\n 定之。。\n (3)本公司目前尚無已洽定之特定人，洽定特定人之相關事宜，擬提請股東常會授權董\n 事會全權處理。\n4.私募股數或張數:擬提請股東會授權董事會，發行股數不超過15,000仟股額度內私募普\n 通股。\n5.得私募額度:不超過15,000仟股。\n6.私募價格訂定之依據及合理性:\n私募價格之訂定，除考量證券交易法對私募有價證券有三年轉讓限制外，係參考相關法\n令規範及下述參考價格而定，應屬合理。\n本次私募普通股現金增資價格之訂定，以定價日前一、三或五個營業日擇一計算本公司\n普通股收盤價之簡單算數平均數扣除無償配股除權及配息，並加回減資反除權後之股\n價，以及定價日前三十個營業日本公司普通股收盤價之簡單算數平均數扣除無償配股除\n權及配息，並加回減資反除權後平均每股股價，孰高者為參考價格，私募普通股每股價\n格之訂定不低於參考價格之八成。實際定價日及實際私募價格於不低於股東會決議之範\n圍內授權董事會視日後洽特定人情形決定之。\n7.本次私募資金用途:本公司為充實營運資金、償還銀行借款及強化競爭力。\n8.不採用公開募集之理由:考量因採私募方式相對具時效性、便利性、發行成本及股權穩\n 定等因素，另私募有價證券三年內不得轉讓之規定將更可確保公司與策略性投資夥伴\n 間之長期合作關係，故不採用公開募集而以私募方式辦理現金增資發行新股。\n9.獨立董事反對或保留意見:無。\n10.實際定價日:尚未訂定。\n11.參考價格:尚未訂定。\n12.實際私募價格、轉換或認購價格:尚未訂定。\n13.本次私募新股之權利義務:本次私募普通股除受證券交易法第43條之8規定之轉讓限制\n 外，其權利義務與已發行之普通股相同。本私募普通股於交付後三年內，除符合法令\n 規定之特定情形外不得自由轉讓；本公司亦擬於該私募普通股交付滿三年後，依相關\n 法令規定向主管機關申請補辦公開發行及上市交易。\n14.附有轉換、交換或認股者，其換股基準日:不適用。\n15.附有轉換、交換或認股者，對股權可能稀釋情形:不適用。\n16.附有轉換或認股者，於私募公司債交付且假設全數轉換或認購普通股後對\n上市普通股股權比率之可能影響（上市普通股數A、A/已發行普通股):不適用。\n17.前項預計上市普通股未達6000萬股且未達25%者，請說明股權流通性偏低之因應措施:\n 不適用。\n18.其他應敘明事項:\n (1) 本案之重要內容，包括發行總額、發行條件、計畫項目、預定資金運用進度、預\n     計可能產生效益及其他未盡事宜等，擬請股東會授權董事會依主管機關相關規定\n     並視市場狀況及公司營運需求訂定之。\n (2) 嗣後如因法令變更、主管機關意見或客觀環境改變而有修正之必要，擬請股東會\n     授權董事會全權處理之。""]], ""footer"": [""以上資料均由各公司依發言當時所屬市場別之規定申報後，由本系統對外公佈，資料如有虛偽不實，均由該公司負責。""], ""header"": {""note"": [], ""subTitle"": [], ""mainTitle"": [""公司當日重大訊息之詳細內容""]}, ""titles"": [{""sub"": [], ""main"": ""序號""}, {""sub"": [], ""main"": ""發言日期""}, {""sub"": [], ""main"": ""發言時間""}, {""sub"": [], ""main"": ""發言人""}, {""sub"": [], ""main"": ""發言人職稱""}, {""sub"": [], ""main"": ""發言人電話""}, {""sub"": [], ""main"": ""主旨""}, {""sub"": [], ""main"": ""符合條款""}, {""sub"": [], ""main"": ""事實發生日""}, {""sub"": [], ""main"": ""說明""}], ""companyAbbreviation"": ""國碩""}, ""datetime"": ""115/03/28 23:31:22""}",2026-03-28 23:31:17
1150327|sii|2406|5,115/03/27,21:38:55,2406,國碩,公告本公司董事會決議通過對子公司禾迅綠電(股)公司未來申請股票上市（櫃）計畫，本公司得辦理對禾迅綠電(股)公司釋股作業暨放棄參與其現金增資,現金增資,1150327,sii,5,"{""code"": 200, ""message"": ""查詢成功"", ""result"": {""marketName"": ""上市公司"", ""companyId"": ""2406"", ""data"": [[5, ""115/03/27"", ""21:38:55"", ""陳繼明"", ""董事長"", ""03-5985510"", ""公告本公司董事會決議通過對子公司禾迅綠電 (股)公司未\r\n來申請股票上市（櫃）計畫，本公司得辦理對禾迅綠電(股)公\r\n司釋股作業暨放棄參與其現金增資"", ""51"", ""115/03/27"", ""1.事實發生日:115/03/27\n2.公司名稱:國碩科技(股)公司\n3.與公司關係(請輸入本公司或子公司):本公司\n4.相互持股比例:不適用\n5.發生緣由:\n(1)為配合本公司透過直接持股36.59%之子公司碩禾電子材料股份有限公司(以下簡\n   稱碩禾電子)持股98.50%子公司禾迅綠電 (股)公司(以下簡稱禾迅綠電) 營運發\n   展、吸引及留任所需專業人才，未來申請股票上市（櫃）計畫及為符合申請股票\n   上市(櫃)法令規定，禾迅綠電於上市(櫃)掛牌時本公司及本公司之子公司，以及\n   前開公司之董事、監察人、代表人，暨持有前開公司股份超過股份總額10%股東,\n   與其關係人總計持有禾迅綠電之股份不得超過與其關係人總計持有禾迅綠電之股\n   份不得超過一般板上市（櫃）掛牌時已發行股數之70%；若禾迅綠電於創新板上\n   市掛牌時，上開持有股份總額限制對象持有禾迅綠電之股份不得超過創新板上市\n   掛牌時已發行股數之80%。因規劃未來申請股票上市(櫃)之股權分散，於禾迅綠\n   電申請上市(櫃)前，本公司得依下列方式一次或分次辦理持有禾迅綠電股份釋股\n   作業或放棄參與該公司現金增資計劃：\n 1.方式一：以放棄認購碩禾電子處分禾迅綠電之股份方式辦理，碩禾電子處分所持\n   有之禾迅綠電股份時，本公司得放棄認購碩禾電子處分禾迅綠電股份中屬本公司\n   之得認購股份，並將優先依本公司最近一次停止過戶日之股東名簿記載之股東依\n   得認購時之持股比例優先認購，惟為避免股務成本增加，以最近一次停止過戶之\n   股東名簿記載股東持股比率計算得認購禾迅綠電壹仟股（含）以上之股東為限。\n   另考量禾迅綠電營運發展、吸引及留任專業人才以達提高經營績效之目的，如本\n   公司股東放棄認購或認購不足部分，將促請碩禾電子在本公司放棄得認購股數範\n   圍內以洽特定人認購之方式認購之，交易相對人將以禾迅綠電員工、本公司暨關\n   係企業員工及對禾迅綠電營運發展有助益之策略性投資人或財務性投資人為原\n   則。\n 2.方式二：以放棄認購禾迅綠電公司現金增資方式辦理，禾迅綠電現金增資發行價\n   格應不低於禾迅綠電決議現金增資之董事會前禾迅綠電最近一期經會計師查核簽\n   證或核閱之財務報表每股淨值，但如該股票已在證券營業處所買賣者，除不低於\n   前述之淨值外，另應依當時市價議定之，必要時應委由獨立專家就價格合理性出\n   具意見書，做為決議之參考依據。考量其營運發展、吸引及留任專業人才以達提\n   高經營績效之目的，除依法保留現金增資股數10%~15%由禾迅綠電之員工認購以\n   及依證券交易法第28 條之1 與相關法令規定應全數提撥辦理公開發行與承銷外\n   本公司得放棄依本公司持有碩禾電子持股比率計算得認購禾迅綠電之股份，並由\n   本公司符合資格之股東優先認購，如本公司股東放棄認購或認購不足部分，將促\n   請禾迅綠電在本公司放棄得認購股數範圍內以洽特定人認購之方式認購之，交易\n   相對人以禾迅綠電員工、本公司暨關係企業之員工及對禾迅綠電營運發展有助益\n   之策略性投資人或財務性投資人為原則，提出認購要約；其中本公司符合資格之\n   股東係指在可認購禾迅綠電現金增資股份時，本公司最近一次停止過戶日之股東\n   名簿記載之股東，且依其所載持股數按比例計算得認購禾迅綠電現增新股股數達\n   壹仟股（含）以上者（屆時本公司股東得依相關辦法辦理拼湊）。惟實際現金增\n   資發行張數、價格、特定人之洽定及作業時程等事宜應以禾迅綠電董事會之決議\n   為準。\n6.因應措施:提請股東會授權本公司董事會全權處理。\n7.其他應敘明事項(若事件發生或決議之主體係屬公開發行以上公司，本則重大訊息同時\n  符合證券交易法施行細則第7條第9款所定對股東權益或證券價格有重大影響之事項):無""]], ""footer"": [""以上資料均由各公司依發言當時所屬市場別之規定申報後，由本系統對外公佈，資料如有虛偽不實，均由該公司負責。""], ""header"": {""note"": [], ""subTitle"": [], ""mainTitle"": [""公司當日重大訊息之詳細內容""]}, ""titles"": [{""sub"": [], ""main"": ""序號""}, {""sub"": [], ""main"": ""發言日期""}, {""sub"": [], ""main"": ""發言時間""}, {""sub"": [], ""main"": ""發言人""}, {""sub"": [], ""main"": ""發言人職稱""}, {""sub"": [], ""main"": ""發言人電話""}, {""sub"": [], ""main"": ""主旨""}, {""sub"": [], ""main"": ""符合條款""}, {""sub"": [], ""main"": ""事實發生日""}, {""sub"": [], ""main"": ""說明""}], ""companyAbbreviation"": ""國碩""}, ""datetime"": ""115/03/28 23:31:23""}",2026-03-28 23:31:17
