key,speech_date,speech_time,company_id,company_name,subject,matched_keywords,enterDate,marketKind,serialNumber,detail_json,fetched_at_tw
1150519|sii|2324|1,115/05/19,18:06:16,2324,仁寶,公告本公司向金融監督管理委員會申請辦理廢止海外第五次無擔保轉換公司債案,公司債,1150519,sii,1,"{""code"": 200, ""message"": ""查詢成功"", ""result"": {""marketName"": ""上市公司"", ""companyId"": ""2324"", ""data"": [[1, ""115/05/19"", ""18:06:16"", ""王正強"", ""副總經理"", ""(02)87978588"", ""公告本公司向金融監督管理委員會申請辦理廢止\r\n海外第五次無擔保轉換公司債案"", ""11"", ""115/05/19"", ""1.事實發生日:115/05/19\n2.原公告申報日期:114/11/12\n3.簡述原公告申報內容:\n公告本公司董事會決議發行海外第五次無擔保轉換公司債\n4.變動緣由及主要內容:\n(1)本公司申報發行海外第五次無擔保轉換公司債，業經\n金融監督管理委員會（下稱金管會）民國115年1月12日\n金管證發字第1140368832號函同意申報生效，及金管會\n115年3月30日金管證發字第1150338491號函准予延長\n募集期間三個月在案。\n(2)因市場環境變化劇烈，考量本公司整體利益及股東權益，\n本公司擬向金管會申請廢止海外第五次無擔保轉換公司債案。\n5.變動後對公司財務業務之影響:無重大影響。\n6.其他應敘明事項:無。""]], ""footer"": [""以上資料均由各公司依發言當時所屬市場別之規定申報後，由本系統對外公佈，資料如有虛偽不實，均由該公司負責。""], ""header"": {""note"": [], ""subTitle"": [], ""mainTitle"": [""公司當日重大訊息之詳細內容""]}, ""titles"": [{""sub"": [], ""main"": ""序號""}, {""sub"": [], ""main"": ""發言日期""}, {""sub"": [], ""main"": ""發言時間""}, {""sub"": [], ""main"": ""發言人""}, {""sub"": [], ""main"": ""發言人職稱""}, {""sub"": [], ""main"": ""發言人電話""}, {""sub"": [], ""main"": ""主旨""}, {""sub"": [], ""main"": ""符合條款""}, {""sub"": [], ""main"": ""事實發生日""}, {""sub"": [], ""main"": ""說明""}], ""companyAbbreviation"": ""仁寶""}, ""datetime"": ""115/05/19 23:20:49""}",2026-05-19 23:20:37
1150518|otc|4416|3,115/05/18,19:11:22,4416,三圓,公告本公司普通股公司債到期還款計劃說明,公司債,1150518,otc,3,"{""code"": 200, ""message"": ""查詢成功"", ""result"": {""marketName"": ""上櫃公司"", ""companyId"": ""4416"", ""data"": [[3, ""115/05/18"", ""19:11:22"", ""王朝平"", ""財務部副總"", ""(02)2563-9136"", ""公告本公司普通股公司債到期還款計劃說明"", ""53"", ""115/05/18"", ""1.事實發生日:115/05/18\n2.公司名稱:三圓建設股份有限公司\n3.與公司關係(請輸入本公司或子公司):本公司\n4.相互持股比例:不適用\n5.發生緣由:依115年04月23日證櫃監字第1150200924號函規定辦理說明\n1.本公司發行111年度第一次有擔保普通公司債，總發行金額$10億元，其中屆滿\n第四年應償還發行總額十分之一，故於115/05/27公司債應償還$1億元及\n利息$10,800千元\n2.償還資金來源：本公司擬以出售敦北長城不動產(台北市八德路三段30.32.34.\n36號14樓及19個車位。)取得之款項$702,790千元，支應前述應付公司債之本金\n及利息\n6.因應措施:無\n7.其他應敘明事項(若事件發生或決議之主體係屬公開發行以上公司，\n本則重大訊息同時符合證券交易法施行細則第7條第9款所定\n對股東權益或證券價格有重大影響之事項):無""]], ""footer"": [""以上資料均由各公司依發言當時所屬市場別之規定申報後，由本系統對外公佈，資料如有虛偽不實，均由該公司負責。""], ""header"": {""note"": [], ""subTitle"": [], ""mainTitle"": [""公司當日重大訊息之詳細內容""]}, ""titles"": [{""sub"": [], ""main"": ""序號""}, {""sub"": [], ""main"": ""發言日期""}, {""sub"": [], ""main"": ""發言時間""}, {""sub"": [], ""main"": ""發言人""}, {""sub"": [], ""main"": ""發言人職稱""}, {""sub"": [], ""main"": ""發言人電話""}, {""sub"": [], ""main"": ""主旨""}, {""sub"": [], ""main"": ""符合條款""}, {""sub"": [], ""main"": ""事實發生日""}, {""sub"": [], ""main"": ""說明""}], ""companyAbbreviation"": ""三圓""}, ""datetime"": ""115/05/19 23:20:49""}",2026-05-19 23:20:37
1150518|otc|8299|1,115/05/18,23:57:23,8299,群聯,公告本公司海外第一次無擔保轉換公司債完成訂價,公司債,1150518,otc,1,"{""code"": 200, ""message"": ""查詢成功"", ""result"": {""marketName"": ""上櫃公司"", ""companyId"": ""8299"", ""data"": [[1, ""115/05/18"", ""23:57:23"", ""于志強"", ""資深特別助理暨營運長"", ""037-586896 #10019"", ""公告本公司海外第一次無擔保轉換公司債完成訂價"", ""53"", ""115/05/18"", ""1.事實發生日:115/05/18\n2.公司名稱:群聯電子股份有限公司\n3.與公司關係(請輸入本公司或子公司):本公司\n4.相互持股比例:不適用\n5.發生緣由:本公司海外第一次無擔保轉換公司債完成訂價\n6.因應措施:不適用\n7.其他應敘明事項(若事件發生或決議之主體係屬公開發行以上公司，\n本則重大訊息同時符合證券交易法施行細則第7條第9款所定\n對股東權益或證券價格有重大影響之事項):\n一、募集海外公司債總額、債券每張金額、發行價格及預定發行日期：\n    (一)募集海外公司債總額：美金8億元(包含A券公司債美金4億元、\n        B券公司債美金4億元)。\n    (二)債券每張面額：美金20萬元，或如超過美金20萬元，以美金10萬元之整數倍數\n        發行。\n    (三)發行價格：按面額100%發行。\n    (四)預定發行日期：115年5月26日。\n二、募集海外公司債之利率：票面利率為年利率0%。\n三、募集海外公司債償還方法及期限：\n    (一)償還方法：本公司債除已被提前贖回、買回並註銷或債券持有人行使轉換權外\n        ，本公司應於到期日，按本公司債面額加計年利率-0.25%(按半年計算)之收益\n        率(簡稱「到期贖回金額」)將本公司債贖回。\n    A券公司債之到期贖回金額將按固定匯率換算為新臺幣，並以該新臺幣金額按當時\n    匯率(參考上午十一時Taipei Forex Inc.所顯示之定盤匯率)換算為美金償還。\n    固定匯率計為1美金兌換新臺幣31.6350元。\n    (二) 期限：自發行日起滿5年之日為到期日，到期日為民國120年5月26日。\n四、轉換辦法及重要約定事項：\n    (一)轉換標的：本公司新發行之普通股。\n    (二)轉換期間：除提前將本債券贖回或買回、或停止轉換期間(定義如下)外，債券\n        持有人得於本債券發行屆滿三個月(不含發行日)之翌日起，至(1)到期日前10日\n        止或(2)債券持有人行使賣回權之日或本公司行使贖回權之日(不含到期日)前第　\n        5個營業日止，依相關法令及受託契約之規定，隨時向本公司請求將本債券轉換\n        為發行公司之普通股。\n        依目前中華民國法令規定，前述停止轉換期間係指：\n        (a) 依中華民國法令或櫃買中心規定之停止過戶之期間，惟不包括本公司股東\n            常會及股東臨時會之停止過戶期間。\n        (b) 如本公司辦理無償配股、現金股息或現金增資時，自本公司無償配股停止\n            過戶日、現金股息停止過戶日或現金增資認股停止過戶日前十五個營業日\n            起，至權利分派基準日止。\n        (c) 如本公司辦理減資者，自本公司辦理減資之減資基準日起至減資換發股票\n            開始交易日前一日止。\n        (d) 如本公司辦理股票變更面額者，自本公司辦理股票變更面額之停止轉換起\n            始日至新股換發股票開始交易日前一日止。\n        前項(d)變更面額之停止轉換起始日係指向經濟部申請變更登記之前一個營業日\n        ，本公司並應於該起始日前四個營業日公告停止轉換期間。\n        前述有關停止過戶期間之法令如有變更時，應依修訂後法令辦理。\n    (三)轉換價格：A券公司債與B券公司債之轉換價格分別為新臺幣3,418.75元與\n        新臺幣3,555.50元，轉換價格以訂價日民國115年5月18日本公司於櫃買中心之\n        普通股收盤價新臺幣2,735元之125%與130%分別訂定之。\n    (四)轉換價格調整：本債券發行後，轉換價格應依受託契約相關反稀釋條款調整之\n    (五)債券持有人賣回權：除下列情事外，債券持有人不得要求本公司於到期日前將\n        其持有本債券全部或部分賣回給公司：\n        (1)除本債券被提前贖回、買回並註銷或轉換外，A券公司債債券持有人得於本\n           債券發行屆滿2年當日，B券公司債債券持有人得於本債券發行屆滿3年當日\n           ，要求本公司依本債券面額加計年利率 -0.25% 之利息補償金，且以每\n           半年為計算基礎所得之金額](簡稱「提前賣回金額」)，將本債券全部或\n           部分贖回。\n        (2)若本公司普通股在櫃買中心終止上櫃，各債券持有人得要求本公司依提前\n           賣回金額將本債券全部或部分贖回。\n        (3)若本公司發生本債券受託契約 (以下簡稱「受託契約」)所定義之控制權\n           變動情事時，各債券持有人得要求本公司依提前賣回金額將本債券全部或\n           部分贖回。\n        債券持有人行使前述賣回權，及本公司受理債券持有人之賣回請求，應依據\n        受託契約所訂賣回程序為之。提前賣回金額將由本公司於受託契約所訂之付款\n        日以現金支付。\n        A券公司債之提前賣回金額將按固定匯率換算為新臺幣，並以該新臺幣金額按\n        當時匯率(參考上午十一時Taipei Forex Inc.所顯示之定盤匯率)換算為美金\n        償還。固定匯率計為1美金兌換新臺幣31.6350元。\n        (六)本公司之提前贖回權:\n            本公司於下列情況，得提前贖回本債券：\n            (1)於A券公司債發行之日起屆滿2年之翌日至到期日前，以及於B券公司債\n               發行之日起屆滿3年之翌日至到期日前，如本公司普通股於櫃買中心之\n               收盤價格，連續30個交易日中有20個交易日，達提前贖回金額(定義如\n               下)乘以當時轉換價格再除以本債券面額後所得之總數之130%以上時，\n               本公司得依提前贖回金額贖回全部或部分本債券。\n            (2)百分之九十以上之本債券已被贖回、行使轉換權、買回並註銷時，本\n               公司得依提前贖回金額將尚流通在外之本債券全部贖回。\n            (3)因中華民國稅務法令變更，致使本公司於發行日後因本債券而稅務負\n               擔增加或必須支付額外之利息費用或增加成本時，本公司得依提前贖\n               回金額提前將本債券全部贖回。債券持有人得選擇不讓其持有之債券\n               被贖回，惟該債券持有人不得請求本公司支付額外稅賦或費用。\n            本公司行使提前贖回權，應依據受託契約所訂之贖回程序為之，本公司\n            將於受託契約所訂之贖回日以現金贖回本債券。\n            提前贖回金額係指本債券面額加計年利率-0.25%之利息補償金，且以每\n            半年為計算基礎所得之金額。\n            A券公司債之提前贖回金額將按固定匯率換算為新臺幣，並以該新臺幣\n            金額按當時匯率(參考上午十一時Taipei Forex Inc.所顯示之定盤匯率)\n            換算為美金償還。固定匯率計為1美金兌換新臺幣31.6350元。\n五、發行及交易地點：新加坡交易所。\n六、資金運用計畫及預計可能產生之效益: 支應外幣購料之資金需求。\n七、對股東權益之主要影響：\n    本次所發行之海外無擔保轉換公司債若全部按發行後轉換價格轉換為普通股，如\n    全數轉換，則原股東股權之稀釋比率約為3.33%，其對原股東股權稀釋比例效果\n    尚屬有限。""]], ""footer"": [""以上資料均由各公司依發言當時所屬市場別之規定申報後，由本系統對外公佈，資料如有虛偽不實，均由該公司負責。""], ""header"": {""note"": [], ""subTitle"": [], ""mainTitle"": [""公司當日重大訊息之詳細內容""]}, ""titles"": [{""sub"": [], ""main"": ""序號""}, {""sub"": [], ""main"": ""發言日期""}, {""sub"": [], ""main"": ""發言時間""}, {""sub"": [], ""main"": ""發言人""}, {""sub"": [], ""main"": ""發言人職稱""}, {""sub"": [], ""main"": ""發言人電話""}, {""sub"": [], ""main"": ""主旨""}, {""sub"": [], ""main"": ""符合條款""}, {""sub"": [], ""main"": ""事實發生日""}, {""sub"": [], ""main"": ""說明""}], ""companyAbbreviation"": ""群聯""}, ""datetime"": ""115/05/19 23:20:50""}",2026-05-19 23:20:37
1150519|otc|6712|1,115/05/19,14:17:25,6712,長聖,公告本公司董事會決議第三次買回庫藏股(更正買回區間價格上限),庫藏股,1150519,otc,1,"{""code"": 200, ""message"": ""查詢成功"", ""result"": {""marketName"": ""上櫃公司"", ""companyId"": ""6712"", ""data"": [[1, ""115/05/19"", ""14:17:25"", ""許錦婷"", ""專案管理部經理"", ""04-23252888"", ""公告本公司董事會決議第三次買回庫藏股\r\n(更正買回區間價格上限)"", ""35"", ""115/05/15"", ""1.董事會決議日期:115/05/15\r\n2.買回股份目的:維護公司信用及股東權益\r\n3.買回股份種類:普通股\r\n4.買回股份總金額上限(元):1,721,767,531\r\n5.預定買回之期間:115/05/18~115/07/14\r\n6.預定買回之數量(股):2,000,000\r\n7.買回區間價格(元):128.00~180.00，公司股價低於區間價格下限，將繼續買回\r\n8.買回方式:自集中交易市場買回\r\n9.預定買回股份占公司已發行股份總數之比率(%):2.06\r\n10.申報時已持有本公司股份之累積股數(股):0\r\n11.申報前五年內買回公司股份之情形:\r\n(1)實際買回股份期間：114/02/21 ~ 114/04/18 、預定買回股數(股)：2000000 、實際已買回\r\n股數(股)：1922000 、執行情形(實際已買回股數占預定買回股數%)：96.00\r\n(2)實際買回股份期間：112/08/16 ~ 112/09/22 、預定買回股數(股)：2000000 、實際已買回\r\n股數(股)：1860000 、執行情形(實際已買回股數占預定買回股數%)：93.00\r\n12.已申報買回但未執行完畢之情形:\r\n無。\r\n13.董事會決議買回股份之會議紀錄:\r\n【案由一】：本公司第三次庫藏股買回案，提請 討論。\r\n【說  明】：\r\n(一)為維護公司信用及股東權益而買回本公司股份，預計實施第三次庫藏股買回，依據證券交易法\r\n第二十八條之二第一項第三款及上市上櫃公司買回本公司股份辦法之規定辦理，並辦理註銷股份。\r\n(二)擬自櫃檯買賣市場買回本公司股份，相關事項如下：\r\n1.買回股份之目的：維護公司信用及股東權益。\r\n2.買回股份之種類：普通股。\r\n3.買回股份之總金額上限：新台幣360,000 仟元。\r\n4.預計買回之期間與數量：自115年5月18日起至115年7月14日止。預計買回2,000仟股，佔本公司\r\n已發行股份之2.06%。\r\n5.買回之區間價格：新台幣180元至128元之間，惟當本公司股價低於上開買回之區間價格下限時，\r\n得繼續執行買回股份。\r\n6.買回之方式：自櫃檯買賣市場買回。\r\n(三)擬出具董事會已考慮公司財務狀況及不影響公司資本維持之聲明書，請詳附件一。\r\n(四)已委請台新證券股份有限公司出具買回股份價格之合理性評估意見書，請詳附件二。\r\n(五)提請討論公決。\r\n14.「上市上櫃公司買回本公司股份辦法」第十條規定之轉讓辦法:\r\n不適用。\r\n15.「上市上櫃公司買回本公司股份辦法」第十一條規定之轉換或認股辦法:\r\n不適用。\r\n16.董事會已考慮公司財務狀況，不影響公司資本維持之聲明:\r\n一、本公司經115年5月15日第四屆第十八次董事會三分之二以上董事之出席及出席董事超過二分之\r\n一之同意通過，自申報日起二個月內於櫃檯買賣市場買回本公司股份2,000,000股。\r\n二、上述買回股份總數，僅占本公司已發行股份之2.06%，且買回股份所需金額上限僅占本公司115\r\n年3月31日流動資產之56.63%，茲聲明本公司董事會已考慮公司財務狀況，上述股份之買回並不影響\r\n本公司資本之維持。\r\n三、本聲明書業經本公司上述同次董事會議通過，出席董事8人均同意本聲明書之內容，併此聲明。\r\n17.會計師或證券承銷商對買回股份價格之合理性評估意見:\r\n該公司本次預計買回2,000仟股，未超過已發行股數96,917仟股之10%，以預計取得董事會授權之買\r\n回股份之總金額上限360,000仟元計算，低於該公司保留盈餘加發行股份溢價及已實現之資本公積之\r\n金額。另預估買回最大現金支出數額為360,000仟元，亦低於115年3月31日之現金及約當現金\r\n418,905仟元，對該公司之營運尚屬可承受範圍。\r\n經評估，長聖國際生技股份有限公司本次預計買回公司股份對該公司之股東權益、每股淨值、負債比\r\n率、速動比率、流動比率未有重大影響，且預定買回股份數量、價格及總金額均依法規辦理，尚屬合\r\n理。\r\n18.其他證期局所規定之事項:\r\n無。""]], ""footer"": [""以上資料均由各公司依發言當時所屬市場別之規定申報後，由本系統對外公佈，資料如有虛偽不實，均由該公司負責。""], ""header"": {""note"": [], ""subTitle"": [], ""mainTitle"": [""公司當日重大訊息之詳細內容""]}, ""titles"": [{""sub"": [], ""main"": ""序號""}, {""sub"": [], ""main"": ""發言日期""}, {""sub"": [], ""main"": ""發言時間""}, {""sub"": [], ""main"": ""發言人""}, {""sub"": [], ""main"": ""發言人職稱""}, {""sub"": [], ""main"": ""發言人電話""}, {""sub"": [], ""main"": ""主旨""}, {""sub"": [], ""main"": ""符合條款""}, {""sub"": [], ""main"": ""事實發生日""}, {""sub"": [], ""main"": ""說明""}], ""companyAbbreviation"": ""長聖""}, ""datetime"": ""115/05/19 23:20:50""}",2026-05-19 23:20:37
1150519|otc|3264|1,115/05/19,14:43:00,3264,欣銓,本公司取得機器設備公告,機器設備,1150519,otc,1,"{""code"": 200, ""message"": ""查詢成功"", ""result"": {""marketName"": ""上櫃公司"", ""companyId"": ""3264"", ""data"": [[1, ""115/05/19"", ""14:43:00"", ""江文山"", ""副處長"", ""03-5976688-1957"", ""本公司取得機器設備公告"", ""20"", ""115/05/19"", ""1.標的物之名稱及性質（如坐落台中市北區ＸＸ段ＸＸ小段土地）:\r\n生產用之機器設備\r\n2.事實發生日:115/2/26~115/5/19\r\n3.董事會通過日期: 不適用\r\n4.其他核決日期:\r\n核決層級:依本公司核決權限規定辦理\r\n民國115年5月19日\r\n5.交易單位數量（如ＸＸ平方公尺，折合ＸＸ坪）、每單位價格及交易總金額:\r\n交易數量:一批\n本批交易總金額: NTD 1,236,415,552\r\n6.交易相對人及其與公司之關係（交易相對人如屬自然人，且非公司之關\r\n係人者，得免揭露其姓名）:\r\n交易相對人: ADVANTEST TAIWAN INC\n與公司之關係: 無\r\n7.交易相對人為關係人者，並應公告選定關係人為交易對象之原因及前次移轉之\r\n所有人、前次移轉之所有人與公司及交易相對人間相互之關係、前次移轉日期\r\n及移轉金額:\r\n不適用\r\n8.交易標的最近五年內所有權人曾為公司之關係人者，尚應公告關係\r\n人之取得及處分日期、價格及交易當時與公司之關係:\r\n不適用\r\n9.預計處分利益（或損失）（取得資產者不適用）（遞延者應列表說明\r\n認列情形）:\r\n不適用\r\n10.交付或付款條件（含付款期間及金額）、契約限制條款及其他重要約定\r\n事項:\r\n採電匯或信用狀付款\r\n11.本次交易之決定方式（如招標、比價或議價）、價格決定之參考依據及\r\n決策單位:\r\n交易決定方式: 比價及議價\n價格決定: 依市場行情\n決策單位: 依本公司核決權限規定辦理\r\n12.專業估價者事務所或公司名稱及其估價金額:\r\n不適用\r\n13.專業估價師姓名:\r\n不適用\r\n14.專業估價師開業證書字號:\r\n不適用\r\n15.估價報告是否為限定價格、特定價格或特殊價格:否或不適用\r\n16.是否尚未取得估價報告:否或不適用\r\n17.尚未取得估價報告之原因:\r\n不適用\r\n18.估價結果有重大差異時，其差異原因及會計師意見:\r\n不適用\r\n19.會計師事務所名稱:\r\n不適用\r\n20.會計師姓名:\r\n不適用\r\n21.會計師開業證書字號:\r\n不適用\r\n22.經紀人及經紀費用:\r\n不適用\r\n23.取得或處分之具體目的或用途:\r\n配合營運需求\r\n24.本次交易表示異議之董事之意見:\r\n不適用\r\n25.本次交易為關係人交易:否\r\n26.監察人承認或審計委員會同意日期:\r\n不適用\r\n27.本次交易係向關係人取得不動產或其使用權資產:否\r\n28.依「公開發行公司取得或處分資產處理準則」第十六條規定\r\n評估之價格:不適用\r\n29.依前項評估之價格較交易價格為低者，依同準則第十七條規\r\n定評估之價格:不適用\r\n30.前已就同一件事件發布重大訊息日期: 不適用\r\n31.其他敘明事項:\r\n無""]], ""footer"": [""以上資料均由各公司依發言當時所屬市場別之規定申報後，由本系統對外公佈，資料如有虛偽不實，均由該公司負責。""], ""header"": {""note"": [], ""subTitle"": [], ""mainTitle"": [""公司當日重大訊息之詳細內容""]}, ""titles"": [{""sub"": [], ""main"": ""序號""}, {""sub"": [], ""main"": ""發言日期""}, {""sub"": [], ""main"": ""發言時間""}, {""sub"": [], ""main"": ""發言人""}, {""sub"": [], ""main"": ""發言人職稱""}, {""sub"": [], ""main"": ""發言人電話""}, {""sub"": [], ""main"": ""主旨""}, {""sub"": [], ""main"": ""符合條款""}, {""sub"": [], ""main"": ""事實發生日""}, {""sub"": [], ""main"": ""說明""}], ""companyAbbreviation"": ""欣銓""}, ""datetime"": ""115/05/19 23:20:51""}",2026-05-19 23:20:37
1150519|otc|3362|1,115/05/19,14:44:56,3362,先進光,公告本公司國內第一次有擔保轉換公司債轉換價格調整,公司債,1150519,otc,1,"{""code"": 200, ""message"": ""查詢成功"", ""result"": {""marketName"": ""上櫃公司"", ""companyId"": ""3362"", ""data"": [[1, ""115/05/19"", ""14:44:56"", ""紀國隆"", ""處長"", ""04-25659888#8705"", ""公告本公司國內第一次有擔保轉換公司債轉換價格調整"", ""53"", ""115/05/19"", ""1.事實發生日:115/05/19\n2.公司名稱:先進光電科技股份有限公司\n3.與公司關係(請輸入本公司或子公司):本公司\n4.相互持股比例:不適用\n5.發生緣由:因應本公司辦理現金增資發行普通股，依本公司國內第一次\n有擔保轉換公司債發行及轉換辦法第十一條規定調整轉換價格。\n6.因應措施:自現金增資股款收足日(增資基準日)115年6月1日起，國內第一次\n有擔保轉換公司債轉換價格由新台幣251元調整為新台幣249.80元。\n7.其他應敘明事項(若事件發生或決議之主體係屬公開發行以上公司，\n本則重大訊息同時符合證券交易法施行細則第7條第9款所定\n對股東權益或證券價格有重大影響之事項):無""]], ""footer"": [""以上資料均由各公司依發言當時所屬市場別之規定申報後，由本系統對外公佈，資料如有虛偽不實，均由該公司負責。""], ""header"": {""note"": [], ""subTitle"": [], ""mainTitle"": [""公司當日重大訊息之詳細內容""]}, ""titles"": [{""sub"": [], ""main"": ""序號""}, {""sub"": [], ""main"": ""發言日期""}, {""sub"": [], ""main"": ""發言時間""}, {""sub"": [], ""main"": ""發言人""}, {""sub"": [], ""main"": ""發言人職稱""}, {""sub"": [], ""main"": ""發言人電話""}, {""sub"": [], ""main"": ""主旨""}, {""sub"": [], ""main"": ""符合條款""}, {""sub"": [], ""main"": ""事實發生日""}, {""sub"": [], ""main"": ""說明""}], ""companyAbbreviation"": ""先進光""}, ""datetime"": ""115/05/19 23:20:52""}",2026-05-19 23:20:37
