key,speech_date,speech_time,company_id,company_name,subject,matched_keywords,enterDate,marketKind,serialNumber,detail_json,fetched_at_tw
1150518|sii|4958|2,115/05/18,17:42:42,4958,臻鼎-KY,代子公司慶鼎精密電子(淮安)有限公司公告取得機器設備,機器設備,1150518,sii,2,"{""code"": 200, ""message"": ""查詢成功"", ""result"": {""marketName"": ""上市公司"", ""companyId"": ""4958"", ""data"": [[2, ""115/05/18"", ""17:42:42"", ""凌惇"", ""資深經理"", ""03-3835678"", ""代子公司慶鼎精密電子(淮安)有限公司公告取得機器設備"", ""20"", ""115/05/18"", ""1.標的物之名稱及性質（如坐落台中市北區ＸＸ段ＸＸ小段土地）:\r\n機器設備\r\n2.事實發生日:114/5/19~115/5/18\r\n3.董事會通過日期: 不適用\r\n4.其他核決日期:\r\n核決層級:總經理核決\r\n民國115年5月18日\r\n5.交易單位數量（如ＸＸ平方公尺，折合ＸＸ坪）、每單位價格及交易總金額:\r\n交易數量:一批\n交易總金額:新台幣1,042,065,364元\r\n6.交易相對人及其與公司之關係（交易相對人如屬自然人，且非公司之關\r\n係人者，得免揭露其姓名）:\r\n交易相對人:博可機械(太倉)有限公司\n與公司之關係:無\r\n7.交易相對人為關係人者，並應公告選定關係人為交易對象之原因及前次移轉之\r\n所有人、前次移轉之所有人與公司及交易相對人間相互之關係、前次移轉日期\r\n及移轉金額:\r\n不適用\r\n8.交易標的最近五年內所有權人曾為公司之關係人者，尚應公告關係\r\n人之取得及處分日期、價格及交易當時與公司之關係:\r\n不適用\r\n9.預計處分利益（或損失）（取得資產者不適用）（遞延者應列表說明\r\n認列情形）:\r\n不適用\r\n10.交付或付款條件（含付款期間及金額）、契約限制條款及其他重要約定\r\n事項:\r\n依採購合約規定\r\n11.本次交易之決定方式（如招標、比價或議價）、價格決定之參考依據及\r\n決策單位:\r\n交易決定方式:比價及議價\n價格決定之參考依據:依市場行情\n決策單位:依公司核決權限決定\r\n12.專業估價者事務所或公司名稱及其估價金額:\r\n不適用\r\n13.專業估價師姓名:\r\n不適用\r\n14.專業估價師開業證書字號:\r\n不適用\r\n15.估價報告是否為限定價格、特定價格或特殊價格:否或不適用\r\n16.是否尚未取得估價報告:否或不適用\r\n17.尚未取得估價報告之原因:\r\n不適用\r\n18.估價結果有重大差異時，其差異原因及會計師意見:\r\n不適用\r\n19.會計師事務所名稱:\r\n不適用\r\n20.會計師姓名:\r\n不適用\r\n21.會計師開業證書字號:\r\n不適用\r\n22.經紀人及經紀費用:\r\n無\r\n23.取得或處分之具體目的或用途:\r\n供營業使用\r\n24.本次交易表示異議之董事之意見:\r\n不適用\r\n25.本次交易為關係人交易:否\r\n26.監察人承認或審計委員會同意日期:\r\n不適用\r\n27.本次交易係向關係人取得不動產或其使用權資產:否\r\n28.依「公開發行公司取得或處分資產處理準則」第十六條規定\r\n評估之價格:不適用\r\n29.依前項評估之價格較交易價格為低者，依同準則第十七條規\r\n定評估之價格:不適用\r\n30.前已就同一件事件發布重大訊息日期: 不適用\r\n31.其他敘明事項:\r\n無""]], ""footer"": [""以上資料均由各公司依發言當時所屬市場別之規定申報後，由本系統對外公佈，資料如有虛偽不實，均由該公司負責。""], ""header"": {""note"": [], ""subTitle"": [], ""mainTitle"": [""公司當日重大訊息之詳細內容""]}, ""titles"": [{""sub"": [], ""main"": ""序號""}, {""sub"": [], ""main"": ""發言日期""}, {""sub"": [], ""main"": ""發言時間""}, {""sub"": [], ""main"": ""發言人""}, {""sub"": [], ""main"": ""發言人職稱""}, {""sub"": [], ""main"": ""發言人電話""}, {""sub"": [], ""main"": ""主旨""}, {""sub"": [], ""main"": ""符合條款""}, {""sub"": [], ""main"": ""事實發生日""}, {""sub"": [], ""main"": ""說明""}], ""companyAbbreviation"": ""臻鼎-KY""}, ""datetime"": ""115/05/19 23:20:39""}",2026-05-19 23:20:37
1150518|sii|3583|1,115/05/18,17:44:49,3583,辛耘,公告辛耘股份有限公司國內第一次無擔保轉換公司債(簡稱：辛耘一，代碼：35831)發行公司行使債券贖回權暨訂於115年07月08日終止櫃檯買賣等相關事宜。,公司債,1150518,sii,1,"{""code"": 200, ""message"": ""查詢成功"", ""result"": {""marketName"": ""上市公司"", ""companyId"": ""3583"", ""data"": [[1, ""115/05/18"", ""17:44:49"", ""沈淑眞"", ""董事長特助"", ""0287512323 Ext.1104"", ""公告辛耘股份有限公司國內第一次無擔保轉換公司債(簡稱：辛耘一，代碼：35831)發行公司行使債券贖回權暨訂於115年07月08日終止櫃檯買賣等相關事宜。"", ""51"", ""115/05/18"", ""內容：依辛耘一發行及轉換辦法第十八條規定辦理。\n發行公司於115年06月08日至115年07月07日行使債券贖回權，贖回權價格為債券面額之100.0000%\n(一)、依辛耘公司國內第一次無擔保轉換公司債發行及轉換辦法第十八條第一項規定，本轉換公司債於發行滿三個月之次日(民國113年9月8日)起至發行期間屆滿前四十日(民國116年4月28日)止，若本公司普通股股票之收盤價格連續三十個營業日超過當時轉換價格達百分之三十(含)時，本公司得於其後三十個營業日內，以掛號寄發給債權人(以「債券收回通知書」寄發日前第五個營業日債權人名冊所載者為準)一份三十日期滿之「債券收回通知書」(前述期間自本公司寄發之日起算，並以該期間屆滿日為債券收回基準日，且前述期間不得為第九條之停止轉換期間)，對於其後因買賣或其他原因始取得本轉換公司債之投資人，則以公告方式為之，且函請櫃買中心公告債權人贖回權之行使，並於債券收回基準日後五個營業日內，按債券面額以現金收回流通在外之本轉換公司債。\n(二)、轉換公司債停止過戶期間：不適用。\n(三)、通知及受理轉換公司債贖回期間：115年06月08日至115年07月07日\n(四)、轉換公司債收回基準日：115年07月07日\n(五)、轉換公司債終止櫃檯買賣日期:115年07月08日\n(六)、掛號寄發債券收回通知書日期:115年06月08日\n(七)、債券收回手續\n(1)、債權人請檢附 1.轉換公司債帳簿劃撥轉換/贖回/賣回申請書(申請書可至各證券商取得)，並加蓋集保帳戶印鑑 2.證券存摺 3.身分證正反面影本，至往來證券商辦理債券收回手續。\n(2)、債權人得自債券收回通知之始日（115年06月08日）起至屆滿日（115年07月07日）之前一營業日止，由債券持有人向往來券商辦理贖回手續。\n(八)、如債券持有人不欲公司行使贖回權，擬請求將本轉換公司債轉換為普通股，最遲應於115年07月09日前至往來證券商辦理轉換手續。\n(九)、公司股務代理機構（包括地址及電話）: 中國信託商業銀行代理部，地址： 100台北市中正區重慶南路一段83號5樓，電話： (02)66365566。\n警語：請投資人注意，具有請求轉換資格者，如未於115年07月09日前以書面請求轉換，本公司將按面額計算以現金收回其全部債券。""]], ""footer"": [""以上資料均由各公司依發言當時所屬市場別之規定申報後，由本系統對外公佈，資料如有虛偽不實，均由該公司負責。""], ""header"": {""note"": [], ""subTitle"": [], ""mainTitle"": [""公司當日重大訊息之詳細內容""]}, ""titles"": [{""sub"": [], ""main"": ""序號""}, {""sub"": [], ""main"": ""發言日期""}, {""sub"": [], ""main"": ""發言時間""}, {""sub"": [], ""main"": ""發言人""}, {""sub"": [], ""main"": ""發言人職稱""}, {""sub"": [], ""main"": ""發言人電話""}, {""sub"": [], ""main"": ""主旨""}, {""sub"": [], ""main"": ""符合條款""}, {""sub"": [], ""main"": ""事實發生日""}, {""sub"": [], ""main"": ""說明""}], ""companyAbbreviation"": ""辛耘""}, ""datetime"": ""115/05/19 23:20:41""}",2026-05-19 23:20:37
1150518|sii|3583|2,115/05/18,17:45:38,3583,辛耘,公告辛耘股份有限公司國內第二次無擔保轉換公司債(簡稱：辛耘二，代碼：35832)發行公司行使債券贖回權暨訂於115年07月08日終止櫃檯買賣等相關事宜。,公司債,1150518,sii,2,"{""code"": 200, ""message"": ""查詢成功"", ""result"": {""marketName"": ""上市公司"", ""companyId"": ""3583"", ""data"": [[2, ""115/05/18"", ""17:45:38"", ""沈淑眞"", ""董事長特助"", ""0287512323 Ext.1104"", ""公告辛耘股份有限公司國內第二次無擔保轉換公司債(簡稱：辛耘二，代碼：35832)發行公司行使債券贖回權暨訂於115年07月08日終止櫃檯買賣等相關事宜。"", ""51"", ""115/05/18"", ""內容：依辛耘二發行及轉換辦法第十八條規定辦理。\n發行公司於115年06月08日至115年07月07日行使債券贖回權，贖回權價格為債券面額之100.0000%\n(一)、依辛耘公司國內第二次無擔保轉換公司債發行及轉換辦法第十八條第一項規定，本轉換公司債於發&#64008;滿三個月之翌日(民國113年9月20日)起至發&#64008;期間屆滿前四十日(民國116年5月10日)止，&#63860;本公司普通股之收盤價格&#63898;續三十個營業日超過當時轉換價格達百分之三十(含)時，本公司得於其後三十個營業日內，以掛號寄發一份三十日期滿之「債券收回通知書」(前述期間自本公司發信之日起算，並以該期間屆滿日為債券收回基準日，且前述期間&#63847;得為第九條之停止轉換期間)予債券持有人(以「債券收回通知書」寄發日前第五個營業日債券持有人名冊所載者為準，對於其後因買賣或其他原因始取得本轉換公司債之持有人，則以公告方式為之)，贖回價格訂為本債券面額，以現金收回其全部債券，並函請櫃買中心公告。本公司執行收回請求，應於債券收回基準日後五個營業日內，按債券面額以現&#63754;贖回其流通在外之本轉換公司債。\n(二)、轉換公司債停止過戶期間：不適用。\n(三)、通知及受理轉換公司債贖回期間：115年06月08日至115年07月07日\n(四)、轉換公司債收回基準日：115年07月07日\n(五)、轉換公司債終止櫃檯買賣日期:115年07月08日\n(六)、掛號寄發債券收回通知書日期:115年06月08日\n(七)、債券收回手續\n(1)、債權人請檢附 1.轉換公司債帳簿劃撥轉換/贖回/賣回申請書(申請書可至各證券商取得)，並加蓋集保帳戶印鑑 2.證券存摺 3.身分證正反面影本，至往來證券商辦理債券收回手續。\n(2)、債權人得自債券收回通知之始日（115年06月08日）起至屆滿日（115年07月07日）之前一營業日止，由債券持有人向往來券商辦理贖回手續。\n(八)、如債券持有人不欲公司行使贖回權，擬請求將本轉換公司債轉換為普通股，最遲應於115年07月09日前至往來證券商辦理轉換手續。\n(九)、公司股務代理機構（包括地址及電話）: 中國信託商業銀行代理部，地址： 100台北市中正區重慶南路一段83號5樓，電話： (02)66365566。\n警語：請投資人注意，具有請求轉換資格者，如未於115年07月09日前以書面請求轉換，本公司將按面額計算以現金收回其全部債券。""]], ""footer"": [""以上資料均由各公司依發言當時所屬市場別之規定申報後，由本系統對外公佈，資料如有虛偽不實，均由該公司負責。""], ""header"": {""note"": [], ""subTitle"": [], ""mainTitle"": [""公司當日重大訊息之詳細內容""]}, ""titles"": [{""sub"": [], ""main"": ""序號""}, {""sub"": [], ""main"": ""發言日期""}, {""sub"": [], ""main"": ""發言時間""}, {""sub"": [], ""main"": ""發言人""}, {""sub"": [], ""main"": ""發言人職稱""}, {""sub"": [], ""main"": ""發言人電話""}, {""sub"": [], ""main"": ""主旨""}, {""sub"": [], ""main"": ""符合條款""}, {""sub"": [], ""main"": ""事實發生日""}, {""sub"": [], ""main"": ""說明""}], ""companyAbbreviation"": ""辛耘""}, ""datetime"": ""115/05/19 23:20:41""}",2026-05-19 23:20:37
1150518|sii|7610|1,115/05/18,18:43:18,7610,聯友金屬-創,公告本公司國內第一次無擔保轉換公司債收足債款,公司債,1150518,sii,1,"{""code"": 200, ""message"": ""查詢成功"", ""result"": {""marketName"": ""上市公司"", ""companyId"": ""7610"", ""data"": [[1, ""115/05/18"", ""18:43:18"", ""吳永中"", ""總經理"", ""08-8661018"", ""公告本公司國內第一次無擔保轉換公司債收足債款"", ""51"", ""115/05/18"", ""1.事實發生日:115/05/18\n2.公司名稱:聯友金屬科技股份有限公司\n3.與公司關係(請輸入本公司或子公司):本公司\n4.相互持股比例:不適用\n5.發生緣由:依據「發行人募集與發行有價證券處理準則」第九條第一項第二款規定辦理\n公告，本公司發行國內第一次無擔保轉換公司債至公告日止，債款代收銀行業已收足所\n有應募款項並匯撥至專戶存儲銀行，共計新台幣808,000,000元整，特此公告。\n6.因應措施:無\n7.其他應敘明事項(若事件發生或決議之主體係屬公開發行以上公司，本則重大訊息同時\n  符合證券交易法施行細則第7條第9款所定對股東權益或證券價格有重大影響之事項):\n無""]], ""footer"": [""以上資料均由各公司依發言當時所屬市場別之規定申報後，由本系統對外公佈，資料如有虛偽不實，均由該公司負責。""], ""header"": {""note"": [], ""subTitle"": [], ""mainTitle"": [""公司當日重大訊息之詳細內容""]}, ""titles"": [{""sub"": [], ""main"": ""序號""}, {""sub"": [], ""main"": ""發言日期""}, {""sub"": [], ""main"": ""發言時間""}, {""sub"": [], ""main"": ""發言人""}, {""sub"": [], ""main"": ""發言人職稱""}, {""sub"": [], ""main"": ""發言人電話""}, {""sub"": [], ""main"": ""主旨""}, {""sub"": [], ""main"": ""符合條款""}, {""sub"": [], ""main"": ""事實發生日""}, {""sub"": [], ""main"": ""說明""}], ""companyAbbreviation"": ""聯友金屬-創""}, ""datetime"": ""115/05/19 23:20:42""}",2026-05-19 23:20:37
1150518|sii|1589|2,115/05/18,19:52:37,1589,永冠-KY,公告本公司中華民國境內第四次無擔保轉換公司債(簡稱：永冠四KY，代碼：15894)經櫃買中心通知列為停止櫃檯買賣,公司債,1150518,sii,2,"{""code"": 200, ""message"": ""查詢成功"", ""result"": {""marketName"": ""上市公司"", ""companyId"": ""1589"", ""data"": [[2, ""115/05/18"", ""19:52:37"", ""蔡樹根"", ""副董事長"", ""(02)2791-7198"", ""公告本公司中華民國境內第四次無擔保轉換公司債(簡稱：永冠\r\n四KY，代碼：15894)經櫃買中心通知列為停止櫃檯買賣"", ""51"", ""115/05/18"", ""1.事實發生日:115/05/18\n2.公司名稱:永冠能源科技集團有限公司\n3.與公司關係(請輸入本公司或子公司):本公司\n4.相互持股比例:不適用\n5.發生緣由:\n  (1)本公司未依法令期限公告申報114年度財務報告及115年度第一季財務報告，依證\n     交所營業細則第50條之3第1項第1款之規定，自115年5月20日起併案停止買賣。\n  (2)依櫃買中心業務規則第12條之1第l項第4款及第15款規定，永冠四KY自115年5月20\n     日起併案繼續停止櫃檯買賣。\n6.因應措施:\n  積極遴選繼任會計師，儘速完成114年度財務報告及115年度第一季財務報告之會計師\n  簽證，並辦理申報及公告。\n7.其他應敘明事項(若事件發生或決議之主體係屬公開發行以上公司，本則重大訊息同時\n  符合證券交易法施行細則第7條第9款所定對股東權益或證券價格有重大影響之事項):\n  無。""]], ""footer"": [""以上資料均由各公司依發言當時所屬市場別之規定申報後，由本系統對外公佈，資料如有虛偽不實，均由該公司負責。""], ""header"": {""note"": [], ""subTitle"": [], ""mainTitle"": [""公司當日重大訊息之詳細內容""]}, ""titles"": [{""sub"": [], ""main"": ""序號""}, {""sub"": [], ""main"": ""發言日期""}, {""sub"": [], ""main"": ""發言時間""}, {""sub"": [], ""main"": ""發言人""}, {""sub"": [], ""main"": ""發言人職稱""}, {""sub"": [], ""main"": ""發言人電話""}, {""sub"": [], ""main"": ""主旨""}, {""sub"": [], ""main"": ""符合條款""}, {""sub"": [], ""main"": ""事實發生日""}, {""sub"": [], ""main"": ""說明""}], ""companyAbbreviation"": ""永冠-KY""}, ""datetime"": ""115/05/19 23:20:43""}",2026-05-19 23:20:37
1150519|sii|2376|3,115/05/19,01:37:16,2376,技嘉,公告本公司115年度海外第五次無擔保轉換公司債完成訂價,公司債,1150519,sii,3,"{""code"": 200, ""message"": ""查詢成功"", ""result"": {""marketName"": ""上市公司"", ""companyId"": ""2376"", ""data"": [[3, ""115/05/19"", ""01:37:16"", ""劉文忠"", ""協理"", ""89124000"", ""公告本公司115年度海外第五次無擔保轉換\r\n公司債完成訂價"", ""51"", ""115/05/18"", ""1.事實發生日:115/05/18\n2.公司名稱:技嘉科技股份有限公司\n3.與公司關係(請輸入本公司或子公司):本公司\n4.相互持股比例:不適用\n5.發生緣由:本公司115年度海外第五次無擔保轉換公司債完成訂價\n6.因應措施:依規定辦理公告。\n7.其他應敘明事項(若事件發生或決議之主體係屬公開發行以上公司，本則重大訊息同時\n  符合證券交易法施行細則第7條第9款所定對股東權益或證券價格有重大影響之事項):\n本次發行業經金融監督管理委員會115年1月2日金管證發字第　\n1140368154號函同意申報生效並經金管證發字第1150336628號同意延長募集期間至115年\n7月1日\n公告事項：\n一、海外公司債發行總額、債券每張金額、發行價格及預定發行日期：\n本次發行總額：美金500,000,000元\n債券每張面額：美金200,000元或為美金200,000元的整數倍數\n發行價格：依面額100%發行\n預定發行日期：115年5月26日\n二、發行利率：票面利率為年利率0%\n三、海外公司債償還方法及期限：\n償還方法及期限：本債券除已被提前贖回、賣回並註銷或行　\n    使轉換權外，發行公司應於到期日，按本債券面額加計年利率2.25% (按半年計算)\n    之收益率，以美金將本債券贖回。到期贖回金額將按訂價日決定之新台幣兌美金\n    匯率(訂為1美金兌換新台幣31.635元，下稱「固定匯率」)換算為新台幣，並\n    以該新台幣金額按當時匯率(參考上午十一時Taipei Forex Inc.所顯示之定盤匯率)\n    換算為美金償還。\n到期日：120年5月26日。\n四、轉換辦法及重要約定事項：\n(1)發行公司名稱：\n 技嘉科技股份有限公司 (以下簡稱「技嘉」或「發行公司」或「本公司」)。\n(2)債券持有人之賣回權：除下列情事外，債券持有人不得要求本公司於到期日前將其\n   持有本債券全部或部分贖回：\n(a) 除本債券被提前贖回、買回並註銷或轉換外，債券持有人得於\n    本債券發行屆滿兩年及屆滿四年當日，要求發行公司依本債\n    券面額加計年利率為2.25%之利息補償金，且以每半年為計\n    算基礎所得之金額（以下簡稱「提前贖回金額」），將\n    本債券全部或部分贖回。\n(b) 若技嘉普通股在台灣證券交易所終止上市，債券持有人得\n    要求發行公司依提前贖回金額，將本債券全部或部分贖回。\n(c) 若發行公司發生本債券受託契約（以下簡稱「受託契約」）\n    所定義之控制權變動情事時，債券持有人得要求發行公司\n    依提前贖回金額將本債券全部或部分贖回。\n(d) 債券持有人行使前述賣回權，及發行公司受理債券持有人\n    之賣回請求，應依據受託契約所訂賣回程序為之，發行公\n    司將於受託契約所訂之付款日以現金贖回本公司債。\n 提前贖回金額將按固定匯率換算為新臺幣，並以該新臺幣金\n 額按賣回當時匯率(參考上午十一時Taipei Forex Inc.所顯\n 示之定盤匯率)換算為美金償還。\n(3)發行公司之提前贖回權：\n   發行公司於下列情況，得提前贖回本公司債：\n (a) 於本債券發行之日起屆滿3年之翌日至到期日前，如發行\n   公司普通股於台灣證券交易所之收盤價格（依當時匯率換\n   算為美元），連續30個營業日中有20個交易日(如遇除權或\n   除息者，於除權或除息交易日至除權或除息基準日之間，\n   採用之收盤價格，應先設算為除權或除息前之價格)達提前\n   贖回金額(定義於後)乘以當時轉換價格(以固定匯率換算為\n   美元)再除以本債券面額後所得之總數130%時，發行公司得\n   以提前贖回金額贖回全部或部份本債券。\n (b) 百分之九十以上之本債券已被贖回、經債券持有人行使\n   轉換權、買回並註銷時，發行公司得依提前贖回金額將尚\n   流通在外之本債券全部贖回。\n (c) 因中華民國稅務法令變更，致使發行公司於發行日後因\n   本債券而稅務負擔增加或必須支付額外之利息費用或增加\n   成本時，發行公司得依提前贖回金額提前將本債券全部贖\n   回。倘債券持有人不參與贖回，該債券持有人不得請求發\n   行公司負擔額外之稅賦或費用。\n 「提前贖回金額」係指公司依本債券面額加計年利率2.25%\n   之利息補償金，且以每半年為計算基礎所得之金額。\n  提前贖回金額將按固定匯率換算為新臺幣，並以該新臺幣\n  金額按贖回當時匯率(參考上午十一時Taipei Forex Inc.\n  所顯示之定盤匯率)換算為美金償還。\n(4)轉換規定：\n (a) 轉換標的\n  技嘉新發行之普通股(以下簡稱「普通股」)。\n (b) 轉換期間\n  除提前將本債券贖回或買回或停止轉換期間（定義如下）\n  外，債券持有人得於本債券發行屆滿三個月之翌日起（不\n  含發行日），至(1)到期日前10日止，或(2)債券持有人行使賣回權之日\n  或本公司行使贖回權之日(不含到期日)前第5個營業日止，依相關法令及\n  受託契約之規定，隨時向發行公司請求將本債券轉換為發行公司之\n  普通股。\n  前述停止轉換期間係指:\n  (i) 依中華民國法律停止過戶之期間，包括於技嘉股東常\n   會開會前六十日內，股東臨時會開會前三十日內。\n  (ii) 若技嘉辦理無償配股、現金股息或現金增資時，自技\n   嘉無償配股停止過戶日、現金股息停止過戶日或現金增資\n   認股停止過戶日前十五個營業日起，至權利分派基準日止。\n  (iii) 如技嘉辦理減資者，自技嘉辦理減資之減資基準日起\n  至減資換發股票開始交易日前一日止。\n  (iv) 如技嘉辦理變更面額者，自技嘉辦理股票變更面額之\n  停止轉換起始日至新股換發股票開始交易日前一日止。\n  (v) 其他依中華民國法令或台灣證券交易所\n  規定之停止過戶期間。\n 前述有關停止過戶期間之法令如有變更時，應依修訂法令後辦理。\n(c)轉換價格\n  本公司債之轉換價格為每股新台幣371.81元。\n (轉換價格所用之固定匯率為美金:新台幣=1:31.635)。\n(d)轉換普通股股數\n  轉換時，以本債券發行面額乘以固定匯率，再除以轉換日\n  當時的每股轉換價格，計算出可轉換為發行公司之普通股\n  股數。如有不足一股時，其餘數將以美金現金支付，計算\n  至美金元為止，元以下四捨五入。\n(e)轉換價格之調整\n  本公司債發行後，轉換價格應依據市場反稀釋慣例調\n  整之。相關價格調整應按本公司債公開說明書及/或受託\n  契約之規定及公式定之。\n五、發行及交易地點：新加坡交易所。\n六、發行方式約定由特定人認購之情事：無。\n七、資金運用計劃及預計可能產生效益：因應外幣購料之資金需求。\n八、對股東權益之主要影響：\n   本次所發行之海外無擔保轉換公司債若全部按發行後轉\n  換價格轉換為普通股，如全數轉換，則原股東股權之稀\n  釋比率約為5.97%，其對原股東股權稀釋比例效果尚屬有限。""]], ""footer"": [""以上資料均由各公司依發言當時所屬市場別之規定申報後，由本系統對外公佈，資料如有虛偽不實，均由該公司負責。""], ""header"": {""note"": [], ""subTitle"": [], ""mainTitle"": [""公司當日重大訊息之詳細內容""]}, ""titles"": [{""sub"": [], ""main"": ""序號""}, {""sub"": [], ""main"": ""發言日期""}, {""sub"": [], ""main"": ""發言時間""}, {""sub"": [], ""main"": ""發言人""}, {""sub"": [], ""main"": ""發言人職稱""}, {""sub"": [], ""main"": ""發言人電話""}, {""sub"": [], ""main"": ""主旨""}, {""sub"": [], ""main"": ""符合條款""}, {""sub"": [], ""main"": ""事實發生日""}, {""sub"": [], ""main"": ""說明""}], ""companyAbbreviation"": ""技嘉""}, ""datetime"": ""115/05/19 23:20:44""}",2026-05-19 23:20:37
