key,speech_date,speech_time,company_id,company_name,subject,matched_keywords,enterDate,marketKind,serialNumber,detail_json,fetched_at_tw
1150527|sii|2887|3,115/05/27,17:41:21,2887,台新新光金,本公司代子公司台新期貨公告現金增資基準日,現金增資,1150527,sii,3,"{""code"": 200, ""message"": ""查詢成功"", ""result"": {""marketName"": ""上市公司"", ""companyId"": ""2887"", ""data"": [[3, ""115/05/27"", ""17:41:21"", ""林維俊"", ""總經理"", ""02-55761888"", ""本公司代子公司台新期貨公告現金增資基準日"", ""11"", ""115/05/27"", ""1.董事會決議或公司決定日期:115/05/27\n2.發行股數:66,666,667股\n3.每股面額:新臺幣10元\n4.發行總金額:新臺幣800,000,004元\n5.發行價格:新臺幣12元\n6.員工認股股數:0股\n7.原股東認購比率:100%\n8.公開銷售方式及股數:0股\n9.畸零股及逾期未認購股份之處理方式:無\n10.本次發行新股之權利義務:與已發行之普通股相同\n11.本次增資資金用途:充實營運資金與擴展業務\n12.現金增資認股基準日:115/05/27\n13.最後過戶日:不適用\n14.停止過戶起始日期:不適用\n15.停止過戶截止日期:不適用\n16.股款繳納期間:115/05/28\n17.與代收及專戶存儲價款行庫訂約日期:不適用\n18.委託代收存款機構:不適用\n19.委託存儲款項機構:不適用\n20.其他應敘明事項:\n(1)本增資案經金融監督管理委員會115年5月27日金管證期字第1150344477號函\n核准在案。\n(2)於115年5月11日第二屆第九次董事會，授權董事長訂定增資基準日。\n(3)增資基準日為115年5月28日。""]], ""footer"": [""以上資料均由各公司依發言當時所屬市場別之規定申報後，由本系統對外公佈，資料如有虛偽不實，均由該公司負責。""], ""header"": {""note"": [], ""subTitle"": [], ""mainTitle"": [""公司當日重大訊息之詳細內容""]}, ""titles"": [{""sub"": [], ""main"": ""序號""}, {""sub"": [], ""main"": ""發言日期""}, {""sub"": [], ""main"": ""發言時間""}, {""sub"": [], ""main"": ""發言人""}, {""sub"": [], ""main"": ""發言人職稱""}, {""sub"": [], ""main"": ""發言人電話""}, {""sub"": [], ""main"": ""主旨""}, {""sub"": [], ""main"": ""符合條款""}, {""sub"": [], ""main"": ""事實發生日""}, {""sub"": [], ""main"": ""說明""}], ""companyAbbreviation"": ""台新新光金""}, ""datetime"": ""115/05/28 02:28:17""}",2026-05-28 02:28:16
1150527|sii|1909|7,115/05/27,18:42:02,1909,榮成,公告本公司第二十八次買回庫藏股執行完畢情形,庫藏股,1150527,sii,7,"{""code"": 200, ""message"": ""查詢成功"", ""result"": {""marketName"": ""上市公司"", ""companyId"": ""1909"", ""data"": [[7, ""115/05/27"", ""18:42:02"", ""林器暉"", ""經理"", ""02-5581-1777"", ""公告本公司第二十八次買回庫藏股執行完畢情形"", ""35"", ""115/07/10"", ""1.原預定買回股份總金額上限(元):6,673,748,649\r\n2.原預定買回之期間:115/05/11~115/07/10\r\n3.原預定買回之數量(股):8,000,000\r\n4.原預定買回區間價格(元):6.42~10.00\r\n5.本次實際買回期間:115/05/13~115/05/27\r\n6.本次已買回股份數量(股):8,000,000\r\n7.本次已買回股份總金額(元):71,689,678\r\n8.本次平均每股買回價格(元):8.96\r\n9.累積已持有自己公司股份數量(股):36,299,000\r\n10.累積已持有自己公司股份數量占公司已發行股份總數之比率(%):2.73\r\n11.本次未執行完畢之原因:\r\n\r\n12.其他應敘明事項:\r\n無。""]], ""footer"": [""以上資料均由各公司依發言當時所屬市場別之規定申報後，由本系統對外公佈，資料如有虛偽不實，均由該公司負責。""], ""header"": {""note"": [], ""subTitle"": [], ""mainTitle"": [""公司當日重大訊息之詳細內容""]}, ""titles"": [{""sub"": [], ""main"": ""序號""}, {""sub"": [], ""main"": ""發言日期""}, {""sub"": [], ""main"": ""發言時間""}, {""sub"": [], ""main"": ""發言人""}, {""sub"": [], ""main"": ""發言人職稱""}, {""sub"": [], ""main"": ""發言人電話""}, {""sub"": [], ""main"": ""主旨""}, {""sub"": [], ""main"": ""符合條款""}, {""sub"": [], ""main"": ""事實發生日""}, {""sub"": [], ""main"": ""說明""}], ""companyAbbreviation"": ""榮成""}, ""datetime"": ""115/05/28 02:28:18""}",2026-05-28 02:28:16
1150527|sii|6670|8,115/05/27,19:30:30,6670,復盛應用,公告復盛應用科技股份有限公司國內第二次無擔保(例：第一次有擔保)轉(交)換公司債(簡稱：復盛應用二，代碼：66702)停止受理轉交換等相關事項。,公司債,1150527,sii,8,"{""code"": 200, ""message"": ""查詢成功"", ""result"": {""marketName"": ""上市公司"", ""companyId"": ""6670"", ""data"": [[8, ""115/05/27"", ""19:30:30"", ""許廷儀"", ""財務長"", ""03-3635370"", ""公告復盛應用科技股份有限公司國內第二次無擔保(例：第一次有擔保)轉(交)換公司債(簡稱：復盛應用二，代碼：66702)停止受理轉交換等相關事項。"", ""51"", ""115/05/27"", ""內容：本公司國內第二次無擔保轉換公司債發行及轉換辦法第九條規定辦理<br>(一)停止受理轉交換之事由：辦理配股配息作業事宜。<br>(其他事項敘明：)<br>(二)停止受理轉交換登記起訖日期：115年06月04日至115年06月30日止。<br>(三)債券持有人如擬申請轉換，最遲應於停止受理轉換登記之始日（115年06月04日）之前一營業日前（115年06月02日），向往來證券商辦理轉換手續。<br>無""]], ""footer"": [""以上資料均由各公司依發言當時所屬市場別之規定申報後，由本系統對外公佈，資料如有虛偽不實，均由該公司負責。""], ""header"": {""note"": [], ""subTitle"": [], ""mainTitle"": [""公司當日重大訊息之詳細內容""]}, ""titles"": [{""sub"": [], ""main"": ""序號""}, {""sub"": [], ""main"": ""發言日期""}, {""sub"": [], ""main"": ""發言時間""}, {""sub"": [], ""main"": ""發言人""}, {""sub"": [], ""main"": ""發言人職稱""}, {""sub"": [], ""main"": ""發言人電話""}, {""sub"": [], ""main"": ""主旨""}, {""sub"": [], ""main"": ""符合條款""}, {""sub"": [], ""main"": ""事實發生日""}, {""sub"": [], ""main"": ""說明""}], ""companyAbbreviation"": ""復盛應用""}, ""datetime"": ""115/05/28 02:28:18""}",2026-05-28 02:28:16
1150527|otc|6125|1,115/05/27,18:40:16,6125,廣運,代重要子公司盛新材料科技股份有限公司公告115年現金增資訂定認股基準日相關事宜(含代收股款及存儲專戶行庫),現金增資,1150527,otc,1,"{""code"": 200, ""message"": ""查詢成功"", ""result"": {""marketName"": ""上櫃公司"", ""companyId"": ""6125"", ""data"": [[1, ""115/05/27"", ""18:40:16"", ""沈麗娟"", ""總經理"", ""(02)2786-3797"", ""代重要子公司盛新材料科技股份有限公司公告115年\r\n現金增資訂定認股基準日相關事宜(含代收股款及存儲專戶行庫)"", ""11"", ""115/05/27"", ""1.董事會決議或公司決定日期:115/05/27\n2.發行股數:20,000,000股。\n3.每股面額:新台幣10元。\n4.發行總金額:以面額計新台幣200,000,000元。\n5.發行價格:每股新台幣35元。\n6.員工認股股數:依公司法第267條規定，保留發行新股總額之10%，計2,000,000股由\n 本公司及控制從屬公司員工認購。\n7.原股東認購比率:本次現金增資發行新股總額之90%，計18,000,000股由原股東按\n 認股基準日股東名簿所載之持股比例認購。\n8.公開銷售方式及股數:不適用。\n9.畸零股及逾期未認購股份之處理方式:認購股數不足一股之畸零股，自停止過\n 戶日起五日內由股東自行向本公司股務代理機構辦理拼湊整股認購，原股東及\n 員工放棄認購之股份或拼湊不足一股之畸零股，授權董事長洽特定人按發行價\n 格認購之。\n10.本次發行新股之權利義務:本次現金增資發行新股，其權利、義務與原發行之\n  普通股股份相同。\n11.本次增資資金用途:充實營運資金、償還債務、擴充機器設備。\n12.現金增資認股基準日:115/06/08\n13.最後過戶日:115/06/03\n14.停止過戶起始日期:115/06/04\n15.停止過戶截止日期:115/06/08\n16.股款繳納期間:115/06/15至115/06/22\n17.與代收及專戶存儲價款行庫訂約日期:115/05/27\n18.委託代收款項機構:台灣銀行南港分行。\n19.委託存儲款項機構:華南商業銀行南港分行。\n20.其他應敘明事項:\n (一)本公司115年03月03日董事會決議通過辦理。\n (二)本次現金增資計劃之重要內容，包括發行條件、計畫項目、暫訂價格、預定進\n     度及預計產生效益，暨其他有關本次現金增資相關事項，未來如因主管機關核\n     定及為因應客觀環境需修正或變更，及向主管機關申請延期或撤銷，或前述各\n     項未盡事宜，擬授權董事長全權處理之。""]], ""footer"": [""以上資料均由各公司依發言當時所屬市場別之規定申報後，由本系統對外公佈，資料如有虛偽不實，均由該公司負責。""], ""header"": {""note"": [], ""subTitle"": [], ""mainTitle"": [""公司當日重大訊息之詳細內容""]}, ""titles"": [{""sub"": [], ""main"": ""序號""}, {""sub"": [], ""main"": ""發言日期""}, {""sub"": [], ""main"": ""發言時間""}, {""sub"": [], ""main"": ""發言人""}, {""sub"": [], ""main"": ""發言人職稱""}, {""sub"": [], ""main"": ""發言人電話""}, {""sub"": [], ""main"": ""主旨""}, {""sub"": [], ""main"": ""符合條款""}, {""sub"": [], ""main"": ""事實發生日""}, {""sub"": [], ""main"": ""說明""}], ""companyAbbreviation"": ""廣運""}, ""datetime"": ""115/05/28 02:28:19""}",2026-05-28 02:28:16
1150527|rotc|6682|3,115/05/27,22:57:44,6682,華旭先進,公告本公司115年現金增資基準日暨相關事宜,現金增資,1150527,rotc,3,"{""code"": 200, ""message"": ""查詢成功"", ""result"": {""marketName"": ""興櫃公司"", ""companyId"": ""6682"", ""data"": [[3, ""115/05/27"", ""22:57:44"", ""黃文瑞"", ""董事長"", ""04-23586649"", ""公告本公司115年現金增資基準日暨相關事宜"", ""9"", ""115/05/27"", ""1.董事會決議或公司決定日期:115/05/27\n2.發行股數:5,000,000股\n3.每股面額:新台幣10元\n4.發行總金額:50,000,000元\n5.發行價格:新台幣40元\n6.員工認股股數:依公司法規定保留10%，計500,000股由員工認購。\n7.原股東認購比例(另請說明每仟股暫定得認購股數):\n 增資發行股數之90%，計4,500,000股由原股東按認股基準日股東名簿記載\n 之持股比例，依本公司普通股發行股份總數147,105,902股計算，每仟股認\n 購30.59020704股。\n8.公開銷售方式及股數:不適用。\n9.畸零股及逾期未認購股份之處理方式:\n 認購股數不足一股之畸零股，得由股東於停止過戶日起五日內自行至本公司\n 股務代理機構辦理拼湊登記，逾期或拼湊不足一股之畸零股、原股東與員工\n 放棄認購或認購不足部分，擬授權董事長洽特定人按發行價格認購之。\n10.本次發行新股之權利義務:與原發行普通股股份相同。\n11.本次增資資金用途:轉投資子公司及充實營運資金。\n12.現金增資認股基準日:115/06/23\n13.最後過戶日:115/06/18\n14.停止過戶起始日期:115/06/19\n15.停止過戶截止日期:115/06/23\n16.股款繳納期間:\n(1)原股東及員工股款繳納期間：115/06/29~115/07/07\n(2)特定人股款繳納期間：115/07/08~115/07/10\n17.與代收及專戶存儲價款行庫訂約日期:俟正式簽約後另行公告。\n18.委託代收款項機構:俟正式簽約後另行公告。\n19.委託存儲款項機構:俟正式簽約後另行公告。\n20.其他應敘明事項:\n(1)本次現金增資案業經金融監督管理委員會115年05月26日金管證發字\n   第1150344346號函申報生效在案。\n(2)本次現金增資之資金運用計畫項目、資金運用進度及預計可能產生效益等相關\n   事項，如因主客觀環境變動或因應主管機關需求而修正時，擬授權董事長全權\n   處理。\n(3)凡持有本公司股票而尚未辦理過戶之股東，請於民國115年06月18日前親臨本公\n   司股務代理機構「兆豐證券股份公司股務代理本部」(台北市中正區忠孝東路二段\n   95號1樓)，辦理過戶手續，掛號郵寄者以民國115年06月18日(最後過戶日)郵戳\n   日期為憑。凡參加台灣集中保管結算所股份有限公司進行集中辦理過戶者，本\n   公司股務代理人將依其送交之資料逕行辦理過戶手續。""]], ""footer"": [""以上資料均由各公司依發言當時所屬市場別之規定申報後，由本系統對外公佈，資料如有虛偽不實，均由該公司負責。""], ""header"": {""note"": [], ""subTitle"": [], ""mainTitle"": [""公司當日重大訊息之詳細內容""]}, ""titles"": [{""sub"": [], ""main"": ""序號""}, {""sub"": [], ""main"": ""發言日期""}, {""sub"": [], ""main"": ""發言時間""}, {""sub"": [], ""main"": ""發言人""}, {""sub"": [], ""main"": ""發言人職稱""}, {""sub"": [], ""main"": ""發言人電話""}, {""sub"": [], ""main"": ""主旨""}, {""sub"": [], ""main"": ""符合條款""}, {""sub"": [], ""main"": ""事實發生日""}, {""sub"": [], ""main"": ""說明""}], ""companyAbbreviation"": ""華旭先進""}, ""datetime"": ""115/05/28 02:28:20""}",2026-05-28 02:28:16
