key,speech_date,speech_time,company_id,company_name,subject,matched_keywords,enterDate,marketKind,serialNumber,detail_json,fetched_at_tw
1150507|sii|3011|1,115/05/13,19:31:28,3011,今皓,公告本公司董事會決議不繼續辦理114年股東常會通過之私募普通股案,私募普通股,1150507,sii,1,"{""code"": 200, ""message"": ""查詢成功"", ""result"": {""marketName"": ""上市公司"", ""companyId"": ""3011"", ""data"": [[1, ""115/05/13"", ""19:31:28"", ""林盟傑"", ""總經理"", ""2918-9189"", ""公告本公司董事會決議不繼續辦理114年股東常會\r\n通過之私募普通股案"", ""16"", ""115/05/13"", ""1.董事會決議變更日期:115/05/13\n2.原計畫申報生效之日期:114/06/30\n3.追補發行之日期:不適用\n4.變動原因:\n(1)本公司於114年6月30日股東常會決議通過辦理114年私募普通股案，私募普通股之\n   額度為不超過20,000仟股，且授權董事會於114年股東常會決議日起一年內分二次\n   辦理。\n(2)本公司114年10月29日辦理第一次私募後，私募普通股剩餘額度7,572,400股，因本\n   次私募案即將於115年6月30日屆滿，將不再繼續辦理，本案將提115年度股東常會\n   報告。\n5.歷次變更前後募集資金計畫:不適用。\n6.預計執行進度:不適用。\n7.預計完成日期:不適用。\n8.預計可能產生效益:不適用。\n9.與原預計效益產生之差異:不適用。\n10.本次變更對股東權益之影響:不適用。\n11.原主辦承銷商評估意見摘要:不適用。\n12.其他應敘明事項:無。""]], ""footer"": [""以上資料均由各公司依發言當時所屬市場別之規定申報後，由本系統對外公佈，資料如有虛偽不實，均由該公司負責。""], ""header"": {""note"": [], ""subTitle"": [], ""mainTitle"": [""公司當日重大訊息之詳細內容""]}, ""titles"": [{""main"": ""序號"", ""sub"": []}, {""main"": ""發言日期"", ""sub"": []}, {""main"": ""發言時間"", ""sub"": []}, {""main"": ""發言人"", ""sub"": []}, {""main"": ""發言人職稱"", ""sub"": []}, {""main"": ""發言人電話"", ""sub"": []}, {""main"": ""主旨"", ""sub"": []}, {""main"": ""符合條款"", ""sub"": []}, {""main"": ""事實發生日"", ""sub"": []}, {""main"": ""說明"", ""sub"": []}], ""companyAbbreviation"": ""今皓""}, ""datetime"": ""115/05/14 04:16:40""}",2026-05-14 04:16:33
1150508|sii|3011|1,115/05/13,19:34:49,3011,今皓,公告本公司董事會決議辦理私募普通股案,私募普通股,1150508,sii,1,"{""code"": 200, ""message"": ""查詢成功"", ""result"": {""marketName"": ""上市公司"", ""companyId"": ""3011"", ""data"": [[1, ""115/05/13"", ""19:34:49"", ""林盟傑"", ""總經理"", ""2918-9189"", ""公告本公司董事會決議辦理私募普通股案"", ""11"", ""115/05/13"", ""1.董事會決議日期:115/05/13\n2.私募有價證券種類:普通股\n3.私募對象及其與公司間關係:本次私募普通股之對象，以證券交易法第43條之6及金融\n監督管理委員會112年9月12日金管證發字第1120383220號令規定之應募人資格為限，並\n依相關規定辦理。\n應募人如為本公司內部人或關係人，本公司將選擇對公司營運有相當瞭解且有利於公\n司未來之營運者，以達到強化股東結構，與支持公司長期發展之目的，亦可健全本公\n司財務結構，提升股東權益。惟該名單僅為潛在應募對象，不代表該等內部人或關係\n人已同意認購本公司私募普通股股權；可能應募人名單如下：\n\n可能應募人                       與本公司之關係\n----------                       ----------------\n石浩吉                           本公司董事長\n曾柏湖                           本公司董事\n何昭陽                           本公司董事\n張嘉伶                           本公司法人董事代表人\n金緻人工智能投資有限公司           本公司法人董事\n\n上述名單屬於法人者：金緻人工智能投資有限公司；其股東持股比例占前十名之股東\n名稱、持股比例及與本公司之關係如下：\n\n該法人前十名股東        持股比例              與本公司關係\n---------------------  --------   -----------------------------------------\n智銀未來科技有限合夥     90.91%    本公司第十三屆法人董事候選人之主要股東\n陳文偉                  9.09%      本公司第十三屆法人董事候選人之負責人\n\n4.私募股數或張數:發行股數不超過普通股20,000仟股。\n5.得私募額度:在不超過20,000仟股額度內，於股東會決議之日起授權董事會於一年內\n合計定價及辦理次數不超過三次。\n6.私募價格訂定之依據及合理性:\n一.參考價格以下列二基準計算價格較高者定之：\n1.定價日前一、三或五個營業日擇一計算普通股收盤價簡單算數平均數扣除無償配股\n  除權及配息，並加回減資反除權後之股價。\n2.定價日前三十個營業日普通股收盤價簡單算數平均數扣除無償配股除權及配息，並\n  加回減資反除權後之股價。\n二.本次私募實際發行價格不得低於股票面額：\n1.應募人如為公司內部人或關係人，符合公開發行公司辦理私募有價證券應注意事項\n  第四條第一項第二款規定，其發行價格擬以不低於參考價格之八成為依據。\n2.應募人如為策略性投資人，其發行價格擬不低於參考價格之八成為訂價依據。\n3.私募有價證券之實際定價日及實際私募價格，擬提請股東會於不低於股東會決議成\n  數範圍內授權董事會視日後洽定特定人情形及市場狀況決定之。\n4.本次私募發行將僅限定適用單一定價依據，不得有同次發行股份適用不同發行價格\n  之情形。\n三.私募有價證券之發行條件訂定係因證券交易法對私募有價證券有三年轉讓限制，且\n   對應募人資格亦嚴格規範，本次私募價格之訂定，係遵循主管機關之相關規定，同\n   時參酌本公司經營績效、最近期淨值及近期股價等因素後決定，其訂定方式應屬合\n   理。\n7.本次私募資金用途:充實營運資金、償還銀行借款、轉投資或其他。\n8.不採用公開募集之理由:考量資本市場狀況、籌募資本之時效性、可行性、發行成本\n及引進投資人之實際需求，辦理私募具有迅速簡便之特性，故不採用公開募集而擬提\n請股東會授權董事會視公司營運需求辦理私募，以有效提高籌資之機動性及靈活性。\n9.獨立董事反對或保留意見:無。\n10.實際定價日:尚未訂定。\n11.參考價格:尚未訂定。\n12.實際私募價格、轉換或認購價格:尚未訂定。\n13.本次私募新股之權利義務:本次私募之普通股其權利義務與本公司已發行之普通股相\n  同，惟依據「證券交易法」規定，私募普通股於私募有價證券交付日起三年內，除\n  依「證券交易法」第43條之8規定之轉讓對象外，不得自由轉讓。本公司將於交付日\n  起滿三年後依據「證券交易法」及相關規定，向主管機關補辦公開發行及申請上市　\n  交易。\n14.附有轉換、交換或認股者，其換股基準日:不適用。\n15.附有轉換、交換或認股者，對股權可能稀釋情形:不適用。\n16.附有轉換或認股者，於私募公司債交付且假設全數轉換或認購普通股後對\n上市普通股股權比率之可能影響（上市普通股數A、A/已發行普通股):不適用。\n17.前項預計上市普通股未達6000萬股且未達25%者，請說明股權流通性偏低之因應措施:\n不適用。\n18.其他應敘明事項:\n(一)本次私募計畫之主要內容，除私募定價成數外，包括實際發行價格、發行股數、\n    發行條件、計畫項目、募集金額、預計進度及預計可能產生之效益等相關事項，\n    暨其他一切有關發行計畫之事項，擬提請股東會同意授權董事會視市場狀況調整、\n    訂定與辦理，未來如因主管機關指示修正或基於營運評估或客觀環境需要變更時，\n    亦授權董事會全權處理之。\n(二)為配合本次以私募方式辦理現金增資發行普通股，除上述授權範圍外，俟股東會\n    通過本案後，擬提請由董事會授權本公司董事長全權辦理並代表本公司簽署一切\n    有關私募普通股之契約及文件。""]], ""footer"": [""以上資料均由各公司依發言當時所屬市場別之規定申報後，由本系統對外公佈，資料如有虛偽不實，均由該公司負責。""], ""header"": {""note"": [], ""subTitle"": [], ""mainTitle"": [""公司當日重大訊息之詳細內容""]}, ""titles"": [{""main"": ""序號"", ""sub"": []}, {""main"": ""發言日期"", ""sub"": []}, {""main"": ""發言時間"", ""sub"": []}, {""main"": ""發言人"", ""sub"": []}, {""main"": ""發言人職稱"", ""sub"": []}, {""main"": ""發言人電話"", ""sub"": []}, {""main"": ""主旨"", ""sub"": []}, {""main"": ""符合條款"", ""sub"": []}, {""main"": ""事實發生日"", ""sub"": []}, {""main"": ""說明"", ""sub"": []}], ""companyAbbreviation"": ""今皓""}, ""datetime"": ""115/05/14 04:16:41""}",2026-05-14 04:16:33
1150513|sii|6239|1,115/05/13,19:43:41,6239,力成,本公司訂購機器設備公告,機器設備,1150513,sii,1,"{""code"": 200, ""message"": ""查詢成功"", ""result"": {""marketName"": ""上市公司"", ""companyId"": ""6239"", ""data"": [[1, ""115/05/13"", ""19:43:41"", ""沈俊宏"", ""財務長"", ""03-5980300"", ""本公司訂購機器設備公告"", ""20"", ""115/05/13"", ""1.標的物之名稱及性質（如坐落台中市北區ＸＸ段ＸＸ小段土地）:\r\n封裝設備及其零配件。\r\n2.事實發生日:114/10/27~115/5/13\r\n3.董事會通過日期: 不適用\r\n4.其他核決日期:\r\n核決層級:董事長\r\n民國115年05月13日\r\n5.交易單位數量（如ＸＸ平方公尺，折合ＸＸ坪）、每單位價格及交易總金額:\r\n一批；交易總金額：新台幣540,634,942元。\r\n6.交易相對人及其與公司之關係（交易相對人如屬自然人，且非公司之關\r\n係人者，得免揭露其姓名）:\r\n迪思科高科技股份有限公司；與公司關係：無。\r\n7.交易相對人為關係人者，並應公告選定關係人為交易對象之原因及前次移轉之\r\n所有人、前次移轉之所有人與公司及交易相對人間相互之關係、前次移轉日期\r\n及移轉金額:\r\n不適用。\r\n8.交易標的最近五年內所有權人曾為公司之關係人者，尚應公告關係\r\n人之取得及處分日期、價格及交易當時與公司之關係:\r\n不適用。\r\n9.預計處分利益（或損失）（取得資產者不適用）（遞延者應列表說明\r\n認列情形）:\r\n不適用。\r\n10.交付或付款條件（含付款期間及金額）、契約限制條款及其他重要約定\r\n事項:\r\n付款條件依採購合約(採購單)所示支付。\r\n11.本次交易之決定方式（如招標、比價或議價）、價格決定之參考依據及\r\n決策單位:\r\n依公司採購相關辦法程序進行比價及議價，經權責主管核准後進行採購。\r\n12.專業估價者事務所或公司名稱及其估價金額:\r\n不適用。\r\n13.專業估價師姓名:\r\n不適用。\r\n14.專業估價師開業證書字號:\r\n不適用。\r\n15.估價報告是否為限定價格、特定價格或特殊價格:否或不適用\r\n16.是否尚未取得估價報告:是\r\n17.尚未取得估價報告之原因:\r\n不適用。\r\n18.估價結果有重大差異時，其差異原因及會計師意見:\r\n不適用。\r\n19.會計師事務所名稱:\r\n不適用。\r\n20.會計師姓名:\r\n不適用。\r\n21.會計師開業證書字號:\r\n不適用。\r\n22.經紀人及經紀費用:\r\n不適用。\r\n23.取得或處分之具體目的或用途:\r\n供營運生產使用。\r\n24.本次交易表示異議之董事之意見:\r\n不適用。\r\n25.本次交易為關係人交易:否\r\n26.監察人承認或審計委員會同意日期:\r\n不適用\r\n27.本次交易係向關係人取得不動產或其使用權資產:否\r\n28.依「公開發行公司取得或處分資產處理準則」第十六條規定\r\n評估之價格:不適用\r\n29.依前項評估之價格較交易價格為低者，依同準則第十七條規\r\n定評估之價格:不適用\r\n30.前已就同一件事件發布重大訊息日期: 不適用\r\n31.其他敘明事項:\r\n無。""]], ""footer"": [""以上資料均由各公司依發言當時所屬市場別之規定申報後，由本系統對外公佈，資料如有虛偽不實，均由該公司負責。""], ""header"": {""note"": [], ""subTitle"": [], ""mainTitle"": [""公司當日重大訊息之詳細內容""]}, ""titles"": [{""main"": ""序號"", ""sub"": []}, {""main"": ""發言日期"", ""sub"": []}, {""main"": ""發言時間"", ""sub"": []}, {""main"": ""發言人"", ""sub"": []}, {""main"": ""發言人職稱"", ""sub"": []}, {""main"": ""發言人電話"", ""sub"": []}, {""main"": ""主旨"", ""sub"": []}, {""main"": ""符合條款"", ""sub"": []}, {""main"": ""事實發生日"", ""sub"": []}, {""main"": ""說明"", ""sub"": []}], ""companyAbbreviation"": ""力成""}, ""datetime"": ""115/05/14 04:16:41""}",2026-05-14 04:16:33
1150513|otc|3390|1,115/05/13,17:59:31,3390,旭軟,公告本公司113年度現金增資發行新股暨國內第二次有擔保轉換公司債之資金運用計畫變更,現金增資|公司債,1150513,otc,1,"{""code"": 200, ""message"": ""查詢成功"", ""result"": {""marketName"": ""上櫃公司"", ""companyId"": ""3390"", ""data"": [[1, ""115/05/13"", ""17:59:31"", ""黃淑媛"", ""行銷處處長"", ""03-2220998"", ""公告本公司113年度現金增資發行新股暨國內第二次有擔保轉換\r\n公司債之資金運用計畫變更"", ""16"", ""115/05/12"", ""1.董事會決議變更日期:115/05/12\n2.原計畫申報生效日期:114/01/16\n3.追補發行日期:不適用\n4.變動原因:本公司原購買土地及廠房做為自主生產使用，惟原地上建物地上物之部分\n違建未符合現有法令規範，若採修建方式應無法取得使用執照，且考量修建費用高\n昂等因素，經本公司委任建築師之建議擬變更建置方式。\n5.歷次變更前後募集資金計畫:\n(1)變更前:購置工業用地(含其建物)及建置廠務設施450,000仟元。\n(2)變更後:購置工業用地(含其建物)及建置廠務設施599,982仟元。\n6.預計執行進度:115年第三季\n7.預計完成日期:115年第三季\n8.預計可能產生效益:節省租金支出及可取得資產產權完整性及資產自主運用性\n，亦使本公司完整建構軟性印刷電路板製程，達到資源控管、成本控制、時程管理\n，加速生產效能，滿足不同客戶需求。\n9.與原預計效益產生之差異:購建廠房(含周邊建設)及廠務設施：與變更前相較預計\n115年度及未來每年度可分別節省廠房租金支出1,165仟元及3,494仟元。\n10.本次變更對股東權益之影響:本公司廠務設施及搬遷費用計畫項目金額較原\n預計增加，係因應原地上物之部分違建未符合現有法令規範，若採修建方式應\n無法取得使用執照，且考量修建費用高昂等因素，經本公司委任建築師之建議\n擬變更建置方式，計畫變更後未來每年度可減少租金費用由計畫變更前之\n2,220仟元增加至3,494仟元，對公司未來營運有正面助益，將有助於提升\n未來股東權益。\n11.原主辦承銷商評估意見摘要:\n(1)本次募集資金計畫變更之必要性、合理性\n該公司本次計畫變更主要係向金琦豐企業股份有限公司購買土地及廠房\n做為自主生產使用，惟原地上建物地上物之部分違建未符合現有法令規範，若\n採修建方式應無法取得使用執照，且考量修建費用高昂等因素，經該公\n司委任建築師之建議擬變更建置方式，故將廠務設施及搬遷費用需求資\n金由原計畫之新台幣100,000仟元調增至新台幣249,982仟元，該等因素\n係為符合法規以順利申請使用執照，使該購置土地及廠務設施達可使用\n狀況，並將該公司原二、三廠於租賃期間前順利搬遷至新址以利營運不\n受影響，且計畫變更後未來每年度可減少租金費用由計畫變更前之2,220\n仟元增加至3,494仟元，對公司未來營運有正面助益，故該公司本次計畫\n變更確有其必要性。有關本次計畫變更，該公司係以原計畫為基礎，考量\n符合法規遵循及委任建築師之專業評估等因素，對於廠務設施及搬遷費用\n之成本做出適時調整，故其計畫變更理由亦屬合理。\n(2)變更後預計效益與進度達成可行性\n該公司本次募集資金計畫變更後，預計115年度及未來每年度分別可減少\n租金費用1,165仟元及3,494仟元；而進度亦以原計畫為基礎，參酌承包商\n所提出的建廠時程及工程款之支付進度，調整為預計興建廠房及建置廠務\n設施於115年第三季完成。整體而言，其變更後預計效益與進度達成尚屬\n合理可行。\n12.其他應敘明事項:無""]], ""footer"": [""以上資料均由各公司依發言當時所屬市場別之規定申報後，由本系統對外公佈，資料如有虛偽不實，均由該公司負責。""], ""header"": {""note"": [], ""subTitle"": [], ""mainTitle"": [""公司當日重大訊息之詳細內容""]}, ""titles"": [{""main"": ""序號"", ""sub"": []}, {""main"": ""發言日期"", ""sub"": []}, {""main"": ""發言時間"", ""sub"": []}, {""main"": ""發言人"", ""sub"": []}, {""main"": ""發言人職稱"", ""sub"": []}, {""main"": ""發言人電話"", ""sub"": []}, {""main"": ""主旨"", ""sub"": []}, {""main"": ""符合條款"", ""sub"": []}, {""main"": ""事實發生日"", ""sub"": []}, {""main"": ""說明"", ""sub"": []}], ""companyAbbreviation"": ""旭軟""}, ""datetime"": ""115/05/14 04:16:42""}",2026-05-14 04:16:33
1150513|otc|5321|3,115/05/13,18:03:28,5321,美而快,公告本公司董事會決議辦理私募現金增資發行普通股,現金增資,1150513,otc,3,"{""code"": 200, ""message"": ""查詢成功"", ""result"": {""marketName"": ""上櫃公司"", ""companyId"": ""5321"", ""data"": [[3, ""115/05/13"", ""18:03:28"", ""王志仁"", ""總經理"", ""0939390157"", ""公告本公司董事會決議辦理私募現金增資發行普通股"", ""11"", ""115/05/13"", ""1.董事會決議日期:115/05/13\n2.私募有價證券種類:普通股\n3.私募對象及其與公司間關係:本次私募之應募對象以符合證券交易法第43條之6及\n金融監督管理委員會112年9月12日金管證發字第1120383220號令規定之策略性投資人\n為限，惟目前本公司尚未洽定應募人。\n4.私募股數或張數:以不超過7,000,000股之普通股為限。\n5.得私募額度:私募總股數以不超過7,000,000股之普通股為限，每股面額10元，擬授權\n董事會，於股東會決議之日起一年內分一次辦理。\n6.私募價格訂定之依據及合理性:\n(1)本次私募普通股價格之訂定，以不低於參考價格之八成為訂定私募價格之依據，且\n不得低於股票面額，參考價格以下列二基準計算價格較高者：\nA.定價日前一、三、五個營業日擇一計算之普通股收盤價簡單算數平均數扣除無償配股\n除權及配息，並加回減資反除權後之每股股價。\nB.定價日前30個營業日之普通股收盤價簡單算數平均數扣除無償配股除權及配息，並\n加回減資反除權後之每股股價。\n(2)實際定價日及實際私募價格，擬請股東會授權董事會在不低於股東會決議成數之\n範圍內，視日後洽特定人情形及資本市場狀況決定之。\n(3)私募有價證券價格之訂定，除考量證券交易法對私募有價證券有三年轉讓限制，\n且對應募人資格亦嚴格規範之外，係依據「公開發行公司辦理私募有價證券應注意\n事項」相關規定辦理，故尚不致有重大損害股東權益之情形，其價格訂定原則應屬\n合理。\n7.本次私募資金用途:\n係因應本公司未來業務發展之資金需求(包括但不限於轉投資、充實新業務營運資金)，\n預計將有助於強化公司競爭力、提升營運效能及強化財務結構之效益，對股東權益有\n正面助益。\n8.不採用公開募集之理由:\n本公司考量目前營運狀況及資本市場接受度，為掌握募集資金之時效性及可行性\n，以便於最短期限內取得長期之資金，故擬透過私募方式募集資金，且私募之限制\n轉讓規定有助於公司經營權之穩定，另透過授權董事會視公司實際營運需求於適當\n時機辦理私募，可提升本公司籌資規劃之效率與彈性。\n9.獨立董事反對或保留意見:無。\n10.實際定價日:尚未訂定。\n11.參考價格:尚未訂定。\n12.實際私募價格、轉換或認購價格:尚未訂定。\n13.本次私募新股之權利義務:\n本次私募普通股之權利義務與本公司已發行之普通股相同，惟其轉讓應受證券交易法\n第43條之8規定之限制。\n14.附有轉換、交換或認股者，其換股基準日:不適用。\n15.附有轉換、交換或認股者，對股權可能稀釋情形:不適用。\n16.附有轉換或認股者，於私募公司債交付且假設全數轉換或認購普通股後對上櫃普通股\n股權比率之可能影響（上櫃普通股數A、A/已發行普通股）:不適用。\n17.前項預計上櫃普通股未達500萬股且未達25%者，請說明股權流通性偏低之因應措施:\n不適用。\n18.其他應敘明事項:\n本次私募計畫之主要內容，除私募訂價成數外，包括實際發行價格、股數、發行條件、\n發行時間、計畫項目、募集金額、應募人之選擇、預計進度及預計可能產生之效益等，\n暨其他一切有關發行計畫之事項，未來如因主管機關指示修正或基於營運評估或因客觀\n環境需要變更時，擬請股東會授權董事會審酌情勢並依相關規定辦理。""]], ""footer"": [""以上資料均由各公司依發言當時所屬市場別之規定申報後，由本系統對外公佈，資料如有虛偽不實，均由該公司負責。""], ""header"": {""note"": [], ""subTitle"": [], ""mainTitle"": [""公司當日重大訊息之詳細內容""]}, ""titles"": [{""main"": ""序號"", ""sub"": []}, {""main"": ""發言日期"", ""sub"": []}, {""main"": ""發言時間"", ""sub"": []}, {""main"": ""發言人"", ""sub"": []}, {""main"": ""發言人職稱"", ""sub"": []}, {""main"": ""發言人電話"", ""sub"": []}, {""main"": ""主旨"", ""sub"": []}, {""main"": ""符合條款"", ""sub"": []}, {""main"": ""事實發生日"", ""sub"": []}, {""main"": ""說明"", ""sub"": []}], ""companyAbbreviation"": ""美而快""}, ""datetime"": ""115/05/14 04:16:42""}",2026-05-14 04:16:33
