key,speech_date,speech_time,company_id,company_name,subject,matched_keywords,enterDate,marketKind,serialNumber,detail_json,fetched_at_tw
1150513|sii|3711|1,115/05/13,17:31:26,3711,日月光投控,代子公司日月光半導體製造(股)公司公告取得萬潤科技股份有限公司供營業用之機器設備,機器設備,1150513,sii,1,"{""code"": 200, ""message"": ""查詢成功"", ""result"": {""marketName"": ""上市公司"", ""companyId"": ""3711"", ""data"": [[1, ""115/05/13"", ""17:31:26"", ""吳田玉"", ""營運長"", ""02-66365678"", ""代子公司日月光半導體製造(股)公司公告\r\n取得萬潤科技股份有限公司供營業用之機器設備"", ""20"", ""115/05/13"", ""1.標的物之名稱及性質（如坐落台中市北區ＸＸ段ＸＸ小段土地）:\r\n供營業用之機器設備\r\n2.事實發生日:115/5/5~115/5/13\r\n3.董事會通過日期: 不適用\r\n4.其他核決日期:\r\n核決層級:總經理核決\r\n民國115年5月13日\r\n5.交易單位數量（如ＸＸ平方公尺，折合ＸＸ坪）、每單位價格及交易總金額:\r\n交易數量：一批\n每單位價格計：新台幣1,008,340仟元(未稅)\n累計交易總金額計：新台幣1,008,340仟元(未稅)\r\n6.交易相對人及其與公司之關係（交易相對人如屬自然人，且非公司之關\r\n係人者，得免揭露其姓名）:\r\n交易相對人：萬潤科技股份有限公司\n與公司之關係：無\r\n7.交易相對人為關係人者，並應公告選定關係人為交易對象之原因及前次移轉之\r\n所有人、前次移轉之所有人與公司及交易相對人間相互之關係、前次移轉日期\r\n及移轉金額:\r\n不適用\r\n8.交易標的最近五年內所有權人曾為公司之關係人者，尚應公告關係\r\n人之取得及處分日期、價格及交易當時與公司之關係:\r\n不適用\r\n9.預計處分利益（或損失）（取得資產者不適用）（遞延者應列表說明\r\n認列情形）:\r\n不適用\r\n10.交付或付款條件（含付款期間及金額）、契約限制條款及其他重要約定\r\n事項:\r\n交付或付款條件：電匯或信用狀付款\n契約限制條款：無\n其他重要約定事項：無\r\n11.本次交易之決定方式（如招標、比價或議價）、價格決定之參考依據及\r\n決策單位:\r\n交易之決定方式及價格決定之參考依據：比價及議價\n決策單位：依該公司核決權限規定辦理\r\n12.專業估價者事務所或公司名稱及其估價金額:\r\n不適用\r\n13.專業估價師姓名:\r\n不適用\r\n14.專業估價師開業證書字號:\r\n不適用\r\n15.估價報告是否為限定價格、特定價格或特殊價格:否或不適用\r\n16.是否尚未取得估價報告:否或不適用\r\n17.尚未取得估價報告之原因:\r\n不適用\r\n18.估價結果有重大差異時，其差異原因及會計師意見:\r\n不適用\r\n19.會計師事務所名稱:\r\n不適用\r\n20.會計師姓名:\r\n不適用\r\n21.會計師開業證書字號:\r\n不適用\r\n22.經紀人及經紀費用:\r\n無\r\n23.取得或處分之具體目的或用途:\r\n供生產及營運用\r\n24.本次交易表示異議之董事之意見:\r\n不適用\r\n25.本次交易為關係人交易:否\r\n26.監察人承認或審計委員會同意日期:\r\n不適用\r\n27.本次交易係向關係人取得不動產或其使用權資產:否\r\n28.依「公開發行公司取得或處分資產處理準則」第十六條規定\r\n評估之價格:不適用\r\n29.依前項評估之價格較交易價格為低者，依同準則第十七條規\r\n定評估之價格:不適用\r\n30.前已就同一件事件發布重大訊息日期: 不適用\r\n31.其他敘明事項:\r\n無""]], ""footer"": [""以上資料均由各公司依發言當時所屬市場別之規定申報後，由本系統對外公佈，資料如有虛偽不實，均由該公司負責。""], ""header"": {""note"": [], ""subTitle"": [], ""mainTitle"": [""公司當日重大訊息之詳細內容""]}, ""titles"": [{""main"": ""序號"", ""sub"": []}, {""main"": ""發言日期"", ""sub"": []}, {""main"": ""發言時間"", ""sub"": []}, {""main"": ""發言人"", ""sub"": []}, {""main"": ""發言人職稱"", ""sub"": []}, {""main"": ""發言人電話"", ""sub"": []}, {""main"": ""主旨"", ""sub"": []}, {""main"": ""符合條款"", ""sub"": []}, {""main"": ""事實發生日"", ""sub"": []}, {""main"": ""說明"", ""sub"": []}], ""companyAbbreviation"": ""日月光投控""}, ""datetime"": ""115/05/14 04:16:35""}",2026-05-14 04:16:33
1150513|sii|6887|8,115/05/13,17:41:16,6887,寶綠特-KY,公告本公司董事會決議通過參與子公司寶綠特資源再生科技股份有限公司現金增資案,現金增資,1150513,sii,8,"{""code"": 200, ""message"": ""查詢成功"", ""result"": {""marketName"": ""上市公司"", ""companyId"": ""6887"", ""data"": [[8, ""115/05/13"", ""17:41:16"", ""林昱君"", ""會計主管"", ""(06)6233306"", ""公告本公司董事會決議通過參與子公司寶綠特資源再生科技股份有限公司現金增資案"", ""20"", ""115/05/13"", ""1.標的物之名稱及性質（屬特別股者，並應標明特別股約定發行條件，如股息率等）:\r\n寶綠特資源再生科技股份有限公司普通股\r\n2.事實發生日:115/5/13~115/5/13\r\n3.董事會通過日期: 民國115年5月13日\r\n4.其他核決日期: 不適用\r\n5.交易數量、每單位價格及交易總金額:\r\n交易數量數量：16,000,000股\n交易價格：每股新台幣10元\n交易總金額：新台幣160,000,000元\r\n6.交易相對人及其與公司之關係（交易相對人如屬自然人，且非公司之\r\n關係人者，得免揭露其姓名）:\r\n寶綠特資源再生科技股份有限公司/本公司100%之子公司\r\n7.交易相對人為關係人者，並應公告選定關係人為交易對象之原因及前次移\r\n轉之所有人、前次移轉之所有人與公司及交易相對人間相互之關係、前次\r\n移轉日期及移轉金額:\r\n不適用\r\n8.交易標的最近五年內所有權人曾為公司之關係人者，尚應公告關係人之取\r\n得及處分日期、價格及交易當時與公司之關係:\r\n不適用\r\n9.本次係處分債權之相關事項（含處分之債權附隨擔保品種類、處分債權\r\n如有屬對關係人債權者尚需公告關係人名稱及本次處分該關係人之債權\r\n帳面金額:\r\n不適用\r\n10.處分利益（或損失）（取得有價證券者不適用）（原遞延者應列表說明\r\n認列情形）:\r\n不適用\r\n11.交付或付款條件（含付款期間及金額）、契約限制條款及其他重要約定\r\n事項:\r\n依寶綠特資源再生科技股份有限公司增資作業時程辦理。\r\n12.本次交易之決定方式、價格決定之參考依據及決策單位:\r\n(1)本次交易之決定方式及價格決定之參考依據:\n依寶綠特資源再生科技股份有限公司訂定之現金增資認購價格及增資作業時程辦理。\n寶綠特資源再生科技股份有限公司現金增資認購價格係參考該公司之每股面額為依據。\n(2)決策單位：本公司董事會。\r\n13.取得或處分有價證券標的公司每股淨值:\r\n10.26元\r\n14.迄目前為止，累積持有本交易證券（含本次交易）之數量、金額、持股\r\n比例及權利受限情形（如質押情形）:\r\n(1)累積持有本交易證券之數量:49,800,000股\n(2)累積持有本交易證券之金額:新台幣498,000,000元\n(3)累積持有本交易證券之持股比例:100%\n(4)權利受限情形:無\r\n15.迄目前為止，依「公開發行公司取得或處分資產處理準則」第三條所列\r\n之有價證券投資（含本次交易）占公司最近期財務報表中總資產及歸屬\r\n於母公司業主之權益之比例暨最近期財務報表中營運資金數額（註二）:\r\n(1)占公司最近期財務報表中總資產之比例:9.72%\n(2)占公司最近期財務報表中總歸屬於母公司業主之權益之比例:16.81%\n(3)最近期財務報表中營運資金數額:新台幣2,103,534千元\r\n16.經紀人及經紀費用:\r\n不適用\r\n17.取得或處分之具體目的或用途:\r\n因應子公司業務需要，參與認購其增資新股\r\n18.本次交易表示異議董事之意見:\r\n無\r\n19.本次交易為關係人交易:是\r\n20.監察人承認或審計委員會同意日期:\r\n民國115年5月13日\r\n21.本次交易會計師出具非合理性意見:不適用\r\n22.會計師事務所名稱:\r\n不適用\r\n23.會計師姓名:\r\n不適用\r\n24.會計師開業證書字號:\r\n不適用\r\n25.是否涉及營運模式變更:否\r\n26.營運模式變更說明:\r\n\r\n27.過去一年及預計未來一年內與交易相對人交易情形:\r\n不適用\r\n28.資金來源:\r\n不適用\r\n29.前已就同一件事件發布重大訊息日期: 不適用\r\n30.其他敘明事項:\r\n無""]], ""footer"": [""以上資料均由各公司依發言當時所屬市場別之規定申報後，由本系統對外公佈，資料如有虛偽不實，均由該公司負責。""], ""header"": {""note"": [], ""subTitle"": [], ""mainTitle"": [""公司當日重大訊息之詳細內容""]}, ""titles"": [{""main"": ""序號"", ""sub"": []}, {""main"": ""發言日期"", ""sub"": []}, {""main"": ""發言時間"", ""sub"": []}, {""main"": ""發言人"", ""sub"": []}, {""main"": ""發言人職稱"", ""sub"": []}, {""main"": ""發言人電話"", ""sub"": []}, {""main"": ""主旨"", ""sub"": []}, {""main"": ""符合條款"", ""sub"": []}, {""main"": ""事實發生日"", ""sub"": []}, {""main"": ""說明"", ""sub"": []}], ""companyAbbreviation"": ""寶綠特-KY""}, ""datetime"": ""115/05/14 04:16:36""}",2026-05-14 04:16:33
1150513|sii|2408|1,115/05/13,18:04:09,2408,南亞科,公告本公司取得廠務設備,廠務設備,1150513,sii,1,"{""code"": 200, ""message"": ""查詢成功"", ""result"": {""marketName"": ""上市公司"", ""companyId"": ""2408"", ""data"": [[1, ""115/05/13"", ""18:04:09"", ""李培瑛"", ""總經理"", ""(02)2904-5858"", ""公告本公司取得廠務設備"", ""20"", ""115/05/13"", ""1.標的物之名稱及性質（如坐落台中市北區ＸＸ段ＸＸ小段土地）:\r\n廠務設備\r\n2.事實發生日:114/12/3~115/5/13\r\n3.董事會通過日期: 不適用\r\n4.其他核決日期:\r\n核決層級:董事長\r\n民國115年5月13日\r\n5.交易單位數量（如ＸＸ平方公尺，折合ＸＸ坪）、每單位價格及交易總金額:\r\n交易數量：一批\n交易總金額：新台幣1,261,067,586元\r\n6.交易相對人及其與公司之關係（交易相對人如屬自然人，且非公司之關\r\n係人者，得免揭露其姓名）:\r\n富呈科技股份有限公司，與公司關係：無。\r\n7.交易相對人為關係人者，並應公告選定關係人為交易對象之原因及前次移轉之\r\n所有人、前次移轉之所有人與公司及交易相對人間相互之關係、前次移轉日期\r\n及移轉金額:\r\n不適用\r\n8.交易標的最近五年內所有權人曾為公司之關係人者，尚應公告關係\r\n人之取得及處分日期、價格及交易當時與公司之關係:\r\n不適用\r\n9.預計處分利益（或損失）（取得資產者不適用）（遞延者應列表說明\r\n認列情形）:\r\n不適用\r\n10.交付或付款條件（含付款期間及金額）、契約限制條款及其他重要約定\r\n事項:\r\n依訂單條件或合約約定辦理\r\n11.本次交易之決定方式（如招標、比價或議價）、價格決定之參考依據及\r\n決策單位:\r\n比、議價：依廠商及其他廠商提供之報價單等作為參考依據，\n並依本公司核決權限規定辦理。\r\n12.專業估價者事務所或公司名稱及其估價金額:\r\n不適用\r\n13.專業估價師姓名:\r\n不適用\r\n14.專業估價師開業證書字號:\r\n不適用\r\n15.估價報告是否為限定價格、特定價格或特殊價格:否或不適用\r\n16.是否尚未取得估價報告:否或不適用\r\n17.尚未取得估價報告之原因:\r\n不適用\r\n18.估價結果有重大差異時，其差異原因及會計師意見:\r\n不適用\r\n19.會計師事務所名稱:\r\n不適用\r\n20.會計師姓名:\r\n不適用\r\n21.會計師開業證書字號:\r\n不適用\r\n22.經紀人及經紀費用:\r\n不適用\r\n23.取得或處分之具體目的或用途:\r\n供生產/營運使用\r\n24.本次交易表示異議之董事之意見:\r\n不適用\r\n25.本次交易為關係人交易:否\r\n26.監察人承認或審計委員會同意日期:\r\n不適用\r\n27.本次交易係向關係人取得不動產或其使用權資產:否\r\n28.依「公開發行公司取得或處分資產處理準則」第十六條規定\r\n評估之價格:不適用\r\n29.依前項評估之價格較交易價格為低者，依同準則第十七條規\r\n定評估之價格:不適用\r\n30.前已就同一件事件發布重大訊息日期: 不適用\r\n31.其他敘明事項:\r\n無""]], ""footer"": [""以上資料均由各公司依發言當時所屬市場別之規定申報後，由本系統對外公佈，資料如有虛偽不實，均由該公司負責。""], ""header"": {""note"": [], ""subTitle"": [], ""mainTitle"": [""公司當日重大訊息之詳細內容""]}, ""titles"": [{""main"": ""序號"", ""sub"": []}, {""main"": ""發言日期"", ""sub"": []}, {""main"": ""發言時間"", ""sub"": []}, {""main"": ""發言人"", ""sub"": []}, {""main"": ""發言人職稱"", ""sub"": []}, {""main"": ""發言人電話"", ""sub"": []}, {""main"": ""主旨"", ""sub"": []}, {""main"": ""符合條款"", ""sub"": []}, {""main"": ""事實發生日"", ""sub"": []}, {""main"": ""說明"", ""sub"": []}], ""companyAbbreviation"": ""南亞科""}, ""datetime"": ""115/05/14 04:16:36""}",2026-05-14 04:16:33
1150513|sii|2393|3,115/05/13,18:14:36,2393,億光,"公告本公司董事會通過現金增資EverlightElectronics(Thailand)Co.,Ltd.",現金增資,1150513,sii,3,"{""code"": 200, ""message"": ""查詢成功"", ""result"": {""marketName"": ""上市公司"", ""companyId"": ""2393"", ""data"": [[3, ""115/05/13"", ""18:14:36"", ""許佳璇"", ""總經理室特別助理"", ""02-26856688"", ""公告本公司董事會通過現金增資Everlight Electronics (Thailand) Co.,Ltd."", ""20"", ""115/05/13"", ""1.標的物之名稱及性質（屬特別股者，並應標明特別股約定發行條件，如股息率等）:\r\nEverlight Electronics (Thailand) Co.,Ltd.\r\n2.事實發生日:115/5/13~115/5/13\r\n3.董事會通過日期: 民國115年5月13日\r\n4.其他核決日期: 不適用\r\n5.交易數量、每單位價格及交易總金額:\r\n現金增資US$5,650萬元\r\n6.交易相對人及其與公司之關係（交易相對人如屬自然人，且非公司之\r\n關係人者，得免揭露其姓名）:\r\nEverlight Electronics (Thailand) Co.,Ltd.\n為本公司持有98%股權之子公司\r\n7.交易相對人為關係人者，並應公告選定關係人為交易對象之原因及前次移\r\n轉之所有人、前次移轉之所有人與公司及交易相對人間相互之關係、前次\r\n移轉日期及移轉金額:\r\n不適用\r\n8.交易標的最近五年內所有權人曾為公司之關係人者，尚應公告關係人之取\r\n得及處分日期、價格及交易當時與公司之關係:\r\n不適用\r\n9.本次係處分債權之相關事項（含處分之債權附隨擔保品種類、處分債權\r\n如有屬對關係人債權者尚需公告關係人名稱及本次處分該關係人之債權\r\n帳面金額:\r\n不適用\r\n10.處分利益（或損失）（取得有價證券者不適用）（原遞延者應列表說明\r\n認列情形）:\r\n不適用\r\n11.交付或付款條件（含付款期間及金額）、契約限制條款及其他重要約定\r\n事項:\r\n現金增資\r\n12.本次交易之決定方式、價格決定之參考依據及決策單位:\r\n決策單位為本公司董事會\r\n13.取得或處分有價證券標的公司每股淨值:\r\n不適用\r\n14.迄目前為止，累積持有本交易證券（含本次交易）之數量、金額、持股\r\n比例及權利受限情形（如質押情形）:\r\n迄目前為止累積投資總金額為US$ 5,888,194.12元(不含本次)\n持有該子公司股份98%\n無權利受限情形\r\n15.迄目前為止，依「公開發行公司取得或處分資產處理準則」第三條所列\r\n之有價證券投資（含本次交易）占公司最近期財務報表中總資產及歸屬\r\n於母公司業主之權益之比例暨最近期財務報表中營運資金數額（註二）:\r\n佔總資產 46 %(114Q4個體財報)\n佔業主權益 66 %(115Q1合併財報)\n營運資金為NT$  4,029,772 仟元(114Q4個體財報)\r\n16.經紀人及經紀費用:\r\n不適用\r\n17.取得或處分之具體目的或用途:\r\n預計進行購買土地、興建廠房及設備建置等相關事項\r\n18.本次交易表示異議董事之意見:\r\n無\r\n19.本次交易為關係人交易:是\r\n20.監察人承認或審計委員會同意日期:\r\n1.民國115年05月13日\r\n21.本次交易會計師出具非合理性意見:不適用\r\n22.會計師事務所名稱:\r\n不適用\r\n23.會計師姓名:\r\n不適用\r\n24.會計師開業證書字號:\r\n不適用\r\n25.是否涉及營運模式變更:否\r\n26.營運模式變更說明:\r\n不適用\r\n27.過去一年及預計未來一年內與交易相對人交易情形:\r\n不適用\r\n28.資金來源:\r\n自有資金\r\n29.前已就同一件事件發布重大訊息日期: 不適用\r\n30.其他敘明事項:\r\n無""]], ""footer"": [""以上資料均由各公司依發言當時所屬市場別之規定申報後，由本系統對外公佈，資料如有虛偽不實，均由該公司負責。""], ""header"": {""note"": [], ""subTitle"": [], ""mainTitle"": [""公司當日重大訊息之詳細內容""]}, ""titles"": [{""main"": ""序號"", ""sub"": []}, {""main"": ""發言日期"", ""sub"": []}, {""main"": ""發言時間"", ""sub"": []}, {""main"": ""發言人"", ""sub"": []}, {""main"": ""發言人職稱"", ""sub"": []}, {""main"": ""發言人電話"", ""sub"": []}, {""main"": ""主旨"", ""sub"": []}, {""main"": ""符合條款"", ""sub"": []}, {""main"": ""事實發生日"", ""sub"": []}, {""main"": ""說明"", ""sub"": []}], ""companyAbbreviation"": ""億光""}, ""datetime"": ""115/05/14 04:16:37""}",2026-05-14 04:16:33
1150513|sii|2883|1,115/05/13,18:25:28,2883,凱基金,公告本公司暨主要子公司115年4月份自結合併盈餘,自結合併,1150513,sii,1,"{""code"": 200, ""message"": ""查詢成功"", ""result"": {""marketName"": ""上市公司"", ""companyId"": ""2883"", ""data"": [[1, ""115/05/13"", ""18:25:28"", ""黃碧玲"", ""資深副總經理"", ""02-27638800"", ""公告本公司暨主要子公司115年4月份自結合併盈餘"", ""51"", ""115/05/13"", ""1.事實發生日:115/05/13\n2.公司名稱:凱基金融控股股份有限公司(原名稱：中華開發金融控股股份有限公司)\n3.與公司關係(請輸入本公司或子公司):本公司\n4.相互持股比例:不適用\n5.發生緣由:公告本公司暨主要子公司115年4月份自結合併盈餘\n6.因應措施:無\n7.其他應敘明事項(若事件發生或決議之主體係屬公開發行以上公司，本則重大訊息同時\n  符合證券交易法施行細則第7條第9款所定對股東權益或證券價格有重大影響之事項):\n\n                                合併稅後(億元)\n--------------------------------------------------------------------------\n　                     4月份                 累計 1 至 4 月份\n--------------------------------------------------------------------------\n　           總損益   母公司  非控制   總損益   母公司  非控制  稅後每股\n　　　　               業主    權益              業主    權益    盈餘(元)\n--------------------------------------------------------------------------\n凱基金控      58.98    58.98   0.00    175.90   175.87    0.03    1.04\n凱基人壽      12.89    12.89   0.00     60.85    60.85    0.00    1.17\n凱基銀行       7.82     7.82   0.00     28.81    28.81    0.00    0.61\n中華開發資本   6.14     6.14   0.00      8.01     7.99    0.02    0.39\n凱基證券      38.51    38.50   0.01     97.58    97.56    0.02    5.37\n上述資料均係公司自結數。\n註1：凱基人壽累計4月未適用外匯價格變動準備金之EPS(元)：1.68\n註2：金控累計4月淨利加計透過其他綜合損益按公允價值衡量之股票累計處分利益\n為374.57億元。""]], ""footer"": [""以上資料均由各公司依發言當時所屬市場別之規定申報後，由本系統對外公佈，資料如有虛偽不實，均由該公司負責。""], ""header"": {""note"": [], ""subTitle"": [], ""mainTitle"": [""公司當日重大訊息之詳細內容""]}, ""titles"": [{""main"": ""序號"", ""sub"": []}, {""main"": ""發言日期"", ""sub"": []}, {""main"": ""發言時間"", ""sub"": []}, {""main"": ""發言人"", ""sub"": []}, {""main"": ""發言人職稱"", ""sub"": []}, {""main"": ""發言人電話"", ""sub"": []}, {""main"": ""主旨"", ""sub"": []}, {""main"": ""符合條款"", ""sub"": []}, {""main"": ""事實發生日"", ""sub"": []}, {""main"": ""說明"", ""sub"": []}], ""companyAbbreviation"": ""凱基金""}, ""datetime"": ""115/05/14 04:16:38""}",2026-05-14 04:16:33
1150513|sii|6958|1,115/05/13,18:36:57,6958,日盛台駿,公告本公司董事會決議買回庫藏股註銷減資基準日,庫藏股,1150513,sii,1,"{""code"": 200, ""message"": ""查詢成功"", ""result"": {""marketName"": ""上市公司"", ""companyId"": ""6958"", ""data"": [[1, ""115/05/13"", ""18:36:57"", ""汪光遠"", ""副總經理"", ""02-25219898"", ""公告本公司董事會決議買回庫藏股註銷減資基準日"", ""11"", ""115/05/13"", ""1.董事會決議日期:115/05/13\n2.減資緣由:依證券交易法第28條之2規定，辦理註銷本公司第1次買回公司之股份。\n3.減資金額:新台幣20,000,000元\n4.消除股份:普通股2,000,000股\n5.減資比率:0.45%\n6.減資後股本:新台幣4,412,893,600元\n7.預定股東會日期:2026/05/26\n8.預計減資新股上市後之上市普通股股數:不適用\n9.預計減資新股上市後之上市普通股股數占已發行普通股比率\n（減資後上市普通股股數/減資後已發行普通股股數）:不適用\n10.前二項預計減資後上巿普通股股數未達6000萬股且未達25%者，\n請說明股權流通性偏低之因應措施:不適用\n11.減資基準日:115/05/26\n12.其他應敘明事項:無""]], ""footer"": [""以上資料均由各公司依發言當時所屬市場別之規定申報後，由本系統對外公佈，資料如有虛偽不實，均由該公司負責。""], ""header"": {""note"": [], ""subTitle"": [], ""mainTitle"": [""公司當日重大訊息之詳細內容""]}, ""titles"": [{""main"": ""序號"", ""sub"": []}, {""main"": ""發言日期"", ""sub"": []}, {""main"": ""發言時間"", ""sub"": []}, {""main"": ""發言人"", ""sub"": []}, {""main"": ""發言人職稱"", ""sub"": []}, {""main"": ""發言人電話"", ""sub"": []}, {""main"": ""主旨"", ""sub"": []}, {""main"": ""符合條款"", ""sub"": []}, {""main"": ""事實發生日"", ""sub"": []}, {""main"": ""說明"", ""sub"": []}], ""companyAbbreviation"": ""日盛台駿""}, ""datetime"": ""115/05/14 04:16:38""}",2026-05-14 04:16:33
1150513|sii|8442|2,115/05/13,19:21:06,8442,威宏-KY,公告本公司除息基準日暨轉換公司債停止轉換期間,公司債,1150513,sii,2,"{""code"": 200, ""message"": ""查詢成功"", ""result"": {""marketName"": ""上市公司"", ""companyId"": ""8442"", ""data"": [[2, ""115/05/13"", ""19:21:06"", ""許新居"", ""總經理"", ""(02)2298-2927"", ""公告本公司除息基準日暨轉換公司債停止轉換期間"", ""14"", ""115/05/13"", ""1.董事會、股東會決議或公司決定日期:115/05/13\n2.除權、息類別（請填入「除權」、「除息」或「除權息」）:除息\n3.普通股發放股利種類及金額:現金股利總額新台幣210,509,292元。\n4.除權（息）交易日:115/08/26\n5.最後過戶日:115/08/27\n6.停止過戶起始日期:115/08/28\n7.停止過戶截止日期:115/09/01\n8.除權（息）基準日:115/09/01\n9.債券最後申請轉換日期:115/08/05\n10.債券停止轉換起始日期:115/08/07\n11.債券停止轉換截止日期:115/09/01\n12.普通股現金股利發放日期:115/09/18\n13.其他應敘明事項:\n本公司嗣後如因股本發生變動，致影響流通在外股份總數時，\n授權董事長依董事會決議之擬分配總額，\n按配息基準日本公司實際流通在外股份總數，調整分配比率。""]], ""footer"": [""以上資料均由各公司依發言當時所屬市場別之規定申報後，由本系統對外公佈，資料如有虛偽不實，均由該公司負責。""], ""header"": {""note"": [], ""subTitle"": [], ""mainTitle"": [""公司當日重大訊息之詳細內容""]}, ""titles"": [{""main"": ""序號"", ""sub"": []}, {""main"": ""發言日期"", ""sub"": []}, {""main"": ""發言時間"", ""sub"": []}, {""main"": ""發言人"", ""sub"": []}, {""main"": ""發言人職稱"", ""sub"": []}, {""main"": ""發言人電話"", ""sub"": []}, {""main"": ""主旨"", ""sub"": []}, {""main"": ""符合條款"", ""sub"": []}, {""main"": ""事實發生日"", ""sub"": []}, {""main"": ""說明"", ""sub"": []}], ""companyAbbreviation"": ""威宏-KY""}, ""datetime"": ""115/05/14 04:16:39""}",2026-05-14 04:16:33
