key,speech_date,speech_time,company_id,company_name,subject,matched_keywords,enterDate,marketKind,serialNumber,detail_json,fetched_at_tw
1150608|otc|6982|2,115/06/08,15:35:32,6982,大井泵浦,公告本公司國內第二次無擔保轉換公司債轉換價格調整,公司債,1150608,otc,2,"{""code"": 200, ""message"": ""查詢成功"", ""result"": {""marketName"": ""上櫃公司"", ""companyId"": ""6982"", ""data"": [[2, ""115/06/08"", ""15:35:32"", ""張登溪"", ""財務長"", ""2768-0189"", ""公告本公司國內第二次無擔保轉換公司債轉換價格調整"", ""53"", ""115/06/08"", ""1.事實發生日:115/06/08\n2.公司名稱:大井泵浦工業股份有限公司\n3.與公司關係(請輸入本公司或子公司):本公司\n4.相互持股比例:不適用\n5.發生緣由:本公司因辦理除息配發現金股利，依據本公司發行之國內第二次無擔保轉換\n 公司債發行及轉換辦法第十一條規定，調整轉換價格。\n6.因應措施:自除息基準日115年6月30日起，國內第二次無擔保轉換公司債之轉換價格\n 由新台幣61.8元調整為新台幣60.1元。\n7.其他應敘明事項(若事件發生或決議之主體係屬公開發行以上公司，\n本則重大訊息同時符合證券交易法施行細則第7條第9款所定\n對股東權益或證券價格有重大影響之事項):無。""]], ""footer"": [""以上資料均由各公司依發言當時所屬市場別之規定申報後，由本系統對外公佈，資料如有虛偽不實，均由該公司負責。""], ""header"": {""note"": [], ""subTitle"": [], ""mainTitle"": [""公司當日重大訊息之詳細內容""]}, ""titles"": [{""sub"": [], ""main"": ""序號""}, {""sub"": [], ""main"": ""發言日期""}, {""sub"": [], ""main"": ""發言時間""}, {""sub"": [], ""main"": ""發言人""}, {""sub"": [], ""main"": ""發言人職稱""}, {""sub"": [], ""main"": ""發言人電話""}, {""sub"": [], ""main"": ""主旨""}, {""sub"": [], ""main"": ""符合條款""}, {""sub"": [], ""main"": ""事實發生日""}, {""sub"": [], ""main"": ""說明""}], ""companyAbbreviation"": ""大井泵浦""}, ""datetime"": ""115/06/08 18:02:38""}",2026-06-08 18:02:26
1150608|otc|6510|1,115/06/08,16:12:12,6510,精測,公告本公司除息基準日及轉換公司債停止轉換期間,公司債,1150608,otc,1,"{""code"": 200, ""message"": ""查詢成功"", ""result"": {""marketName"": ""上櫃公司"", ""companyId"": ""6510"", ""data"": [[1, ""115/06/08"", ""16:12:12"", ""黃水可"", ""總經理"", ""(03)4691234"", ""公告本公司除息基準日及轉換公司債停止轉換期間"", ""14"", ""115/06/08"", ""1.董事會、股東會決議或公司決定日期:115/06/08\n2.除權、息類別（請填入「除權」、「除息」或「除權息」）:除息\n3.發放普通股股利種類及金額:普通股現金股利新台幣501,672,037元，每股配發\n新台幣15.3元\n4.除權（息）交易日:115/07/09\n5.最後過戶日:115/07/10\n6.停止過戶起始日期:115/07/11\n7.停止過戶截止日期:115/07/15\n8.除權（息）基準日:115/07/15\n9.債券最後申請轉換日期:115/06/17\n10.債券停止轉換起始日期:115/06/22\n11.債券停止轉換截止日期:115/07/15\n12.普通股現金股利發放日期:115/08/05\n13.其他應敘明事項:嗣後如因本公司股本變動影響流通在外股數，致股東配息率發生\n變動而須修正時，授權董事長全權處理。""]], ""footer"": [""以上資料均由各公司依發言當時所屬市場別之規定申報後，由本系統對外公佈，資料如有虛偽不實，均由該公司負責。""], ""header"": {""note"": [], ""subTitle"": [], ""mainTitle"": [""公司當日重大訊息之詳細內容""]}, ""titles"": [{""sub"": [], ""main"": ""序號""}, {""sub"": [], ""main"": ""發言日期""}, {""sub"": [], ""main"": ""發言時間""}, {""sub"": [], ""main"": ""發言人""}, {""sub"": [], ""main"": ""發言人職稱""}, {""sub"": [], ""main"": ""發言人電話""}, {""sub"": [], ""main"": ""主旨""}, {""sub"": [], ""main"": ""符合條款""}, {""sub"": [], ""main"": ""事實發生日""}, {""sub"": [], ""main"": ""說明""}], ""companyAbbreviation"": ""精測""}, ""datetime"": ""115/06/08 18:02:39""}",2026-06-08 18:02:26
1150608|otc|2641|1,115/06/08,16:28:15,2641,正德,公告本公司國內第七次無擔保轉換公司債轉換價格調整,公司債,1150608,otc,1,"{""code"": 200, ""message"": ""查詢成功"", ""result"": {""marketName"": ""上櫃公司"", ""companyId"": ""2641"", ""data"": [[1, ""115/06/08"", ""16:28:15"", ""鄭宇宏"", ""財務經理"", ""07-9697988"", ""公告本公司國內第七次無擔保轉換公司債轉換價格調整"", ""53"", ""115/06/08"", ""1.事實發生日:115/06/08\n2.公司名稱:正德海運股份有限公司\n3.與公司關係(請輸入本公司或子公司):本公司\n4.相互持股比例:不適用\n5.發生緣由:因應本公司現金股利發放，依本公司國內第七次無擔保轉換公司債發行　\n及轉換辦法規定調整轉換價格。\n6.因應措施:自除息基準日115年6月29日起，國內第七次無擔保轉換公司債轉換\n價格，由新台幣22.15元調整為新台幣21.59元。\n7.其他應敘明事項(若事件發生或決議之主體係屬公開發行以上公司，\n本則重大訊息同時符合證券交易法施行細則第7條第9款所定\n對股東權益或證券價格有重大影響之事項):無。""]], ""footer"": [""以上資料均由各公司依發言當時所屬市場別之規定申報後，由本系統對外公佈，資料如有虛偽不實，均由該公司負責。""], ""header"": {""note"": [], ""subTitle"": [], ""mainTitle"": [""公司當日重大訊息之詳細內容""]}, ""titles"": [{""sub"": [], ""main"": ""序號""}, {""sub"": [], ""main"": ""發言日期""}, {""sub"": [], ""main"": ""發言時間""}, {""sub"": [], ""main"": ""發言人""}, {""sub"": [], ""main"": ""發言人職稱""}, {""sub"": [], ""main"": ""發言人電話""}, {""sub"": [], ""main"": ""主旨""}, {""sub"": [], ""main"": ""符合條款""}, {""sub"": [], ""main"": ""事實發生日""}, {""sub"": [], ""main"": ""說明""}], ""companyAbbreviation"": ""正德""}, ""datetime"": ""115/06/08 18:02:40""}",2026-06-08 18:02:26
1150608|otc|2641|2,115/06/08,16:28:28,2641,正德,公告本公司國內第八次無擔保轉換公司債轉換價格調整,公司債,1150608,otc,2,"{""code"": 200, ""message"": ""查詢成功"", ""result"": {""marketName"": ""上櫃公司"", ""companyId"": ""2641"", ""data"": [[2, ""115/06/08"", ""16:28:28"", ""鄭宇宏"", ""財務經理"", ""07-9697988"", ""公告本公司國內第八次無擔保轉換公司債轉換價格調整"", ""53"", ""115/06/08"", ""1.事實發生日:115/06/08\n2.公司名稱:正德海運股份有限公司\n3.與公司關係(請輸入本公司或子公司):本公司\n4.相互持股比例:不適用\n5.發生緣由:因應本公司現金股利發放，依本公司國內第八次無擔保轉換公司債發行　\n及轉換辦法規定調整轉換價格。\n6.因應措施:自除息基準日115年6月29日起，國內第八次無擔保轉換公司債轉換\n價格，由新台幣19.30元調整為新台幣18.82元。\n7.其他應敘明事項(若事件發生或決議之主體係屬公開發行以上公司，\n本則重大訊息同時符合證券交易法施行細則第7條第9款所定\n對股東權益或證券價格有重大影響之事項):無。""]], ""footer"": [""以上資料均由各公司依發言當時所屬市場別之規定申報後，由本系統對外公佈，資料如有虛偽不實，均由該公司負責。""], ""header"": {""note"": [], ""subTitle"": [], ""mainTitle"": [""公司當日重大訊息之詳細內容""]}, ""titles"": [{""sub"": [], ""main"": ""序號""}, {""sub"": [], ""main"": ""發言日期""}, {""sub"": [], ""main"": ""發言時間""}, {""sub"": [], ""main"": ""發言人""}, {""sub"": [], ""main"": ""發言人職稱""}, {""sub"": [], ""main"": ""發言人電話""}, {""sub"": [], ""main"": ""主旨""}, {""sub"": [], ""main"": ""符合條款""}, {""sub"": [], ""main"": ""事實發生日""}, {""sub"": [], ""main"": ""說明""}], ""companyAbbreviation"": ""正德""}, ""datetime"": ""115/06/08 18:02:40""}",2026-06-08 18:02:26
1150608|otc|5347|2,115/06/08,17:09:42,5347,世界,公告本公司海外第一次無擔保轉換公司債停止轉換期間,公司債,1150608,otc,2,"{""code"": 200, ""message"": ""查詢成功"", ""result"": {""marketName"": ""上櫃公司"", ""companyId"": ""5347"", ""data"": [[2, ""115/06/08"", ""17:09:42"", ""黃惠蘭"", ""副總經理暨財務長"", ""(03)5770355"", ""公告本公司海外第一次無擔保轉換公司債停止轉換期間"", ""53"", ""115/06/08"", ""1.事實發生日:115/06/08\n2.公司名稱:世界先進積體電路股份有限公司\n3.與公司關係(請輸入本公司或子公司):本公司\n4.相互持股比例:不適用\n5.發生緣由:因114年分派股東現金股利之配息基準日為115年7月12日，\n依海外無擔保轉換公司債發行辦法公告債券停止轉換期間\n6.因應措施:因應配息基準日定於115年7月12日，本公司訂定115年6月16日起\n至115年7月12日止，停止本公司債轉換為普通股。\n7.其他應敘明事項(若事件發生或決議之主體係屬公開發行以上公司，\n本則重大訊息同時符合證券交易法施行細則第7條第9款所定\n對股東權益或證券價格有重大影響之事項):無""]], ""footer"": [""以上資料均由各公司依發言當時所屬市場別之規定申報後，由本系統對外公佈，資料如有虛偽不實，均由該公司負責。""], ""header"": {""note"": [], ""subTitle"": [], ""mainTitle"": [""公司當日重大訊息之詳細內容""]}, ""titles"": [{""sub"": [], ""main"": ""序號""}, {""sub"": [], ""main"": ""發言日期""}, {""sub"": [], ""main"": ""發言時間""}, {""sub"": [], ""main"": ""發言人""}, {""sub"": [], ""main"": ""發言人職稱""}, {""sub"": [], ""main"": ""發言人電話""}, {""sub"": [], ""main"": ""主旨""}, {""sub"": [], ""main"": ""符合條款""}, {""sub"": [], ""main"": ""事實發生日""}, {""sub"": [], ""main"": ""說明""}], ""companyAbbreviation"": ""世界""}, ""datetime"": ""115/06/08 18:02:41""}",2026-06-08 18:02:26
1150608|otc|8477|1,115/06/08,17:56:24,8477,創業家,公告本公司115年第1次及第2次私募普通股收足股款暨增資基準日,私募普通股,1150608,otc,1,"{""code"": 200, ""message"": ""查詢成功"", ""result"": {""marketName"": ""上櫃公司"", ""companyId"": ""8477"", ""data"": [[1, ""115/06/08"", ""17:56:24"", ""蔡忠佑"", ""總經理"", ""06-2796896"", ""公告本公司115年第1次及第2次私募普通股收足股款暨\r\n增資基準日"", ""53"", ""115/06/08"", ""1.事實發生日:115/06/08\n2.公司名稱:創業家數位股份有限公司\n3.與公司關係(請輸入本公司或子公司):本公司\n4.相互持股比例:不適用\n5.發生緣由:\n  (1)本公司115年05月21日股東常會決議通過辦理私募普通股案。\n  (2)本公司115年05月25日董事會決議通過，每股認購價格為12.52元。\n  (3)第1次實際私募普通股16,000,000股，總金額200,320,000元，\n     已於115年06月08日收足股款。\n  (4)第2次實際私募普通股4,000,000股，總金額50,080,000元，\n     已於115年06月08日收足股款。\n  (5)增資基準日為115年06月08日。\n6.因應措施:本次私募普通股相關事項，將於法定期限內公告於公開資訊觀測站\n  之私募專區。\n7.其他應敘明事項(若事件發生或決議之主體係屬公開發行以上公司，\n本則重大訊息同時符合證券交易法施行細則第7條第9款所定\n對股東權益或證券價格有重大影響之事項):無。""]], ""footer"": [""以上資料均由各公司依發言當時所屬市場別之規定申報後，由本系統對外公佈，資料如有虛偽不實，均由該公司負責。""], ""header"": {""note"": [], ""subTitle"": [], ""mainTitle"": [""公司當日重大訊息之詳細內容""]}, ""titles"": [{""sub"": [], ""main"": ""序號""}, {""sub"": [], ""main"": ""發言日期""}, {""sub"": [], ""main"": ""發言時間""}, {""sub"": [], ""main"": ""發言人""}, {""sub"": [], ""main"": ""發言人職稱""}, {""sub"": [], ""main"": ""發言人電話""}, {""sub"": [], ""main"": ""主旨""}, {""sub"": [], ""main"": ""符合條款""}, {""sub"": [], ""main"": ""事實發生日""}, {""sub"": [], ""main"": ""說明""}], ""companyAbbreviation"": ""創業家""}, ""datetime"": ""115/06/08 18:02:41""}",2026-06-08 18:02:26
1150608|rotc|6833|1,115/06/08,13:15:33,6833,太康精密,公告本公司訂定115年現金增資認股基準日及相關事宜(補充代收款及存儲專戶行庫）,現金增資,1150608,rotc,1,"{""code"": 200, ""message"": ""查詢成功"", ""result"": {""marketName"": ""興櫃公司"", ""companyId"": ""6833"", ""data"": [[1, ""115/06/08"", ""13:15:33"", ""張賴弘"", ""執行副總經理"", ""02-26983890"", ""公告本公司訂定115年現金增資認股基準日及相關事宜\r\n(補充代收款及存儲專戶行庫）"", ""9"", ""115/06/08"", ""1.董事會決議或公司決定日期:115/06/08\n2.發行股數:8,000,000股\n3.每股面額:新台幣10元\n4.發行總金額:80,000,000元(以面額計算)\n5.發行價格:每股新台幣21元\n6.員工認股股數:依公司法第267條規定，保留發行新股總數10%計800,000股，\n由本公司員工認購。\n7.原股東認購比例(另請說明每仟股暫定得認購股數):發行新股總數之90%\n計7,200,000股，由原股東按認股基準日股東名簿所記載持有股數按比例認購，\n即每仟股認購144.06627048股。\n8.公開銷售方式及股數:不適用\n9.畸零股及逾期未認購股份之處理方式:認購不足一股之畸零股，由原股東自行於\n停止過戶日起五日內向本公司股務代理機構辦理拼湊成整股認購。原股東及員工\n放棄認股、認購不足或逾期未拼湊，授權董事長按發行價格洽特定人認足。\n10.本次發行新股之權利義務:與原發行之普通股股份相同。\n11.本次增資資金用途:充實營運資金。\n12.現金增資認股基準日:115/06/22\n13.最後過戶日:115/06/17\n14.停止過戶起始日期:115/06/18\n15.停止過戶截止日期:115/06/22\n16.股款繳納期間:115/06/26~115/07/27\n17.與代收及專戶存儲價款行庫訂約日期:115/06/08\n18.委託代收款項機構:台北富邦商業銀行股份有限公司忠孝分行\n19.委託存儲款項機構:台北富邦商業銀行股份有限公司安和分行\n20.其他應敘明事項:\n(1)本次現金增資發行新股案，業經金融監督管理委員會115/05/29金管證發字\n第1150344816號函申報生效在案。本公司依據115/04/27董事會決議授權董事長訂\n定認股基準日、增資基準日、繳款期間、發行條件及辦理與本次現金增資相關事宜。\n(2)本次現金增資發行新股，所訂之發行股數、發行價格、發行條件、計畫項目、\n募集金額及其他有關事項，如因應法令變更或主管機關核定、客觀環境改變或其\n他事實需要而調整修正時，由董事會授權董事長視公司實際需要及市場狀況於法\n令許可範圍內全權處理。""]], ""footer"": [""以上資料均由各公司依發言當時所屬市場別之規定申報後，由本系統對外公佈，資料如有虛偽不實，均由該公司負責。""], ""header"": {""note"": [], ""subTitle"": [], ""mainTitle"": [""公司當日重大訊息之詳細內容""]}, ""titles"": [{""sub"": [], ""main"": ""序號""}, {""sub"": [], ""main"": ""發言日期""}, {""sub"": [], ""main"": ""發言時間""}, {""sub"": [], ""main"": ""發言人""}, {""sub"": [], ""main"": ""發言人職稱""}, {""sub"": [], ""main"": ""發言人電話""}, {""sub"": [], ""main"": ""主旨""}, {""sub"": [], ""main"": ""符合條款""}, {""sub"": [], ""main"": ""事實發生日""}, {""sub"": [], ""main"": ""說明""}], ""companyAbbreviation"": ""太康精密""}, ""datetime"": ""115/06/08 18:02:42""}",2026-06-08 18:02:26
1150608|rotc|1780|3,115/06/08,16:03:46,1780,立弘,公告本公司股票初次上櫃前現金增資發行新股承銷價格,現金增資,1150608,rotc,3,"{""code"": 200, ""message"": ""查詢成功"", ""result"": {""marketName"": ""興櫃公司"", ""companyId"": ""1780"", ""data"": [[3, ""115/06/08"", ""16:03:46"", ""楊幸慧"", ""協理"", ""27030209"", ""公告本公司股票初次上櫃前現金增資發行新股承銷價格"", ""44"", ""115/06/08"", ""1.事實發生日:115/06/08\n2.公司名稱:立弘生化科技股份有限公司\n3.與公司關係(請輸入本公司或子公司):本公司\n4.相互持股比例:不適用\n5.發生緣由:公告本公司股票初次上櫃前現金增資發行新股承銷價格\n6.因應措施:不適用。\n7.其他應敘明事項(若事件發生或決議之主體係屬公開發行以上公司，\n本則重大訊息同時符合證券交易法施行細則第7條第9款所定\n對股東權益或證券價格有重大影響之事項):\n一、本公司為配合初次上櫃前公開承銷辦理現金增資發行普通股12,832,000股，\n    每股面額新台幣10元，總額新台幣128,320,000元，業經財團法人中華民國證券\n    櫃檯買賣中心115年03月27日證櫃審字第1150001431號函申報生效在案。\n二、本次現金增資採溢價方式辦理，競價拍賣最低承銷價格定為每股新台幣16元，\n    依投標價格高者優先得標，每一得標人應依其得標價格認構，各得標單之價格\n    及其數量加權平均價格為新台幣25.49元，高於最低承銷價格之1.18倍為上限，\n    故公開申購承銷價格以每股新台幣18.88元溢價發行。\n三、本次現金增資所發行之新股，其權利義務與原發行之普通股股分相同。""]], ""footer"": [""以上資料均由各公司依發言當時所屬市場別之規定申報後，由本系統對外公佈，資料如有虛偽不實，均由該公司負責。""], ""header"": {""note"": [], ""subTitle"": [], ""mainTitle"": [""公司當日重大訊息之詳細內容""]}, ""titles"": [{""sub"": [], ""main"": ""序號""}, {""sub"": [], ""main"": ""發言日期""}, {""sub"": [], ""main"": ""發言時間""}, {""sub"": [], ""main"": ""發言人""}, {""sub"": [], ""main"": ""發言人職稱""}, {""sub"": [], ""main"": ""發言人電話""}, {""sub"": [], ""main"": ""主旨""}, {""sub"": [], ""main"": ""符合條款""}, {""sub"": [], ""main"": ""事實發生日""}, {""sub"": [], ""main"": ""說明""}], ""companyAbbreviation"": ""立弘""}, ""datetime"": ""115/06/08 18:02:42""}",2026-06-08 18:02:26
