key,speech_date,speech_time,company_id,company_name,subject,matched_keywords,enterDate,marketKind,serialNumber,detail_json,fetched_at_tw
1150629|otc|3664|1,115/06/29,17:32:10,3664,安瑞-KY,公告本公司董事會決議辦理115年第3次私募普通股定價暨增資基準日相關事宜,私募普通股,1150629,otc,1,"{""code"": 200, ""message"": ""查詢成功"", ""result"": {""marketName"": ""上櫃公司"", ""companyId"": ""3664"", ""data"": [[1, ""115/06/29"", ""17:32:10"", ""黃建喬"", ""總經理"", ""02-27846000"", ""公告本公司董事會決議辦理115年第3次私募普通股定價\r\n暨增資基準日相關事宜"", ""11"", ""115/06/29"", ""1.董事會決議日期:115/06/29\n2.私募有價證券種類:普通股\n3.私募對象及其與公司間關係:\n 115年第3次私募普通股之對象以符合證券交易法第43條之6規定選擇特定人\n 及金管會112年9月12日金管證發字第1120383220號規定為限。\n4.私募股數或張數:115年第3次發行4,000,000股\n5.得私募額度:\n  本私募案依據公司115年6月24日股東常會決議之日起一年內分四次辦理。\n  第一次預計募集股數：不高於5,000,000股。\n  第二次預計募集股數：不高於5,000,000股。\n  第三次預計募集股數：不高於5,000,000股。\n  第四次預計募集股數：不高於5,000,000股。\n  私募普通股發行股數不超過2,000萬股，每股面額新台幣10元。\n6.私募價格訂定之依據及合理性:\n  (1)私募普通股之參考價格以下列二基準計算價格較高者定之：\n   (a)定價日前一、三或五個營業日擇一計算普通股收盤價簡單算數平均數\n      扣除無償配股除權及配息，並加回減資反除權後之股價。\n   (b)定價日前三十個營業日普通股收盤價簡單算數平均數扣除無償配股除\n      權及配息，並加回減資反除權後之股價。\n  (2)第3次私募價格之訂定，發行價格不得低於參考價格之八成，且不得低\n     於股票面額。\n  (3)實際私募價格:\n     依據前項說明計算結果，第3次私募每股價格以定價日前30個營業日計\n     算之普通股收盤價簡單算術平均數之股價7.61元為參考價格，擬訂第　\n     3次私募價格為新台幣10.00元(不低於參考價格之八成，且不低於股\n     票面額)。\n  (4)前述私募價格之訂定，考量私募普通股之流通性較低，且其價格訂定係依據\n     「公開發行公司辦理私募有價證券應注意事項」之規定辦理，故應屬合理。\n7.本次私募資金用途:\n  充實集團營運資金、或因應本公司未來多角化發展之資金需求。\n8.不採用公開募集之理由:\n  本公司目前尚需挹注集團營運資金，及考慮籌集資本之時效性、便利性、發行成\n  本等，故採用私募方式辦理籌資。本計劃之執行預計將可強化公司競爭力，以及\n  提升營運效能，對股東權益亦有正面助益。\n9.獨立董事反對或保留意見:無。\n10.實際定價日:115/06/29\n11.參考價格:7.61元\n12.實際私募價格、轉換或認購價格:10.00元\n13.本次私募新股之權利義務:\n  本次私募普通股之權利義務與本公司已發行之普通股相同，惟私募普通股\n  於交付日起三年內，除依證券交易法第43條之8規定之轉讓對象外，餘不得再行賣出，\n  自私募普通股交付日起滿三年後，依相關法令申報補辦公開發行及上櫃交易。\n14.附有轉換、交換或認股者，其換股基準日:不適用。\n15.附有轉換、交換或認股者，對股權可能稀釋情形:不適用。\n16.附有轉換或認股者，於私募公司債交付且假設全數轉換或認購普通股後對上櫃普通股\n股權比率之可能影響（上櫃普通股數A、A/已發行普通股）:不適用。\n17.前項預計上櫃普通股未達500萬股且未達25%者，請說明股權流通性偏低之因應措施:\n  不適用。\n18.其他應敘明事項:\n  (1)第3次私募普通股之預計增資基準日為115年06月29日，股款繳納期間為\n     115年06月29日至115年06月29日。惟實際仍以股款繳納完成日為準，\n     並擬授權董事長依相關法令規定調整之。\n  (2)第3次私募普通股之其他未盡事宜等，若因法令修正或主管機關規定及基\n     於營運評估或客觀環境之影響須變更或修正時，提請董事會授權董事長全\n     權處理之。""]], ""footer"": [""以上資料均由各公司依發言當時所屬市場別之規定申報後，由本系統對外公佈，資料如有虛偽不實，均由該公司負責。""], ""header"": {""note"": [], ""subTitle"": [], ""mainTitle"": [""公司當日重大訊息之詳細內容""]}, ""titles"": [{""sub"": [], ""main"": ""序號""}, {""sub"": [], ""main"": ""發言日期""}, {""sub"": [], ""main"": ""發言時間""}, {""sub"": [], ""main"": ""發言人""}, {""sub"": [], ""main"": ""發言人職稱""}, {""sub"": [], ""main"": ""發言人電話""}, {""sub"": [], ""main"": ""主旨""}, {""sub"": [], ""main"": ""符合條款""}, {""sub"": [], ""main"": ""事實發生日""}, {""sub"": [], ""main"": ""說明""}], ""companyAbbreviation"": ""安瑞-KY""}, ""datetime"": ""115/06/30 03:03:25""}",2026-06-30 03:03:20
1150629|otc|3664|2,115/06/29,17:32:30,3664,安瑞-KY,公告本公司115年第3次私募普通股收足股款暨增資基準日,私募普通股,1150629,otc,2,"{""code"": 200, ""message"": ""查詢成功"", ""result"": {""marketName"": ""上櫃公司"", ""companyId"": ""3664"", ""data"": [[2, ""115/06/29"", ""17:32:30"", ""黃建喬"", ""總經理"", ""02-27846000"", ""公告本公司115年第3次私募普通股收足股款\r\n暨增資基準日"", ""53"", ""115/06/29"", ""1.事實發生日:115/06/29\n2.公司名稱:安瑞科技股份有限公司\n3.與公司關係(請輸入本公司或子公司):本公司\n4.相互持股比例:不適用\n5.發生緣由:\n(1)本公司115年06月24日股東會決議私募普通股。\n(2)本公司115年06月29日董事會決議通過，每股認購價格為10.00元。\n(3)本次實際私募普通股4,000,000股，總金額新台幣40,000,000元，\n   已於115年06月29日收足股款。\n(4)增資基準日為115年06月29日。\n6.因應措施:本次私募普通股重要說明事項，請至公開資訊觀測站之私募專區查詢。\n7.其他應敘明事項(若事件發生或決議之主體係屬公開發行以上公司，\n本則重大訊息同時符合證券交易法施行細則第7條第9款所定\n對股東權益或證券價格有重大影響之事項):無。""]], ""footer"": [""以上資料均由各公司依發言當時所屬市場別之規定申報後，由本系統對外公佈，資料如有虛偽不實，均由該公司負責。""], ""header"": {""note"": [], ""subTitle"": [], ""mainTitle"": [""公司當日重大訊息之詳細內容""]}, ""titles"": [{""sub"": [], ""main"": ""序號""}, {""sub"": [], ""main"": ""發言日期""}, {""sub"": [], ""main"": ""發言時間""}, {""sub"": [], ""main"": ""發言人""}, {""sub"": [], ""main"": ""發言人職稱""}, {""sub"": [], ""main"": ""發言人電話""}, {""sub"": [], ""main"": ""主旨""}, {""sub"": [], ""main"": ""符合條款""}, {""sub"": [], ""main"": ""事實發生日""}, {""sub"": [], ""main"": ""說明""}], ""companyAbbreviation"": ""安瑞-KY""}, ""datetime"": ""115/06/30 03:03:26""}",2026-06-30 03:03:20
1150629|otc|3479|1,115/06/29,17:41:32,3479,安勤,公告本公司買回庫藏股期間屆滿及執行情形,庫藏股,1150629,otc,1,"{""code"": 200, ""message"": ""查詢成功"", ""result"": {""marketName"": ""上櫃公司"", ""companyId"": ""3479"", ""data"": [[1, ""115/06/29"", ""17:41:32"", ""徐崇恒"", ""財務長"", ""(02)82262345"", ""公告本公司買回庫藏股期間屆滿及執行情形"", ""35"", ""115/06/29"", ""1.原預定買回股份總金額上限(元):2,206,127,929\r\n2.原預定買回之期間:115/05/04~115/06/29\r\n3.原預定買回之數量(股):500,000\r\n4.原預定買回區間價格(元):70.00~115.00\r\n5.本次實際買回期間:115/05/04~115/05/13\r\n6.本次已買回股份數量(股):364,000\r\n7.本次已買回股份總金額(元):34,728,764\r\n8.本次平均每股買回價格(元):95.41\r\n9.累積已持有自己公司股份數量(股):364,000\r\n10.累積已持有自己公司股份數量占公司已發行股份總數之比率(%):0.50\r\n11.本次未執行完畢之原因:\r\n本公司於規定價格區間內分批買回庫藏股，執行率72.80%。考量不影響市場量價及維護股東權益，故未全數執行完畢。\r\n12.其他應敘明事項:\r\n無""]], ""footer"": [""以上資料均由各公司依發言當時所屬市場別之規定申報後，由本系統對外公佈，資料如有虛偽不實，均由該公司負責。""], ""header"": {""note"": [], ""subTitle"": [], ""mainTitle"": [""公司當日重大訊息之詳細內容""]}, ""titles"": [{""sub"": [], ""main"": ""序號""}, {""sub"": [], ""main"": ""發言日期""}, {""sub"": [], ""main"": ""發言時間""}, {""sub"": [], ""main"": ""發言人""}, {""sub"": [], ""main"": ""發言人職稱""}, {""sub"": [], ""main"": ""發言人電話""}, {""sub"": [], ""main"": ""主旨""}, {""sub"": [], ""main"": ""符合條款""}, {""sub"": [], ""main"": ""事實發生日""}, {""sub"": [], ""main"": ""說明""}], ""companyAbbreviation"": ""安勤""}, ""datetime"": ""115/06/30 03:03:26""}",2026-06-30 03:03:20
1150629|otc|6111|1,115/06/29,18:17:09,6111,光聚晶電,代子公司九合益科技股份有限公司公告參與安瑞科技股份有限公司私募現金增資,現金增資,1150629,otc,1,"{""code"": 200, ""message"": ""查詢成功"", ""result"": {""marketName"": ""上櫃公司"", ""companyId"": ""6111"", ""data"": [[1, ""115/06/29"", ""18:17:09"", ""莊仁川"", ""財務長暨副總經理"", ""27226266"", ""代子公司九合益科技股份有限公司公告參與安瑞科技股份\r\n有限公司私募現金增資"", ""24"", ""115/06/29"", ""1.標的物之名稱及性質（屬特別股者，並應標明特別股約定發行條件，\r\n如股息率等）:\r\n安瑞科技股份有限公司(下稱\""安瑞公司\"")私募普通股\r\n2.事實發生日:115/06/29\r\n3.交易單位數量、每單位價格及交易總金額:\r\n交易單位數量：4,000,000股\r\n每單位價格：新台幣10元\r\n交易總金額：新台幣40,000,000元\r\n4.交易相對人及其與公司之關係（交易相對人如屬自然人，且非公司\r\n之關係人者，得免揭露其姓名）:\r\n交易相對人：安瑞公司\t\t\t\t\r\n與公司之關係：為本公司之孫公司\r\n5.交易相對人為關係人者，並應公告選定關係人為交易對象之原因及\r\n前次移轉之所有人、前次移轉之所有人與公司及交易相對人間相互之\r\n關係、前次移轉日期及移轉金額:\r\n參與認購私募現金增資案\r\n6.交易標的最近五年內所有權人曾為公司之關係人者，尚應公告\r\n關係人之取得及處分日期、價格及交易當時與公司之關係:\r\n不適用\r\n7.本次係處分債權之相關事項（含處分之債權附隨擔保品種類、處分\r\n債權如有屬對關係人債權者尚需公告關係人名稱及本次處分該關係人\r\n之債權帳面金額:\r\n不適用\r\n8.處分利益（或損失）（取得有價證券者不適用）（遞延者應列表\r\n說明認列情形）:\r\n不適用\r\n9.交付或付款條件（含付款期間及金額）、契約限制條款及其他重要\r\n約定事項:\r\n(1)交付或付款條件:依雙方股份認購合約\t\r\n(2)契約限制條款及其他重要約定事項：無\r\n10.本次交易之決定方式、價格決定之參考依據及決策單位:\r\n價格參考依據：依安瑞公司私募普通股私募價格認購\t\t\t\r\n決策單位：九合益科技股份有限公司董事同意書\r\n11.取得或處分有價證券標的公司每股淨值:0.80\r\n12.有價證券標的公司私募參考價格與每股交易金額差距達20%以上:是\r\n13.迄目前為止，累積持有本交易證券（含本次交易）之數量、金額、\r\n持股比例及權利受限情形（如質押情形）:\r\n本公司\t\t\r\n累積持有本交易證券數量：2,400,000股\r\n累積持有本交易證券金額：51,600,000元\r\n持股比例：3.16%\t\r\n權利受限情形：無\t\t\r\n子公司：九合益科技股份有限公司\t\t\r\n累積持有本交易證券數量：10,670,000股\r\n累積持有本交易證券金額：126,710,000元\r\n持股比例：14.05%\t\r\n權利受限情形：無\t\t\r\n孫公司：Array Holdings for APGFIII Fund LPs\t\t\r\n累積持有本交易證券數量：26,311,000股\r\n累積持有本交易證券金額：506,616,040元\r\n持股比例：34.64%\t\r\n權利受限情形：無\r\n14.迄目前為止，私募有價證券投資（含本次交易）占公司最近期財\r\n務報表中總資產及歸屬於母公司業主之權益之比例暨最近期財務報表中營運資金數額:\r\n佔總資產比例：4.48%\r\n佔母公司業主權益之比例：7.26%\r\n營運資金：新台幣\t(443,187)千元\r\n取得有價證券且營運資金為負數者，尚應公告取得該有價證券之資金來源及在資金\r\n不足情形下，仍取得有價證券之具體原因：\t\t\t\t\t\t\t\r\n115年上半年出售有價證券及新遊戲上市等挹注自有資金，故無資金不足之情形。\r\n15.經理人及經紀費用:\r\n無\r\n16.取得或處分之具體目的或用途:\r\n因應安瑞公司充實營運資金之需求\r\n17.本次交易表示異議董事之意見:\r\n無\r\n18.本次交易為關係人交易:\r\n是\r\n19.董事會通過日期:\r\n民國115 年06 月29 日\r\n20.監察人承認或審計委員會同意日期:\r\n不適用\r\n21.本次交易會計師出具非合理性意見:否\r\n22.會計師事務所名稱:\r\n勤信聯合會計師事務所\r\n23.會計師姓名:\r\n黃勝平會計師\r\n24.會計師開業證書字號:\r\n臺省會證字第4413號\r\n25.其他敘明事項:\r\n九合益科技股份有限公司為本公司及子公司合計持股100%之子公司。""]], ""footer"": [""以上資料均由各公司依發言當時所屬市場別之規定申報後，由本系統對外公佈，資料如有虛偽不實，均由該公司負責。""], ""header"": {""note"": [], ""subTitle"": [], ""mainTitle"": [""公司當日重大訊息之詳細內容""]}, ""titles"": [{""sub"": [], ""main"": ""序號""}, {""sub"": [], ""main"": ""發言日期""}, {""sub"": [], ""main"": ""發言時間""}, {""sub"": [], ""main"": ""發言人""}, {""sub"": [], ""main"": ""發言人職稱""}, {""sub"": [], ""main"": ""發言人電話""}, {""sub"": [], ""main"": ""主旨""}, {""sub"": [], ""main"": ""符合條款""}, {""sub"": [], ""main"": ""事實發生日""}, {""sub"": [], ""main"": ""說明""}], ""companyAbbreviation"": ""光聚晶電""}, ""datetime"": ""115/06/30 03:03:27""}",2026-06-30 03:03:20
1150629|otc|6182|1,115/06/29,18:28:36,6182,合晶,公告本公司註銷限制員工權利新股減資、現金增資及合晶八無擔保可轉債轉換普通股變更登記完成,現金增資,1150629,otc,1,"{""code"": 200, ""message"": ""查詢成功"", ""result"": {""marketName"": ""上櫃公司"", ""companyId"": ""6182"", ""data"": [[1, ""115/06/29"", ""18:28:36"", ""張憲元"", ""總經理"", ""(03)4815001"", ""公告本公司註銷限制員工權利新股減資、現金增資及合晶\r\n八無擔保可轉債轉換普通股變更登記完成"", ""36"", ""115/06/29"", ""1.主管機關核准減資日期:115/06/29\n2.辦理資本變更登記完成日期:115/06/29\n3.對財務報告之影響（含實收資本額與流通在外股數之差異與對每股淨值之影響）:\n(1)限制員工權利新股收回減資註銷、現金增資發行新股及合晶八無擔保可轉換公司債\n   轉換普通股前:\n   本公司實收資本額為新台幣5,736,383,300元，在外流通股數為573,638,330股，每\n   股淨值為新台幣26.60元。\n(2)本次限制員工權利新股收回減資註銷40,000股、現金增資發行新股20,000,000股\n   及合晶八無擔保可轉換公司債轉換普通股2,985股，合計19,962,985股 。\n(3)限制員工權利新股收回減資註銷、現金增資發行新股及合晶八無擔保可轉換公司債\n   轉換普通股後:\n   本公司實收資本額為新台幣5,936,013,150元，在外流通股數為593,601,315股，每\n   股淨值為新台幣25.70元。\n4.預計換股作業計畫:不適用。\n5.預計減資新股上櫃後之上櫃普通股股數:不適用。\n6.預計減資新股上櫃後之上櫃普通股股數占已發行普通股比率\n（減資後上櫃普通股股數/減資後已發行普通股股數）:不適用。\n7.前二項預計減資後上櫃普通股股數未達500萬股且未達25%者，\n請說明股權流通性偏低之因應措施:不適用。\n8.其他應敘明事項:\n(1)以上每股淨值係依最近一期(115Q1)會計師核閱財務報告。\n(2)本公司於115年06月29日接獲新竹科學園區管理局之變更登記核准函，特此公告。""]], ""footer"": [""以上資料均由各公司依發言當時所屬市場別之規定申報後，由本系統對外公佈，資料如有虛偽不實，均由該公司負責。""], ""header"": {""note"": [], ""subTitle"": [], ""mainTitle"": [""公司當日重大訊息之詳細內容""]}, ""titles"": [{""sub"": [], ""main"": ""序號""}, {""sub"": [], ""main"": ""發言日期""}, {""sub"": [], ""main"": ""發言時間""}, {""sub"": [], ""main"": ""發言人""}, {""sub"": [], ""main"": ""發言人職稱""}, {""sub"": [], ""main"": ""發言人電話""}, {""sub"": [], ""main"": ""主旨""}, {""sub"": [], ""main"": ""符合條款""}, {""sub"": [], ""main"": ""事實發生日""}, {""sub"": [], ""main"": ""說明""}], ""companyAbbreviation"": ""合晶""}, ""datetime"": ""115/06/30 03:03:28""}",2026-06-30 03:03:20
1150629|otc|5263|1,115/06/29,19:41:16,5263,智崴,公告本公司訂定115年現金增資認股基準日等相關事宜,現金增資,1150629,otc,1,"{""code"": 200, ""message"": ""查詢成功"", ""result"": {""marketName"": ""上櫃公司"", ""companyId"": ""5263"", ""data"": [[1, ""115/06/29"", ""19:41:16"", ""歐陽志宏"", ""總經理"", ""07-5372869"", ""公告本公司訂定115年現金增資\r\n認股基準日等相關事宜"", ""11"", ""115/06/29"", ""1.董事會決議或公司決定增資基準日期:115/06/29\n2.是否採總括申報發行新股(是，請併敘明預定發行期間/否):否。\n3.主管機關申報生效日期:115/06/29\n4.董事會決議(追補)發行日期:115/05/14\n5.發行總金額及股數:\n發行總金額新台幣50,000千元，發行普通股5,000千股。\n6.採總括申報發行新股案件，本次發行金額及股數:不適用。\n7.採總括申報發行新股案件，本次發行後，剩餘之金額及股數餘額:\n不適用。\n8.每股面額:每股面額新台幣10元。\n9.發行價格:實際發行價格於訂定後另行公告。\n10.員工認股股數:\n依公司法第267條規定，保留10%計500千股由本公司員工認購。\n11.原股東認購比率:\n本次發行新股總數80%計4,000千股，由原股東按認股基準日\n股東名簿記載之持股比率認購，每千股可認購54.10019201股。\n12.公開銷售方式及股數:\n提撥本次發行股數之10%計500千股，\n採公開申購方式辦理公開銷售。\n13.畸零股及逾期未認購股份之處理方式:\n認購不足一股之畸零股，由股東自停止過戶日起五日內\n自行至本公司股務代理機構辦理拼湊一整股認購。\n原股東及員工放棄認購或拼湊不足一股之畸零股部分，\n擬請董事會授權董事長洽特定人按實際發行價格認足。\n14.本次發行新股之權利義務:與原已發行普通股股份相同。\n15.本次增資資金用途:償還金融機構借款。\n16.現金增資認股基準日:115/08/01\n17.最後過戶日:115/07/27\n18.停止過戶起始日期:115/07/28\n19.停止過戶截止日期:115/08/01\n20.股款繳納期間:115/08/05~115/08/12\n21.與代收及專戶存儲價款行庫訂約日期:俟實際簽約後另行公告。\n22.委託代收存款機構:俟實際簽約後另行公告。\n23.委託存儲款項機構:俟實際簽約後另行公告。\n24.其他應敘明事項:\n(1)本次現金增資發行普通股業經金融監督管理委員會\n中華民國115年6月29日金管證發字第1150345815號函申報生效。\n(2)本次現金增資之重要內容，包括實際發行價格、發行股數、\n發行條件及方式、募集金額、計畫項目、資金運用進度、\n預計可能產生效益暨其他一切有關本次現金增資發行計畫之相關事項、\n日期及其他未盡事宜，如因主管機關核定修正或因法令規定及事實需要\n或客觀環境變化而有需變更時，擬請董事會授權董事長視實際情況全權處理之。\n(3)原股東暨員工繳納期間為115/08/05~115/08/12。""]], ""footer"": [""以上資料均由各公司依發言當時所屬市場別之規定申報後，由本系統對外公佈，資料如有虛偽不實，均由該公司負責。""], ""header"": {""note"": [], ""subTitle"": [], ""mainTitle"": [""公司當日重大訊息之詳細內容""]}, ""titles"": [{""sub"": [], ""main"": ""序號""}, {""sub"": [], ""main"": ""發言日期""}, {""sub"": [], ""main"": ""發言時間""}, {""sub"": [], ""main"": ""發言人""}, {""sub"": [], ""main"": ""發言人職稱""}, {""sub"": [], ""main"": ""發言人電話""}, {""sub"": [], ""main"": ""主旨""}, {""sub"": [], ""main"": ""符合條款""}, {""sub"": [], ""main"": ""事實發生日""}, {""sub"": [], ""main"": ""說明""}], ""companyAbbreviation"": ""智崴""}, ""datetime"": ""115/06/30 03:03:28""}",2026-06-30 03:03:20
1150629|otc|8059|2,115/06/29,20:35:35,8059,凱碩,"代重要子公司HumaxNetworks,Inc.公告現金增資收足股款",現金增資,1150629,otc,2,"{""code"": 200, ""message"": ""查詢成功"", ""result"": {""marketName"": ""上櫃公司"", ""companyId"": ""8059"", ""data"": [[2, ""115/06/29"", ""20:35:35"", ""吳麗美"", ""協理"", ""02-2267-3858 #28808"", ""代重要子公司Humax Networks,Inc.公告現金增資收足股款"", ""53"", ""115/06/29"", ""1.事實發生日:115/06/29\n2.公司名稱:Humax Networks,Inc.\n3.與公司關係(請輸入本公司或子公司):子公司\n4.相互持股比例:87.771725%\n5.發生緣由:\n本公司之重要子公司Humax Networks,Inc.115年現金增資發行新股計3,950,542股，\n每股發行價格USD9.8(折合新台幣每股約314.23元)，已於今日收足股款。\n6.因應措施:無。\n7.其他應敘明事項(若事件發生或決議之主體係屬公開發行以上公司，\n本則重大訊息同時符合證券交易法施行細則第7條第9款所定\n對股東權益或證券價格有重大影響之事項):\n本案係依海外當地法規，程序為先訂定增資基準日後辦理股款繳納，請參見115年06月\n09日本公司重要子公司Humax Networks, Inc.公告董事會訂定現金增資基準日及其相關\n事宜之重大訊息。""]], ""footer"": [""以上資料均由各公司依發言當時所屬市場別之規定申報後，由本系統對外公佈，資料如有虛偽不實，均由該公司負責。""], ""header"": {""note"": [], ""subTitle"": [], ""mainTitle"": [""公司當日重大訊息之詳細內容""]}, ""titles"": [{""sub"": [], ""main"": ""序號""}, {""sub"": [], ""main"": ""發言日期""}, {""sub"": [], ""main"": ""發言時間""}, {""sub"": [], ""main"": ""發言人""}, {""sub"": [], ""main"": ""發言人職稱""}, {""sub"": [], ""main"": ""發言人電話""}, {""sub"": [], ""main"": ""主旨""}, {""sub"": [], ""main"": ""符合條款""}, {""sub"": [], ""main"": ""事實發生日""}, {""sub"": [], ""main"": ""說明""}], ""companyAbbreviation"": ""凱碩""}, ""datetime"": ""115/06/30 03:03:29""}",2026-06-30 03:03:20
1150629|rotc|6734|3,115/06/29,20:25:07,6734,安盛生,公告本公司115年現金增資全體董事放棄認購股數達得認購股數二分之一以上，並洽特定人認購事宜,現金增資,1150629,rotc,3,"{""code"": 200, ""message"": ""查詢成功"", ""result"": {""marketName"": ""興櫃公司"", ""companyId"": ""6734"", ""data"": [[3, ""115/06/29"", ""20:25:07"", ""黃舒蘭"", ""財務協理"", ""87511335"", ""公告本公司115年現金增資全體董事放棄認購股數達得認購\r\n股數二分之一以上，並洽特定人認購事宜"", ""37"", ""115/06/29"", ""1.事實發生日:115/06/29\n2.董監事放棄認購原因:整體投資策略考量及理財規劃。\n3.董監事姓名、放棄認購股數及其占得認購股數之比率:\n遠瞻管理顧問有限公司\n放棄認購股數：1,818,654股\n占得認購股數之比率：100%\n董事長個人已完成原股東認購股數之比率：100%\n4.特定人姓名及其認購股數:上述董事放棄認購之股數，授權董事長洽特定人認購之。\n5.其他應敘明事項:無。""]], ""footer"": [""以上資料均由各公司依發言當時所屬市場別之規定申報後，由本系統對外公佈，資料如有虛偽不實，均由該公司負責。""], ""header"": {""note"": [], ""subTitle"": [], ""mainTitle"": [""公司當日重大訊息之詳細內容""]}, ""titles"": [{""sub"": [], ""main"": ""序號""}, {""sub"": [], ""main"": ""發言日期""}, {""sub"": [], ""main"": ""發言時間""}, {""sub"": [], ""main"": ""發言人""}, {""sub"": [], ""main"": ""發言人職稱""}, {""sub"": [], ""main"": ""發言人電話""}, {""sub"": [], ""main"": ""主旨""}, {""sub"": [], ""main"": ""符合條款""}, {""sub"": [], ""main"": ""事實發生日""}, {""sub"": [], ""main"": ""說明""}], ""companyAbbreviation"": ""安盛生""}, ""datetime"": ""115/06/30 03:03:29""}",2026-06-30 03:03:20
