key,speech_date,speech_time,company_id,company_name,subject,matched_keywords,enterDate,marketKind,serialNumber,detail_json,fetched_at_tw
1150519|sii|1436|1,115/05/19,13:54:44,1436,華友聯,公告本公司115年度第一次有擔保普通公司債主要發行條件,公司債,1150519,sii,1,"{""code"": 200, ""message"": ""查詢成功"", ""result"": {""marketName"": ""上市公司"", ""companyId"": ""1436"", ""data"": [[1, ""115/05/19"", ""13:54:44"", ""吳家德"", ""執行副總經理"", ""(07)780-1381"", ""公告本公司115年度第一次有擔保普通公司債主要發行條件"", ""11"", ""115/05/19"", ""1.董事會決議日期:NA\n2.名稱﹝XX公司第X次（有、無）擔保公司債﹞:華友聯開發股份有限公司115年度\n  第一次有擔保普通公司債\n3.是否採總括申報發行公司債(是/否):否\n4.發行總額:發行總面額為新台幣壹拾億元整。\n5.每張面額:新台幣壹佰萬元整。\n6.發行價格:依票面金額十足發行。\n7.發行期間:五年。\n8.發行利率:票面利率為固定年利率2.0%。\n9.擔保品之種類、名稱、金額及約定事項:銀行保證。\n10.募得價款之用途及運用計畫:償還110年度第一次有擔保普通公司債。\n11.承銷方式:委託證券商以洽商銷售方式對外公開承銷。\n12.公司債受託人:臺灣土地銀行股份有限公司。\n13.承銷或代銷機構:第一金證券股份有限公司。\n14.發行保證人:第一商業銀行股份有限公司。\n15.代理還本付息機構:第一商業銀行股份有限公司前鎮分行。\n16.簽證機構:無實體發行，故不適用。\n17.能轉換股份者，其轉換辦法:不適用。\n18.賣回條件:無。\n19.買回條件:無。\n20.附有轉換、交換或認股者，其換股基準日:不適用。\n21.附有轉換、交換或認股者，對股權可能稀釋情形:不適用。\n22.其他應敘明事項:本公司已於民國115年5月7日經董事會通過發行有擔保普通公司債，\n  此公告為相關條件之說明。""]], ""footer"": [""以上資料均由各公司依發言當時所屬市場別之規定申報後，由本系統對外公佈，資料如有虛偽不實，均由該公司負責。""], ""header"": {""note"": [], ""subTitle"": [], ""mainTitle"": [""公司當日重大訊息之詳細內容""]}, ""titles"": [{""sub"": [], ""main"": ""序號""}, {""sub"": [], ""main"": ""發言日期""}, {""sub"": [], ""main"": ""發言時間""}, {""sub"": [], ""main"": ""發言人""}, {""sub"": [], ""main"": ""發言人職稱""}, {""sub"": [], ""main"": ""發言人電話""}, {""sub"": [], ""main"": ""主旨""}, {""sub"": [], ""main"": ""符合條款""}, {""sub"": [], ""main"": ""事實發生日""}, {""sub"": [], ""main"": ""說明""}], ""companyAbbreviation"": ""華友聯""}, ""datetime"": ""115/05/19 23:20:44""}",2026-05-19 23:20:37
1150519|sii|9955|1,115/05/19,14:41:14,9955,佳龍,公告本公司董事會決議通過辦理現金增資發行新股(補充公告),現金增資,1150519,sii,1,"{""code"": 200, ""message"": ""查詢成功"", ""result"": {""marketName"": ""上市公司"", ""companyId"": ""9955"", ""data"": [[1, ""115/05/19"", ""14:41:14"", ""陸怡豪"", ""策略顧問"", ""(03)473-6566"", ""公告本公司董事會決議通過辦理現金增資發行新股(補充公告)"", ""11"", ""115/05/19"", ""1.董事會決議日期:115/05/19\n2.增資資金來源:現金增資發行普通股\n3.是否採總括申報發行新股(是，請併敘明預定發行期間/否):否\n4.全案發行總金額及股數(如屬盈餘或公積轉增資，發行股數則不含配發給員工部分):\n發行總金額:新台幣150,000仟元\n發行股數:15,000仟股\n5.採總括申報發行新股案件，本次發行金額及股數:不適用\n6.採總括申報發行新股案件，本次發行後，剩餘之金額及股數餘額:不適用\n7.每股面額:新臺幣10元\n8.發行價格:暫定發行價格為每股新台幣25元，實際發行價格擬授權\n董事長依承銷商自律規則第6條第1項及其他法令並參酌發行市場狀況訂\n定之(補充公告)。\n9.員工認購股數或配發金額: 依公司法第267條規定，提撥增資發行股數之10%\n由本公司員工認購(補充公告)。\n10.公開銷售股數:依證券交易法第28條之1規定，提撥增資發行新股股數之10%\n對外公開承銷。\n11.原股東認購或無償配發比例:其餘增資發行股數之80%，由原股東按認股基\n準日股東名簿記載之股東及其持有股份比例分別認購之(補充公告)。\n12.畸零股及逾期未認購股份之處理方式:\n原股東認購不足一股之畸零股得由股東在停止過戶日起五日內，逕向本公司股務代\n理機構辦理併湊，其併湊不足一股之畸零股及原股東與員工認購不足及逾期未申\n報併湊之部分，擬授權董事長洽特定人認購之。\n13.本次發行新股之權利義務:與原已發行普通股股份相同。\n14.本次增資資金用途:充實營運資金及償還銀行借款(補充公告)。\n15.其他應敘明事項:\n(1)本次現金增資計畫所訂之發行金額、發行股數、募集金額、資金運用\n狀況暨其他相關事宜如因主管機關核定修正，或因法令規定及因客觀環境\n之營運評估變更時，擬授權董事長辦理。\n(2)本案經呈報主管機關申報生效後，有關認股基準日、增資基準日、股款\n繳納期間及其他未盡事項，擬授權董事長視實際情況依相關法令辦理。\n(3)本次現金增資之實際發行價格，若因市場情形之變動，將依承銷商自律\n規則第6條第1項規定予以調整。""]], ""footer"": [""以上資料均由各公司依發言當時所屬市場別之規定申報後，由本系統對外公佈，資料如有虛偽不實，均由該公司負責。""], ""header"": {""note"": [], ""subTitle"": [], ""mainTitle"": [""公司當日重大訊息之詳細內容""]}, ""titles"": [{""sub"": [], ""main"": ""序號""}, {""sub"": [], ""main"": ""發言日期""}, {""sub"": [], ""main"": ""發言時間""}, {""sub"": [], ""main"": ""發言人""}, {""sub"": [], ""main"": ""發言人職稱""}, {""sub"": [], ""main"": ""發言人電話""}, {""sub"": [], ""main"": ""主旨""}, {""sub"": [], ""main"": ""符合條款""}, {""sub"": [], ""main"": ""事實發生日""}, {""sub"": [], ""main"": ""說明""}], ""companyAbbreviation"": ""佳龍""}, ""datetime"": ""115/05/19 23:20:45""}",2026-05-19 23:20:37
1150519|sii|2543|1,115/05/19,15:29:15,2543,皇昌,公告本公司董事會決議買回庫藏股,庫藏股,1150519,sii,1,"{""code"": 200, ""message"": ""查詢成功"", ""result"": {""marketName"": ""上市公司"", ""companyId"": ""2543"", ""data"": [[1, ""115/05/19"", ""15:29:15"", ""官心惠"", ""副總經理"", ""2792-2988"", ""公告本公司董事會決議買回庫藏股"", ""35"", ""115/05/19"", ""1.董事會決議日期:115/05/19\r\n2.買回股份目的:轉讓股份予員工\r\n3.買回股份種類:普通股\r\n4.買回股份總金額上限(元):4,192,993,463\r\n5.預定買回之期間:115/05/20~115/07/19\r\n6.預定買回之數量(股):20,000,000\r\n7.買回區間價格(元):35.00~70.00，公司股價低於區間價格下限，將繼續買回\r\n8.買回方式:自集中交易市場買回\r\n9.預定買回股份占公司已發行股份總數之比率(%):3.78\r\n10.申報時已持有本公司股份之累積股數(股):0\r\n11.申報前五年內買回公司股份之情形:\r\n(1)實際買回股份期間：114/11/14 ~ 115/01/13 、預定買回股數(股)：10000000 、實際已買回股\r\n數(股)：3842000 、執行情形(實際已買回股數占預定買回股數%)：38.00\r\n12.已申報買回但未執行完畢之情形:\r\n不適用\r\n13.董事會決議買回股份之會議紀錄:\r\n115年第四次董事會\r\n14.「上市上櫃公司買回本公司股份辦法」第十條規定之轉讓辦法:\r\n皇昌營造股份有限公司\r\n第七次買回股份轉讓員工辦法\r\n第一條\t本公司為激勵員工及提昇員工向心力，依據證券交易法第28條之2第1項第1款及金融監督\r\n管\r\n理委員會發布之「上市上櫃公司買回本公司股份辦法」等相關規定，訂定本公司買回股份轉讓員工辦\r\n法。本公司買回股份轉讓予員工，除依有關法令規定外，悉依本辦法規定辦理。\r\n第二條\t本次轉讓予員工之股份為普通股，其權利義務除有關法令及本辦法另有規定者外，與其他\r\n流通在外普通股相同。\r\n第三條\t本次買回之股份，得依本辦法之規定，自買回股份之日起五年內，得一次或分次轉讓予員\r\n工，各次轉讓作業之員工繳款期間及相關事宜，授權董事長另行訂定。\r\n第四條\t凡於認股基準日前到職滿二年或對公司有特殊貢獻經提報董事會同意之本公司員工，得依\r\n本辦法第五條所定認購數額，享有認購資格。\r\n第五條\t員工得認股股數，係依據員工職等、服務年資及對公司之特殊貢獻並兼顧認股基準日時公\r\n司持有之買回股份總額及單一員工認購股數之上限因素為計算標準，訂定員工得受讓認購股數，報請\r\n董事會核准之。\r\n第六條\t本次買回股份轉讓予員工之作業程序:\r\n一、\t依董事會之決議，公告、申報並於執行期限內買回本公司股份。\r\n二、\t董事會依本辦法訂定及公布員工認股基準日、得認購股數標準、認購繳款期間、權利內容\r\n及限制條件等作業事項。\r\n三、\t統計實際認購繳款股數，辦理股票轉讓過戶登記。\r\n四、\t轉讓對象之審核程序：\r\n1.\t經理人：經薪資報酬委員會討論通過後，再提請董事會決議。\r\n2.\t非經理人：經審計委員會討論通過後，再提請董事會決議。\r\n第七條\t本次買回股份轉讓予員工，以實際買回之平均價格為轉讓價格，惟轉讓前，如遇公司已發\r\n行之普通股股分增加或減少，得按發行股份增加或減少比率調整之。\r\n轉讓價格調整公式：調整後轉讓價格＝實際買回股份之平均價格X（申報買回股份時已發行之普通股\r\n總數／轉讓買回股份予員工前已發行之普通股總數）\r\n第八條\t本次買回股份轉讓予員工並辦理過戶登記後，除另有規定者外，其權利義務與原有股份相\r\n同。\r\n第九條\t本辦法經董事會決議通過後生效，修訂時亦同。\r\n第十條\t本辦法應提報東會報告，修改時亦同。\r\n15.「上市上櫃公司買回本公司股份辦法」第十一條規定之轉換或認股辦法:\r\n不適用\r\n16.董事會已考慮公司財務狀況，不影響公司資本維持之聲明:\r\n上述買回股份總數,僅占本公司已發行股份之百分之3.78%，且買回股份所需金額上限僅占本公司流動\r\n資產之百分之15.31%，茲聲明本公司董事會已考慮公司財務狀況,上述股份之買回並不影響本公司資本\r\n之維持。\r\n17.會計師或證券承銷商對買回股份價格之合理性評估意見:\r\n經統一綜合證券股份有限公司評估，公司本次買回公司股份訂定之價格區間，其決策過程具合法性，價\r\n格區間之訂定亦屬合理，且未來執行時對公司財務狀況尚不致造成重大不利影響，應無重大異常情事。\r\n18.其他證期局所規定之事項:\r\n無""]], ""footer"": [""以上資料均由各公司依發言當時所屬市場別之規定申報後，由本系統對外公佈，資料如有虛偽不實，均由該公司負責。""], ""header"": {""note"": [], ""subTitle"": [], ""mainTitle"": [""公司當日重大訊息之詳細內容""]}, ""titles"": [{""sub"": [], ""main"": ""序號""}, {""sub"": [], ""main"": ""發言日期""}, {""sub"": [], ""main"": ""發言時間""}, {""sub"": [], ""main"": ""發言人""}, {""sub"": [], ""main"": ""發言人職稱""}, {""sub"": [], ""main"": ""發言人電話""}, {""sub"": [], ""main"": ""主旨""}, {""sub"": [], ""main"": ""符合條款""}, {""sub"": [], ""main"": ""事實發生日""}, {""sub"": [], ""main"": ""說明""}], ""companyAbbreviation"": ""皇昌""}, ""datetime"": ""115/05/19 23:20:45""}",2026-05-19 23:20:37
1150518|sii|3605|1,115/05/19,16:05:57,3605,宏致,本公司114年度現金增資收足股款暨增資基準日公告,現金增資,1150518,sii,1,"{""code"": 200, ""message"": ""查詢成功"", ""result"": {""marketName"": ""上市公司"", ""companyId"": ""3605"", ""data"": [[1, ""115/05/19"", ""16:05:57"", ""扶大桂"", ""行政處資深處長"", ""(03)4632808"", ""本公司114年度現金增資收足股款暨增資基準日公告"", ""51"", ""115/05/19"", ""1.事實發生日:115/05/19\n2.公司名稱:宏致電子股份有限公司\n3.與公司關係(請輸入本公司或子公司):本公司\n4.相互持股比例:不適用\n5.發生緣由:依據「發行人募集與發行有價證券處理準則」辦理公告。\n (1)本公司辦理114年度現金增資發行新股11,000,000股，每股認購價格新台幣58元，\n    實收股款總額為新台幣638,000,000元，業已全數收足。\n (2)現金增資基準日:115年5月19日。\n (3)預定股款繳納憑證上市日期:115年5月22日。\n6.因應措施:無。\n7.其他應敘明事項(若事件發生或決議之主體係屬公開發行以上公司，本則重大訊息同時\n  符合證券交易法施行細則第7條第9款所定對股東權益或證券價格有重大影響之事項):\n  無。""]], ""footer"": [""以上資料均由各公司依發言當時所屬市場別之規定申報後，由本系統對外公佈，資料如有虛偽不實，均由該公司負責。""], ""header"": {""note"": [], ""subTitle"": [], ""mainTitle"": [""公司當日重大訊息之詳細內容""]}, ""titles"": [{""sub"": [], ""main"": ""序號""}, {""sub"": [], ""main"": ""發言日期""}, {""sub"": [], ""main"": ""發言時間""}, {""sub"": [], ""main"": ""發言人""}, {""sub"": [], ""main"": ""發言人職稱""}, {""sub"": [], ""main"": ""發言人電話""}, {""sub"": [], ""main"": ""主旨""}, {""sub"": [], ""main"": ""符合條款""}, {""sub"": [], ""main"": ""事實發生日""}, {""sub"": [], ""main"": ""說明""}], ""companyAbbreviation"": ""宏致""}, ""datetime"": ""115/05/19 23:20:46""}",2026-05-19 23:20:37
1150519|sii|2101|1,115/05/19,16:34:21,2101,南港,"公告本公司董事會通過第二十一次買回庫藏股2,200仟股相關資訊",庫藏股,1150519,sii,1,"{""code"": 200, ""message"": ""查詢成功"", ""result"": {""marketName"": ""上市公司"", ""companyId"": ""2101"", ""data"": [[1, ""115/05/19"", ""16:34:21"", ""郭美航"", ""財務部協理"", ""27071000#215"", ""公告本公司董事會通過第二十一次買回庫藏股2,200仟股相關資訊"", ""35"", ""115/05/19"", ""1.董事會決議日期:115/05/19\r\n2.買回股份目的:轉讓股份予員工\r\n3.買回股份種類:普通股\r\n4.買回股份總金額上限(元):4,007,924,379\r\n5.預定買回之期間:115/05/19~115/07/18\r\n6.預定買回之數量(股):2,200,000\r\n7.買回區間價格(元):27.00~45.00，公司股價低於區間價格下限，將繼續買回\r\n8.買回方式:自集中交易市場買回\r\n9.預定買回股份占公司已發行股份總數之比率(%):0.30\r\n10.申報時已持有本公司股份之累積股數(股):108,656,595\r\n11.申報前五年內買回公司股份之情形:\r\n(1)實際買回股份期間：115/02/24 ~ 115/03/09 、預定買回股數(股)：2200000 、實際已買回\r\n股數(股)：2200000 、執行情形(實際已買回股數占預定買回股數%)：100.00\r\n(2)實際買回股份期間：115/01/06 ~ 115/02/03 、預定買回股數(股)：2200000 、實際已買回\r\n股數(股)：2200000 、執行情形(實際已買回股數占預定買回股數%)：100.00\r\n(3)實際買回股份期間：114/11/05 ~ 115/01/02 、預定買回股數(股)：2200000 、實際已買回\r\n股數(股)：2037000 、執行情形(實際已買回股數占預定買回股數%)：93.00\r\n(4)實際買回股份期間：114/07/31 ~ 114/09/03 、預定買回股數(股)：2200000 、實際已買回\r\n股數(股)：1833000 、執行情形(實際已買回股數占預定買回股數%)：83.00\r\n(5)實際買回股份期間：114/04/17 ~ 114/06/05 、預定買回股數(股)：11000000 、實際已買回\r\n股數(股)：3199000 、執行情形(實際已買回股數占預定買回股數%)：29.00\r\n12.已申報買回但未執行完畢之情形:\r\nNO.16執行率:29.08% ; NO.17執行率:83.32%\r\nNO.18執行率:92.59% ; NO.19~20執行率:100.00%\r\n13.董事會決議買回股份之會議紀錄:\r\n115.5.19董事會決議通過.\r\n14.「上市上櫃公司買回本公司股份辦法」第十條規定之轉讓辦法:\r\n(1)轉讓股份種類,權利內容及權利受限情形:轉讓種類為普通股,其權\r\n利義務與\r\n其他流通在外普通股相同。\r\n(2)轉讓期間:依法自買回股份之日起5年內,一次或分次轉讓予員工。\r\n\r\n(3)受讓人資格:凡於認股基準日前到職滿6個月或對公司有特殊貢獻\r\n經提報董事會同意\r\n之本公司（及直接或間接持有同一被投資公司表決權股份超過百\r\n分之五十之子公司）\r\n員工(含經本公司簽約勞動契約或投保勞保及災保之顧問、定期聘\r\n僱及外派員工，\r\n不含外籍勞工)，且於員工認購基準日或繳足認購股款前仍在職，\r\n得依本辦法第五條\r\n所定認購&#63849;額，享有認購資格。\r\n(4)轉讓程序:依法自買回股份之日起5年內，授權董事長分次轉讓予\r\n員工。\r\n(5)約定每股轉讓價格:本次買回股份轉讓予員工，以實際買回之每股\r\n平均價格\r\n為轉讓價格，惟在轉讓前如遇公司已發行之普通股再增加者，得按發\r\n行股份增加\r\n比率調整之。\r\n(6)轉讓後之權利義務:本次買回股份轉讓予員工並辦理過戶登記後，\r\n除另有規定者外，\r\n餘權利義務與其他流通在外普通股相同。\r\n(7)其他有關公司與員工權利義務事項:依轉讓辦法辦理之。\r\n15.「上市上櫃公司買回本公司股份辦法」第十一條規定之轉換或認股辦法:\r\n不適用\r\n16.董事會已考慮公司財務狀況，不影響公司資本維持之聲明:\r\n茲聲明本公司董事會已考慮公司財務狀況,上述股份之買回不影響公司資本維持。\r\n17.會計師或證券承銷商對買回股份價格之合理性評估意見:\r\n本次南港公司為激勵員工及提升員工向心力,擬買回股份,\r\n依其所定區間價格執行買回該公司股份,除造成現金流出外,\r\n預計對該公司之財務結構,每股淨值,每股盈餘,股東權益報酬率\r\n,速動比率,流動比率,並未產生重大影響或變動.另其所擬定之\r\n買回價格區間為27.00元至45.00元間,與南港公司近期股價區間相近,\r\n本會計師認為尚屬合理.\r\n18.其他證期局所規定之事項:\r\n無.""]], ""footer"": [""以上資料均由各公司依發言當時所屬市場別之規定申報後，由本系統對外公佈，資料如有虛偽不實，均由該公司負責。""], ""header"": {""note"": [], ""subTitle"": [], ""mainTitle"": [""公司當日重大訊息之詳細內容""]}, ""titles"": [{""sub"": [], ""main"": ""序號""}, {""sub"": [], ""main"": ""發言日期""}, {""sub"": [], ""main"": ""發言時間""}, {""sub"": [], ""main"": ""發言人""}, {""sub"": [], ""main"": ""發言人職稱""}, {""sub"": [], ""main"": ""發言人電話""}, {""sub"": [], ""main"": ""主旨""}, {""sub"": [], ""main"": ""符合條款""}, {""sub"": [], ""main"": ""事實發生日""}, {""sub"": [], ""main"": ""說明""}], ""companyAbbreviation"": ""南港""}, ""datetime"": ""115/05/19 23:20:47""}",2026-05-19 23:20:37
1150519|sii|3450|1,115/05/19,17:03:07,3450,聯鈞,代重要子公司源傑科技股份有限公司公告115年度現金增資收足股款暨現金增資基準日,現金增資,1150519,sii,1,"{""code"": 200, ""message"": ""查詢成功"", ""result"": {""marketName"": ""上市公司"", ""companyId"": ""3450"", ""data"": [[1, ""115/05/19"", ""17:03:07"", ""陳士恩"", ""協理"", ""(02)8245-6186"", ""代重要子公司源傑科技股份有限公司公告115年度現金增資\r\n收足股款暨現金增資基準日"", ""51"", ""115/05/19"", ""1.事實發生日:115/05/19\n2.公司名稱:源傑科技股份有限公司\n3.與公司關係(請輸入本公司或子公司):子公司\n4.相互持股比例:不適用\n5.發生緣由:\n依據「發行人募集與發行有價證券處理準則」第9條規定辦理\n6.因應措施:無\n7.其他應敘明事項(若事件發生或決議之主體係屬公開發行以上公司，本則重大訊息同時\n  符合證券交易法施行細則第7條第9款所定對股東權益或證券價格有重大影響之事項):\n(1)源傑科技股份有限公司115年現金增資發行普通股1,800,000股，每股認購價格\n   新台幣218元，實收股款總金額新台幣392,400,000元，業已全數收足。\n(2)源傑科技股份有限公司訂定115/5/21為現金增資基準日。""]], ""footer"": [""以上資料均由各公司依發言當時所屬市場別之規定申報後，由本系統對外公佈，資料如有虛偽不實，均由該公司負責。""], ""header"": {""note"": [], ""subTitle"": [], ""mainTitle"": [""公司當日重大訊息之詳細內容""]}, ""titles"": [{""sub"": [], ""main"": ""序號""}, {""sub"": [], ""main"": ""發言日期""}, {""sub"": [], ""main"": ""發言時間""}, {""sub"": [], ""main"": ""發言人""}, {""sub"": [], ""main"": ""發言人職稱""}, {""sub"": [], ""main"": ""發言人電話""}, {""sub"": [], ""main"": ""主旨""}, {""sub"": [], ""main"": ""符合條款""}, {""sub"": [], ""main"": ""事實發生日""}, {""sub"": [], ""main"": ""說明""}], ""companyAbbreviation"": ""聯鈞""}, ""datetime"": ""115/05/19 23:20:48""}",2026-05-19 23:20:37
1150519|sii|3708|7,115/05/19,17:06:02,3708,上緯投控,本公司庫藏股註銷減資及可轉換公司債轉換普通股變更登記完成,公司債|庫藏股,1150519,sii,7,"{""code"": 200, ""message"": ""查詢成功"", ""result"": {""marketName"": ""上市公司"", ""companyId"": ""3708"", ""data"": [[7, ""115/05/19"", ""17:06:02"", ""洪嘉敏"", ""協理"", ""049-2255420"", ""本公司庫藏股註銷減資及可轉換公司債轉換普通股\r\n變更登記完成"", ""36"", ""115/05/19"", ""1.主管機關核准減資日期:115/05/15\n2.辦理資本變更登記完成日期:115/05/15\n3.對財務報告之影響（含實收資本額與流通在外股數之差異與對每股淨值之影響）:\n(1)本次註銷庫藏股5,500,000股,每股面額新台幣(以下同)10元，\n     共計減少資本55,000,000元\n(2)註銷減資前：本公司流通在外股數為97,267,193股，實收資本額972,671,930元\n     每股淨值為新台幣179.97元。\n(3)註銷減資後：本次變更登記，係包含庫藏股註銷新台幣55,000,000元，\n   加計可轉換公司債轉換普通股新台幣3,381,910元，\n   實收資本額為新台幣921,053,840元，己發行股數為92,105,384股\n   每股淨值為新台幣190.05元。\n4.預計換股作業計畫:不適用\n5.預計減資新股上市後之上市普通股股數:不適用\n6.預計減資新股上市後之上市普通股股數占已發行普通股比率\n （減資後上市普通股股數/減資後已發行普通股股數）:不適用\n7.前二項預計減資後上巿普通股股數未達6000萬股且未達25%者，請說明股權流通性偏低\n  之因應措施:不適用\n8.其他應敘明事項:\n(1)每股淨值係依115Q1合併財務報表歸屬於母公司業主之權益為計算依據。\n(2)本公司於115/05/19收到變更登記核准函。""]], ""footer"": [""以上資料均由各公司依發言當時所屬市場別之規定申報後，由本系統對外公佈，資料如有虛偽不實，均由該公司負責。""], ""header"": {""note"": [], ""subTitle"": [], ""mainTitle"": [""公司當日重大訊息之詳細內容""]}, ""titles"": [{""sub"": [], ""main"": ""序號""}, {""sub"": [], ""main"": ""發言日期""}, {""sub"": [], ""main"": ""發言時間""}, {""sub"": [], ""main"": ""發言人""}, {""sub"": [], ""main"": ""發言人職稱""}, {""sub"": [], ""main"": ""發言人電話""}, {""sub"": [], ""main"": ""主旨""}, {""sub"": [], ""main"": ""符合條款""}, {""sub"": [], ""main"": ""事實發生日""}, {""sub"": [], ""main"": ""說明""}], ""companyAbbreviation"": ""上緯投控""}, ""datetime"": ""115/05/19 23:20:48""}",2026-05-19 23:20:37
