key,speech_date,speech_time,company_id,company_name,subject,matched_keywords,enterDate,marketKind,serialNumber,detail_json,fetched_at_tw
1150505|otc|4991|1,115/05/05,16:55:58,4991,環宇-KY,"對重要子公司GlobalCommunicationSemiconductors,LLC辦理現金增資",現金增資,1150505,otc,1,"{""code"": 200, ""message"": ""查詢成功"", ""result"": {""marketName"": ""上櫃公司"", ""companyId"": ""4991"", ""data"": [[1, ""115/05/05"", ""16:55:58"", ""余有崇"", ""資深副總"", ""02-82261185"", ""對重要子公司Global Communication Semiconductors, LLC\r\n辦理現金增資"", ""11"", ""115/05/05"", ""1.董事會決議日期:115/05/05\n2.增資資金來源:由母公司GCS Holdings, Inc.對100%持有之子公司Global\nCommunication Semiconductors, LLC進行現金投資\n3.是否採總括申報發行新股(是，請併敘明預定發行期間/否):否\n4.全案發行總金額及股數(如屬盈餘或公積轉增資，發行股數則不含配發給員工部分):\n投資總金額:美金11,832仟元\n股數:不適用\n5.採總括申報發行新股案件，本次發行金額及股數:不適用\n6.採總括申報發行新股案件，本次發行後，剩餘之金額及股數餘額:不適用\n7.每股面額:不適用\n8.發行價格:不適用\n9.員工認購股數或配發金額:不適用\n10.公開銷售股數:不適用\n11.原股東認購或無償配發比例(請註明暫定每仟股認購或配發股數):不適用\n12.畸零股及逾期未認購股份之處理方式:不適用\n13.本次發行新股之權利義務:不適用\n14.本次增資資金用途:子公司Global Communication Semiconductors, LLC\n購置機器設備及充實營運資金\n15.其他應敘明事項:無""]], ""footer"": [""以上資料均由各公司依發言當時所屬市場別之規定申報後，由本系統對外公佈，資料如有虛偽不實，均由該公司負責。""], ""header"": {""note"": [], ""subTitle"": [], ""mainTitle"": [""公司當日重大訊息之詳細內容""]}, ""titles"": [{""main"": ""序號"", ""sub"": []}, {""main"": ""發言日期"", ""sub"": []}, {""main"": ""發言時間"", ""sub"": []}, {""main"": ""發言人"", ""sub"": []}, {""main"": ""發言人職稱"", ""sub"": []}, {""main"": ""發言人電話"", ""sub"": []}, {""main"": ""主旨"", ""sub"": []}, {""main"": ""符合條款"", ""sub"": []}, {""main"": ""事實發生日"", ""sub"": []}, {""main"": ""說明"", ""sub"": []}], ""companyAbbreviation"": ""環宇-KY""}, ""datetime"": ""115/05/05 17:26:57""}",2026-05-05 17:26:34
1150505|otc|5464|2,115/05/05,17:16:45,5464,霖宏,(補充公告)公告本公司國內第二次有擔保轉換公司債代收價款及存儲專戶行庫,公司債,1150505,otc,2,"{""code"": 200, ""message"": ""查詢成功"", ""result"": {""marketName"": ""上櫃公司"", ""companyId"": ""5464"", ""data"": [[2, ""115/05/05"", ""17:16:45"", ""賴柔卉"", ""副理"", ""05-2216696"", ""(補充公告)公告本公司國內第二次有擔保轉換公司債\r\n代收價款及存儲專戶行庫"", ""53"", ""115/05/05"", ""1.事實發生日:115/05/05\n2.公司名稱:霖宏科技股份有限公司\n3.與公司關係(請輸入本公司或子公司):本公司\n4.相互持股比例:不適用\n5.發生緣由:\n依據「發行人募集與發行有價證券處理準則」第九條第一項第二款規定辦理。\n6.因應措施:無。\n7.其他應敘明事項(若事件發生或決議之主體係屬公開發行以上公司，\n本則重大訊息同時符合證券交易法施行細則第7條第9款所定\n對股東權益或證券價格有重大影響之事項):\n(1)訂約日期：民國115年5月4日。\n(2)委託代收價款行庫：第一銀行新湖分行。\n(3)委託存儲專戶行庫：中國信託西台南分行(存儲專戶：中國信託斗六分行)""]], ""footer"": [""以上資料均由各公司依發言當時所屬市場別之規定申報後，由本系統對外公佈，資料如有虛偽不實，均由該公司負責。""], ""header"": {""note"": [], ""subTitle"": [], ""mainTitle"": [""公司當日重大訊息之詳細內容""]}, ""titles"": [{""main"": ""序號"", ""sub"": []}, {""main"": ""發言日期"", ""sub"": []}, {""main"": ""發言時間"", ""sub"": []}, {""main"": ""發言人"", ""sub"": []}, {""main"": ""發言人職稱"", ""sub"": []}, {""main"": ""發言人電話"", ""sub"": []}, {""main"": ""主旨"", ""sub"": []}, {""main"": ""符合條款"", ""sub"": []}, {""main"": ""事實發生日"", ""sub"": []}, {""main"": ""說明"", ""sub"": []}], ""companyAbbreviation"": ""霖宏""}, ""datetime"": ""115/05/05 17:26:58""}",2026-05-05 17:26:34
1150504|rotc|4582|4,115/05/04,19:10:53,4582,聚恆,公告本公司股票初次創新板上市前現金增資發行新股相關事宜（暫定承銷價格及相關時程）,現金增資,1150504,rotc,4,"{""code"": 200, ""message"": ""查詢成功"", ""result"": {""marketName"": ""興櫃公司"", ""companyId"": ""4582"", ""data"": [[4, ""115/05/04"", ""19:10:53"", ""周曉艷"", ""總經理"", ""06-2022202"", ""公告本公司股票初次創新板上市前現金增資發行新股\r\n相關事宜（暫定承銷價格及相關時程）"", ""44"", ""115/05/04"", ""1.事實發生日:115/05/04\n2.公司名稱:聚恆科技股份有限公司\n3.與公司關係(請輸入本公司或子公司):本公司\n4.相互持股比例:不適用\n5.發生緣由:公告本公司股票創新板初次上市前現金增資發行新股相關事宜\n6.因應措施:無\n7.其他應敘明事項(若事件發生或決議之主體係屬公開發行以上公司，\n本則重大訊息同時符合證券交易法施行細則第7條第9款所定\n對股東權益或證券價格有重大影響之事項):\n一、本公司為配合初次創新板上市前公開承銷辦理現金增資發行普通股8,880,000股，\n每股面額新臺幣10元，總額新臺幣88,800,000元，業經臺灣證券交易所股份有限公司\n115年4月20日臺證上二字第1151701034號函申報生效在案。\n二、本次現金增資依公司法第267條規定，保留15%計1,332,000股由本公司員工認購，\n本公司員工認購不足或放棄認購之股份，授權董事長洽特定人按發行價格認購之；其\n餘85%計7,548,000股，由原股東放棄認購，全數委由證券承銷商對外辦理上市前公開\n承銷。\n三、本次現金增資發行普通股8,880,000股，每股面額新臺幣10元，計新台幣\n88,800,000元，以競價拍賣方式辦理承銷。競價拍賣最低承銷價格係以向中華民國證\n券商業同業公會申報競價拍賣約定書前興櫃有成交之30個營業日其成交均價扣除無償\n配股除權(或減資除權)及除息後簡單算術平均數之七成為上限，訂為每股新臺幣20元\n(競價拍賣底價)，依投標價格高者優先得標，每一得標人應依其得標價格認購，公開\n承銷價格則以各得標單之價格及其數量加權平均所得之價格為之，並以最低承銷價格\n之1.3倍為上限，故每股發行價格暫定以新臺幣26元溢價發行。\n四、本次現金增資募集金額擬用於充實營運資金。\n五、本次現金增資發行新股認股繳款期間：\n1.競價拍賣期間：115/05/07~115/05/11\n2.員工認股繳款期間：115/05/14~115/05/18\n3.競價拍賣扣款日期：115/05/18\n4.特定人認股繳款日期：115/05/19~115/05/20\n5.增資基準日：115/05/20\n六、本次現金增資所發行之新股，其權利義務與原發行之普通股股份相同。""]], ""footer"": [""以上資料均由各公司依發言當時所屬市場別之規定申報後，由本系統對外公佈，資料如有虛偽不實，均由該公司負責。""], ""header"": {""note"": [], ""subTitle"": [], ""mainTitle"": [""公司當日重大訊息之詳細內容""]}, ""titles"": [{""main"": ""序號"", ""sub"": []}, {""main"": ""發言日期"", ""sub"": []}, {""main"": ""發言時間"", ""sub"": []}, {""main"": ""發言人"", ""sub"": []}, {""main"": ""發言人職稱"", ""sub"": []}, {""main"": ""發言人電話"", ""sub"": []}, {""main"": ""主旨"", ""sub"": []}, {""main"": ""符合條款"", ""sub"": []}, {""main"": ""事實發生日"", ""sub"": []}, {""main"": ""說明"", ""sub"": []}], ""companyAbbreviation"": ""聚恆""}, ""datetime"": ""115/05/05 17:26:58""}",2026-05-05 17:26:34
1150504|rotc|4582|2,115/05/04,19:11:48,4582,聚恆,公告本公司股票創新板初次上市前現金增資股款委託代收及存儲價款機構,現金增資,1150504,rotc,2,"{""code"": 200, ""message"": ""查詢成功"", ""result"": {""marketName"": ""興櫃公司"", ""companyId"": ""4582"", ""data"": [[2, ""115/05/04"", ""19:11:48"", ""周曉艷"", ""總經理"", ""06-2022202"", ""公告本公司股票創新板初次上市前現金增資股款委託\r\n代收及存儲價款機構"", ""44"", ""115/05/04"", ""1.事實發生日:115/05/04\n2.公司名稱:聚恆科技股份有限公司\n3.與公司關係(請輸入本公司或子公司):本公司\n4.相互持股比例:不適用\n5.發生緣由:依據「發行人募集與發行有價證券處理準則第9條」規定辦理公告\n6.因應措施:無\n7.其他應敘明事項(若事件發生或決議之主體係屬公開發行以上公司，\n本則重大訊息同時符合證券交易法施行細則第7條第9款所定\n對股東權益或證券價格有重大影響之事項):\n(1)訂約日期：115/05/04\n(2)委託代收價款機構\n   員工認股代收股款機構：台灣中小企業銀行永大分行\n   競價拍賣代收股款機構：臺灣銀行中崙分行\n(3)委託存儲價款機構：台灣中小企業銀行永康分行""]], ""footer"": [""以上資料均由各公司依發言當時所屬市場別之規定申報後，由本系統對外公佈，資料如有虛偽不實，均由該公司負責。""], ""header"": {""note"": [], ""subTitle"": [], ""mainTitle"": [""公司當日重大訊息之詳細內容""]}, ""titles"": [{""main"": ""序號"", ""sub"": []}, {""main"": ""發言日期"", ""sub"": []}, {""main"": ""發言時間"", ""sub"": []}, {""main"": ""發言人"", ""sub"": []}, {""main"": ""發言人職稱"", ""sub"": []}, {""main"": ""發言人電話"", ""sub"": []}, {""main"": ""主旨"", ""sub"": []}, {""main"": ""符合條款"", ""sub"": []}, {""main"": ""事實發生日"", ""sub"": []}, {""main"": ""說明"", ""sub"": []}], ""companyAbbreviation"": ""聚恆""}, ""datetime"": ""115/05/05 17:26:59""}",2026-05-05 17:26:34
1150505|rotc|7768|2,115/05/05,16:02:29,7768,頌勝科技,公告本公司辦理股票初次上市前現金增資收足股款暨現金增資基準日,現金增資,1150505,rotc,2,"{""code"": 200, ""message"": ""查詢成功"", ""result"": {""marketName"": ""興櫃公司"", ""companyId"": ""7768"", ""data"": [[2, ""115/05/05"", ""16:02:29"", ""林順陽"", ""副總經理暨財務長"", ""04-23550168"", ""公告本公司辦理股票初次上市前現金增資收足股款\r\n暨現金增資基準日"", ""44"", ""115/05/05"", ""1.事實發生日:115/05/05\n2.公司名稱:頌勝科技材料股份有限公司\n3.與公司關係(請輸入本公司或子公司):本公司\n4.相互持股比例:不適用\n5.發生緣由:依據「發行人募集與發行有價證券處理準則」第9條第1項第2款規定辦理\n6.因應措施:無\n7.其他應敘明事項(若事件發生或決議之主體係屬公開發行以上公司，\n本則重大訊息同時符合證券交易法施行細則第7條第9款所定\n對股東權益或證券價格有重大影響之事項):\n一、本公司股票初次上市前現金增資發行普通股7,800,000股，\n   競價拍賣最低承銷價格為每股新台幣215元，依投標價格高者優先得標，\n   每一得標人應依其得標價格認購，各得標單之價格及其數量加權平均價格\n   為每股新台幣375.74元，公開申購承銷價格為每股新台幣258元，\n   總計新台幣2,673,617,840元，業已全數收足。\n二、現金增資基準日：115年05月05日。""]], ""footer"": [""以上資料均由各公司依發言當時所屬市場別之規定申報後，由本系統對外公佈，資料如有虛偽不實，均由該公司負責。""], ""header"": {""note"": [], ""subTitle"": [], ""mainTitle"": [""公司當日重大訊息之詳細內容""]}, ""titles"": [{""main"": ""序號"", ""sub"": []}, {""main"": ""發言日期"", ""sub"": []}, {""main"": ""發言時間"", ""sub"": []}, {""main"": ""發言人"", ""sub"": []}, {""main"": ""發言人職稱"", ""sub"": []}, {""main"": ""發言人電話"", ""sub"": []}, {""main"": ""主旨"", ""sub"": []}, {""main"": ""符合條款"", ""sub"": []}, {""main"": ""事實發生日"", ""sub"": []}, {""main"": ""說明"", ""sub"": []}], ""companyAbbreviation"": ""頌勝科技""}, ""datetime"": ""115/05/05 17:26:59""}",2026-05-05 17:26:34
1150505|rotc|4195|1,115/05/05,16:12:22,4195,基米,公告本公司股票初次上市前現金增資員工認購股款催繳事宜,現金增資,1150505,rotc,1,"{""code"": 200, ""message"": ""查詢成功"", ""result"": {""marketName"": ""興櫃公司"", ""companyId"": ""4195"", ""data"": [[1, ""115/05/05"", ""16:12:22"", ""江俊奇"", ""總經理"", ""2696-1658"", ""公告本公司股票初次上市前現金增資員工認購股款催繳事宜"", ""44"", ""115/05/05"", ""1.事實發生日:115/05/05\n2.公司名稱:基龍米克斯生物科技股份有限公司\n3.與公司關係(請輸入本公司或子公司):本公司\n4.相互持股比例:不適用\n5.發生緣由:本公司股票初次上市前現金增資員工認股繳款期限已於115年5月5日下午\n3時30分截止，惟有部份員工尚未繳納現金增資股款，依法辦理催告。\n6.因應措施:\n(1)依公司法第267條第1項準用同法第142條之規定辦理，自115年5月6日起至115年\n   6月7日下午3時30分止為股款催繳期間。\n(2)尚未繳款之員工，須於上述期間內持原繳款書至台中商業銀行台北分行及全台\n   各分行辦理繳款，逾期仍未繳款者即喪失認購新股之權利。\n(3)於催繳期間繳款之員工，俟催繳期間屆滿並經集保公司作業後，依其認購股數\n   撥入認股人登記之集保帳戶。\n7.其他應敘明事項(若事件發生或決議之主體係屬公開發行以上公司，\n本則重大訊息同時符合證券交易法施行細則第7條第9款所定\n對股東權益或證券價格有重大影響之事項):無""]], ""footer"": [""以上資料均由各公司依發言當時所屬市場別之規定申報後，由本系統對外公佈，資料如有虛偽不實，均由該公司負責。""], ""header"": {""note"": [], ""subTitle"": [], ""mainTitle"": [""公司當日重大訊息之詳細內容""]}, ""titles"": [{""main"": ""序號"", ""sub"": []}, {""main"": ""發言日期"", ""sub"": []}, {""main"": ""發言時間"", ""sub"": []}, {""main"": ""發言人"", ""sub"": []}, {""main"": ""發言人職稱"", ""sub"": []}, {""main"": ""發言人電話"", ""sub"": []}, {""main"": ""主旨"", ""sub"": []}, {""main"": ""符合條款"", ""sub"": []}, {""main"": ""事實發生日"", ""sub"": []}, {""main"": ""說明"", ""sub"": []}], ""companyAbbreviation"": ""基米""}, ""datetime"": ""115/05/05 17:27:00""}",2026-05-05 17:26:34
1150505|rotc|7816|1,115/05/05,16:31:56,7816,來穎,代重要子公司達振能源股份有限公司公告董事會決議通過辦理現金增資發行新股案,現金增資,1150505,rotc,1,"{""code"": 200, ""message"": ""查詢成功"", ""result"": {""marketName"": ""興櫃公司"", ""companyId"": ""7816"", ""data"": [[1, ""115/05/05"", ""16:31:56"", ""林信宏"", ""執行副總經理"", ""03-5970328"", ""代重要子公司達振能源股份有限公司公告董事\r\n會決議通過辦理現金增資發行新股案"", ""9"", ""115/05/05"", ""1.董事會決議日期:115/05/05\n2.增資資金來源:現金增資\n3.發行股數(如屬盈餘或公積轉增資，則不含配發給員工部分):\n15,384,620股\n4.每股面額:新臺幣10元\n5.發行總金額:200,000,060元\n6.發行價格:新臺幣13元\n7.員工認購股數或配發金額:依公司法規定保留10%，\n計1,538,462股由員工認購。\n8.公開銷售股數:不適用\n9.原股東認購或無償配發比例(請註明暫定每仟股認購或配發股數):\n增資發行股數之90%，計13,846,158股由原股東按持股比率認購，\n每仟股認股553.717968股\n10.畸零股及逾期未認購股份之處理方式:授權董事長洽特定人認購。\n11.本次發行新股之權利義務:與原發行普通股股份相同。\n12.本次增資資金用途:充實營運資金。\n13.其他應敘明事項:本次現金增資基準日為115年5月21日，增資基準日或特定人\n繳款期間如有異動授權董事長全權處理。""]], ""footer"": [""以上資料均由各公司依發言當時所屬市場別之規定申報後，由本系統對外公佈，資料如有虛偽不實，均由該公司負責。""], ""header"": {""note"": [], ""subTitle"": [], ""mainTitle"": [""公司當日重大訊息之詳細內容""]}, ""titles"": [{""main"": ""序號"", ""sub"": []}, {""main"": ""發言日期"", ""sub"": []}, {""main"": ""發言時間"", ""sub"": []}, {""main"": ""發言人"", ""sub"": []}, {""main"": ""發言人職稱"", ""sub"": []}, {""main"": ""發言人電話"", ""sub"": []}, {""main"": ""主旨"", ""sub"": []}, {""main"": ""符合條款"", ""sub"": []}, {""main"": ""事實發生日"", ""sub"": []}, {""main"": ""說明"", ""sub"": []}], ""companyAbbreviation"": ""來穎""}, ""datetime"": ""115/05/05 17:27:00""}",2026-05-05 17:26:34
1150505|rotc|7842|3,115/05/05,16:35:11,7842,天能綠電,公告本公司股票初次上櫃前現金增資員工認購股款催繳事宜,現金增資,1150505,rotc,3,"{""code"": 200, ""message"": ""查詢成功"", ""result"": {""marketName"": ""興櫃公司"", ""companyId"": ""7842"", ""data"": [[3, ""115/05/05"", ""16:35:11"", ""唐亞聖"", ""總經理"", ""02-2656-0608"", ""公告本公司股票初次上櫃前現金增資員工認購股款催繳事宜"", ""44"", ""115/05/05"", ""1.事實發生日:115/05/05\n2.公司名稱:天能綠電股份有限公司\n3.與公司關係(請輸入本公司或子公司):本公司\n4.相互持股比例:不適用\n5.發生緣由:本公司股票初次上櫃前現金增資員工認股繳款期限\n已於115年5月5日下午3時30分截止，惟仍有部分員工尚未繳納現金增資股款，\n依法辦理催告。\n6.因應措施:\n(1)依公司法第267條第1項準用同法第142條之規定辦理，自115年5月6日起\n至115年6月8日下午3時30分止為股款催繳期間。\n(2)尚未繳款之員工，請於上述期間內持原繳款書至台新國際商業銀行敦南分行\n及全國各分行辦理繳款，逾期仍未繳款者即喪失認購新股之權利。\n(3)於催繳期間繳款之員工，俟催繳期間屆滿並經集保公司作業後，依其認購股數\n撥入認股人登記之集保帳戶。\n7.其他應敘明事項(若事件發生或決議之主體係屬公開發行以上公司，\n本則重大訊息同時符合證券交易法施行細則第7條第9款所定\n對股東權益或證券價格有重大影響之事項):無。""]], ""footer"": [""以上資料均由各公司依發言當時所屬市場別之規定申報後，由本系統對外公佈，資料如有虛偽不實，均由該公司負責。""], ""header"": {""note"": [], ""subTitle"": [], ""mainTitle"": [""公司當日重大訊息之詳細內容""]}, ""titles"": [{""main"": ""序號"", ""sub"": []}, {""main"": ""發言日期"", ""sub"": []}, {""main"": ""發言時間"", ""sub"": []}, {""main"": ""發言人"", ""sub"": []}, {""main"": ""發言人職稱"", ""sub"": []}, {""main"": ""發言人電話"", ""sub"": []}, {""main"": ""主旨"", ""sub"": []}, {""main"": ""符合條款"", ""sub"": []}, {""main"": ""事實發生日"", ""sub"": []}, {""main"": ""說明"", ""sub"": []}], ""companyAbbreviation"": ""天能綠電""}, ""datetime"": ""115/05/05 17:27:01""}",2026-05-05 17:26:34
1150505|rotc|7427|1,115/05/05,16:44:57,7427,華上生醫,公告本公司115年第一次現金增資收足股款暨訂定增資基準日,現金增資,1150505,rotc,1,"{""code"": 200, ""message"": ""查詢成功"", ""result"": {""marketName"": ""興櫃公司"", ""companyId"": ""7427"", ""data"": [[1, ""115/05/05"", ""16:44:57"", ""趙月秀"", ""資深副總經理"", ""02-27851399"", ""公告本公司115年第一次現金增資收足股款暨訂定增資基準日"", ""44"", ""115/05/05"", ""1.事實發生日: 115/05/05\n2.公司名稱:華上生技醫藥股份有限公司\n3.與公司關係(請輸入本公司或子公司):本公司\n4.相互持股比例:不適用\n5.發生緣由:依據「發行人募集與發行有價證券處理準則」第9條規定辦理公告\n6.因應措施:無\n7.其他應敘明事項(若事件發生或決議之主體係屬公開發行以上公司，\n本則重大訊息同時符合證券交易法施行細則第7條第9款所定\n對股東權益或證券價格有重大影響之事項):\n(1)本公司115年第一次現金增資發行普通股10,000,000股，每股發行價格新台幣30元\n，實收股款總金額為新台幣300,000,000元，業已全數收足。\n(2)本公司訂定115年5月5日為增資基準日。""]], ""footer"": [""以上資料均由各公司依發言當時所屬市場別之規定申報後，由本系統對外公佈，資料如有虛偽不實，均由該公司負責。""], ""header"": {""note"": [], ""subTitle"": [], ""mainTitle"": [""公司當日重大訊息之詳細內容""]}, ""titles"": [{""main"": ""序號"", ""sub"": []}, {""main"": ""發言日期"", ""sub"": []}, {""main"": ""發言時間"", ""sub"": []}, {""main"": ""發言人"", ""sub"": []}, {""main"": ""發言人職稱"", ""sub"": []}, {""main"": ""發言人電話"", ""sub"": []}, {""main"": ""主旨"", ""sub"": []}, {""main"": ""符合條款"", ""sub"": []}, {""main"": ""事實發生日"", ""sub"": []}, {""main"": ""說明"", ""sub"": []}], ""companyAbbreviation"": ""華上生醫""}, ""datetime"": ""115/05/05 17:27:02""}",2026-05-05 17:26:34
